drop table if exists tbl1,tbl2;
create table tbl1 (pk int,i1 int, v2 varchar(80), i3 char(20),i4 float, d4 datetime(6),i5 decimal(5,3),i6 bool, primary key(pk));
insert into tbl1 values(1,1,'abc12','1agc',1.25,'2014-01-01 12:00:00',23.23,1),
(2,10,'23abc12','4agc1',-0.25,'2015-11-01 12:00:00',-23.230,0),
(3,201,'xx23abc12','cagc1',-2.25,'2015-11-21 11:20:10',3.231,1),
(4,80,'zx23abc12','zcagc1',2.25,'2013-01-21 11:20:10',-3.231,1),
(5,53,'cx23abc12','rcagc1',109.25,'2016-01-22 11:20:10',-13.131,0);
alter system major freeze tenant = sys;
alter system major freeze tenant = all_user;
alter system major freeze tenant = all_meta;
insert into tbl1 values (6,78,'tx23abc12','icagc1',-109.25,'2014-09-16 16:24:00',-13.531,1),(8,50,'vx23abc12','wcagc1',-85.85,'2014-09-10 16:20:21',93.131,1),(9,610,'ukx23abc12','pecagc1',-1.85,'2014-09-19 16:20:21',99.131,0),(10,42,'kx23abc12','ecagc1',-85.86,'2014-09-18 16:20:21',-99.131,1),(11,null,null,null,null,null,null,null);
set autocommit=0;
set autocommit=0;
select * from tbl1  where pk=100 for update;
pk	i1	v2	i3	i4	d4	i5	i6
insert into  tbl1 values(100,102,'abdggc12','1agc1d',1.215,'2014-01-01 12:00:10',83.23,1);
update tbl1 set i1=i1-300 where pk in (100,1,123,8,9);
update tbl1 set pk=200 where pk=100;
select * from tbl1 where pk in (100,200);
pk	i1	v2	i3	i4	d4	i5	i6
commit;
select * from tbl1 where pk in (100,200);
pk	i1	v2	i3	i4	d4	i5	i6
100	-198	abdggc12	1agc1d	1.215	2014-01-01 12:00:10.000000	83.230	1
commit;
select * from tbl1 where pk in (100,200);
pk	i1	v2	i3	i4	d4	i5	i6
100	-198	abdggc12	1agc1d	1.215	2014-01-01 12:00:10.000000	83.230	1
delete  from tbl1 where pk in (100,200);
commit;
select * from tbl1  where pk=100 for update;
pk	i1	v2	i3	i4	d4	i5	i6
insert into  tbl1 values(100,102,'abdggc12','1agc1d',1.215,'2014-01-01 12:00:10',83.23,1);
update tbl1 set i1=i1-300 where pk in (100,1,123,8,9);
insert into  tbl1 values(100,102,'abdggc12','1agc1d',1.215,'2014-01-01 12:00:10',83.23,1);
Got one of the listed errors
select * from tbl1 where pk in (100,200);
pk	i1	v2	i3	i4	d4	i5	i6
commit;
select * from tbl1 where pk in (100,200);
pk	i1	v2	i3	i4	d4	i5	i6
100	-198	abdggc12	1agc1d	1.215	2014-01-01 12:00:10.000000	83.230	1
commit;
select * from tbl1 where pk in (100,200);
pk	i1	v2	i3	i4	d4	i5	i6
100	-198	abdggc12	1agc1d	1.215	2014-01-01 12:00:10.000000	83.230	1
delete  from tbl1 where pk in (100,200);
commit;
select * from tbl1  where pk=100 for update;
pk	i1	v2	i3	i4	d4	i5	i6
insert into  tbl1 values(100,102,'abdggc12','1agc1d',1.215,'2014-01-01 12:00:10',83.23,1);
update tbl1 set i1=i1-300 where pk in (100,1,123,8,9);
select * from tbl1  where pk=100 for update;
pk	i1	v2	i3	i4	d4	i5	i6
100	-198	abdggc12	1agc1d	1.215	2014-01-01 12:00:10.000000	83.230	1
replace  into  tbl1 values(100,105,'abdggc12','1agc1d',1.215,'2014-01-01 12:00:10',83.23,1);
Got one of the listed errors
select * from tbl1 where pk in (100,200);
pk	i1	v2	i3	i4	d4	i5	i6
commit;
select * from tbl1 where pk in (100,200);
pk	i1	v2	i3	i4	d4	i5	i6
100	-198	abdggc12	1agc1d	1.215	2014-01-01 12:00:10.000000	83.230	1
commit;
select * from tbl1 where pk in (100,200);
pk	i1	v2	i3	i4	d4	i5	i6
100	-198	abdggc12	1agc1d	1.215	2014-01-01 12:00:10.000000	83.230	1
delete  from tbl1 where pk in (100,200);
commit;
select * from tbl1  where pk in(100,10,1,200) for update;
pk	i1	v2	i3	i4	d4	i5	i6
1	-899	abc12	1agc	1.25	2014-01-01 12:00:00.000000	23.230	1
10	42	kx23abc12	ecagc1	-85.86	2014-09-18 16:20:21.000000	-99.131	1
insert into  tbl1 values(100,102,'abdggc12','1agc1d',1.215,'2014-01-01 12:00:10',83.23,1);
update tbl1 set i1=i1-300 where pk in (100,1,123,8,9);
Got one of the listed errors
update tbl1 set i1=i1-300 where pk in (100,123);
update tbl1 set pk=1 where pk=1;
Got one of the listed errors
select * from tbl1 t1 where t1.pk in(100,200) for update;
pk	i1	v2	i3	i4	d4	i5	i6
100	-198	abdggc12	1agc1d	1.215	2014-01-01 12:00:10.000000	83.230	1
replace  into  tbl1 values(100,105,'abdggc12','1agc1d',1.215,'2014-01-01 12:00:10',83.23,1);
Got one of the listed errors
select * from tbl1 where pk in (100,200);
pk	i1	v2	i3	i4	d4	i5	i6
update tbl1 set pk=1 where pk=1;
commit;
select * from tbl1 where pk in (100,200);
pk	i1	v2	i3	i4	d4	i5	i6
100	-198	abdggc12	1agc1d	1.215	2014-01-01 12:00:10.000000	83.230	1
commit;
select * from tbl1 where pk in (100,200);
pk	i1	v2	i3	i4	d4	i5	i6
100	-198	abdggc12	1agc1d	1.215	2014-01-01 12:00:10.000000	83.230	1
delete  from tbl1 where pk in (100,200);
