drop table if exists t1,t2,t3,t11,t12;
CREATE TABLE t1 (a int, b int, c int, primary key(a,b));
INSERT INTO t1 VALUES (1,1,0);
INSERT INTO t1 VALUES (1,2,0);
INSERT INTO t1 VALUES (1,3,0);
DELETE from t1 where a=1 limit 1;
DELETE from t1 where a=1 and b =1;
INSERT INTO t1 VALUES (1,1,0);
DELETE from t1 where a=1 and b=1;
DELETE from t1 where a=1 and b=2;
DELETE from t1 where a=1 and b=3;
INSERT INTO t1 VALUES (1,2,0);
DELETE from t1 where a=1 and b=2;
INSERT INTO t1 VALUES (1,2,0);
DELETE from t1 where a=1 and b=2;
drop table t1;
create table t1 (
a bigint not null,
b bigint not null default 0,
c bigint not null default 0,
d bigint not null default 0,
e bigint not null default 0,
f bigint not null default 0,
g bigint not null default 0,
h bigint not null default 0,
i bigint not null default 0,
j bigint not null default 0,
primary key (a));
insert into t1 (a) values (2),(4),(6),(8),(10),(12),(14),(16),(18),(20),(22),(24),(26),(23);
delete from t1 where a=26;
drop table t1;
create table t1 (
a bigint not null,
b bigint not null default 0,
c bigint not null default 0,
d bigint not null default 0,
e bigint not null default 0,
f bigint not null default 0,
g bigint not null default 0,
h bigint not null default 0,
i bigint not null default 0,
j bigint not null default 0,
primary key (a));
insert into t1 (a) values (2),(4),(6),(8),(10),(12),(14),(16),(18),(20),(22),(24),(26),(23),(27);
delete from t1 where a=27;
drop table t1;
CREATE TABLE t1 (
bool1     char(0) default NULL,
not_null varchar(20)  NOT NULL default '',
misc     integer not null,
PRIMARY KEY  (not_null)
) ;
INSERT INTO t1 VALUES (NULL,'a',4), (NULL,'b',5), (NULL,'c',6), (NULL,'d',7);
select * from t1 where misc > 5 and bool1 is null;
bool1	not_null	misc
NULL	c	6
NULL	d	7
delete   from t1 where not_null='c';
delete   from t1 where not_null='d';
select * from t1 where misc > 5 and bool1 is null;
bool1	not_null	misc
select count(*) from t1;
count(*)
2
select count(*) from t1;
count(*)
2
select count(*) from t1;
count(*)
2
drop table t1;
create table t1 (a int not null auto_increment primary key, b char(32));
insert into t1 (a,b) values (1,'apple'), (2,'apple');
select * from t1;
a	b
1	apple
2	apple
delete t1 from t1, t1 as t2 where t1.b = t2.b and t1.a > t2.a;
select * from t1;
a	b
1	apple
drop table t1;
create table t11 (a int NOT NULL, b int, primary key (a));
create table t12 (a int NOT NULL, b int, primary key (a));
create table t2 (a int NOT NULL, b int, primary key (a));
insert into t11 values (0, 10),(1, 11),(2, 12);
insert into t12 values (33, 10),(0, 11),(2, 12);
insert into t2 values (1, 21),(2, 12),(3, 23);
select * from t11;
a	b
0	10
1	11
2	12
select * from t12;
a	b
0	11
2	12
33	10
select * from t2;
a	b
1	21
2	12
3	23
delete t11.*, t12.* from t11,t12 where t11.a = t12.a and t11.b <> (select b from t2 where t11.a < t2.a);
ERROR 21000: Subquery returns more than 1 row
select * from t11;
a	b
0	10
1	11
2	12
select * from t12;
a	b
0	11
2	12
33	10
insert into t11 values (2, 12) on duplicate key update a=values(a), b=values(b);
delete from t11 where t11.b <> (select b from t2 where t11.a < t2.a);
ERROR 21000: Subquery returns more than 1 row
select * from t11;
a	b
0	10
1	11
2	12
select * from t11;
a	b
0	10
1	11
2	12
drop table t11, t12, t2;
CREATE TABLE t1 ( a int PRIMARY KEY );
DELETE FROM t1 WHERE t1.a > 0 ORDER BY t1.a;
INSERT INTO t1 VALUES (0),(1),(2);
DELETE FROM t1 WHERE t1.a > 0 ORDER BY t1.a LIMIT 1;
SELECT * FROM t1;
a
0
2
DROP TABLE t1;
create table t1 (a int);
delete `4.t1` from t1 as `4.t1` where `4.t1`.a = 5;
delete FROM `4.t1` USING t1 as `4.t1` where `4.t1`.a = 5;
drop table t1;
create table t1(f1 int primary key);
insert into t1 values (4),(3),(1),(2);
delete from t1 where (@a:= f1) order by f1 limit 1;
select @a;
@a
1
drop table t1;
CREATE TABLE t1 (
`date` date ,
`time` time ,
`seq` int(10) unsigned NOT NULL auto_increment,
PRIMARY KEY  (`seq`),
KEY `seq` (`seq`),
KEY `time` (`time`),
KEY `date` (`date`)
);
DELETE FROM t1 ORDER BY date ASC, time ASC LIMIT 1;
drop table t1;
CREATE TABLE t1 (a int not null,b int not null);
CREATE TABLE t2 (a int not null, b int not null, primary key (a,b));
CREATE TABLE t3 (a int not null, b int not null, primary key (a,b));
insert into t1 values (1,1),(2,1),(1,3);
insert into t2 values (1,1),(2,2),(3,3);
insert into t3 values (1,1),(2,1),(1,3);
select * from t1,t2,t3 where t1.a=t2.a AND t2.b=t3.a and t1.b=t3.b;
a	b	a	b	a	b
1	1	1	1	1	1
1	3	1	1	1	3
2	1	2	2	2	1
delete t2.*,t3.* from t1,t2,t3 where t1.a=t2.a AND t2.b=t3.a and t1.b=t3.b;
select * from t3;
a	b
drop table t1,t2,t3;
create table t1(a datetime not null primary key, b int);
insert into t1 values (USEC_TO_TIME(0),1);
insert into t1 values (timestamp'1970-01-01 08:00:00',1);
ERROR 23000: Duplicate entry '1970-01-01 08:00:00.000000' for key 'PRIMARY'
select * from t1 where a is null;
a	b
delete from t1 where a = null;
delete from t1 where a = timestamp'1970-01-01 08:00:00';
select count(*) from t1;
count(*)
0
drop table t1;
CREATE TABLE t1 (a INT);
INSERT INTO t1 VALUES (1);
DELETE FROM t1 ORDER BY x;
ERROR 42S22: Unknown column 'x' in 'order clause'
DELETE FROM t1 ORDER BY t2.x;
ERROR 42S22: Unknown column 't2.x' in 'order clause'
DELETE FROM t1 ORDER BY (SELECT x);
ERROR 42S22: Unknown column 'x' in 'field list'
DROP TABLE t1;
CREATE TABLE t1 (
a INT
);
CREATE TABLE t2 (
a INT
);
drop database if exists db1;
drop database if exists db2;
CREATE DATABASE db1;
CREATE TABLE db1.t1 (
a INT
);
INSERT INTO db1.t1 (a) SELECT * FROM t1;
CREATE DATABASE db2;
CREATE TABLE db2.t1 (
a INT
);
INSERT INTO db2.t1 (a) SELECT * FROM t2;
DELETE FROM t1 alias USING t1, t2 alias WHERE t1.a = alias.a;
ERROR 42000: You have an error in your SQL syntax; check the manual that corresponds to your OceanBase version for the right syntax to use near 'USING t1, t2 alias WHERE t1.a = alias.a' at line 1
DELETE FROM alias USING t1, t2 alias WHERE t1.a = alias.a;
DELETE FROM t1, alias USING t1, t2 alias WHERE t1.a = alias.a;
DELETE FROM t1, t2 USING t1, t2 alias WHERE t1.a = alias.a;
ERROR 42S02: Unknown table 't2' in MULTI DELETE
DELETE FROM db1.t1 alias USING db1.t1, db2.t1 alias WHERE db1.t1.a = alias.a;
ERROR 42000: You have an error in your SQL syntax; check the manual that corresponds to your OceanBase version for the right syntax to use near 'USING db1.t1, db2.t1 alias WHERE db1.t1.a = alias.a' at line 1
DELETE FROM alias USING db1.t1, db2.t1 alias WHERE db1.t1.a = alias.a;
DELETE FROM db2.alias USING db1.t1, db2.t1 alias WHERE db1.t1.a = alias.a;
DELETE FROM t1 USING t1 WHERE a = 1;
SELECT * FROM t1;
a
DELETE FROM t1 alias USING t1 alias WHERE a = 2;
ERROR 42000: You have an error in your SQL syntax; check the manual that corresponds to your OceanBase version for the right syntax to use near 'USING t1 alias WHERE a = 2' at line 1
SELECT * FROM t1;
a
delete t1.* from db1.t1 as t1, db2.t1;
ERROR 42S02: Unknown table 't1' in MULTI DELETE
select * from t1;
a
delete db1.t1.* from db1.t1 as t1, db2.t1;
select * from db1.t1;
a
DROP TABLE t1, t2;
DROP DATABASE db1;
DROP DATABASE db2;
#
# Bug #49552 : sql_buffer_result cause crash + not found records
#   in multitable delete/subquery
#
CREATE TABLE t1(a INT);
INSERT INTO t1 VALUES (1),(2),(3);
DELETE t1 FROM (SELECT SUM(a) a FROM t1) x,t1;
SELECT * FROM t1;
a
DROP TABLE t1;
End of 5.0 tests
DROP DATABASE IF EXISTS db1;
DROP DATABASE IF EXISTS db2;
DROP DATABASE IF EXISTS db3;
DROP DATABASE IF EXISTS db4;
DROP TABLE IF EXISTS t1, t2;
DROP TABLE IF EXISTS a1;
USE test;
CREATE DATABASE db1;
CREATE DATABASE db2;
CREATE TABLE db1.t1 (a INT, b INT);
INSERT INTO db1.t1 VALUES (1,1),(2,2),(3,3);
CREATE TABLE db1.t2 AS SELECT * FROM db1.t1;
CREATE TABLE db2.t1 AS SELECT * FROM db1.t2;
CREATE TABLE db2.t2 AS SELECT * FROM db2.t1;
CREATE TABLE t1 AS SELECT * FROM db2.t2;
CREATE TABLE t2 AS SELECT * FROM t1;
CREATE DATABASE db3;
USE db3;
DROP DATABASE db3;
SELECT * FROM t1;
ERROR 3D000: No database selected
DELETE a1,a2 FROM db1.t1, db2.t2;
ERROR 3D000: No database selected
DELETE a1,a2 FROM db1.t1, db2.t2;
ERROR 3D000: No database selected
DELETE a1,a2 FROM db1.t1 AS a1, db2.t2;
ERROR 3D000: No database selected
DELETE a1,a2 FROM db1.t1, db2.t2 AS a2;
ERROR 3D000: No database selected
DELETE FROM a1,a2 USING db1.t1, db2.t2;
ERROR 3D000: No database selected
DELETE FROM a1,a2 USING db1.t1, db2.t2;
ERROR 3D000: No database selected
DELETE FROM a1,a2 USING db1.t1 AS a1, db2.t2;
ERROR 3D000: No database selected
DELETE FROM a1,a2 USING db1.t1, db2.t2 AS a2;
ERROR 3D000: No database selected
DELETE a1 FROM db1.t1 AS a1, db2.t2 AS a1;
ERROR 3D000: No database selected
DELETE a1 FROM db1.a1, db2.t2 AS a1;
ERROR 42S02: Table 'db1.a1' doesn't exist
DELETE a1 FROM a1, db1.t1 AS a1;
ERROR 3D000: No database selected
DELETE t1 FROM db1.t1, db2.t1 AS a1;
DELETE t1 FROM db1.t1 AS a1, db2.t1 AS a2;
ERROR 3D000: No database selected
DELETE t1 FROM db1.t1, db2.t1;
ERROR 3D000: No database selected
USE test;
DELETE a1,a2 FROM db1.t1, db2.t2;
ERROR 42S02: Unknown table 'a1' in MULTI DELETE
DELETE a1,a2 FROM db1.t1, db2.t2;
ERROR 42S02: Unknown table 'a1' in MULTI DELETE
DELETE a1,a2 FROM db1.t1 AS a1, db2.t2;
ERROR 42S02: Unknown table 'a2' in MULTI DELETE
DELETE a1,a2 FROM db1.t1, db2.t2 AS a2;
ERROR 42S02: Unknown table 'a1' in MULTI DELETE
DELETE a1,a2 FROM db3.t1 AS a1, db4.t2 AS a2;
ERROR 42S02: Table 'db3.t1' doesn't exist
DELETE a1,a2 FROM db3.t1 AS a1, db4.t2 AS a2;
ERROR 42S02: Table 'db3.t1' doesn't exist
DELETE FROM a1,a2 USING db1.t1, db2.t2;
ERROR 42S02: Unknown table 'a1' in MULTI DELETE
DELETE FROM a1,a2 USING db1.t1, db2.t2;
ERROR 42S02: Unknown table 'a1' in MULTI DELETE
DELETE FROM a1,a2 USING db1.t1 AS a1, db2.t2;
ERROR 42S02: Unknown table 'a2' in MULTI DELETE
DELETE FROM a1,a2 USING db1.t1, db2.t2 AS a2;
ERROR 42S02: Unknown table 'a1' in MULTI DELETE
DELETE FROM a1,a2 USING db3.t1 AS a1, db4.t2 AS a2;
ERROR 42S02: Table 'db3.t1' doesn't exist
DELETE FROM a1,a2 USING db3.t1 AS a1, db4.t2 AS a2;
ERROR 42S02: Table 'db3.t1' doesn't exist
DELETE a1 FROM db1.t1 AS a1, db2.t2 AS a1;
ERROR 42S02: Unknown table 'a1' in MULTI DELETE
DELETE a1 FROM db1.a1, db2.t2 AS a1;
ERROR 42S02: Table 'db1.a1' doesn't exist
DELETE a1 FROM a1, db1.t1 AS a1;
ERROR 42S02: Table 'test.a1' doesn't exist
DELETE t1 FROM db1.t1, db2.t1 AS a1;
DELETE t1 FROM db1.t1 AS a1, db2.t1 AS a2;
ERROR 42S02: Unknown table 't1' in MULTI DELETE
DELETE t1 FROM db1.t1, db2.t1;
ERROR 42S02: Unknown table 't1' in MULTI DELETE
DELETE t1 FROM db1.t2 AS t1, db2.t2 AS t2 WHERE t2.a = 1 AND t1.a = t2.a;
SELECT ROW_COUNT();
ROW_COUNT()
1
DELETE a1, a2 FROM db2.t1 AS a1, t2 AS a2 WHERE a1.a = 2 AND a2.a = 2;
SELECT ROW_COUNT();
ROW_COUNT()
1
DROP DATABASE db1;
DROP DATABASE db2;
DROP TABLE t1, t2;
#
# Bug#46958: Assertion in Diagnostics_area::set_ok_status, trigger,
# merge table
#
CREATE TABLE t1 ( a INT );
CREATE TABLE t2 ( a INT );
CREATE TABLE t3 ( a INT );
INSERT INTO t1 VALUES (1), (2);
INSERT INTO t2 VALUES (1), (2);
INSERT INTO t3 VALUES (1), (2);
DELETE t1, t2, t3 FROM t1, t2, t3;
SELECT * FROM t1;
a
SELECT * FROM t2;
a
SELECT * FROM t3;
a
DROP TABLE t1, t2, t3;
CREATE TABLE t1 ( a INT );
CREATE TABLE t2 ( a INT );
CREATE TABLE t3 ( a INT );
INSERT INTO t1 VALUES (1), (2);
INSERT INTO t2 VALUES (1), (2);
INSERT INTO t3 VALUES (1), (2);
DELETE t1, t2, t3 FROM t1, t2, t3;
SELECT * FROM t1;
a
SELECT * FROM t2;
a
SELECT * FROM t3;
a
DROP TABLE t1, t2, t3;
#
# Bug #46425 crash in Diagnostics_area::set_ok_status,
#            empty statement, DELETE IGNORE
#
CREATE table t1 (i INTEGER);
INSERT INTO t1 VALUES (1);
DROP TABLE t1;
#
# Bug #53450: Crash/assertion
#    'virtual int ha_myisam::index_first(uchar*)') at assert.c:81
#
CREATE TABLE t1 (a INT,    b INT,    c INT,
INDEX(a), INDEX(b), INDEX(c));
INSERT INTO t1 VALUES (1,2,3), (4,5,6), (7,8,9);
DELETE FROM t1 WHERE a = 10 OR b = 20 ORDER BY c LIMIT 1;
DROP TABLE t1;
#
# Bug #53034: Multiple-table DELETE statements not accepting
#             'Access compatibility' syntax
#
CREATE TABLE t1 (id INT);
CREATE TABLE t2 LIKE t1;
CREATE TABLE t3 LIKE t1;
DELETE FROM t1.*, test.t2.*, a.* USING t1, t2, t3 AS a;
DROP TABLE t1, t2, t3;
End of 5.1 tests
#
# Bug#51099 Assertion in mysql_multi_delete_prepare()
#
DROP TABLE IF EXISTS t1, t2;
DROP VIEW IF EXISTS v1, v2;
CREATE TABLE t1(a INT);
CREATE TABLE t2(b INT);
CREATE VIEW v1 AS SELECT a, b FROM t1, t2;
CREATE VIEW v2 AS SELECT a FROM v1;
DROP VIEW v2, v1;
DROP TABLE t1, t2;
