set SESSION ob_query_timeout = 60 * 1000 * 1000;
set SESSION ob_trx_timeout = 60 * 1000 * 1000;
set SESSION ob_trx_idle_timeout = 60 * 1000 * 1000;
set SESSION ob_query_timeout = 60 * 1000 * 1000;
set SESSION ob_trx_timeout = 60 * 1000 * 1000;
set SESSION ob_trx_idle_timeout = 60 * 1000 * 1000;
drop table if exists test_uncommitted_trx_minor_merge;
create table test_uncommitted_trx_minor_merge(c1 int primary key, c2 int);
insert into test_uncommitted_trx_minor_merge values (1,1);
select * from test_uncommitted_trx_minor_merge;
c1	c2
1	1
insert into test_uncommitted_trx_minor_merge values (2,2);
begin;
insert into test_uncommitted_trx_minor_merge values (3,3);
update test_uncommitted_trx_minor_merge set c2 = 10 where c1 = 1;
commit;
select * from test_uncommitted_trx_minor_merge;
c1	c2
1	10
2	2
3	3
2
begin;
insert into test_uncommitted_trx_minor_merge values (4,4);
commit;
select * from test_uncommitted_trx_minor_merge;
c1	c2
1	10
2	2
3	3
4	4
begin;
insert into test_uncommitted_trx_minor_merge values (5,5);
update test_uncommitted_trx_minor_merge set c2 = 100 where c1 = 2;
alter system set undo_retention = 0;
commit;
select * from test_uncommitted_trx_minor_merge;
c1	c2
1	10
2	100
3	3
4	4
5	5
select * from test_uncommitted_trx_minor_merge;
c1	c2
1	10
2	100
3	3
4	4
5	5
alter system set undo_retention = 1800;
drop table test_uncommitted_trx_minor_merge;
