set SESSION ob_query_timeout = 60 * 1000 * 1000;
set SESSION ob_trx_timeout = 60 * 1000 * 1000;
set SESSION ob_trx_idle_timeout = 60 * 1000 * 1000;
drop table if exists test_get_uncommitted_row_with_fuse_row_t;
create table test_get_uncommitted_row_with_fuse_row_t(a int primary key, b int, unique key u_idx(b));
insert into test_get_uncommitted_row_with_fuse_row_t (a, b) values (1, 10), (2, 20), (3, 30);
begin;
select * from test_get_uncommitted_row_with_fuse_row_t where a = 2 for update;
a	b
2	20
update test_get_uncommitted_row_with_fuse_row_t set b = b + 1 where a = 2;
update test_get_uncommitted_row_with_fuse_row_t set b = 30 where a = 2;
ERROR 23000: Duplicate entry '30' for key 'u_idx'
select * from test_get_uncommitted_row_with_fuse_row_t where a = 2;
a	b
2	20
commit;
select * from test_get_uncommitted_row_with_fuse_row_t where a = 2;
a	b
2	21
drop table test_get_uncommitted_row_with_fuse_row_t;
