set GLOBAL ob_query_timeout = 1000000000000;
set GLOBAL ob_trx_timeout = 10000000000000;
set GLOBAL ob_trx_idle_timeout = 10000000000;
alter system set syslog_io_bandwidth_limit = '100G';
alter system set minor_compact_trigger = 10;
drop table if exists t1;
create table t1(num int, str varchar(2000), tag int);
insert into t1 values(1, repeat('Hello OceanBase', 50), 1);
begin;
SAVEPOINT p1;
alter system minor freeze tenant = sys;
alter system minor freeze tenant = all_user;
alter system minor freeze tenant = all_meta;
select * from t1 where num = 1 for update nowait;
ERROR HY000: Lock wait timeout exceeded; try restarting transaction
ROLLBACK TO SAVEPOINT p1;
select * from t1 where num = 1 for update nowait;
num	str	tag
1	Hello OceanBaseHello OceanBaseHello OceanBaseHello OceanBaseHello OceanBaseHello OceanBaseHello OceanBaseHello OceanBaseHello OceanBaseHello OceanBaseHello OceanBaseHello OceanBaseHello OceanBaseHello OceanBaseHello OceanBaseHello OceanBaseHello OceanBaseHello OceanBaseHello OceanBaseHello OceanBaseHello OceanBaseHello OceanBaseHello OceanBaseHello OceanBaseHello OceanBaseHello OceanBaseHello OceanBaseHello OceanBaseHello OceanBaseHello OceanBaseHello OceanBaseHello OceanBaseHello OceanBaseHello OceanBaseHello OceanBaseHello OceanBaseHello OceanBaseHello OceanBaseHello OceanBaseHello OceanBaseHello OceanBaseHello OceanBaseHello OceanBaseHello OceanBaseHello OceanBaseHello OceanBaseHello OceanBaseHello OceanBaseHello OceanBaseHello OceanBase	1
update t1 set str = repeat('Hello OceanBase9', 50) where num = 1;
SAVEPOINT p2;
alter system minor freeze tenant = sys;
alter system minor freeze tenant = all_user;
alter system minor freeze tenant = all_meta;
select * from t1 where num = 1 for update nowait;
ERROR HY000: Lock wait timeout exceeded; try restarting transaction
ROLLBACK TO SAVEPOINT p2;
select * from t1 where num = 1 for update nowait;
ERROR HY000: Lock wait timeout exceeded; try restarting transaction
commit;
select * from t1 where num = 1 for update nowait;
num	str	tag
1	Hello OceanBase9Hello OceanBase9Hello OceanBase9Hello OceanBase9Hello OceanBase9Hello OceanBase9Hello OceanBase9Hello OceanBase9Hello OceanBase9Hello OceanBase9Hello OceanBase9Hello OceanBase9Hello OceanBase9Hello OceanBase9Hello OceanBase9Hello OceanBase9Hello OceanBase9Hello OceanBase9Hello OceanBase9Hello OceanBase9Hello OceanBase9Hello OceanBase9Hello OceanBase9Hello OceanBase9Hello OceanBase9Hello OceanBase9Hello OceanBase9Hello OceanBase9Hello OceanBase9Hello OceanBase9Hello OceanBase9Hello OceanBase9Hello OceanBase9Hello OceanBase9Hello OceanBase9Hello OceanBase9Hello OceanBase9Hello OceanBase9Hello OceanBase9Hello OceanBase9Hello OceanBase9Hello OceanBase9Hello OceanBase9Hello OceanBase9Hello OceanBase9Hello OceanBase9Hello OceanBase9Hello OceanBase9Hello OceanBase9Hello OceanBase9	1
begin;
alter system minor freeze tenant = sys;
alter system minor freeze tenant = all_user;
alter system minor freeze tenant = all_meta;
select * from t1 where num = 1 for update nowait;
ERROR HY000: Lock wait timeout exceeded; try restarting transaction
rollback;
select * from t1 where num = 1 for update nowait;
num	str	tag
1	Hello OceanBase9Hello OceanBase9Hello OceanBase9Hello OceanBase9Hello OceanBase9Hello OceanBase9Hello OceanBase9Hello OceanBase9Hello OceanBase9Hello OceanBase9Hello OceanBase9Hello OceanBase9Hello OceanBase9Hello OceanBase9Hello OceanBase9Hello OceanBase9Hello OceanBase9Hello OceanBase9Hello OceanBase9Hello OceanBase9Hello OceanBase9Hello OceanBase9Hello OceanBase9Hello OceanBase9Hello OceanBase9Hello OceanBase9Hello OceanBase9Hello OceanBase9Hello OceanBase9Hello OceanBase9Hello OceanBase9Hello OceanBase9Hello OceanBase9Hello OceanBase9Hello OceanBase9Hello OceanBase9Hello OceanBase9Hello OceanBase9Hello OceanBase9Hello OceanBase9Hello OceanBase9Hello OceanBase9Hello OceanBase9Hello OceanBase9Hello OceanBase9Hello OceanBase9Hello OceanBase9Hello OceanBase9Hello OceanBase9Hello OceanBase9	1
begin;
update t1 set str = repeat('Hello OceanBase0.', 50) where num = 1;
select * from t1 where num = 1 for update nowait;
ERROR HY000: Lock wait timeout exceeded; try restarting transaction
alter system minor freeze tenant = sys;
alter system minor freeze tenant = all_user;
alter system minor freeze tenant = all_meta;
select * from t1 where num = 1 for update nowait;
ERROR HY000: Lock wait timeout exceeded; try restarting transaction
commit;
select * from t1 where num = 1 for update nowait;
num	str	tag
1	Hello OceanBase0.Hello OceanBase0.Hello OceanBase0.Hello OceanBase0.Hello OceanBase0.Hello OceanBase0.Hello OceanBase0.Hello OceanBase0.Hello OceanBase0.Hello OceanBase0.Hello OceanBase0.Hello OceanBase0.Hello OceanBase0.Hello OceanBase0.Hello OceanBase0.Hello OceanBase0.Hello OceanBase0.Hello OceanBase0.Hello OceanBase0.Hello OceanBase0.Hello OceanBase0.Hello OceanBase0.Hello OceanBase0.Hello OceanBase0.Hello OceanBase0.Hello OceanBase0.Hello OceanBase0.Hello OceanBase0.Hello OceanBase0.Hello OceanBase0.Hello OceanBase0.Hello OceanBase0.Hello OceanBase0.Hello OceanBase0.Hello OceanBase0.Hello OceanBase0.Hello OceanBase0.Hello OceanBase0.Hello OceanBase0.Hello OceanBase0.Hello OceanBase0.Hello OceanBase0.Hello OceanBase0.Hello OceanBase0.Hello OceanBase0.Hello OceanBase0.Hello OceanBase0.Hello OceanBase0.Hello OceanBase0.Hello OceanBase0.	1
drop table t1;
alter system set minor_compact_trigger = 2;
