alter system set _fast_commit_callback_count = 0;
alter system set _private_buffer_size = '1B';
set SESSION ob_query_timeout = 600 * 1000 * 1000;
set SESSION ob_trx_timeout = 600 * 1000 * 1000;
set SESSION ob_trx_idle_timeout = 600 * 1000 * 1000;
set SESSION ob_query_timeout = 600 * 1000 * 1000;
set SESSION ob_trx_timeout = 600 * 1000 * 1000;
set SESSION ob_trx_idle_timeout = 600 * 1000 * 1000;
drop table if exists test_rollback_and_major_t;
create table test_rollback_and_major_t(row_key int primary key, row_value int);
insert into test_rollback_and_major_t values(1,1);
begin;
begin;
savepoint x;
update test_rollback_and_major_t set row_value = 2 * 123 where row_key = 1;
insert into test_rollback_and_major_t values(2 + 3000, 2);
rollback to savepoint x;
insert into test_rollback_and_major_t values(2 * 10, 1);
select count(*) from test_rollback_and_major_t;
count(*)
2
savepoint x;
update test_rollback_and_major_t set row_value = 2 * 321 where row_key = 1;
insert into test_rollback_and_major_t values(2 + 3000, 2);
rollback to savepoint x;
insert into test_rollback_and_major_t values(2 * 10 + 5, 1);
select count(*) from test_rollback_and_major_t;
count(*)
2
savepoint x;
update test_rollback_and_major_t set row_value = 4 * 123 where row_key = 1;
insert into test_rollback_and_major_t values(4 + 3000, 4);
rollback to savepoint x;
insert into test_rollback_and_major_t values(4 * 10, 1);
select count(*) from test_rollback_and_major_t;
count(*)
3
savepoint x;
update test_rollback_and_major_t set row_value = 4 * 321 where row_key = 1;
insert into test_rollback_and_major_t values(4 + 3000, 4);
rollback to savepoint x;
insert into test_rollback_and_major_t values(4 * 10 + 5, 1);
select count(*) from test_rollback_and_major_t;
count(*)
3
savepoint x;
update test_rollback_and_major_t set row_value = 6 * 123 where row_key = 1;
insert into test_rollback_and_major_t values(6 + 3000, 6);
rollback to savepoint x;
insert into test_rollback_and_major_t values(6 * 10, 1);
select count(*) from test_rollback_and_major_t;
count(*)
4
savepoint x;
update test_rollback_and_major_t set row_value = 6 * 321 where row_key = 1;
insert into test_rollback_and_major_t values(6 + 3000, 6);
rollback to savepoint x;
insert into test_rollback_and_major_t values(6 * 10 + 5, 1);
select count(*) from test_rollback_and_major_t;
count(*)
4
savepoint x;
update test_rollback_and_major_t set row_value = 8 * 123 where row_key = 1;
insert into test_rollback_and_major_t values(8 + 3000, 8);
rollback to savepoint x;
insert into test_rollback_and_major_t values(8 * 10, 1);
select count(*) from test_rollback_and_major_t;
count(*)
5
savepoint x;
update test_rollback_and_major_t set row_value = 8 * 321 where row_key = 1;
insert into test_rollback_and_major_t values(8 + 3000, 8);
rollback to savepoint x;
insert into test_rollback_and_major_t values(8 * 10 + 5, 1);
select count(*) from test_rollback_and_major_t;
count(*)
5
savepoint x;
update test_rollback_and_major_t set row_value = 10 * 123 where row_key = 1;
insert into test_rollback_and_major_t values(10 + 3000, 10);
rollback to savepoint x;
insert into test_rollback_and_major_t values(10 * 10, 1);
select count(*) from test_rollback_and_major_t;
count(*)
6
savepoint x;
update test_rollback_and_major_t set row_value = 10 * 321 where row_key = 1;
insert into test_rollback_and_major_t values(10 + 3000, 10);
rollback to savepoint x;
insert into test_rollback_and_major_t values(10 * 10 + 5, 1);
select count(*) from test_rollback_and_major_t;
count(*)
6
savepoint x;
update test_rollback_and_major_t set row_value = 12 * 123 where row_key = 1;
insert into test_rollback_and_major_t values(12 + 3000, 12);
rollback to savepoint x;
insert into test_rollback_and_major_t values(12 * 10, 1);
select count(*) from test_rollback_and_major_t;
count(*)
7
savepoint x;
update test_rollback_and_major_t set row_value = 12 * 321 where row_key = 1;
insert into test_rollback_and_major_t values(12 + 3000, 12);
rollback to savepoint x;
insert into test_rollback_and_major_t values(12 * 10 + 5, 1);
select count(*) from test_rollback_and_major_t;
count(*)
7
savepoint x;
update test_rollback_and_major_t set row_value = 14 * 123 where row_key = 1;
insert into test_rollback_and_major_t values(14 + 3000, 14);
rollback to savepoint x;
insert into test_rollback_and_major_t values(14 * 10, 1);
select count(*) from test_rollback_and_major_t;
count(*)
8
savepoint x;
update test_rollback_and_major_t set row_value = 14 * 321 where row_key = 1;
insert into test_rollback_and_major_t values(14 + 3000, 14);
rollback to savepoint x;
insert into test_rollback_and_major_t values(14 * 10 + 5, 1);
select count(*) from test_rollback_and_major_t;
count(*)
8
savepoint x;
update test_rollback_and_major_t set row_value = 16 * 123 where row_key = 1;
insert into test_rollback_and_major_t values(16 + 3000, 16);
rollback to savepoint x;
insert into test_rollback_and_major_t values(16 * 10, 1);
select count(*) from test_rollback_and_major_t;
count(*)
9
savepoint x;
update test_rollback_and_major_t set row_value = 16 * 321 where row_key = 1;
insert into test_rollback_and_major_t values(16 + 3000, 16);
rollback to savepoint x;
insert into test_rollback_and_major_t values(16 * 10 + 5, 1);
select count(*) from test_rollback_and_major_t;
count(*)
9
savepoint x;
update test_rollback_and_major_t set row_value = 18 * 123 where row_key = 1;
insert into test_rollback_and_major_t values(18 + 3000, 18);
rollback to savepoint x;
insert into test_rollback_and_major_t values(18 * 10, 1);
select count(*) from test_rollback_and_major_t;
count(*)
10
savepoint x;
update test_rollback_and_major_t set row_value = 18 * 321 where row_key = 1;
insert into test_rollback_and_major_t values(18 + 3000, 18);
rollback to savepoint x;
insert into test_rollback_and_major_t values(18 * 10 + 5, 1);
select count(*) from test_rollback_and_major_t;
count(*)
10
savepoint x;
update test_rollback_and_major_t set row_value = 20 * 123 where row_key = 1;
insert into test_rollback_and_major_t values(20 + 3000, 20);
rollback to savepoint x;
insert into test_rollback_and_major_t values(20 * 10, 1);
select count(*) from test_rollback_and_major_t;
count(*)
11
savepoint x;
update test_rollback_and_major_t set row_value = 20 * 321 where row_key = 1;
insert into test_rollback_and_major_t values(20 + 3000, 20);
rollback to savepoint x;
insert into test_rollback_and_major_t values(20 * 10 + 5, 1);
select count(*) from test_rollback_and_major_t;
count(*)
11
savepoint x;
update test_rollback_and_major_t set row_value = 22 * 123 where row_key = 1;
insert into test_rollback_and_major_t values(22 + 3000, 22);
rollback to savepoint x;
insert into test_rollback_and_major_t values(22 * 10, 1);
select count(*) from test_rollback_and_major_t;
count(*)
12
savepoint x;
update test_rollback_and_major_t set row_value = 22 * 321 where row_key = 1;
insert into test_rollback_and_major_t values(22 + 3000, 22);
rollback to savepoint x;
insert into test_rollback_and_major_t values(22 * 10 + 5, 1);
select count(*) from test_rollback_and_major_t;
count(*)
12
savepoint x;
update test_rollback_and_major_t set row_value = 24 * 123 where row_key = 1;
insert into test_rollback_and_major_t values(24 + 3000, 24);
rollback to savepoint x;
insert into test_rollback_and_major_t values(24 * 10, 1);
select count(*) from test_rollback_and_major_t;
count(*)
13
savepoint x;
update test_rollback_and_major_t set row_value = 24 * 321 where row_key = 1;
insert into test_rollback_and_major_t values(24 + 3000, 24);
rollback to savepoint x;
insert into test_rollback_and_major_t values(24 * 10 + 5, 1);
select count(*) from test_rollback_and_major_t;
count(*)
13
savepoint x;
update test_rollback_and_major_t set row_value = 26 * 123 where row_key = 1;
insert into test_rollback_and_major_t values(26 + 3000, 26);
rollback to savepoint x;
insert into test_rollback_and_major_t values(26 * 10, 1);
select count(*) from test_rollback_and_major_t;
count(*)
14
savepoint x;
update test_rollback_and_major_t set row_value = 26 * 321 where row_key = 1;
insert into test_rollback_and_major_t values(26 + 3000, 26);
rollback to savepoint x;
insert into test_rollback_and_major_t values(26 * 10 + 5, 1);
select count(*) from test_rollback_and_major_t;
count(*)
14
savepoint x;
update test_rollback_and_major_t set row_value = 28 * 123 where row_key = 1;
insert into test_rollback_and_major_t values(28 + 3000, 28);
rollback to savepoint x;
insert into test_rollback_and_major_t values(28 * 10, 1);
select count(*) from test_rollback_and_major_t;
count(*)
15
savepoint x;
update test_rollback_and_major_t set row_value = 28 * 321 where row_key = 1;
insert into test_rollback_and_major_t values(28 + 3000, 28);
rollback to savepoint x;
insert into test_rollback_and_major_t values(28 * 10 + 5, 1);
select count(*) from test_rollback_and_major_t;
count(*)
15
savepoint x;
update test_rollback_and_major_t set row_value = 30 * 123 where row_key = 1;
insert into test_rollback_and_major_t values(30 + 3000, 30);
rollback to savepoint x;
insert into test_rollback_and_major_t values(30 * 10, 1);
select count(*) from test_rollback_and_major_t;
count(*)
16
savepoint x;
update test_rollback_and_major_t set row_value = 30 * 321 where row_key = 1;
insert into test_rollback_and_major_t values(30 + 3000, 30);
rollback to savepoint x;
insert into test_rollback_and_major_t values(30 * 10 + 5, 1);
select count(*) from test_rollback_and_major_t;
count(*)
16
savepoint x;
update test_rollback_and_major_t set row_value = 32 * 123 where row_key = 1;
insert into test_rollback_and_major_t values(32 + 3000, 32);
rollback to savepoint x;
insert into test_rollback_and_major_t values(32 * 10, 1);
select count(*) from test_rollback_and_major_t;
count(*)
17
savepoint x;
update test_rollback_and_major_t set row_value = 32 * 321 where row_key = 1;
insert into test_rollback_and_major_t values(32 + 3000, 32);
rollback to savepoint x;
insert into test_rollback_and_major_t values(32 * 10 + 5, 1);
select count(*) from test_rollback_and_major_t;
count(*)
17
savepoint x;
update test_rollback_and_major_t set row_value = 34 * 123 where row_key = 1;
insert into test_rollback_and_major_t values(34 + 3000, 34);
rollback to savepoint x;
insert into test_rollback_and_major_t values(34 * 10, 1);
select count(*) from test_rollback_and_major_t;
count(*)
18
savepoint x;
update test_rollback_and_major_t set row_value = 34 * 321 where row_key = 1;
insert into test_rollback_and_major_t values(34 + 3000, 34);
rollback to savepoint x;
insert into test_rollback_and_major_t values(34 * 10 + 5, 1);
select count(*) from test_rollback_and_major_t;
count(*)
18
savepoint x;
update test_rollback_and_major_t set row_value = 36 * 123 where row_key = 1;
insert into test_rollback_and_major_t values(36 + 3000, 36);
rollback to savepoint x;
insert into test_rollback_and_major_t values(36 * 10, 1);
select count(*) from test_rollback_and_major_t;
count(*)
19
savepoint x;
update test_rollback_and_major_t set row_value = 36 * 321 where row_key = 1;
insert into test_rollback_and_major_t values(36 + 3000, 36);
rollback to savepoint x;
insert into test_rollback_and_major_t values(36 * 10 + 5, 1);
select count(*) from test_rollback_and_major_t;
count(*)
19
savepoint x;
update test_rollback_and_major_t set row_value = 38 * 123 where row_key = 1;
insert into test_rollback_and_major_t values(38 + 3000, 38);
rollback to savepoint x;
insert into test_rollback_and_major_t values(38 * 10, 1);
select count(*) from test_rollback_and_major_t;
count(*)
20
savepoint x;
update test_rollback_and_major_t set row_value = 38 * 321 where row_key = 1;
insert into test_rollback_and_major_t values(38 + 3000, 38);
rollback to savepoint x;
insert into test_rollback_and_major_t values(38 * 10 + 5, 1);
select count(*) from test_rollback_and_major_t;
count(*)
20
savepoint x;
update test_rollback_and_major_t set row_value = 40 * 123 where row_key = 1;
insert into test_rollback_and_major_t values(40 + 3000, 40);
rollback to savepoint x;
insert into test_rollback_and_major_t values(40 * 10, 1);
select count(*) from test_rollback_and_major_t;
count(*)
21
savepoint x;
update test_rollback_and_major_t set row_value = 40 * 321 where row_key = 1;
insert into test_rollback_and_major_t values(40 + 3000, 40);
rollback to savepoint x;
insert into test_rollback_and_major_t values(40 * 10 + 5, 1);
select count(*) from test_rollback_and_major_t;
count(*)
21
savepoint x;
update test_rollback_and_major_t set row_value = 42 * 123 where row_key = 1;
insert into test_rollback_and_major_t values(42 + 3000, 42);
rollback to savepoint x;
insert into test_rollback_and_major_t values(42 * 10, 1);
select count(*) from test_rollback_and_major_t;
count(*)
22
savepoint x;
update test_rollback_and_major_t set row_value = 42 * 321 where row_key = 1;
insert into test_rollback_and_major_t values(42 + 3000, 42);
rollback to savepoint x;
insert into test_rollback_and_major_t values(42 * 10 + 5, 1);
select count(*) from test_rollback_and_major_t;
count(*)
22
savepoint x;
update test_rollback_and_major_t set row_value = 44 * 123 where row_key = 1;
insert into test_rollback_and_major_t values(44 + 3000, 44);
rollback to savepoint x;
insert into test_rollback_and_major_t values(44 * 10, 1);
select count(*) from test_rollback_and_major_t;
count(*)
23
savepoint x;
update test_rollback_and_major_t set row_value = 44 * 321 where row_key = 1;
insert into test_rollback_and_major_t values(44 + 3000, 44);
rollback to savepoint x;
insert into test_rollback_and_major_t values(44 * 10 + 5, 1);
select count(*) from test_rollback_and_major_t;
count(*)
23
savepoint x;
update test_rollback_and_major_t set row_value = 46 * 123 where row_key = 1;
insert into test_rollback_and_major_t values(46 + 3000, 46);
rollback to savepoint x;
insert into test_rollback_and_major_t values(46 * 10, 1);
select count(*) from test_rollback_and_major_t;
count(*)
24
savepoint x;
update test_rollback_and_major_t set row_value = 46 * 321 where row_key = 1;
insert into test_rollback_and_major_t values(46 + 3000, 46);
rollback to savepoint x;
insert into test_rollback_and_major_t values(46 * 10 + 5, 1);
select count(*) from test_rollback_and_major_t;
count(*)
24
savepoint x;
update test_rollback_and_major_t set row_value = 48 * 123 where row_key = 1;
insert into test_rollback_and_major_t values(48 + 3000, 48);
rollback to savepoint x;
insert into test_rollback_and_major_t values(48 * 10, 1);
select count(*) from test_rollback_and_major_t;
count(*)
25
savepoint x;
update test_rollback_and_major_t set row_value = 48 * 321 where row_key = 1;
insert into test_rollback_and_major_t values(48 + 3000, 48);
rollback to savepoint x;
insert into test_rollback_and_major_t values(48 * 10 + 5, 1);
select count(*) from test_rollback_and_major_t;
count(*)
25
savepoint x;
update test_rollback_and_major_t set row_value = 50 * 123 where row_key = 1;
insert into test_rollback_and_major_t values(50 + 3000, 50);
rollback to savepoint x;
insert into test_rollback_and_major_t values(50 * 10, 1);
select count(*) from test_rollback_and_major_t;
count(*)
26
savepoint x;
update test_rollback_and_major_t set row_value = 50 * 321 where row_key = 1;
insert into test_rollback_and_major_t values(50 + 3000, 50);
rollback to savepoint x;
insert into test_rollback_and_major_t values(50 * 10 + 5, 1);
select count(*) from test_rollback_and_major_t;
count(*)
26
savepoint x;
update test_rollback_and_major_t set row_value = 52 * 123 where row_key = 1;
insert into test_rollback_and_major_t values(52 + 3000, 52);
rollback to savepoint x;
insert into test_rollback_and_major_t values(52 * 10, 1);
select count(*) from test_rollback_and_major_t;
count(*)
27
savepoint x;
update test_rollback_and_major_t set row_value = 52 * 321 where row_key = 1;
insert into test_rollback_and_major_t values(52 + 3000, 52);
rollback to savepoint x;
insert into test_rollback_and_major_t values(52 * 10 + 5, 1);
select count(*) from test_rollback_and_major_t;
count(*)
27
savepoint x;
update test_rollback_and_major_t set row_value = 54 * 123 where row_key = 1;
insert into test_rollback_and_major_t values(54 + 3000, 54);
rollback to savepoint x;
insert into test_rollback_and_major_t values(54 * 10, 1);
select count(*) from test_rollback_and_major_t;
count(*)
28
savepoint x;
update test_rollback_and_major_t set row_value = 54 * 321 where row_key = 1;
insert into test_rollback_and_major_t values(54 + 3000, 54);
rollback to savepoint x;
insert into test_rollback_and_major_t values(54 * 10 + 5, 1);
select count(*) from test_rollback_and_major_t;
count(*)
28
savepoint x;
update test_rollback_and_major_t set row_value = 56 * 123 where row_key = 1;
insert into test_rollback_and_major_t values(56 + 3000, 56);
rollback to savepoint x;
insert into test_rollback_and_major_t values(56 * 10, 1);
select count(*) from test_rollback_and_major_t;
count(*)
29
savepoint x;
update test_rollback_and_major_t set row_value = 56 * 321 where row_key = 1;
insert into test_rollback_and_major_t values(56 + 3000, 56);
rollback to savepoint x;
insert into test_rollback_and_major_t values(56 * 10 + 5, 1);
select count(*) from test_rollback_and_major_t;
count(*)
29
savepoint x;
update test_rollback_and_major_t set row_value = 58 * 123 where row_key = 1;
insert into test_rollback_and_major_t values(58 + 3000, 58);
rollback to savepoint x;
insert into test_rollback_and_major_t values(58 * 10, 1);
select count(*) from test_rollback_and_major_t;
count(*)
30
savepoint x;
update test_rollback_and_major_t set row_value = 58 * 321 where row_key = 1;
insert into test_rollback_and_major_t values(58 + 3000, 58);
rollback to savepoint x;
insert into test_rollback_and_major_t values(58 * 10 + 5, 1);
select count(*) from test_rollback_and_major_t;
count(*)
30
savepoint x;
update test_rollback_and_major_t set row_value = 60 * 123 where row_key = 1;
insert into test_rollback_and_major_t values(60 + 3000, 60);
rollback to savepoint x;
insert into test_rollback_and_major_t values(60 * 10, 1);
select count(*) from test_rollback_and_major_t;
count(*)
31
savepoint x;
update test_rollback_and_major_t set row_value = 60 * 321 where row_key = 1;
insert into test_rollback_and_major_t values(60 + 3000, 60);
rollback to savepoint x;
insert into test_rollback_and_major_t values(60 * 10 + 5, 1);
select count(*) from test_rollback_and_major_t;
count(*)
31
savepoint x;
update test_rollback_and_major_t set row_value = 62 * 123 where row_key = 1;
insert into test_rollback_and_major_t values(62 + 3000, 62);
rollback to savepoint x;
insert into test_rollback_and_major_t values(62 * 10, 1);
select count(*) from test_rollback_and_major_t;
count(*)
32
savepoint x;
update test_rollback_and_major_t set row_value = 62 * 321 where row_key = 1;
insert into test_rollback_and_major_t values(62 + 3000, 62);
rollback to savepoint x;
insert into test_rollback_and_major_t values(62 * 10 + 5, 1);
select count(*) from test_rollback_and_major_t;
count(*)
32
savepoint x;
update test_rollback_and_major_t set row_value = 64 * 123 where row_key = 1;
insert into test_rollback_and_major_t values(64 + 3000, 64);
rollback to savepoint x;
insert into test_rollback_and_major_t values(64 * 10, 1);
select count(*) from test_rollback_and_major_t;
count(*)
33
savepoint x;
update test_rollback_and_major_t set row_value = 64 * 321 where row_key = 1;
insert into test_rollback_and_major_t values(64 + 3000, 64);
rollback to savepoint x;
insert into test_rollback_and_major_t values(64 * 10 + 5, 1);
select count(*) from test_rollback_and_major_t;
count(*)
33
savepoint x;
update test_rollback_and_major_t set row_value = 66 * 123 where row_key = 1;
insert into test_rollback_and_major_t values(66 + 3000, 66);
rollback to savepoint x;
insert into test_rollback_and_major_t values(66 * 10, 1);
select count(*) from test_rollback_and_major_t;
count(*)
34
savepoint x;
update test_rollback_and_major_t set row_value = 66 * 321 where row_key = 1;
insert into test_rollback_and_major_t values(66 + 3000, 66);
rollback to savepoint x;
insert into test_rollback_and_major_t values(66 * 10 + 5, 1);
select count(*) from test_rollback_and_major_t;
count(*)
34
savepoint x;
update test_rollback_and_major_t set row_value = 68 * 123 where row_key = 1;
insert into test_rollback_and_major_t values(68 + 3000, 68);
rollback to savepoint x;
insert into test_rollback_and_major_t values(68 * 10, 1);
select count(*) from test_rollback_and_major_t;
count(*)
35
savepoint x;
update test_rollback_and_major_t set row_value = 68 * 321 where row_key = 1;
insert into test_rollback_and_major_t values(68 + 3000, 68);
rollback to savepoint x;
insert into test_rollback_and_major_t values(68 * 10 + 5, 1);
select count(*) from test_rollback_and_major_t;
count(*)
35
savepoint x;
update test_rollback_and_major_t set row_value = 70 * 123 where row_key = 1;
insert into test_rollback_and_major_t values(70 + 3000, 70);
rollback to savepoint x;
insert into test_rollback_and_major_t values(70 * 10, 1);
select count(*) from test_rollback_and_major_t;
count(*)
36
savepoint x;
update test_rollback_and_major_t set row_value = 70 * 321 where row_key = 1;
insert into test_rollback_and_major_t values(70 + 3000, 70);
rollback to savepoint x;
insert into test_rollback_and_major_t values(70 * 10 + 5, 1);
select count(*) from test_rollback_and_major_t;
count(*)
36
savepoint x;
update test_rollback_and_major_t set row_value = 72 * 123 where row_key = 1;
insert into test_rollback_and_major_t values(72 + 3000, 72);
rollback to savepoint x;
insert into test_rollback_and_major_t values(72 * 10, 1);
select count(*) from test_rollback_and_major_t;
count(*)
37
savepoint x;
update test_rollback_and_major_t set row_value = 72 * 321 where row_key = 1;
insert into test_rollback_and_major_t values(72 + 3000, 72);
rollback to savepoint x;
insert into test_rollback_and_major_t values(72 * 10 + 5, 1);
select count(*) from test_rollback_and_major_t;
count(*)
37
savepoint x;
update test_rollback_and_major_t set row_value = 74 * 123 where row_key = 1;
insert into test_rollback_and_major_t values(74 + 3000, 74);
rollback to savepoint x;
insert into test_rollback_and_major_t values(74 * 10, 1);
select count(*) from test_rollback_and_major_t;
count(*)
38
savepoint x;
update test_rollback_and_major_t set row_value = 74 * 321 where row_key = 1;
insert into test_rollback_and_major_t values(74 + 3000, 74);
rollback to savepoint x;
insert into test_rollback_and_major_t values(74 * 10 + 5, 1);
select count(*) from test_rollback_and_major_t;
count(*)
38
savepoint x;
update test_rollback_and_major_t set row_value = 76 * 123 where row_key = 1;
insert into test_rollback_and_major_t values(76 + 3000, 76);
rollback to savepoint x;
insert into test_rollback_and_major_t values(76 * 10, 1);
select count(*) from test_rollback_and_major_t;
count(*)
39
savepoint x;
update test_rollback_and_major_t set row_value = 76 * 321 where row_key = 1;
insert into test_rollback_and_major_t values(76 + 3000, 76);
rollback to savepoint x;
insert into test_rollback_and_major_t values(76 * 10 + 5, 1);
select count(*) from test_rollback_and_major_t;
count(*)
39
savepoint x;
update test_rollback_and_major_t set row_value = 78 * 123 where row_key = 1;
insert into test_rollback_and_major_t values(78 + 3000, 78);
rollback to savepoint x;
insert into test_rollback_and_major_t values(78 * 10, 1);
select count(*) from test_rollback_and_major_t;
count(*)
40
savepoint x;
update test_rollback_and_major_t set row_value = 78 * 321 where row_key = 1;
insert into test_rollback_and_major_t values(78 + 3000, 78);
rollback to savepoint x;
insert into test_rollback_and_major_t values(78 * 10 + 5, 1);
select count(*) from test_rollback_and_major_t;
count(*)
40
savepoint x;
update test_rollback_and_major_t set row_value = 80 * 123 where row_key = 1;
insert into test_rollback_and_major_t values(80 + 3000, 80);
rollback to savepoint x;
insert into test_rollback_and_major_t values(80 * 10, 1);
select count(*) from test_rollback_and_major_t;
count(*)
41
savepoint x;
update test_rollback_and_major_t set row_value = 80 * 321 where row_key = 1;
insert into test_rollback_and_major_t values(80 + 3000, 80);
rollback to savepoint x;
insert into test_rollback_and_major_t values(80 * 10 + 5, 1);
select count(*) from test_rollback_and_major_t;
count(*)
41
savepoint x;
update test_rollback_and_major_t set row_value = 82 * 123 where row_key = 1;
insert into test_rollback_and_major_t values(82 + 3000, 82);
rollback to savepoint x;
insert into test_rollback_and_major_t values(82 * 10, 1);
select count(*) from test_rollback_and_major_t;
count(*)
42
savepoint x;
update test_rollback_and_major_t set row_value = 82 * 321 where row_key = 1;
insert into test_rollback_and_major_t values(82 + 3000, 82);
rollback to savepoint x;
insert into test_rollback_and_major_t values(82 * 10 + 5, 1);
select count(*) from test_rollback_and_major_t;
count(*)
42
savepoint x;
update test_rollback_and_major_t set row_value = 84 * 123 where row_key = 1;
insert into test_rollback_and_major_t values(84 + 3000, 84);
rollback to savepoint x;
insert into test_rollback_and_major_t values(84 * 10, 1);
select count(*) from test_rollback_and_major_t;
count(*)
43
savepoint x;
update test_rollback_and_major_t set row_value = 84 * 321 where row_key = 1;
insert into test_rollback_and_major_t values(84 + 3000, 84);
rollback to savepoint x;
insert into test_rollback_and_major_t values(84 * 10 + 5, 1);
select count(*) from test_rollback_and_major_t;
count(*)
43
savepoint x;
update test_rollback_and_major_t set row_value = 86 * 123 where row_key = 1;
insert into test_rollback_and_major_t values(86 + 3000, 86);
rollback to savepoint x;
insert into test_rollback_and_major_t values(86 * 10, 1);
select count(*) from test_rollback_and_major_t;
count(*)
44
savepoint x;
update test_rollback_and_major_t set row_value = 86 * 321 where row_key = 1;
insert into test_rollback_and_major_t values(86 + 3000, 86);
rollback to savepoint x;
insert into test_rollback_and_major_t values(86 * 10 + 5, 1);
select count(*) from test_rollback_and_major_t;
count(*)
44
savepoint x;
update test_rollback_and_major_t set row_value = 88 * 123 where row_key = 1;
insert into test_rollback_and_major_t values(88 + 3000, 88);
rollback to savepoint x;
insert into test_rollback_and_major_t values(88 * 10, 1);
select count(*) from test_rollback_and_major_t;
count(*)
45
savepoint x;
update test_rollback_and_major_t set row_value = 88 * 321 where row_key = 1;
insert into test_rollback_and_major_t values(88 + 3000, 88);
rollback to savepoint x;
insert into test_rollback_and_major_t values(88 * 10 + 5, 1);
select count(*) from test_rollback_and_major_t;
count(*)
45
savepoint x;
update test_rollback_and_major_t set row_value = 90 * 123 where row_key = 1;
insert into test_rollback_and_major_t values(90 + 3000, 90);
rollback to savepoint x;
insert into test_rollback_and_major_t values(90 * 10, 1);
select count(*) from test_rollback_and_major_t;
count(*)
46
savepoint x;
update test_rollback_and_major_t set row_value = 90 * 321 where row_key = 1;
insert into test_rollback_and_major_t values(90 + 3000, 90);
rollback to savepoint x;
insert into test_rollback_and_major_t values(90 * 10 + 5, 1);
select count(*) from test_rollback_and_major_t;
count(*)
46
savepoint x;
update test_rollback_and_major_t set row_value = 92 * 123 where row_key = 1;
insert into test_rollback_and_major_t values(92 + 3000, 92);
rollback to savepoint x;
insert into test_rollback_and_major_t values(92 * 10, 1);
select count(*) from test_rollback_and_major_t;
count(*)
47
savepoint x;
update test_rollback_and_major_t set row_value = 92 * 321 where row_key = 1;
insert into test_rollback_and_major_t values(92 + 3000, 92);
rollback to savepoint x;
insert into test_rollback_and_major_t values(92 * 10 + 5, 1);
select count(*) from test_rollback_and_major_t;
count(*)
47
savepoint x;
update test_rollback_and_major_t set row_value = 94 * 123 where row_key = 1;
insert into test_rollback_and_major_t values(94 + 3000, 94);
rollback to savepoint x;
insert into test_rollback_and_major_t values(94 * 10, 1);
select count(*) from test_rollback_and_major_t;
count(*)
48
savepoint x;
update test_rollback_and_major_t set row_value = 94 * 321 where row_key = 1;
insert into test_rollback_and_major_t values(94 + 3000, 94);
rollback to savepoint x;
insert into test_rollback_and_major_t values(94 * 10 + 5, 1);
select count(*) from test_rollback_and_major_t;
count(*)
48
savepoint x;
update test_rollback_and_major_t set row_value = 96 * 123 where row_key = 1;
insert into test_rollback_and_major_t values(96 + 3000, 96);
rollback to savepoint x;
insert into test_rollback_and_major_t values(96 * 10, 1);
select count(*) from test_rollback_and_major_t;
count(*)
49
savepoint x;
update test_rollback_and_major_t set row_value = 96 * 321 where row_key = 1;
insert into test_rollback_and_major_t values(96 + 3000, 96);
rollback to savepoint x;
insert into test_rollback_and_major_t values(96 * 10 + 5, 1);
select count(*) from test_rollback_and_major_t;
count(*)
49
savepoint x;
update test_rollback_and_major_t set row_value = 98 * 123 where row_key = 1;
insert into test_rollback_and_major_t values(98 + 3000, 98);
rollback to savepoint x;
insert into test_rollback_and_major_t values(98 * 10, 1);
select count(*) from test_rollback_and_major_t;
count(*)
50
savepoint x;
update test_rollback_and_major_t set row_value = 98 * 321 where row_key = 1;
insert into test_rollback_and_major_t values(98 + 3000, 98);
rollback to savepoint x;
insert into test_rollback_and_major_t values(98 * 10 + 5, 1);
select count(*) from test_rollback_and_major_t;
count(*)
50
savepoint x;
update test_rollback_and_major_t set row_value = 100 * 123 where row_key = 1;
insert into test_rollback_and_major_t values(100 + 3000, 100);
rollback to savepoint x;
insert into test_rollback_and_major_t values(100 * 10, 1);
select count(*) from test_rollback_and_major_t;
count(*)
51
savepoint x;
update test_rollback_and_major_t set row_value = 100 * 321 where row_key = 1;
insert into test_rollback_and_major_t values(100 + 3000, 100);
rollback to savepoint x;
insert into test_rollback_and_major_t values(100 * 10 + 5, 1);
select count(*) from test_rollback_and_major_t;
count(*)
51
savepoint x;
update test_rollback_and_major_t set row_value = 102 * 123 where row_key = 1;
insert into test_rollback_and_major_t values(102 + 3000, 102);
rollback to savepoint x;
insert into test_rollback_and_major_t values(102 * 10, 1);
select count(*) from test_rollback_and_major_t;
count(*)
52
savepoint x;
update test_rollback_and_major_t set row_value = 102 * 321 where row_key = 1;
insert into test_rollback_and_major_t values(102 + 3000, 102);
rollback to savepoint x;
insert into test_rollback_and_major_t values(102 * 10 + 5, 1);
select count(*) from test_rollback_and_major_t;
count(*)
52
savepoint x;
update test_rollback_and_major_t set row_value = 104 * 123 where row_key = 1;
insert into test_rollback_and_major_t values(104 + 3000, 104);
rollback to savepoint x;
insert into test_rollback_and_major_t values(104 * 10, 1);
select count(*) from test_rollback_and_major_t;
count(*)
53
savepoint x;
update test_rollback_and_major_t set row_value = 104 * 321 where row_key = 1;
insert into test_rollback_and_major_t values(104 + 3000, 104);
rollback to savepoint x;
insert into test_rollback_and_major_t values(104 * 10 + 5, 1);
select count(*) from test_rollback_and_major_t;
count(*)
53
savepoint x;
update test_rollback_and_major_t set row_value = 106 * 123 where row_key = 1;
insert into test_rollback_and_major_t values(106 + 3000, 106);
rollback to savepoint x;
insert into test_rollback_and_major_t values(106 * 10, 1);
select count(*) from test_rollback_and_major_t;
count(*)
54
savepoint x;
update test_rollback_and_major_t set row_value = 106 * 321 where row_key = 1;
insert into test_rollback_and_major_t values(106 + 3000, 106);
rollback to savepoint x;
insert into test_rollback_and_major_t values(106 * 10 + 5, 1);
select count(*) from test_rollback_and_major_t;
count(*)
54
savepoint x;
update test_rollback_and_major_t set row_value = 108 * 123 where row_key = 1;
insert into test_rollback_and_major_t values(108 + 3000, 108);
rollback to savepoint x;
insert into test_rollback_and_major_t values(108 * 10, 1);
select count(*) from test_rollback_and_major_t;
count(*)
55
savepoint x;
update test_rollback_and_major_t set row_value = 108 * 321 where row_key = 1;
insert into test_rollback_and_major_t values(108 + 3000, 108);
rollback to savepoint x;
insert into test_rollback_and_major_t values(108 * 10 + 5, 1);
select count(*) from test_rollback_and_major_t;
count(*)
55
savepoint x;
update test_rollback_and_major_t set row_value = 110 * 123 where row_key = 1;
insert into test_rollback_and_major_t values(110 + 3000, 110);
rollback to savepoint x;
insert into test_rollback_and_major_t values(110 * 10, 1);
select count(*) from test_rollback_and_major_t;
count(*)
56
savepoint x;
update test_rollback_and_major_t set row_value = 110 * 321 where row_key = 1;
insert into test_rollback_and_major_t values(110 + 3000, 110);
rollback to savepoint x;
insert into test_rollback_and_major_t values(110 * 10 + 5, 1);
select count(*) from test_rollback_and_major_t;
count(*)
56
savepoint x;
update test_rollback_and_major_t set row_value = 112 * 123 where row_key = 1;
insert into test_rollback_and_major_t values(112 + 3000, 112);
rollback to savepoint x;
insert into test_rollback_and_major_t values(112 * 10, 1);
select count(*) from test_rollback_and_major_t;
count(*)
57
savepoint x;
update test_rollback_and_major_t set row_value = 112 * 321 where row_key = 1;
insert into test_rollback_and_major_t values(112 + 3000, 112);
rollback to savepoint x;
insert into test_rollback_and_major_t values(112 * 10 + 5, 1);
select count(*) from test_rollback_and_major_t;
count(*)
57
savepoint x;
update test_rollback_and_major_t set row_value = 114 * 123 where row_key = 1;
insert into test_rollback_and_major_t values(114 + 3000, 114);
rollback to savepoint x;
insert into test_rollback_and_major_t values(114 * 10, 1);
select count(*) from test_rollback_and_major_t;
count(*)
58
savepoint x;
update test_rollback_and_major_t set row_value = 114 * 321 where row_key = 1;
insert into test_rollback_and_major_t values(114 + 3000, 114);
rollback to savepoint x;
insert into test_rollback_and_major_t values(114 * 10 + 5, 1);
select count(*) from test_rollback_and_major_t;
count(*)
58
savepoint x;
update test_rollback_and_major_t set row_value = 116 * 123 where row_key = 1;
insert into test_rollback_and_major_t values(116 + 3000, 116);
rollback to savepoint x;
insert into test_rollback_and_major_t values(116 * 10, 1);
select count(*) from test_rollback_and_major_t;
count(*)
59
savepoint x;
update test_rollback_and_major_t set row_value = 116 * 321 where row_key = 1;
insert into test_rollback_and_major_t values(116 + 3000, 116);
rollback to savepoint x;
insert into test_rollback_and_major_t values(116 * 10 + 5, 1);
select count(*) from test_rollback_and_major_t;
count(*)
59
savepoint x;
update test_rollback_and_major_t set row_value = 118 * 123 where row_key = 1;
insert into test_rollback_and_major_t values(118 + 3000, 118);
rollback to savepoint x;
insert into test_rollback_and_major_t values(118 * 10, 1);
select count(*) from test_rollback_and_major_t;
count(*)
60
savepoint x;
update test_rollback_and_major_t set row_value = 118 * 321 where row_key = 1;
insert into test_rollback_and_major_t values(118 + 3000, 118);
rollback to savepoint x;
insert into test_rollback_and_major_t values(118 * 10 + 5, 1);
select count(*) from test_rollback_and_major_t;
count(*)
60
savepoint x;
update test_rollback_and_major_t set row_value = 120 * 123 where row_key = 1;
insert into test_rollback_and_major_t values(120 + 3000, 120);
rollback to savepoint x;
insert into test_rollback_and_major_t values(120 * 10, 1);
select count(*) from test_rollback_and_major_t;
count(*)
61
savepoint x;
update test_rollback_and_major_t set row_value = 120 * 321 where row_key = 1;
insert into test_rollback_and_major_t values(120 + 3000, 120);
rollback to savepoint x;
insert into test_rollback_and_major_t values(120 * 10 + 5, 1);
select count(*) from test_rollback_and_major_t;
count(*)
61
savepoint x;
update test_rollback_and_major_t set row_value = 122 * 123 where row_key = 1;
insert into test_rollback_and_major_t values(122 + 3000, 122);
rollback to savepoint x;
insert into test_rollback_and_major_t values(122 * 10, 1);
select count(*) from test_rollback_and_major_t;
count(*)
62
savepoint x;
update test_rollback_and_major_t set row_value = 122 * 321 where row_key = 1;
insert into test_rollback_and_major_t values(122 + 3000, 122);
rollback to savepoint x;
insert into test_rollback_and_major_t values(122 * 10 + 5, 1);
select count(*) from test_rollback_and_major_t;
count(*)
62
savepoint x;
update test_rollback_and_major_t set row_value = 124 * 123 where row_key = 1;
insert into test_rollback_and_major_t values(124 + 3000, 124);
rollback to savepoint x;
insert into test_rollback_and_major_t values(124 * 10, 1);
select count(*) from test_rollback_and_major_t;
count(*)
63
savepoint x;
update test_rollback_and_major_t set row_value = 124 * 321 where row_key = 1;
insert into test_rollback_and_major_t values(124 + 3000, 124);
rollback to savepoint x;
insert into test_rollback_and_major_t values(124 * 10 + 5, 1);
select count(*) from test_rollback_and_major_t;
count(*)
63
savepoint x;
update test_rollback_and_major_t set row_value = 126 * 123 where row_key = 1;
insert into test_rollback_and_major_t values(126 + 3000, 126);
rollback to savepoint x;
insert into test_rollback_and_major_t values(126 * 10, 1);
select count(*) from test_rollback_and_major_t;
count(*)
64
savepoint x;
update test_rollback_and_major_t set row_value = 126 * 321 where row_key = 1;
insert into test_rollback_and_major_t values(126 + 3000, 126);
rollback to savepoint x;
insert into test_rollback_and_major_t values(126 * 10 + 5, 1);
select count(*) from test_rollback_and_major_t;
count(*)
64
savepoint x;
update test_rollback_and_major_t set row_value = 128 * 123 where row_key = 1;
insert into test_rollback_and_major_t values(128 + 3000, 128);
rollback to savepoint x;
insert into test_rollback_and_major_t values(128 * 10, 1);
select count(*) from test_rollback_and_major_t;
count(*)
65
savepoint x;
update test_rollback_and_major_t set row_value = 128 * 321 where row_key = 1;
insert into test_rollback_and_major_t values(128 + 3000, 128);
rollback to savepoint x;
insert into test_rollback_and_major_t values(128 * 10 + 5, 1);
select count(*) from test_rollback_and_major_t;
count(*)
65
savepoint x;
update test_rollback_and_major_t set row_value = 130 * 123 where row_key = 1;
insert into test_rollback_and_major_t values(130 + 3000, 130);
rollback to savepoint x;
insert into test_rollback_and_major_t values(130 * 10, 1);
select count(*) from test_rollback_and_major_t;
count(*)
66
savepoint x;
update test_rollback_and_major_t set row_value = 130 * 321 where row_key = 1;
insert into test_rollback_and_major_t values(130 + 3000, 130);
rollback to savepoint x;
insert into test_rollback_and_major_t values(130 * 10 + 5, 1);
select count(*) from test_rollback_and_major_t;
count(*)
66
savepoint x;
update test_rollback_and_major_t set row_value = 132 * 123 where row_key = 1;
insert into test_rollback_and_major_t values(132 + 3000, 132);
rollback to savepoint x;
insert into test_rollback_and_major_t values(132 * 10, 1);
select count(*) from test_rollback_and_major_t;
count(*)
67
savepoint x;
update test_rollback_and_major_t set row_value = 132 * 321 where row_key = 1;
insert into test_rollback_and_major_t values(132 + 3000, 132);
rollback to savepoint x;
insert into test_rollback_and_major_t values(132 * 10 + 5, 1);
select count(*) from test_rollback_and_major_t;
count(*)
67
savepoint x;
update test_rollback_and_major_t set row_value = 134 * 123 where row_key = 1;
insert into test_rollback_and_major_t values(134 + 3000, 134);
rollback to savepoint x;
insert into test_rollback_and_major_t values(134 * 10, 1);
select count(*) from test_rollback_and_major_t;
count(*)
68
savepoint x;
update test_rollback_and_major_t set row_value = 134 * 321 where row_key = 1;
insert into test_rollback_and_major_t values(134 + 3000, 134);
rollback to savepoint x;
insert into test_rollback_and_major_t values(134 * 10 + 5, 1);
select count(*) from test_rollback_and_major_t;
count(*)
68
savepoint x;
update test_rollback_and_major_t set row_value = 136 * 123 where row_key = 1;
insert into test_rollback_and_major_t values(136 + 3000, 136);
rollback to savepoint x;
insert into test_rollback_and_major_t values(136 * 10, 1);
select count(*) from test_rollback_and_major_t;
count(*)
69
savepoint x;
update test_rollback_and_major_t set row_value = 136 * 321 where row_key = 1;
insert into test_rollback_and_major_t values(136 + 3000, 136);
rollback to savepoint x;
insert into test_rollback_and_major_t values(136 * 10 + 5, 1);
select count(*) from test_rollback_and_major_t;
count(*)
69
savepoint x;
update test_rollback_and_major_t set row_value = 138 * 123 where row_key = 1;
insert into test_rollback_and_major_t values(138 + 3000, 138);
rollback to savepoint x;
insert into test_rollback_and_major_t values(138 * 10, 1);
select count(*) from test_rollback_and_major_t;
count(*)
70
savepoint x;
update test_rollback_and_major_t set row_value = 138 * 321 where row_key = 1;
insert into test_rollback_and_major_t values(138 + 3000, 138);
rollback to savepoint x;
insert into test_rollback_and_major_t values(138 * 10 + 5, 1);
select count(*) from test_rollback_and_major_t;
count(*)
70
savepoint x;
update test_rollback_and_major_t set row_value = 140 * 123 where row_key = 1;
insert into test_rollback_and_major_t values(140 + 3000, 140);
rollback to savepoint x;
insert into test_rollback_and_major_t values(140 * 10, 1);
select count(*) from test_rollback_and_major_t;
count(*)
71
savepoint x;
update test_rollback_and_major_t set row_value = 140 * 321 where row_key = 1;
insert into test_rollback_and_major_t values(140 + 3000, 140);
rollback to savepoint x;
insert into test_rollback_and_major_t values(140 * 10 + 5, 1);
select count(*) from test_rollback_and_major_t;
count(*)
71
savepoint x;
update test_rollback_and_major_t set row_value = 142 * 123 where row_key = 1;
insert into test_rollback_and_major_t values(142 + 3000, 142);
rollback to savepoint x;
insert into test_rollback_and_major_t values(142 * 10, 1);
select count(*) from test_rollback_and_major_t;
count(*)
72
savepoint x;
update test_rollback_and_major_t set row_value = 142 * 321 where row_key = 1;
insert into test_rollback_and_major_t values(142 + 3000, 142);
rollback to savepoint x;
insert into test_rollback_and_major_t values(142 * 10 + 5, 1);
select count(*) from test_rollback_and_major_t;
count(*)
72
savepoint x;
update test_rollback_and_major_t set row_value = 144 * 123 where row_key = 1;
insert into test_rollback_and_major_t values(144 + 3000, 144);
rollback to savepoint x;
insert into test_rollback_and_major_t values(144 * 10, 1);
select count(*) from test_rollback_and_major_t;
count(*)
73
savepoint x;
update test_rollback_and_major_t set row_value = 144 * 321 where row_key = 1;
insert into test_rollback_and_major_t values(144 + 3000, 144);
rollback to savepoint x;
insert into test_rollback_and_major_t values(144 * 10 + 5, 1);
select count(*) from test_rollback_and_major_t;
count(*)
73
savepoint x;
update test_rollback_and_major_t set row_value = 146 * 123 where row_key = 1;
insert into test_rollback_and_major_t values(146 + 3000, 146);
rollback to savepoint x;
insert into test_rollback_and_major_t values(146 * 10, 1);
select count(*) from test_rollback_and_major_t;
count(*)
74
savepoint x;
update test_rollback_and_major_t set row_value = 146 * 321 where row_key = 1;
insert into test_rollback_and_major_t values(146 + 3000, 146);
rollback to savepoint x;
insert into test_rollback_and_major_t values(146 * 10 + 5, 1);
select count(*) from test_rollback_and_major_t;
count(*)
74
savepoint x;
update test_rollback_and_major_t set row_value = 148 * 123 where row_key = 1;
insert into test_rollback_and_major_t values(148 + 3000, 148);
rollback to savepoint x;
insert into test_rollback_and_major_t values(148 * 10, 1);
select count(*) from test_rollback_and_major_t;
count(*)
75
savepoint x;
update test_rollback_and_major_t set row_value = 148 * 321 where row_key = 1;
insert into test_rollback_and_major_t values(148 + 3000, 148);
rollback to savepoint x;
insert into test_rollback_and_major_t values(148 * 10 + 5, 1);
select count(*) from test_rollback_and_major_t;
count(*)
75
savepoint x;
update test_rollback_and_major_t set row_value = 150 * 123 where row_key = 1;
insert into test_rollback_and_major_t values(150 + 3000, 150);
rollback to savepoint x;
insert into test_rollback_and_major_t values(150 * 10, 1);
select count(*) from test_rollback_and_major_t;
count(*)
76
savepoint x;
update test_rollback_and_major_t set row_value = 150 * 321 where row_key = 1;
insert into test_rollback_and_major_t values(150 + 3000, 150);
rollback to savepoint x;
insert into test_rollback_and_major_t values(150 * 10 + 5, 1);
select count(*) from test_rollback_and_major_t;
count(*)
76
savepoint x;
update test_rollback_and_major_t set row_value = 152 * 123 where row_key = 1;
insert into test_rollback_and_major_t values(152 + 3000, 152);
rollback to savepoint x;
insert into test_rollback_and_major_t values(152 * 10, 1);
select count(*) from test_rollback_and_major_t;
count(*)
77
savepoint x;
update test_rollback_and_major_t set row_value = 152 * 321 where row_key = 1;
insert into test_rollback_and_major_t values(152 + 3000, 152);
rollback to savepoint x;
insert into test_rollback_and_major_t values(152 * 10 + 5, 1);
select count(*) from test_rollback_and_major_t;
count(*)
77
savepoint x;
update test_rollback_and_major_t set row_value = 154 * 123 where row_key = 1;
insert into test_rollback_and_major_t values(154 + 3000, 154);
rollback to savepoint x;
insert into test_rollback_and_major_t values(154 * 10, 1);
select count(*) from test_rollback_and_major_t;
count(*)
78
savepoint x;
update test_rollback_and_major_t set row_value = 154 * 321 where row_key = 1;
insert into test_rollback_and_major_t values(154 + 3000, 154);
rollback to savepoint x;
insert into test_rollback_and_major_t values(154 * 10 + 5, 1);
select count(*) from test_rollback_and_major_t;
count(*)
78
savepoint x;
update test_rollback_and_major_t set row_value = 156 * 123 where row_key = 1;
insert into test_rollback_and_major_t values(156 + 3000, 156);
rollback to savepoint x;
insert into test_rollback_and_major_t values(156 * 10, 1);
select count(*) from test_rollback_and_major_t;
count(*)
79
savepoint x;
update test_rollback_and_major_t set row_value = 156 * 321 where row_key = 1;
insert into test_rollback_and_major_t values(156 + 3000, 156);
rollback to savepoint x;
insert into test_rollback_and_major_t values(156 * 10 + 5, 1);
select count(*) from test_rollback_and_major_t;
count(*)
79
savepoint x;
update test_rollback_and_major_t set row_value = 158 * 123 where row_key = 1;
insert into test_rollback_and_major_t values(158 + 3000, 158);
rollback to savepoint x;
insert into test_rollback_and_major_t values(158 * 10, 1);
select count(*) from test_rollback_and_major_t;
count(*)
80
savepoint x;
update test_rollback_and_major_t set row_value = 158 * 321 where row_key = 1;
insert into test_rollback_and_major_t values(158 + 3000, 158);
rollback to savepoint x;
insert into test_rollback_and_major_t values(158 * 10 + 5, 1);
select count(*) from test_rollback_and_major_t;
count(*)
80
savepoint x;
update test_rollback_and_major_t set row_value = 160 * 123 where row_key = 1;
insert into test_rollback_and_major_t values(160 + 3000, 160);
rollback to savepoint x;
insert into test_rollback_and_major_t values(160 * 10, 1);
select count(*) from test_rollback_and_major_t;
count(*)
81
savepoint x;
update test_rollback_and_major_t set row_value = 160 * 321 where row_key = 1;
insert into test_rollback_and_major_t values(160 + 3000, 160);
rollback to savepoint x;
insert into test_rollback_and_major_t values(160 * 10 + 5, 1);
select count(*) from test_rollback_and_major_t;
count(*)
81
savepoint x;
update test_rollback_and_major_t set row_value = 162 * 123 where row_key = 1;
insert into test_rollback_and_major_t values(162 + 3000, 162);
rollback to savepoint x;
insert into test_rollback_and_major_t values(162 * 10, 1);
select count(*) from test_rollback_and_major_t;
count(*)
82
savepoint x;
update test_rollback_and_major_t set row_value = 162 * 321 where row_key = 1;
insert into test_rollback_and_major_t values(162 + 3000, 162);
rollback to savepoint x;
insert into test_rollback_and_major_t values(162 * 10 + 5, 1);
select count(*) from test_rollback_and_major_t;
count(*)
82
savepoint x;
update test_rollback_and_major_t set row_value = 164 * 123 where row_key = 1;
insert into test_rollback_and_major_t values(164 + 3000, 164);
rollback to savepoint x;
insert into test_rollback_and_major_t values(164 * 10, 1);
select count(*) from test_rollback_and_major_t;
count(*)
83
savepoint x;
update test_rollback_and_major_t set row_value = 164 * 321 where row_key = 1;
insert into test_rollback_and_major_t values(164 + 3000, 164);
rollback to savepoint x;
insert into test_rollback_and_major_t values(164 * 10 + 5, 1);
select count(*) from test_rollback_and_major_t;
count(*)
83
savepoint x;
update test_rollback_and_major_t set row_value = 166 * 123 where row_key = 1;
insert into test_rollback_and_major_t values(166 + 3000, 166);
rollback to savepoint x;
insert into test_rollback_and_major_t values(166 * 10, 1);
select count(*) from test_rollback_and_major_t;
count(*)
84
savepoint x;
update test_rollback_and_major_t set row_value = 166 * 321 where row_key = 1;
insert into test_rollback_and_major_t values(166 + 3000, 166);
rollback to savepoint x;
insert into test_rollback_and_major_t values(166 * 10 + 5, 1);
select count(*) from test_rollback_and_major_t;
count(*)
84
savepoint x;
update test_rollback_and_major_t set row_value = 168 * 123 where row_key = 1;
insert into test_rollback_and_major_t values(168 + 3000, 168);
rollback to savepoint x;
insert into test_rollback_and_major_t values(168 * 10, 1);
select count(*) from test_rollback_and_major_t;
count(*)
85
savepoint x;
update test_rollback_and_major_t set row_value = 168 * 321 where row_key = 1;
insert into test_rollback_and_major_t values(168 + 3000, 168);
rollback to savepoint x;
insert into test_rollback_and_major_t values(168 * 10 + 5, 1);
select count(*) from test_rollback_and_major_t;
count(*)
85
savepoint x;
update test_rollback_and_major_t set row_value = 170 * 123 where row_key = 1;
insert into test_rollback_and_major_t values(170 + 3000, 170);
rollback to savepoint x;
insert into test_rollback_and_major_t values(170 * 10, 1);
select count(*) from test_rollback_and_major_t;
count(*)
86
savepoint x;
update test_rollback_and_major_t set row_value = 170 * 321 where row_key = 1;
insert into test_rollback_and_major_t values(170 + 3000, 170);
rollback to savepoint x;
insert into test_rollback_and_major_t values(170 * 10 + 5, 1);
select count(*) from test_rollback_and_major_t;
count(*)
86
savepoint x;
update test_rollback_and_major_t set row_value = 172 * 123 where row_key = 1;
insert into test_rollback_and_major_t values(172 + 3000, 172);
rollback to savepoint x;
insert into test_rollback_and_major_t values(172 * 10, 1);
select count(*) from test_rollback_and_major_t;
count(*)
87
savepoint x;
update test_rollback_and_major_t set row_value = 172 * 321 where row_key = 1;
insert into test_rollback_and_major_t values(172 + 3000, 172);
rollback to savepoint x;
insert into test_rollback_and_major_t values(172 * 10 + 5, 1);
select count(*) from test_rollback_and_major_t;
count(*)
87
savepoint x;
update test_rollback_and_major_t set row_value = 174 * 123 where row_key = 1;
insert into test_rollback_and_major_t values(174 + 3000, 174);
rollback to savepoint x;
insert into test_rollback_and_major_t values(174 * 10, 1);
select count(*) from test_rollback_and_major_t;
count(*)
88
savepoint x;
update test_rollback_and_major_t set row_value = 174 * 321 where row_key = 1;
insert into test_rollback_and_major_t values(174 + 3000, 174);
rollback to savepoint x;
insert into test_rollback_and_major_t values(174 * 10 + 5, 1);
select count(*) from test_rollback_and_major_t;
count(*)
88
savepoint x;
update test_rollback_and_major_t set row_value = 176 * 123 where row_key = 1;
insert into test_rollback_and_major_t values(176 + 3000, 176);
rollback to savepoint x;
insert into test_rollback_and_major_t values(176 * 10, 1);
select count(*) from test_rollback_and_major_t;
count(*)
89
savepoint x;
update test_rollback_and_major_t set row_value = 176 * 321 where row_key = 1;
insert into test_rollback_and_major_t values(176 + 3000, 176);
rollback to savepoint x;
insert into test_rollback_and_major_t values(176 * 10 + 5, 1);
select count(*) from test_rollback_and_major_t;
count(*)
89
savepoint x;
update test_rollback_and_major_t set row_value = 178 * 123 where row_key = 1;
insert into test_rollback_and_major_t values(178 + 3000, 178);
rollback to savepoint x;
insert into test_rollback_and_major_t values(178 * 10, 1);
select count(*) from test_rollback_and_major_t;
count(*)
90
savepoint x;
update test_rollback_and_major_t set row_value = 178 * 321 where row_key = 1;
insert into test_rollback_and_major_t values(178 + 3000, 178);
rollback to savepoint x;
insert into test_rollback_and_major_t values(178 * 10 + 5, 1);
select count(*) from test_rollback_and_major_t;
count(*)
90
savepoint x;
update test_rollback_and_major_t set row_value = 180 * 123 where row_key = 1;
insert into test_rollback_and_major_t values(180 + 3000, 180);
rollback to savepoint x;
insert into test_rollback_and_major_t values(180 * 10, 1);
select count(*) from test_rollback_and_major_t;
count(*)
91
savepoint x;
update test_rollback_and_major_t set row_value = 180 * 321 where row_key = 1;
insert into test_rollback_and_major_t values(180 + 3000, 180);
rollback to savepoint x;
insert into test_rollback_and_major_t values(180 * 10 + 5, 1);
select count(*) from test_rollback_and_major_t;
count(*)
91
savepoint x;
update test_rollback_and_major_t set row_value = 182 * 123 where row_key = 1;
insert into test_rollback_and_major_t values(182 + 3000, 182);
rollback to savepoint x;
insert into test_rollback_and_major_t values(182 * 10, 1);
select count(*) from test_rollback_and_major_t;
count(*)
92
savepoint x;
update test_rollback_and_major_t set row_value = 182 * 321 where row_key = 1;
insert into test_rollback_and_major_t values(182 + 3000, 182);
rollback to savepoint x;
insert into test_rollback_and_major_t values(182 * 10 + 5, 1);
select count(*) from test_rollback_and_major_t;
count(*)
92
savepoint x;
update test_rollback_and_major_t set row_value = 184 * 123 where row_key = 1;
insert into test_rollback_and_major_t values(184 + 3000, 184);
rollback to savepoint x;
insert into test_rollback_and_major_t values(184 * 10, 1);
select count(*) from test_rollback_and_major_t;
count(*)
93
savepoint x;
update test_rollback_and_major_t set row_value = 184 * 321 where row_key = 1;
insert into test_rollback_and_major_t values(184 + 3000, 184);
rollback to savepoint x;
insert into test_rollback_and_major_t values(184 * 10 + 5, 1);
select count(*) from test_rollback_and_major_t;
count(*)
93
savepoint x;
update test_rollback_and_major_t set row_value = 186 * 123 where row_key = 1;
insert into test_rollback_and_major_t values(186 + 3000, 186);
rollback to savepoint x;
insert into test_rollback_and_major_t values(186 * 10, 1);
select count(*) from test_rollback_and_major_t;
count(*)
94
savepoint x;
update test_rollback_and_major_t set row_value = 186 * 321 where row_key = 1;
insert into test_rollback_and_major_t values(186 + 3000, 186);
rollback to savepoint x;
insert into test_rollback_and_major_t values(186 * 10 + 5, 1);
select count(*) from test_rollback_and_major_t;
count(*)
94
savepoint x;
update test_rollback_and_major_t set row_value = 188 * 123 where row_key = 1;
insert into test_rollback_and_major_t values(188 + 3000, 188);
rollback to savepoint x;
insert into test_rollback_and_major_t values(188 * 10, 1);
select count(*) from test_rollback_and_major_t;
count(*)
95
savepoint x;
update test_rollback_and_major_t set row_value = 188 * 321 where row_key = 1;
insert into test_rollback_and_major_t values(188 + 3000, 188);
rollback to savepoint x;
insert into test_rollback_and_major_t values(188 * 10 + 5, 1);
select count(*) from test_rollback_and_major_t;
count(*)
95
savepoint x;
update test_rollback_and_major_t set row_value = 190 * 123 where row_key = 1;
insert into test_rollback_and_major_t values(190 + 3000, 190);
rollback to savepoint x;
insert into test_rollback_and_major_t values(190 * 10, 1);
select count(*) from test_rollback_and_major_t;
count(*)
96
savepoint x;
update test_rollback_and_major_t set row_value = 190 * 321 where row_key = 1;
insert into test_rollback_and_major_t values(190 + 3000, 190);
rollback to savepoint x;
insert into test_rollback_and_major_t values(190 * 10 + 5, 1);
select count(*) from test_rollback_and_major_t;
count(*)
96
savepoint x;
update test_rollback_and_major_t set row_value = 192 * 123 where row_key = 1;
insert into test_rollback_and_major_t values(192 + 3000, 192);
rollback to savepoint x;
insert into test_rollback_and_major_t values(192 * 10, 1);
select count(*) from test_rollback_and_major_t;
count(*)
97
savepoint x;
update test_rollback_and_major_t set row_value = 192 * 321 where row_key = 1;
insert into test_rollback_and_major_t values(192 + 3000, 192);
rollback to savepoint x;
insert into test_rollback_and_major_t values(192 * 10 + 5, 1);
select count(*) from test_rollback_and_major_t;
count(*)
97
savepoint x;
update test_rollback_and_major_t set row_value = 194 * 123 where row_key = 1;
insert into test_rollback_and_major_t values(194 + 3000, 194);
rollback to savepoint x;
insert into test_rollback_and_major_t values(194 * 10, 1);
select count(*) from test_rollback_and_major_t;
count(*)
98
savepoint x;
update test_rollback_and_major_t set row_value = 194 * 321 where row_key = 1;
insert into test_rollback_and_major_t values(194 + 3000, 194);
rollback to savepoint x;
insert into test_rollback_and_major_t values(194 * 10 + 5, 1);
select count(*) from test_rollback_and_major_t;
count(*)
98
savepoint x;
update test_rollback_and_major_t set row_value = 196 * 123 where row_key = 1;
insert into test_rollback_and_major_t values(196 + 3000, 196);
rollback to savepoint x;
insert into test_rollback_and_major_t values(196 * 10, 1);
select count(*) from test_rollback_and_major_t;
count(*)
99
savepoint x;
update test_rollback_and_major_t set row_value = 196 * 321 where row_key = 1;
insert into test_rollback_and_major_t values(196 + 3000, 196);
rollback to savepoint x;
insert into test_rollback_and_major_t values(196 * 10 + 5, 1);
select count(*) from test_rollback_and_major_t;
count(*)
99
savepoint x;
update test_rollback_and_major_t set row_value = 198 * 123 where row_key = 1;
insert into test_rollback_and_major_t values(198 + 3000, 198);
rollback to savepoint x;
insert into test_rollback_and_major_t values(198 * 10, 1);
select count(*) from test_rollback_and_major_t;
count(*)
100
savepoint x;
update test_rollback_and_major_t set row_value = 198 * 321 where row_key = 1;
insert into test_rollback_and_major_t values(198 + 3000, 198);
rollback to savepoint x;
insert into test_rollback_and_major_t values(198 * 10 + 5, 1);
select count(*) from test_rollback_and_major_t;
count(*)
100
savepoint x;
update test_rollback_and_major_t set row_value = 200 * 123 where row_key = 1;
insert into test_rollback_and_major_t values(200 + 3000, 200);
rollback to savepoint x;
insert into test_rollback_and_major_t values(200 * 10, 1);
select count(*) from test_rollback_and_major_t;
count(*)
101
savepoint x;
update test_rollback_and_major_t set row_value = 200 * 321 where row_key = 1;
insert into test_rollback_and_major_t values(200 + 3000, 200);
rollback to savepoint x;
insert into test_rollback_and_major_t values(200 * 10 + 5, 1);
select count(*) from test_rollback_and_major_t;
count(*)
101
commit;
select * from test_rollback_and_major_t;
row_key	row_value
1	1
20	1
40	1
60	1
80	1
100	1
120	1
140	1
160	1
180	1
200	1
220	1
240	1
260	1
280	1
300	1
320	1
340	1
360	1
380	1
400	1
420	1
440	1
460	1
480	1
500	1
520	1
540	1
560	1
580	1
600	1
620	1
640	1
660	1
680	1
700	1
720	1
740	1
760	1
780	1
800	1
820	1
840	1
860	1
880	1
900	1
920	1
940	1
960	1
980	1
1000	1
1020	1
1040	1
1060	1
1080	1
1100	1
1120	1
1140	1
1160	1
1180	1
1200	1
1220	1
1240	1
1260	1
1280	1
1300	1
1320	1
1340	1
1360	1
1380	1
1400	1
1420	1
1440	1
1460	1
1480	1
1500	1
1520	1
1540	1
1560	1
1580	1
1600	1
1620	1
1640	1
1660	1
1680	1
1700	1
1720	1
1740	1
1760	1
1780	1
1800	1
1820	1
1840	1
1860	1
1880	1
1900	1
1920	1
1940	1
1960	1
1980	1
2000	1
commit;
select * from test_rollback_and_major_t;
row_key	row_value
1	1
20	1
25	1
40	1
45	1
60	1
65	1
80	1
85	1
100	1
105	1
120	1
125	1
140	1
145	1
160	1
165	1
180	1
185	1
200	1
205	1
220	1
225	1
240	1
245	1
260	1
265	1
280	1
285	1
300	1
305	1
320	1
325	1
340	1
345	1
360	1
365	1
380	1
385	1
400	1
405	1
420	1
425	1
440	1
445	1
460	1
465	1
480	1
485	1
500	1
505	1
520	1
525	1
540	1
545	1
560	1
565	1
580	1
585	1
600	1
605	1
620	1
625	1
640	1
645	1
660	1
665	1
680	1
685	1
700	1
705	1
720	1
725	1
740	1
745	1
760	1
765	1
780	1
785	1
800	1
805	1
820	1
825	1
840	1
845	1
860	1
865	1
880	1
885	1
900	1
905	1
920	1
925	1
940	1
945	1
960	1
965	1
980	1
985	1
1000	1
1005	1
1020	1
1025	1
1040	1
1045	1
1060	1
1065	1
1080	1
1085	1
1100	1
1105	1
1120	1
1125	1
1140	1
1145	1
1160	1
1165	1
1180	1
1185	1
1200	1
1205	1
1220	1
1225	1
1240	1
1245	1
1260	1
1265	1
1280	1
1285	1
1300	1
1305	1
1320	1
1325	1
1340	1
1345	1
1360	1
1365	1
1380	1
1385	1
1400	1
1405	1
1420	1
1425	1
1440	1
1445	1
1460	1
1465	1
1480	1
1485	1
1500	1
1505	1
1520	1
1525	1
1540	1
1545	1
1560	1
1565	1
1580	1
1585	1
1600	1
1605	1
1620	1
1625	1
1640	1
1645	1
1660	1
1665	1
1680	1
1685	1
1700	1
1705	1
1720	1
1725	1
1740	1
1745	1
1760	1
1765	1
1780	1
1785	1
1800	1
1805	1
1820	1
1825	1
1840	1
1845	1
1860	1
1865	1
1880	1
1885	1
1900	1
1905	1
1920	1
1925	1
1940	1
1945	1
1960	1
1965	1
1980	1
1985	1
2000	1
2005	1
alter system set _private_buffer_size = '16K';
alter system set _fast_commit_callback_count = 10000;
