drop table if exists t1;
SET @test_character_set= 'euckr';
SET @test_collation= 'euckr_korean_ci';
SET @safe_character_set_server= @@character_set_server;
SET @safe_collation_server= @@collation_server;
SET @safe_character_set_client= @@character_set_client;
SET @safe_character_set_results= @@character_set_results;
SET character_set_server= @test_character_set;
SET collation_server= @test_collation;
CREATE DATABASE d1;
USE d1;
CREATE TABLE t1 (c CHAR(10), KEY(c));
SHOW FULL COLUMNS FROM t1;
Field	Type	Collation	Null	Key	Default	Extra	Privileges	Comment
c	char(10)	euckr_korean_ci	YES	MUL	NULL		SELECT,INSERT,UPDATE,REFERENCES	
INSERT INTO t1 VALUES ('aaa'),('aaaa'),('aaaaa');
SELECT c as want3results FROM t1 WHERE c LIKE 'aaa%';
want3results
aaa
aaaa
aaaaa
DROP TABLE t1;
CREATE TABLE t1 (c1 varchar(15), KEY c1 (c1(2)));
SHOW FULL COLUMNS FROM t1;
Field	Type	Collation	Null	Key	Default	Extra	Privileges	Comment
c1	varchar(15)	euckr_korean_ci	YES		NULL		SELECT,INSERT,UPDATE,REFERENCES	
INSERT INTO t1 VALUES ('location'),('loberge'),('lotre'),('boabab');
SELECT c1 as want3results from t1 where c1 like 'l%';
want3results
location
loberge
lotre
SELECT c1 as want3results from t1 where c1 like 'lo%';
want3results
location
loberge
lotre
SELECT c1 as want1result  from t1 where c1 like 'loc%';
want1result
location
SELECT c1 as want1result  from t1 where c1 like 'loca%';
want1result
location
SELECT c1 as want1result  from t1 where c1 like 'locat%';
want1result
location
SELECT c1 as want1result  from t1 where c1 like 'locati%';
want1result
location
SELECT c1 as want1result  from t1 where c1 like 'locatio%';
want1result
location
SELECT c1 as want1result  from t1 where c1 like 'location%';
want1result
location
DROP TABLE t1;
create table t1 (a set('a') not null);
insert ignore into t1 values (),();
Warnings:
Warning	1364	Field 'a' doesn't have a default value
Warning	1364	Field 'a' doesn't have a default value
select cast(a as char(1)) from t1;
cast(a as char(1))


select a sounds like a from t1;
a sounds like a
1
1
select 1 from t1 order by cast(a as char(1));
1
1
1
drop table t1;
set names utf8mb3;
create table t1 (
name varchar(10),
level smallint unsigned);
show create table t1;
Table	Create Table
t1	CREATE TABLE `t1` (
  `name` varchar(10) DEFAULT NULL,
  `level` smallint(5) unsigned DEFAULT NULL
) DEFAULT CHARSET = euckr ROW_FORMAT = DYNAMIC COMPRESSION = 'zstd_1.3.8' REPLICA_NUM = 1 BLOCK_SIZE = 16384 USE_BLOOM_FILTER = FALSE TABLET_SIZE = 134217728 PCTFREE = 0
insert into t1 values ('string',1);
select concat(name,space(level)), concat(name, repeat(' ',level)) from t1;
concat(name,space(level))	concat(name, repeat(' ',level))
string 	string 
drop table t1;
DROP DATABASE d1;
USE test;
SET character_set_server= @safe_character_set_server;
SET collation_server= @safe_collation_server;
SET character_set_client= @safe_character_set_client;
SET character_set_results= @safe_character_set_results;
SET NAMES euckr;
SET collation_connection='euckr_korean_ci';
create table t1 select repeat('a',4000) a;
delete from t1;
insert into t1 values ('a'), ('a '), ('a\t');
select collation(a),hex(a) from t1 order by a;
collation(a)	hex(a)
euckr_korean_ci	6109
euckr_korean_ci	61
euckr_korean_ci	6120
drop table t1;
create table t1 engine=innodb select repeat('a',50) as c1;
alter table t1 add index(c1(5));
insert into t1 values ('abcdefg'),('abcde100'),('abcde110'),('abcde111');
select collation(c1) from t1 limit 1;
collation(c1)
euckr_korean_ci
select c1 from t1 where c1 like 'abcdef%' order by c1;
c1
abcdefg
select c1 from t1 where c1 like 'abcde1%' order by c1;
c1
abcde100
abcde110
abcde111
select c1 from t1 where c1 like 'abcde11%' order by c1;
c1
abcde110
abcde111
select c1 from t1 where c1 like 'abcde111%' order by c1;
c1
abcde111
drop table t1;
select @@collation_connection;
@@collation_connection
euckr_korean_ci
create table t1 ROW_FORMAT=DYNAMIC select repeat('a',50) as c1 ;
insert into t1 values('abcdef');
insert into t1 values('_bcdef');
insert into t1 values('a_cdef');
insert into t1 values('ab_def');
insert into t1 values('abc_ef');
insert into t1 values('abcd_f');
insert into t1 values('abcde_');
select c1 as c1u from t1 where c1 like 'ab\_def';
c1u
ab_def
select c1 as c2h from t1 where c1 like 'ab#_def' escape '#';
c2h
ab_def
drop table t1;
SET collation_connection='euckr_bin';
create table t1 select repeat('a',4000) a;
delete from t1;
insert into t1 values ('a'), ('a '), ('a\t');
select collation(a),hex(a) from t1 order by a;
collation(a)	hex(a)
euckr_bin	6109
euckr_bin	61
euckr_bin	6120
drop table t1;
create table t1 engine=innodb select repeat('a',50) as c1;
alter table t1 add index(c1(5));
insert into t1 values ('abcdefg'),('abcde100'),('abcde110'),('abcde111');
select collation(c1) from t1 limit 1;
collation(c1)
euckr_bin
select c1 from t1 where c1 like 'abcdef%' order by c1;
c1
abcdefg
select c1 from t1 where c1 like 'abcde1%' order by c1;
c1
abcde100
abcde110
abcde111
select c1 from t1 where c1 like 'abcde11%' order by c1;
c1
abcde110
abcde111
select c1 from t1 where c1 like 'abcde111%' order by c1;
c1
abcde111
drop table t1;
select @@collation_connection;
@@collation_connection
euckr_bin
create table t1 ROW_FORMAT=DYNAMIC select repeat('a',50) as c1 ;
insert into t1 values('abcdef');
insert into t1 values('_bcdef');
insert into t1 values('a_cdef');
insert into t1 values('ab_def');
insert into t1 values('abc_ef');
insert into t1 values('abcd_f');
insert into t1 values('abcde_');
select c1 as c1u from t1 where c1 like 'ab\_def';
c1u
ab_def
select c1 as c2h from t1 where c1 like 'ab#_def' escape '#';
c2h
ab_def
drop table t1;
SET NAMES euckr;
CREATE TABLE t1 (a text) character set euckr;
INSERT INTO t1 VALUES (0xA2E6),(0xFEF7);
SELECT hex(a) FROM t1 ORDER BY a;
hex(a)
A2E6
FEF7
DROP TABLE t1;
create table t1 (s1 varchar(5) character set euckr);
insert into t1 values (0xA141);
insert into t1 values (0xA15A);
insert into t1 values (0xA161);
insert into t1 values (0xA17A);
insert into t1 values (0xA181);
insert into t1 values (0xA1FE);
insert into t1 values (0xA140);
ERROR HY000: Incorrect string value
insert into t1 values (0xA15B);
ERROR HY000: Incorrect string value
insert into t1 values (0xA160);
ERROR HY000: Incorrect string value
insert into t1 values (0xA17B);
ERROR HY000: Incorrect string value
insert into t1 values (0xA180);
ERROR HY000: Incorrect string value
insert into t1 values (0xA1FF);
ERROR HY000: Incorrect string value
select hex(s1), hex(convert(s1 using utf8mb3)) from t1 order by binary s1;
hex(s1)	hex(convert(s1 using utf8mb3))
A141	ECA2A5
A15A	ECA381
A161	ECA382
A17A	ECA3A5
A181	ECA3A6
A1FE	EFBFA2
drop table t1;
SET NAMES utf8mb3;
CREATE TABLE t1 (a varchar(10) character set euckr);
INSERT INTO t1 VALUES (0xA2E6), (0xA2E7);
SELECT hex(a), hex(@utf8mb3:=convert(a using utf8mb3)), hex(convert(@utf8mb3 using euckr)) FROM t1;
hex(a)	hex(@utf8mb3:=convert(a using utf8mb3))	hex(convert(@utf8mb3 using euckr))
A2E6	E282AC	NULL
A2E7	C2AE	C2AE
Warnings:
Warning	1300	Invalid euckr character string: 'AC'
SELECT hex(a), hex(@utf8mb3:=convert(a using utf8mb3)), hex(convert(@utf8mb3 using euckr)) FROM t1;
hex(a)	hex(@utf8mb3:=convert(a using utf8mb3))	hex(convert(@utf8mb3 using euckr))
A2E6	E282AC	A2E6
A2E7	C2AE	A2E7
DROP TABLE t1;
#
# WL#3332 Korean Enhancements
# euckr valid codes are now [81..FE][41..5A,61..7A,81..FE]
#
CREATE TABLE t1 (a binary(1), key(a));
DROP table if exists t2;
Warnings:
Note	1051	Unknown table 'test.t2'
CREATE TABLE t2 (s VARCHAR(4), a VARCHAR(1) CHARACTER SET euckr);
INSERT INTO t2
SELECT hex(concat(t11.a, t12.a)), concat(t11.a, t12.a)
FROM t1 t11, t1 t12
WHERE t11.a >= 0x81 AND t11.a <= 0xFE
AND   t12.a >= 0x41 AND t12.a <= 0xFE
ORDER BY t11.a, t12.a;
ERROR HY000: Incorrect string value
SELECT s as bad_code FROM t2 WHERE a='' ORDER BY s;
bad_code
DELETE FROM t2 WHERE a='';
ALTER TABLE t2 ADD u VARCHAR(1) CHARACTER SET utf8mb3, ADD a2 VARCHAR(1) CHARACTER SET euckr;
UPDATE t2 SET u=a, a2=u;
SELECT s as unassigned_code FROM t2 WHERE u='?';
unassigned_code
DELETE FROM t2 WHERE u='?';
SELECT count(*) as roundtrip_problem_chars FROM t2 WHERE hex(a) <> hex(a2);
roundtrip_problem_chars
0
SELECT s, hex(a), hex(u), hex(a2) FROM t2 ORDER BY s;
s	hex(a)	hex(u)	hex(a2)
DROP TABLE t1, t2;
SET sql_mode = default;
End of 5.4 tests
SET sql_mode = 'NO_ENGINE_SUBSTITUTION';
SET NAMES utf8mb3;
SET collation_connection=euckr_korean_ci;
CREATE TABLE t1 (b VARCHAR(2));
INSERT INTO t1 VALUES ('0'),('1'),('2'),('3'),('4'),('5'),('6'),('7');
INSERT INTO t1 VALUES ('8'),('9'),('A'),('B'),('C'),('D'),('E'),('F');
DROP table if exists head, tail;
Warnings:
Note	1051	Unknown table 'test.head'
Note	1051	Unknown table 'test.tail'
CREATE TABLE head AS SELECT CONCAT(b1.b, b2.b) AS head FROM t1 b1, t1 b2;
CREATE TABLE tail AS SELECT CONCAT(b1.b, b2.b) AS tail FROM t1 b1, t1 b2;
DROP TABLE t1;
CREATE TABLE t1 AS
SELECT concat(head, tail) AS code, ' ' AS a
FROM head, tail
WHERE (head BETWEEN '80' AND 'FF') AND (tail BETWEEN '20' AND 'FF')
ORDER BY head, tail;
DROP TABLE head, tail;
SHOW CREATE TABLE t1;
Table	Create Table
t1	CREATE TABLE `t1` (
  `code` varchar(8) DEFAULT NULL,
  `a` varchar(1) CHARACTER SET euckr NOT NULL DEFAULT ''
) DEFAULT CHARSET = utf8mb4 ROW_FORMAT = DYNAMIC COMPRESSION = 'zstd_1.3.8' REPLICA_NUM = 1 BLOCK_SIZE = 16384 USE_BLOOM_FILTER = FALSE TABLET_SIZE = 134217728 PCTFREE = 0
SET @@session.max_error_count = 64;
Warnings:
Warning	1235	This system variable now is mock not supported
UPDATE t1 SET a=unhex(code) ORDER BY code;
SET @@session.max_error_count = default;
Warnings:
Warning	1235	This system variable now is mock not supported
SELECT COUNT(*) FROM t1 WHERE a<>'';
COUNT(*)
22428
SELECT code, hex(upper(a)), hex(lower(a)),a, upper(a), lower(a) FROM t1 WHERE hex(a)<>hex(upper(a)) OR hex(a)<>hex(lower(a));
code	hex(upper(a))	hex(lower(a))	a	upper(a)	lower(a)
A3C1	A3C1	A3E1	Ａ	Ａ	ａ
A3C2	A3C2	A3E2	Ｂ	Ｂ	ｂ
A3C3	A3C3	A3E3	Ｃ	Ｃ	ｃ
A3C4	A3C4	A3E4	Ｄ	Ｄ	ｄ
A3C5	A3C5	A3E5	Ｅ	Ｅ	ｅ
A3C6	A3C6	A3E6	Ｆ	Ｆ	ｆ
A3C7	A3C7	A3E7	Ｇ	Ｇ	ｇ
A3C8	A3C8	A3E8	Ｈ	Ｈ	ｈ
A3C9	A3C9	A3E9	Ｉ	Ｉ	ｉ
A3CA	A3CA	A3EA	Ｊ	Ｊ	ｊ
A3CB	A3CB	A3EB	Ｋ	Ｋ	ｋ
A3CC	A3CC	A3EC	Ｌ	Ｌ	ｌ
A3CD	A3CD	A3ED	Ｍ	Ｍ	ｍ
A3CE	A3CE	A3EE	Ｎ	Ｎ	ｎ
A3CF	A3CF	A3EF	Ｏ	Ｏ	ｏ
A3D0	A3D0	A3F0	Ｐ	Ｐ	ｐ
A3D1	A3D1	A3F1	Ｑ	Ｑ	ｑ
A3D2	A3D2	A3F2	Ｒ	Ｒ	ｒ
A3D3	A3D3	A3F3	Ｓ	Ｓ	ｓ
A3D4	A3D4	A3F4	Ｔ	Ｔ	ｔ
A3D5	A3D5	A3F5	Ｕ	Ｕ	ｕ
A3D6	A3D6	A3F6	Ｖ	Ｖ	ｖ
A3D7	A3D7	A3F7	Ｗ	Ｗ	ｗ
A3D8	A3D8	A3F8	Ｘ	Ｘ	ｘ
A3D9	A3D9	A3F9	Ｙ	Ｙ	ｙ
A3DA	A3DA	A3FA	Ｚ	Ｚ	ｚ
A3E1	A3C1	A3E1	ａ	Ａ	ａ
A3E2	A3C2	A3E2	ｂ	Ｂ	ｂ
A3E3	A3C3	A3E3	ｃ	Ｃ	ｃ
A3E4	A3C4	A3E4	ｄ	Ｄ	ｄ
A3E5	A3C5	A3E5	ｅ	Ｅ	ｅ
A3E6	A3C6	A3E6	ｆ	Ｆ	ｆ
A3E7	A3C7	A3E7	ｇ	Ｇ	ｇ
A3E8	A3C8	A3E8	ｈ	Ｈ	ｈ
A3E9	A3C9	A3E9	ｉ	Ｉ	ｉ
A3EA	A3CA	A3EA	ｊ	Ｊ	ｊ
A3EB	A3CB	A3EB	ｋ	Ｋ	ｋ
A3EC	A3CC	A3EC	ｌ	Ｌ	ｌ
A3ED	A3CD	A3ED	ｍ	Ｍ	ｍ
A3EE	A3CE	A3EE	ｎ	Ｎ	ｎ
A3EF	A3CF	A3EF	ｏ	Ｏ	ｏ
A3F0	A3D0	A3F0	ｐ	Ｐ	ｐ
A3F1	A3D1	A3F1	ｑ	Ｑ	ｑ
A3F2	A3D2	A3F2	ｒ	Ｒ	ｒ
A3F3	A3D3	A3F3	ｓ	Ｓ	ｓ
A3F4	A3D4	A3F4	ｔ	Ｔ	ｔ
A3F5	A3D5	A3F5	ｕ	Ｕ	ｕ
A3F6	A3D6	A3F6	ｖ	Ｖ	ｖ
A3F7	A3D7	A3F7	ｗ	Ｗ	ｗ
A3F8	A3D8	A3F8	ｘ	Ｘ	ｘ
A3F9	A3D9	A3F9	ｙ	Ｙ	ｙ
A3FA	A3DA	A3FA	ｚ	Ｚ	ｚ
A5A1	A5B0	A5A1	ⅰ	Ⅰ	ⅰ
A5A2	A5B1	A5A2	ⅱ	Ⅱ	ⅱ
A5A3	A5B2	A5A3	ⅲ	Ⅲ	ⅲ
A5A4	A5B3	A5A4	ⅳ	Ⅳ	ⅳ
A5A5	A5B4	A5A5	ⅴ	Ⅴ	ⅴ
A5A6	A5B5	A5A6	ⅵ	Ⅵ	ⅵ
A5A7	A5B6	A5A7	ⅶ	Ⅶ	ⅶ
A5A8	A5B7	A5A8	ⅷ	Ⅷ	ⅷ
A5A9	A5B8	A5A9	ⅸ	Ⅸ	ⅸ
A5AA	A5B9	A5AA	ⅹ	Ⅹ	ⅹ
A5B0	A5B0	A5A1	Ⅰ	Ⅰ	ⅰ
A5B1	A5B1	A5A2	Ⅱ	Ⅱ	ⅱ
A5B2	A5B2	A5A3	Ⅲ	Ⅲ	ⅲ
A5B3	A5B3	A5A4	Ⅳ	Ⅳ	ⅳ
A5B4	A5B4	A5A5	Ⅴ	Ⅴ	ⅴ
A5B5	A5B5	A5A6	Ⅵ	Ⅵ	ⅵ
A5B6	A5B6	A5A7	Ⅶ	Ⅶ	ⅶ
A5B7	A5B7	A5A8	Ⅷ	Ⅷ	ⅷ
A5B8	A5B8	A5A9	Ⅸ	Ⅸ	ⅸ
A5B9	A5B9	A5AA	Ⅹ	Ⅹ	ⅹ
A5C1	A5C1	A5E1	Α	Α	α
A5C2	A5C2	A5E2	Β	Β	β
A5C3	A5C3	A5E3	Γ	Γ	γ
A5C4	A5C4	A5E4	Δ	Δ	δ
A5C5	A5C5	A5E5	Ε	Ε	ε
A5C6	A5C6	A5E6	Ζ	Ζ	ζ
A5C7	A5C7	A5E7	Η	Η	η
A5C8	A5C8	A5E8	Θ	Θ	θ
A5C9	A5C9	A5E9	Ι	Ι	ι
A5CA	A5CA	A5EA	Κ	Κ	κ
A5CB	A5CB	A5EB	Λ	Λ	λ
A5CC	A5CC	A5EC	Μ	Μ	μ
A5CD	A5CD	A5ED	Ν	Ν	ν
A5CE	A5CE	A5EE	Ξ	Ξ	ξ
A5CF	A5CF	A5EF	Ο	Ο	ο
A5D0	A5D0	A5F0	Π	Π	π
A5D1	A5D1	A5F1	Ρ	Ρ	ρ
A5D2	A5D2	A5F2	Σ	Σ	σ
A5D3	A5D3	A5F3	Τ	Τ	τ
A5D4	A5D4	A5F4	Υ	Υ	υ
A5D5	A5D5	A5F5	Φ	Φ	φ
A5D6	A5D6	A5F6	Χ	Χ	χ
A5D7	A5D7	A5F7	Ψ	Ψ	ψ
A5D8	A5D8	A5F8	Ω	Ω	ω
A5E1	A5C1	A5E1	α	Α	α
A5E2	A5C2	A5E2	β	Β	β
A5E3	A5C3	A5E3	γ	Γ	γ
A5E4	A5C4	A5E4	δ	Δ	δ
A5E5	A5C5	A5E5	ε	Ε	ε
A5E6	A5C6	A5E6	ζ	Ζ	ζ
A5E7	A5C7	A5E7	η	Η	η
A5E8	A5C8	A5E8	θ	Θ	θ
A5E9	A5C9	A5E9	ι	Ι	ι
A5EA	A5CA	A5EA	κ	Κ	κ
A5EB	A5CB	A5EB	λ	Λ	λ
A5EC	A5CC	A5EC	μ	Μ	μ
A5ED	A5CD	A5ED	ν	Ν	ν
A5EE	A5CE	A5EE	ξ	Ξ	ξ
A5EF	A5CF	A5EF	ο	Ο	ο
A5F0	A5D0	A5F0	π	Π	π
A5F1	A5D1	A5F1	ρ	Ρ	ρ
A5F2	A5D2	A5F2	σ	Σ	σ
A5F3	A5D3	A5F3	τ	Τ	τ
A5F4	A5D4	A5F4	υ	Υ	υ
A5F5	A5D5	A5F5	φ	Φ	φ
A5F6	A5D6	A5F6	χ	Χ	χ
A5F7	A5D7	A5F7	ψ	Ψ	ψ
A5F8	A5D8	A5F8	ω	Ω	ω
A7D9	A7D9	A5F8	Ω	Ω	ω
A8A1	A8A1	A9A1	Æ	Æ	æ
A8A2	A8A2	A9A3	Ð	Ð	ð
A8A4	A8A4	A9A4	Ħ	Ħ	ħ
A8A6	A8A6	A9A6	Ĳ	Ĳ	ĳ
A8A8	A8A8	A9A8	Ŀ	Ŀ	ŀ
A8A9	A8A9	A9A9	Ł	Ł	ł
A8AA	A8AA	A9AA	Ø	Ø	ø
A8AB	A8AB	A9AB	Œ	Œ	œ
A8AD	A8AD	A9AD	Þ	Þ	þ
A8AE	A8AE	A9AE	Ŧ	Ŧ	ŧ
A8AF	A8AF	A9AF	Ŋ	Ŋ	ŋ
A9A1	A8A1	A9A1	æ	Æ	æ
A9A3	A8A2	A9A3	ð	Ð	ð
A9A4	A8A4	A9A4	ħ	Ħ	ħ
A9A5	0049	A9A5	ı	 I	ı
A9A6	A8A6	A9A6	ĳ	Ĳ	ĳ
A9A8	A8A8	A9A8	ŀ	Ŀ	ŀ
A9A9	A8A9	A9A9	ł	Ł	ł
A9AA	A8AA	A9AA	ø	Ø	ø
A9AB	A8AB	A9AB	œ	Œ	œ
A9AD	A8AD	A9AD	þ	Þ	þ
A9AE	A8AE	A9AE	ŧ	Ŧ	ŧ
A9AF	A8AF	A9AF	ŋ	Ŋ	ŋ
ACA1	ACA1	ACD1	А	А	а
ACA2	ACA2	ACD2	Б	Б	б
ACA3	ACA3	ACD3	В	В	в
ACA4	ACA4	ACD4	Г	Г	г
ACA5	ACA5	ACD5	Д	Д	д
ACA6	ACA6	ACD6	Е	Е	е
ACA7	ACA7	ACD7	Ё	Ё	ё
ACA8	ACA8	ACD8	Ж	Ж	ж
ACA9	ACA9	ACD9	З	З	з
ACAA	ACAA	ACDA	И	И	и
ACAB	ACAB	ACDB	Й	Й	й
ACAC	ACAC	ACDC	К	К	к
ACAD	ACAD	ACDD	Л	Л	л
ACAE	ACAE	ACDE	М	М	м
ACAF	ACAF	ACDF	Н	Н	н
ACB0	ACB0	ACE0	О	О	о
ACB1	ACB1	ACE1	П	П	п
ACB2	ACB2	ACE2	Р	Р	р
ACB3	ACB3	ACE3	С	С	с
ACB4	ACB4	ACE4	Т	Т	т
ACB5	ACB5	ACE5	У	У	у
ACB6	ACB6	ACE6	Ф	Ф	ф
ACB7	ACB7	ACE7	Х	Х	х
ACB8	ACB8	ACE8	Ц	Ц	ц
ACB9	ACB9	ACE9	Ч	Ч	ч
ACBA	ACBA	ACEA	Ш	Ш	ш
ACBB	ACBB	ACEB	Щ	Щ	щ
ACBC	ACBC	ACEC	Ъ	Ъ	ъ
ACBD	ACBD	ACED	Ы	Ы	ы
ACBE	ACBE	ACEE	Ь	Ь	ь
ACBF	ACBF	ACEF	Э	Э	э
ACC0	ACC0	ACF0	Ю	Ю	ю
ACC1	ACC1	ACF1	Я	Я	я
ACD1	ACA1	ACD1	а	А	а
ACD2	ACA2	ACD2	б	Б	б
ACD3	ACA3	ACD3	в	В	в
ACD4	ACA4	ACD4	г	Г	г
ACD5	ACA5	ACD5	д	Д	д
ACD6	ACA6	ACD6	е	Е	е
ACD7	ACA7	ACD7	ё	Ё	ё
ACD8	ACA8	ACD8	ж	Ж	ж
ACD9	ACA9	ACD9	з	З	з
ACDA	ACAA	ACDA	и	И	и
ACDB	ACAB	ACDB	й	Й	й
ACDC	ACAC	ACDC	к	К	к
ACDD	ACAD	ACDD	л	Л	л
ACDE	ACAE	ACDE	м	М	м
ACDF	ACAF	ACDF	н	Н	н
ACE0	ACB0	ACE0	о	О	о
ACE1	ACB1	ACE1	п	П	п
ACE2	ACB2	ACE2	р	Р	р
ACE3	ACB3	ACE3	с	С	с
ACE4	ACB4	ACE4	т	Т	т
ACE5	ACB5	ACE5	у	У	у
ACE6	ACB6	ACE6	ф	Ф	ф
ACE7	ACB7	ACE7	х	Х	х
ACE8	ACB8	ACE8	ц	Ц	ц
ACE9	ACB9	ACE9	ч	Ч	ч
ACEA	ACBA	ACEA	ш	Ш	ш
ACEB	ACBB	ACEB	щ	Щ	щ
ACEC	ACBC	ACEC	ъ	Ъ	ъ
ACED	ACBD	ACED	ы	Ы	ы
ACEE	ACBE	ACEE	ь	Ь	ь
ACEF	ACBF	ACEF	э	Э	э
ACF0	ACC0	ACF0	ю	Ю	ю
ACF1	ACC1	ACF1	я	Я	я
SELECT * FROM t1
WHERE HEX(CAST(LOWER(a) AS CHAR CHARACTER SET utf8mb3)) <>
HEX(LOWER(CAST(a AS CHAR CHARACTER SET utf8mb3))) ORDER BY code;
code	a
A1CA	Å
SELECT * FROM t1
WHERE HEX(CAST(UPPER(a) AS CHAR CHARACTER SET utf8mb3)) <>
HEX(UPPER(CAST(a AS CHAR CHARACTER SET utf8mb3))) ORDER BY code;
code	a
A8CD	ⓐ
A8CE	ⓑ
A8CF	ⓒ
A8D0	ⓓ
A8D1	ⓔ
A8D2	ⓕ
A8D3	ⓖ
A8D4	ⓗ
A8D5	ⓘ
A8D6	ⓙ
A8D7	ⓚ
A8D8	ⓛ
A8D9	ⓜ
A8DA	ⓝ
A8DB	ⓞ
A8DC	ⓟ
A8DD	ⓠ
A8DE	ⓡ
A8DF	ⓢ
A8E0	ⓣ
A8E1	ⓤ
A8E2	ⓥ
A8E3	ⓦ
A8E4	ⓧ
A8E5	ⓨ
A8E6	ⓩ
A9A2	đ
A9A5	ı
DROP TABLE t1;
SET sql_mode = default;
#
# End of 5.6 tests
#
