set sql_mode='';
drop table if exists dt;
create table dt(id int primary key auto_increment, str_val varchar(100), dt_val datetime(6), ts_val timestamp(6) NULL, d_val date, t_val time(6));
set time_zone='+8:00';
insert into dt(str_val) values
('2015-05-30 11:12:13'),
('2015.05.30 11.12.13'),
('2015/05/30 11/12/13'),
('2015+05=30 11*12&13'),
('2015^05%30 11$12#13'),
('2015@05!30 11~12`13'),
('1000-01-01 00:00:00'),
('1969-12-31 23:59:59'),
('1970-01-01 00:00:00'),
('9999-12-31 23:59:59'),
('101112'),
('101112131415'),
('1011121314151'),
('10111213141516');
update dt set dt_val = str_val;
update dt set ts_val = str_val;
update dt set d_val = str_val;
update dt set t_val = str_val;
insert into dt(dt_val, ts_val, d_val, t_val) values
(     DATE '1990-09-01',               DATE '1990-09-01',               DATE '1990-09-01',               DATE '1990-09-01'), 
(TIMESTAMP '1990-09-01 12:34:56', TIMESTAMP '1990-09-01 12:34:56', TIMESTAMP '1990-09-01 12:34:56', TIMESTAMP '1990-09-01 12:34:56');
select str_val, dt_val, ts_val, d_val, t_val from dt order by dt_val, ts_val, d_val, t_val, str_val;
str_val	dt_val	ts_val	d_val	t_val
1000-01-01 00:00:00	1000-01-01 00:00:00.000000	1000-01-01 00:00:00.000000	1000-01-01	00:00:00.000000
10111213141516	1011-12-13 14:15:16.000000	1011-12-13 14:15:16.000000	1011-12-13	14:15:16.000000
1969-12-31 23:59:59	1969-12-31 23:59:59.000000	1969-12-31 23:59:59.000000	1969-12-31	23:59:59.000000
1970-01-01 00:00:00	1970-01-01 00:00:00.000000	1970-01-01 00:00:00.000000	1970-01-01	00:00:00.000000
NULL	1990-09-01 00:00:00.000000	1990-09-01 00:00:00.000000	1990-09-01	00:00:00.000000
NULL	1990-09-01 12:34:56.000000	1990-09-01 12:34:56.000000	1990-09-01	12:34:56.000000
101112	2010-11-12 00:00:00.000000	2010-11-12 00:00:00.000000	2010-11-12	10:11:12.000000
101112131415	2010-11-12 13:14:15.000000	2010-11-12 13:14:15.000000	2010-11-12	13:14:15.000000
1011121314151	2010-11-12 13:14:15.000000	2010-11-12 13:14:15.000000	2010-11-12	13:14:15.000000
2015+05=30 11*12&13	2015-05-30 11:12:13.000000	2015-05-30 11:12:13.000000	2015-05-30	11:12:13.000000
2015-05-30 11:12:13	2015-05-30 11:12:13.000000	2015-05-30 11:12:13.000000	2015-05-30	11:12:13.000000
2015.05.30 11.12.13	2015-05-30 11:12:13.000000	2015-05-30 11:12:13.000000	2015-05-30	11:12:13.000000
2015/05/30 11/12/13	2015-05-30 11:12:13.000000	2015-05-30 11:12:13.000000	2015-05-30	11:12:13.000000
2015@05!30 11~12`13	2015-05-30 11:12:13.000000	2015-05-30 11:12:13.000000	2015-05-30	11:12:13.000000
2015^05%30 11$12#13	2015-05-30 11:12:13.000000	2015-05-30 11:12:13.000000	2015-05-30	11:12:13.000000
9999-12-31 23:59:59	9999-12-31 23:59:59.000000	9999-12-31 23:59:59.000000	9999-12-31	23:59:59.000000
set time_zone='-8:00';
select str_val, ts_val from dt order by ts_val, str_val;
str_val	ts_val
1000-01-01 00:00:00	0999-12-31 08:00:00.000000
10111213141516	1011-12-12 22:15:16.000000
1969-12-31 23:59:59	1969-12-31 07:59:59.000000
1970-01-01 00:00:00	1969-12-31 08:00:00.000000
NULL	1990-08-31 08:00:00.000000
NULL	1990-08-31 20:34:56.000000
101112	2010-11-11 08:00:00.000000
101112131415	2010-11-11 21:14:15.000000
1011121314151	2010-11-11 21:14:15.000000
2015+05=30 11*12&13	2015-05-29 19:12:13.000000
2015-05-30 11:12:13	2015-05-29 19:12:13.000000
2015.05.30 11.12.13	2015-05-29 19:12:13.000000
2015/05/30 11/12/13	2015-05-29 19:12:13.000000
2015@05!30 11~12`13	2015-05-29 19:12:13.000000
2015^05%30 11$12#13	2015-05-29 19:12:13.000000
9999-12-31 23:59:59	9999-12-31 07:59:59.000000
set time_zone='+8:00';
select str_val, date_format(dt_val, '%Y-%b-%D %T %a'), date_format(ts_val, '%Y-%b-%D %T %a') from dt order by dt_val, ts_val, str_val;
str_val	date_format(dt_val, '%Y-%b-%D %T %a')	date_format(ts_val, '%Y-%b-%D %T %a')
1000-01-01 00:00:00	1000-Jan-1st 00:00:00 Wed	1000-Jan-1st 00:00:00 Wed
10111213141516	1011-Dec-13th 14:15:16 Fri	1011-Dec-13th 14:15:16 Fri
1969-12-31 23:59:59	1969-Dec-31st 23:59:59 Wed	1969-Dec-31st 23:59:59 Wed
1970-01-01 00:00:00	1970-Jan-1st 00:00:00 Thu	1970-Jan-1st 00:00:00 Thu
NULL	1990-Sep-1st 00:00:00 Sat	1990-Sep-1st 00:00:00 Sat
NULL	1990-Sep-1st 12:34:56 Sat	1990-Sep-1st 12:34:56 Sat
101112	2010-Nov-12th 00:00:00 Fri	2010-Nov-12th 00:00:00 Fri
101112131415	2010-Nov-12th 13:14:15 Fri	2010-Nov-12th 13:14:15 Fri
1011121314151	2010-Nov-12th 13:14:15 Fri	2010-Nov-12th 13:14:15 Fri
2015+05=30 11*12&13	2015-May-30th 11:12:13 Sat	2015-May-30th 11:12:13 Sat
2015-05-30 11:12:13	2015-May-30th 11:12:13 Sat	2015-May-30th 11:12:13 Sat
2015.05.30 11.12.13	2015-May-30th 11:12:13 Sat	2015-May-30th 11:12:13 Sat
2015/05/30 11/12/13	2015-May-30th 11:12:13 Sat	2015-May-30th 11:12:13 Sat
2015@05!30 11~12`13	2015-May-30th 11:12:13 Sat	2015-May-30th 11:12:13 Sat
2015^05%30 11$12#13	2015-May-30th 11:12:13 Sat	2015-May-30th 11:12:13 Sat
9999-12-31 23:59:59	9999-Dec-31st 23:59:59 Fri	9999-Dec-31st 23:59:59 Fri
drop table dt;
create table dt(id int primary key auto_increment, str varchar(100), t_val time(6));
insert into dt(str) values
('12:34:56');
update dt set t_val = str;
select str, t_val from dt order by t_val, str;
str	t_val
12:34:56	12:34:56.000000
drop table if exists dt;
create table dt(id int primary key auto_increment, int_val bigint, dt_val datetime, d_val date, t_val time);
insert into dt(int_val) values
(101112),
(101112131415),
(10111213141516);
update dt set dt_val = int_val;
update dt set d_val = int_val;
update dt set t_val = int_val;
select int_val, dt_val, d_val, t_val from dt order by dt_val, d_val, t_val, int_val;
int_val	dt_val	d_val	t_val
10111213141516	1011-12-13 14:15:16	1011-12-13	14:15:16
101112	2010-11-12 00:00:00	2010-11-12	10:11:12
101112131415	2010-11-12 13:14:15	2010-11-12	13:14:15
drop table if exists dt;
