can't determine a row
drop table if exists t1;
create table t1(c1 int, c2 int, primary key(c1));
insert into t1 values(1,1),(2,2),(3,3);
delete from t1 where c1 in(1);
select * from t1;
c1	c2
2	2
3	3
delete from t1 where c1 in(1,2);
select * from t1;
c1	c2
3	3
delete from t1 where c1>=3;
select * from t1;
c1	c2
insert into t1 values(1,1),(2,2),(3,3);
delete from t1 where c1<=1;
select * from t1;
c1	c2
2	2
3	3
delete from t1 where 1>=c1;
select * from t1;
c1	c2
2	2
3	3
delete from t1 where 3<=c1;
select * from t1;
c1	c2
2	2
delete from t1 where 2<=c1;
select * from t1;
c1	c2
insert into t1 values(1,1),(2,2),(3,3);
delete from t1 where c1>1 and c1<3;
select * from t1;
c1	c2
1	1
3	3
delete from t1 where c1=1 or c1=2;
select * from t1;
c1	c2
3	3
delete from t1 where c1<1 or c1<2;
select * from t1;
c1	c2
3	3
delete from t1 where c1=1 and c1=2;
select * from t1;
c1	c2
3	3
delete from t1 where c1>1 and c1=2;
select * from t1;
c1	c2
3	3
drop table if exists t1;
create table t1(c1 int, c2 int, primary key(c1));
insert into t1 values(1,1),(2,2),(3,3);
delete from t1 where c2 in(1);
select * from t1;
c1	c2
2	2
3	3
delete from t1 where c2 in(1,2);
select * from t1;
c1	c2
3	3
delete from t1 where c2>=3;
select * from t1;
c1	c2
insert into t1 values(1,1),(2,2),(3,3);
delete from t1 where c2<=1;
select * from t1;
c1	c2
2	2
3	3
delete from t1 where 1>=c2;
select * from t1;
c1	c2
2	2
3	3
delete from t1 where 3<=c2;
select * from t1;
c1	c2
2	2
delete from t1 where c2>1 and c2<3;
select * from t1;
c1	c2
delete from t1 where c2=1 or c2=2;
select * from t1;
c1	c2
delete from t1 where c2<1 or c2<2;
select * from t1;
c1	c2
delete from t1 where c2=1 and c2=2;
select * from t1;
c1	c2
delete from t1 where c2>1 and c2=2;
select * from t1;
c1	c2
drop table if exists t1;
create table t1(c1 int, c2 int, primary key(c1));
insert into t1 values(1,1),(2,2),(3,3);
delete from t1 where (c1,c2) in((1,1));
select * from t1;
c1	c2
2	2
3	3
delete from t1 where (c1,c2) in((1,1),(2,2));
select * from t1;
c1	c2
3	3
delete from t1 where (c2,c1) in((1,1));
select * from t1;
c1	c2
3	3
delete from t1 where (c2,c1) in((1,1),(2,2));
select * from t1;
c1	c2
3	3
delete from t1 where c1 > 1 and c2 >10 and c1=1;
select * from t1;
c1	c2
3	3
delete from t1 where c1 > 1 or c2 >10 and c1=1;
select * from t1;
c1	c2
drop table if exists t1;
create table t1(c1 int, c2 int, primary key(c1));
insert into t1 values(1,1),(2,2),(3,3);
delete from t1 where c2<=1;
select * from t1;
c1	c2
2	2
3	3
delete from t1 where 1>=c2;
select * from t1;
c1	c2
2	2
3	3
delete from t1 where 3<=c2;
select * from t1;
c1	c2
2	2
delete from t1 where c2>1 and c2<3;
select * from t1;
c1	c2
insert into t1 values(1,1),(2,2),(3,3);
delete from t1 where c2=1 or c2=2;
select * from t1;
c1	c2
3	3
delete from t1 where c2<1 or c2<2;
select * from t1;
c1	c2
3	3
delete from t1 where c2=1 and c2=2;
select * from t1;
c1	c2
3	3
delete from t1 where c2>1 and c2=2;
select * from t1;
c1	c2
3	3
drop table if exists t1;
