drop table if exists t1;
drop table if exists sbtest1;
create table t1(nr int, a longtext, b longblob);
insert into t1 values(10, repeat('a', 5000), repeat('A', 5000));
insert into t1 values(20, repeat('b', 50000), repeat('B', 50000));
insert into t1 values(30, repeat('c', 500000), repeat('C', 500000));
insert into t1 values(40, repeat('d', 3000000), repeat('D', 3000000));
insert into t1 select * from t1;
insert into t1 values(1, repeat('e', 2000000), repeat('E', 2000000));
insert into t1 select * from t1;
insert into t1 values(1, repeat('e', 2000000), repeat('E', 2000000));
insert into t1 values(2, repeat('f', 3000000), repeat('F', 3000000));
select nr, sum(length(a)), sum(length(b)), substr(a, 1000, 10), substr(b, 1000, 10), count(1) from t1 group by nr order by nr asc;
nr	sum(length(a))	sum(length(b))	substr(a, 1000, 10)	substr(b, 1000, 10)	count(1)
1	6000000	6000000	eeeeeeeeee	EEEEEEEEEE	3
2	3000000	3000000	ffffffffff	FFFFFFFFFF	1
10	20000	20000	aaaaaaaaaa	AAAAAAAAAA	4
20	200000	200000	bbbbbbbbbb	BBBBBBBBBB	4
30	2000000	2000000	cccccccccc	CCCCCCCCCC	4
40	12000000	12000000	dddddddddd	DDDDDDDDDD	4
alter system major freeze tenant = sys;
alter system major freeze tenant = all_user;
alter system major freeze tenant = all_meta;
select nr, sum(length(a)), sum(length(b)), substr(a, 1000, 10), substr(b, 1000, 10), count(1) from t1 group by nr order by nr asc;
nr	sum(length(a))	sum(length(b))	substr(a, 1000, 10)	substr(b, 1000, 10)	count(1)
1	6000000	6000000	eeeeeeeeee	EEEEEEEEEE	3
2	3000000	3000000	ffffffffff	FFFFFFFFFF	1
10	20000	20000	aaaaaaaaaa	AAAAAAAAAA	4
20	200000	200000	bbbbbbbbbb	BBBBBBBBBB	4
30	2000000	2000000	cccccccccc	CCCCCCCCCC	4
40	12000000	12000000	dddddddddd	DDDDDDDDDD	4
delete from t1 where nr = 2;
update t1 set a = "updated" where nr = 1;
select nr, sum(length(a)), sum(length(b)), substr(a, 1, 5), substr(b, 1000, 10), count(1) from t1 group by nr order by nr asc;
nr	sum(length(a))	sum(length(b))	substr(a, 1, 5)	substr(b, 1000, 10)	count(1)
1	21	6000000	updat	EEEEEEEEEE	3
10	20000	20000	aaaaa	AAAAAAAAAA	4
20	200000	200000	bbbbb	BBBBBBBBBB	4
30	2000000	2000000	ccccc	CCCCCCCCCC	4
40	12000000	12000000	ddddd	DDDDDDDDDD	4
alter system major freeze tenant = sys;
alter system major freeze tenant = all_user;
alter system major freeze tenant = all_meta;
select nr, sum(length(a)), sum(length(b)), substr(a, 1, 5), substr(b, 1000, 10), count(1) from t1 group by nr order by nr asc;
nr	sum(length(a))	sum(length(b))	substr(a, 1, 5)	substr(b, 1000, 10)	count(1)
1	21	6000000	updat	EEEEEEEEEE	3
10	20000	20000	aaaaa	AAAAAAAAAA	4
20	200000	200000	bbbbb	BBBBBBBBBB	4
30	2000000	2000000	ccccc	CCCCCCCCCC	4
40	12000000	12000000	ddddd	DDDDDDDDDD	4
drop table t1;
CREATE TABLE sbtest1(c1 TINYBLOB NOT NULL);
ALTER TABLE sbtest1 ADD COLUMN d int;
insert INTO sbtest1 values(NULL,10),(NULL,20),(NULL,110),(NULL,120),(NULL,100),(NULL,90);
ERROR 23000: Column 'c1' cannot be null
insert ignore INTO sbtest1 values(NULL,10),(NULL,20),(NULL,110),(NULL,120),(NULL,100),(NULL,90);
Warnings:
Warning	1048	Column 'c1' cannot be null
Warning	1048	Column 'c1' cannot be null
Warning	1048	Column 'c1' cannot be null
Warning	1048	Column 'c1' cannot be null
Warning	1048	Column 'c1' cannot be null
Warning	1048	Column 'c1' cannot be null
select * from sbtest1;
c1	d
	10
	20
	110
	120
	100
	90
drop table sbtest1;
create table t1(a decimal(10,0));
alter table t1 modify a varbinary(5);
INSERT INTO t1 VALUES (10);
ALTER TABLE t1 AUTO_INCREMENT=10;
ALTER TABLE t1 ADD COLUMN (c INT);
ALTER TABLE t1 ADD c2 TIME  NOT NULL FIRST;
ALTER TABLE t1 ADD c4 LONGTEXT  NOT NULL AFTER c2;
select * from t1;
c2	c4	a	c
00:00:00		10	NULL
drop table t1;
