# ----------------------------------------------------------------------
# Base test of GEOMETRY spatial index.
# ----------------------------------------------------------------------
DROP TABLE IF EXISTS spatial_index_syntax;
CREATE TABLE spatial_index_syntax (g GEOMETRY NOT NULL SRID 4326, INDEX(g) LOCAL);
SHOW FIELDS FROM spatial_index_syntax;
Field	Type	Null	Key	Default	Extra
g	geometry	NO	MUL	NULL	
DROP TABLE IF EXISTS spatial_index_syntax;
CREATE TABLE spatial_index_syntax (g GEOMETRY NOT NULL SRID 4326, INDEX(g) GLOBAL);
SHOW FIELDS FROM spatial_index_syntax;
Field	Type	Null	Key	Default	Extra
g	geometry	NO	MUL	NULL	
DROP TABLE IF EXISTS spatial_index_syntax;
CREATE TABLE spatial_index_syntax (g GEOMETRY NOT NULL SRID 4326, INDEX(g));
SHOW FIELDS FROM spatial_index_syntax;
Field	Type	Null	Key	Default	Extra
g	geometry	NO	MUL	NULL	
DROP TABLE IF EXISTS spatial_index_syntax;
CREATE TABLE spatial_index_syntax (g GEOMETRY NOT NULL SRID 4326, SPATIAL INDEX(g) LOCAL);
SHOW FIELDS FROM spatial_index_syntax;
Field	Type	Null	Key	Default	Extra
g	geometry	NO	MUL	NULL	
DROP TABLE IF EXISTS spatial_index_syntax;
CREATE TABLE spatial_index_syntax (g GEOMETRY NOT NULL SRID 4326, SPATIAL INDEX(g) GLOBAL);
SHOW FIELDS FROM spatial_index_syntax;
Field	Type	Null	Key	Default	Extra
g	geometry	NO	MUL	NULL	
DROP TABLE IF EXISTS spatial_index_syntax;
CREATE TABLE spatial_index_syntax (g GEOMETRY NOT NULL SRID 4326, SPATIAL INDEX(g));
SHOW FIELDS FROM spatial_index_syntax;
Field	Type	Null	Key	Default	Extra
g	geometry	NO	MUL	NULL	
DROP TABLE IF EXISTS spatial_index_syntax;
DROP TABLE IF EXISTS spatial_index_syntax;
Warnings:
Note	1051	Unknown table 'test.spatial_index_syntax'
CREATE TABLE spatial_index_syntax (g GEOMETRY NOT NULL SRID 4326);
ALTER TABLE spatial_index_syntax ADD INDEX idx(g) LOCAL;
SHOW FIELDS FROM spatial_index_syntax;
Field	Type	Null	Key	Default	Extra
g	geometry	NO	MUL	NULL	
DROP INDEX idx ON spatial_index_syntax;
ALTER TABLE spatial_index_syntax ADD INDEX idx(g) GLOBAL;
SHOW FIELDS FROM spatial_index_syntax;
Field	Type	Null	Key	Default	Extra
g	geometry	NO	MUL	NULL	
DROP INDEX idx ON spatial_index_syntax;
ALTER TABLE spatial_index_syntax ADD INDEX idx(g);
SHOW FIELDS FROM spatial_index_syntax;
Field	Type	Null	Key	Default	Extra
g	geometry	NO	MUL	NULL	
DROP INDEX idx ON spatial_index_syntax;
DROP TABLE IF EXISTS spatial_index_syntax;
CREATE TABLE spatial_index_syntax (g GEOMETRY NOT NULL SRID 4326);
ALTER TABLE spatial_index_syntax ADD SPATIAL INDEX idx(g) LOCAL;
SHOW FIELDS FROM spatial_index_syntax;
Field	Type	Null	Key	Default	Extra
g	geometry	NO	MUL	NULL	
DROP INDEX idx ON spatial_index_syntax;
ALTER TABLE spatial_index_syntax ADD SPATIAL INDEX idx(g) GLOBAL;
SHOW FIELDS FROM spatial_index_syntax;
Field	Type	Null	Key	Default	Extra
g	geometry	NO	MUL	NULL	
DROP INDEX idx ON spatial_index_syntax;
ALTER TABLE spatial_index_syntax ADD SPATIAL INDEX idx(g);
SHOW FIELDS FROM spatial_index_syntax;
Field	Type	Null	Key	Default	Extra
g	geometry	NO	MUL	NULL	
DROP INDEX idx ON spatial_index_syntax;
DROP TABLE IF EXISTS spatial_index_syntax;
CREATE TABLE spatial_index_syntax (g GEOMETRY NOT NULL SRID 4326);
CREATE INDEX idx ON spatial_index_syntax (g) LOCAL;
SHOW FIELDS FROM spatial_index_syntax;
Field	Type	Null	Key	Default	Extra
g	geometry	NO	MUL	NULL	
DROP INDEX idx ON spatial_index_syntax;
CREATE INDEX idx ON spatial_index_syntax (g) GLOBAL;
SHOW FIELDS FROM spatial_index_syntax;
Field	Type	Null	Key	Default	Extra
g	geometry	NO	MUL	NULL	
DROP INDEX idx ON spatial_index_syntax;
CREATE INDEX idx ON spatial_index_syntax (g);
SHOW FIELDS FROM spatial_index_syntax;
Field	Type	Null	Key	Default	Extra
g	geometry	NO	MUL	NULL	
DROP INDEX idx ON spatial_index_syntax;
DROP TABLE IF EXISTS spatial_index_syntax;
CREATE TABLE spatial_index_syntax (g GEOMETRY NOT NULL SRID 4326);
CREATE SPATIAL INDEX idx ON spatial_index_syntax (g) LOCAL;
SHOW FIELDS FROM spatial_index_syntax;
Field	Type	Null	Key	Default	Extra
g	geometry	NO	MUL	NULL	
DROP INDEX idx ON spatial_index_syntax;
CREATE SPATIAL INDEX idx ON spatial_index_syntax (g) GLOBAL;
SHOW FIELDS FROM spatial_index_syntax;
Field	Type	Null	Key	Default	Extra
g	geometry	NO	MUL	NULL	
DROP INDEX idx ON spatial_index_syntax;
CREATE SPATIAL INDEX idx ON spatial_index_syntax (g);
SHOW FIELDS FROM spatial_index_syntax;
Field	Type	Null	Key	Default	Extra
g	geometry	NO	MUL	NULL	
DROP INDEX idx ON spatial_index_syntax;
DROP TABLE IF EXISTS spatial_index_constraint;
CREATE TABLE spatial_index_constraint (g1 GEOMETRY NOT NULL SRID 4326, g2 GEOMETRY NOT NULL SRID 4326);
CREATE INDEX idx ON spatial_index_constraint (g1, g2);
ERROR 42000: Too many key parts specified; max 64 parts allowed
DROP TABLE IF EXISTS spatial_index_constraint;
CREATE TABLE spatial_index_constraint (i int, g GEOMETRY NOT NULL SRID 4326);
CREATE INDEX idx ON spatial_index_constraint (i, g);
ERROR 42000: Too many key parts specified; max 64 parts allowed
DROP TABLE IF EXISTS spatial_index_constraint;
CREATE TABLE spatial_index_constraint (i int, g GEOMETRY NOT NULL SRID 4326);
CREATE SPATIAL INDEX idx ON spatial_index_constraint (i);
ERROR 42000: A SPATIAL index may only contain a geometrical type column.
DROP TABLE IF EXISTS spatial_index_constraint;
CREATE TABLE spatial_index_constraint (i int, g GEOMETRY NOT NULL SRID 4326);
CREATE UNIQUE INDEX idx ON spatial_index_constraint (g);
ERROR HY000: Spatial indexes can't be primary or unique indexes.
DROP TABLE IF EXISTS spatial_index_constraint;
CREATE TABLE spatial_index_constraint (i int, g GEOMETRY);
CREATE INDEX idx ON spatial_index_constraint (g);
ERROR 42000: All parts of a SPATIAL index must be NOT NULL.
DROP TABLE IF EXISTS spatial_index_constraint;
CREATE TABLE spatial_index_constraint (g GEOMETRY NOT NULL SRID 4326);
CREATE INDEX idx ON spatial_index_constraint (g);
INSERT INTO spatial_index_constraint values (ST_GEOMFROMTEXT('POINT(1 1)', 0));
ERROR HY000: The SRID of the geometry does not match the SRID of the column. The SRID of the geometry is 0, but the SRID of the column is 4326. Consider changing the SRID of the geometry or the SRID property of the column.
DROP TABLE IF EXISTS spatial_index_constraint;
DROP TABLE IF EXISTS spatial_index_dml;
SET @v=ST_GEOMFROMTEXT('POINT(0 0)', 4326);
SET @v0=ST_GEOMFROMTEXT('POINT(0 0)', 4326);
SET @v1=ST_GEOMFROMTEXT('POINT(1 1)', 4326);
CREATE TABLE spatial_index_dml (i int, g GEOMETRY NOT NULL SRID 4326, PRIMARY KEY (i));
CREATE INDEX idx ON spatial_index_dml (g);
INSERT INTO spatial_index_dml VALUES (1, ST_GEOMFROMTEXT('POINT(0 0)', 4326));
SELECT /*+INDEX(spatial_index_dml idx)*/ st_astext(g) FROM spatial_index_dml WHERE ST_INTERSECTS(g, ST_GEOMFROMTEXT('POINT(0 0)', 4326));
st_astext(g)
POINT(0 0)
DROP TABLE spatial_index_dml;
CREATE TABLE spatial_index_dml (i int, g GEOMETRY NOT NULL SRID 4326, PRIMARY KEY (i));
CREATE INDEX idx ON spatial_index_dml (g);
INSERT INTO spatial_index_dml VALUES (1, ST_GEOMFROMTEXT('POINT(0 0)', 4326));
SELECT /*+INDEX(spatial_index_dml idx)*/ st_astext(g) FROM spatial_index_dml WHERE ST_INTERSECTS(g, ST_GEOMFROMTEXT('POINT(0 0)', 4326));
st_astext(g)
POINT(0 0)
DROP TABLE spatial_index_dml;
CREATE TABLE spatial_index_dml (i1 int, i2 int, g GEOMETRY NOT NULL SRID 4326, PRIMARY KEY (i1, i2));
CREATE INDEX idx ON spatial_index_dml (g);
INSERT INTO spatial_index_dml VALUES (1, 2, ST_GEOMFROMTEXT('POINT(0 0)', 4326));
SELECT /*+INDEX(spatial_index_dml idx)*/ st_astext(g) FROM spatial_index_dml WHERE ST_INTERSECTS(g, ST_GEOMFROMTEXT('POINT(0 0)', 4326));
st_astext(g)
POINT(0 0)
DROP TABLE spatial_index_dml;
DROP TABLE IF EXISTS spatial_index_dml;
Warnings:
Note	1051	Unknown table 'test.spatial_index_dml'
CREATE TABLE spatial_index_dml (i int, g GEOMETRY NOT NULL SRID 4326, PRIMARY KEY (i));
CREATE INDEX idx ON spatial_index_dml (g);
INSERT INTO spatial_index_dml VALUES (1, ST_GEOMFROMTEXT('POINT(0 0)', 4326));
UPDATE spatial_index_dml SET g=ST_GEOMFROMTEXT('POINT(1 2)', 4326) WHERE ST_INTERSECTS(g, ST_GEOMFROMTEXT('POINT(0 0)', 4326));
SELECT /*+INDEX(spatial_index_dml idx)*/ g FROM spatial_index_dml WHERE ST_INTERSECTS(g, ST_GEOMFROMTEXT('POINT(1 1)', 4326));
g
DROP TABLE IF EXISTS spatial_index_dml;
CREATE TABLE spatial_index_dml (i1 int, i2 int, g GEOMETRY NOT NULL SRID 4326, PRIMARY KEY (i1, i2));
CREATE INDEX idx ON spatial_index_dml (g);
SET @v0=ST_GEOMFROMTEXT('POINT(0 0)', 4326);
SET @v1=ST_GEOMFROMTEXT('POINT(1 1)', 4326);
INSERT INTO spatial_index_dml VALUES (1, 2, ST_GEOMFROMTEXT('POINT(0 0)', 4326));
UPDATE spatial_index_dml SET g=ST_GEOMFROMTEXT('POINT(1 2)', 4326) WHERE ST_INTERSECTS(g, ST_GEOMFROMTEXT('POINT(0 0)', 4326));
SELECT /*+INDEX(spatial_index_dml idx)*/ g FROM spatial_index_dml WHERE ST_INTERSECTS(g, ST_GEOMFROMTEXT('POINT(1 1)', 4326));
g
DROP TABLE IF EXISTS spatial_index_dml;
CREATE TABLE spatial_index_dml (i int, g GEOMETRY NOT NULL SRID 4326, PRIMARY KEY (i));
CREATE INDEX idx ON spatial_index_dml (g);
SET @v0=ST_GEOMFROMTEXT('POINT(0 0)', 4326);
INSERT INTO spatial_index_dml VALUES (1, ST_GEOMFROMTEXT('POINT(0 0)', 4326));
DELETE FROM spatial_index_dml WHERE ST_INTERSECTS(g, ST_GEOMFROMTEXT('POINT(0 0)', 4326));
SELECT /*+INDEX(spatial_index_dml idx)*/ g FROM spatial_index_dml WHERE ST_INTERSECTS(g, ST_GEOMFROMTEXT('POINT(0 0)', 4326));
g
DROP TABLE IF EXISTS spatial_index_dml;
CREATE TABLE spatial_index_dml (i1 int, i2 int, g GEOMETRY NOT NULL SRID 4326, PRIMARY KEY (i1, i2));
CREATE INDEX idx ON spatial_index_dml (g);
SET @v0=ST_GEOMFROMTEXT('POINT(0 0)', 4326);
INSERT INTO spatial_index_dml VALUES (1, 2, ST_GEOMFROMTEXT('POINT(0 0)', 4326));
DELETE FROM spatial_index_dml WHERE ST_INTERSECTS(g, ST_GEOMFROMTEXT('POINT(0 0)', 4326));
SELECT /*+INDEX(spatial_index_dml idx)*/ g FROM spatial_index_dml WHERE ST_INTERSECTS(g, ST_GEOMFROMTEXT('POINT(0 0)', 4326));
g
DROP TABLE IF EXISTS spatial_index_query;
SET @v=ST_GEOMFROMTEXT('POINT(0 0)', 4326);
CREATE TABLE spatial_index_query (i int, g GEOMETRY NOT NULL SRID 4326, PRIMARY KEY(i));
CREATE INDEX idx ON spatial_index_query (g);
INSERT INTO spatial_index_query VALUES (0, ST_GEOMFROMTEXT('POINT(0 0)', 4326));
INSERT INTO spatial_index_query VALUES (1, ST_GEOMFROMTEXT('POINT(0 0)', 4326));
INSERT INTO spatial_index_query VALUES (2, ST_GEOMFROMTEXT('POINT(0 0)', 4326));
SELECT /*+INDEX(spatial_index_query idx)*/ st_astext(g) FROM spatial_index_query WHERE ST_INTERSECTS(g, ST_GEOMFROMTEXT('POINT(0 0)', 4326));
st_astext(g)
POINT(0 0)
POINT(0 0)
POINT(0 0)
DROP TABLE IF EXISTS spatial_index_query;
CREATE TABLE spatial_index_query (i int, g GEOMETRY NOT NULL SRID 4326);
CREATE INDEX idx ON spatial_index_query (g);
SET @v=ST_GEOMFROMTEXT('POINT(1 1)', 4326);
INSERT INTO spatial_index_query VALUES (1, ST_GEOMFROMTEXT('POINT(1 1)', 4326));
SET @cart_py = ST_GeomFromText('POLYGON((0 0, 10 0, 10 5, 0 5, 0 0))', 4326);
SELECT /*+INDEX(spatial_index_query idx)*/ st_astext(g) from spatial_index_query where st_intersects(g, ST_GeomFromText('POLYGON((0 0, 10 0, 10 5, 0 5, 0 0))', 4326));
st_astext(g)
POINT(1 1)
DROP TABLE IF EXISTS spatial_index_rebuild;
CREATE TABLE spatial_index_rebuild (i int, g GEOMETRY NOT NULL SRID 4326, PRIMARY KEY(i));
SET @v=ST_GEOMFROMTEXT('POINT(0 0)', 4326);
INSERT INTO spatial_index_rebuild VALUES (0, ST_GEOMFROMTEXT('POINT(0 0)', 4326));
INSERT INTO spatial_index_rebuild VALUES (1, ST_GEOMFROMTEXT('POINT(0 0)', 4326));
INSERT INTO spatial_index_rebuild VALUES (2, ST_GEOMFROMTEXT('POINT(0 0)', 4326));
CREATE INDEX idx ON spatial_index_rebuild (g);
SELECT /*+INDEX(spatial_index_rebuild idx)*/ st_astext(g) FROM spatial_index_rebuild WHERE ST_INTERSECTS(g, ST_GEOMFROMTEXT('POINT(0 0)', 4326));
st_astext(g)
POINT(0 0)
POINT(0 0)
POINT(0 0)
drop table if exists spatial_index;
CREATE TABLE spatial_index (i INT, g GEOMETRY NOT NULL SRID 4326, PRIMARY KEY (i),  SPATIAL KEY (g))with column group ( each column);
select i, st_astext(g) from spatial_index where ST_Intersects(g, ST_GEOMFROMTEXT('POINT(2 2)', 4326));
i	st_astext(g)
drop table if exists t1;
create table t1(a int,b int);
create index idx1 on t1(a);
SELECT st_astext(a) FROM t1  WHERE st_equals(a, point(7, 7));
st_astext(a)
explain SELECT st_astext(a) FROM t1  WHERE st_equals(a, point(7, 7));
Query Plan
===============================================
|ID|OPERATOR       |NAME|EST.ROWS|EST.TIME(us)|
-----------------------------------------------
|0 |TABLE FULL SCAN|t1  |1       |22          |
===============================================
Outputs & filters:
-------------------------------------
  0 - output([st_astext(cast(t1.a, LONGTEXT(536870911)))]), filter([st_equals(cast(t1.a, VARCHAR(1048576)), point(cast(7, DOUBLE(-1, -1)), cast(7, DOUBLE(-1,
       -1))))]), rowset=8
      access([t1.a]), partitions(p0)
      is_index_back=false, is_global_index=false, filter_before_indexback[false], 
      range_key([t1.__pk_increment]), range(MIN ; MAX)always true
drop table t1;
drop table if exists spatial_index_dml;
CREATE TABLE spatial_index_dml (i1 int, i2 int, g GEOMETRY NOT NULL SRID 4326, PRIMARY KEY (i1));
INSERT INTO spatial_index_dml VALUES (1, 2, ST_GEOMFROMTEXT('POINT(0 0)', 4326));
CREATE INDEX idx ON spatial_index_dml (g);
alter table spatial_index_dml drop column i2;
select i1, st_astext(g)  from spatial_index_dml;
i1	st_astext(g)
1	POINT(0 0)
drop table spatial_index_dml;
drop table if exists t1;
Warnings:
Note	1051	Unknown table 'test.t1'
create table t1 (c1 int primary key,j json, g GEOMETRY NOT NULL SRID 4326, SPATIAL INDEX(g));
insert into t1 values (1,'{"b":2}', ST_GeomFromText('POINT(1 1)', 4326));
insert into t1 values (2, '{"b":2}', ST_GeomFromText('POINT(-1 1)', 4326));
insert into t1 values (3,'{"b":2}',  ST_GeomFromText('POINT(-1 -1)', 4326));
insert into t1 values (4, '{"b":2}', ST_GeomFromText('POINT(1 -1)', 4326));
insert into t1 values (5,'{"b":2}',  ST_GeomFromText('POLYGON((0 0, 1 0, 1 -1, 0 -1, 0 0))', 4326));
insert into t1 values (6, '{"b":2}', ST_GeomFromText('LINESTRING(-1 -1, 3 3)', 4326));
insert into t1 values (7, '{"b":2}', ST_GeomFromText('POLYGON((1 1, -1 1, -1 -1, 1 -1, 1 1))', 4326));
insert into t1 values (8,'{"b":2}',  ST_GeomFromText('POLYGON((0 0, 0 2, 2 2, 2 0, 0 0))', 4326));
explain SELECT /*+ index(t1 g) */ * from t1 where  ST_INTERSECTS(g,ST_GeomFromText('POINT(-1 -1)', 4326));
Query Plan
================================================
|ID|OPERATOR       |NAME |EST.ROWS|EST.TIME(us)|
------------------------------------------------
|0 |TABLE FULL SCAN|t1(g)|1       |159         |
================================================
Outputs & filters:
-------------------------------------
  0 - output([t1.c1], [t1.j], [t1.g]), filter([ST_INTERSECTS(t1.g, ST_GeomFromText('POINT(-1 -1)', 4326))])
      access([t1.c1], [t1.g], [t1.j]), partitions(p0)
      is_index_back=true, is_global_index=false, filter_before_indexback[false], 
      range_key([t1.__cellid_18], [t1.__mbr_18], [t1.c1]), range(383950835169648260,MIN,MIN ; 383950835169648260,MAX,MAX), (383950835169648272,MIN,MIN ; 
      383950835169648272,MAX,MAX), (383950835169648320,MIN,MIN ; 383950835169648320,MAX,MAX), (383950835169648384,MIN,MIN ; 383950835169648384,MAX,MAX), (383950835169647616,
      MIN,MIN ; 383950835169647616,MAX,MAX), (383950835169644544,MIN,MIN ; 383950835169644544,MAX,MAX), (383950835169640448,MIN,MIN ; 383950835169640448,MAX,MAX),
       (383950835169689600,MIN,MIN ; 383950835169689600,MAX,MAX), (383950835169886208,MIN,MIN ; 383950835169886208,MAX,MAX), (383950835170672640,MIN,MIN ; 383950835170672640,
      MAX,MAX), (383950835173818368,MIN,MIN ; 383950835173818368,MAX,MAX), (383950835161235456,MIN,MIN ; 383950835161235456,MAX,MAX), (383950835144458240,MIN,
      MIN ; 383950835144458240,MAX,MAX), (383950835077349376,MIN,MIN ; 383950835077349376,MAX,MAX), (383950835882655744,MIN,MIN ; 383950835882655744,MAX,MAX),
       (383950839103881216,MIN,MIN ; 383950839103881216,MAX,MAX), (383950851988783104,MIN,MIN ; 383950851988783104,MAX,MAX), (383950903528390656,MIN,MIN ; 383950903528390656,
      MAX,MAX), (383950834808913920,MIN,MIN ; 383950834808913920,MAX,MAX), (383950559931006976,MIN,MIN ; 383950559931006976,MAX,MAX), (383953858465890304,MIN,
      MIN ; 383953858465890304,MAX,MAX), (383949460419379200,MIN,MIN ; 383949460419379200,MAX,MAX), (384002236977512448,MIN,MIN ; 384002236977512448,MAX,MAX),
       (384213343210045440,MIN,MIN ; 384213343210045440,MAX,MAX), (383931868233334784,MIN,MIN ; 383931868233334784,MAX,MAX), (382805968326492160,MIN,MIN ; 382805968326492160,
      MAX,MAX), (378302368699121664,MIN,MIN ; 378302368699121664,MAX,MAX), (360287970189639680,MIN,MIN ; 360287970189639680,MAX,MAX), (288230376151711744,MIN,
      MIN ; 288230376151711744,MAX,MAX), (1152921504606846976,MIN,MIN ; 1152921504606846976,MAX,MAX), (383950835169648257,MIN,MIN ; 383950835169648257,MAX,MAX)
alter table t1 drop column j;
explain SELECT /*+ index(t1 g) */ * from t1 where  ST_INTERSECTS(g,ST_GeomFromText('POINT(-1 -1)', 4326));
Query Plan
================================================
|ID|OPERATOR       |NAME |EST.ROWS|EST.TIME(us)|
------------------------------------------------
|0 |TABLE FULL SCAN|t1(g)|1       |159         |
================================================
Outputs & filters:
-------------------------------------
  0 - output([t1.c1], [t1.g]), filter([ST_INTERSECTS(t1.g, ST_GeomFromText('POINT(-1 -1)', 4326))])
      access([t1.c1], [t1.g]), partitions(p0)
      is_index_back=true, is_global_index=false, filter_before_indexback[false], 
      range_key([t1.__cellid_18], [t1.__mbr_18], [t1.c1]), range(383950835169648260,MIN,MIN ; 383950835169648260,MAX,MAX), (383950835169648272,MIN,MIN ; 
      383950835169648272,MAX,MAX), (383950835169648320,MIN,MIN ; 383950835169648320,MAX,MAX), (383950835169648384,MIN,MIN ; 383950835169648384,MAX,MAX), (383950835169647616,
      MIN,MIN ; 383950835169647616,MAX,MAX), (383950835169644544,MIN,MIN ; 383950835169644544,MAX,MAX), (383950835169640448,MIN,MIN ; 383950835169640448,MAX,MAX),
       (383950835169689600,MIN,MIN ; 383950835169689600,MAX,MAX), (383950835169886208,MIN,MIN ; 383950835169886208,MAX,MAX), (383950835170672640,MIN,MIN ; 383950835170672640,
      MAX,MAX), (383950835173818368,MIN,MIN ; 383950835173818368,MAX,MAX), (383950835161235456,MIN,MIN ; 383950835161235456,MAX,MAX), (383950835144458240,MIN,
      MIN ; 383950835144458240,MAX,MAX), (383950835077349376,MIN,MIN ; 383950835077349376,MAX,MAX), (383950835882655744,MIN,MIN ; 383950835882655744,MAX,MAX),
       (383950839103881216,MIN,MIN ; 383950839103881216,MAX,MAX), (383950851988783104,MIN,MIN ; 383950851988783104,MAX,MAX), (383950903528390656,MIN,MIN ; 383950903528390656,
      MAX,MAX), (383950834808913920,MIN,MIN ; 383950834808913920,MAX,MAX), (383950559931006976,MIN,MIN ; 383950559931006976,MAX,MAX), (383953858465890304,MIN,
      MIN ; 383953858465890304,MAX,MAX), (383949460419379200,MIN,MIN ; 383949460419379200,MAX,MAX), (384002236977512448,MIN,MIN ; 384002236977512448,MAX,MAX),
       (384213343210045440,MIN,MIN ; 384213343210045440,MAX,MAX), (383931868233334784,MIN,MIN ; 383931868233334784,MAX,MAX), (382805968326492160,MIN,MIN ; 382805968326492160,
      MAX,MAX), (378302368699121664,MIN,MIN ; 378302368699121664,MAX,MAX), (360287970189639680,MIN,MIN ; 360287970189639680,MAX,MAX), (288230376151711744,MIN,
      MIN ; 288230376151711744,MAX,MAX), (1152921504606846976,MIN,MIN ; 1152921504606846976,MAX,MAX), (383950835169648257,MIN,MIN ; 383950835169648257,MAX,MAX)
alter table t1 add c0 char(20) before g;
explain SELECT /*+ index(t1 g) */ * from t1 where  ST_INTERSECTS(g,ST_GeomFromText('POINT(-1 -1)', 4326));
Query Plan
================================================
|ID|OPERATOR       |NAME |EST.ROWS|EST.TIME(us)|
------------------------------------------------
|0 |TABLE FULL SCAN|t1(g)|1       |159         |
================================================
Outputs & filters:
-------------------------------------
  0 - output([t1.c1], [t1.c0], [t1.g]), filter([ST_INTERSECTS(t1.g, ST_GeomFromText('POINT(-1 -1)', 4326))])
      access([t1.c1], [t1.g], [t1.c0]), partitions(p0)
      is_index_back=true, is_global_index=false, filter_before_indexback[false], 
      range_key([t1.__cellid_18], [t1.__mbr_18], [t1.c1]), range(383950835169648260,MIN,MIN ; 383950835169648260,MAX,MAX), (383950835169648272,MIN,MIN ; 
      383950835169648272,MAX,MAX), (383950835169648320,MIN,MIN ; 383950835169648320,MAX,MAX), (383950835169648384,MIN,MIN ; 383950835169648384,MAX,MAX), (383950835169647616,
      MIN,MIN ; 383950835169647616,MAX,MAX), (383950835169644544,MIN,MIN ; 383950835169644544,MAX,MAX), (383950835169640448,MIN,MIN ; 383950835169640448,MAX,MAX),
       (383950835169689600,MIN,MIN ; 383950835169689600,MAX,MAX), (383950835169886208,MIN,MIN ; 383950835169886208,MAX,MAX), (383950835170672640,MIN,MIN ; 383950835170672640,
      MAX,MAX), (383950835173818368,MIN,MIN ; 383950835173818368,MAX,MAX), (383950835161235456,MIN,MIN ; 383950835161235456,MAX,MAX), (383950835144458240,MIN,
      MIN ; 383950835144458240,MAX,MAX), (383950835077349376,MIN,MIN ; 383950835077349376,MAX,MAX), (383950835882655744,MIN,MIN ; 383950835882655744,MAX,MAX),
       (383950839103881216,MIN,MIN ; 383950839103881216,MAX,MAX), (383950851988783104,MIN,MIN ; 383950851988783104,MAX,MAX), (383950903528390656,MIN,MIN ; 383950903528390656,
      MAX,MAX), (383950834808913920,MIN,MIN ; 383950834808913920,MAX,MAX), (383950559931006976,MIN,MIN ; 383950559931006976,MAX,MAX), (383953858465890304,MIN,
      MIN ; 383953858465890304,MAX,MAX), (383949460419379200,MIN,MIN ; 383949460419379200,MAX,MAX), (384002236977512448,MIN,MIN ; 384002236977512448,MAX,MAX),
       (384213343210045440,MIN,MIN ; 384213343210045440,MAX,MAX), (383931868233334784,MIN,MIN ; 383931868233334784,MAX,MAX), (382805968326492160,MIN,MIN ; 382805968326492160,
      MAX,MAX), (378302368699121664,MIN,MIN ; 378302368699121664,MAX,MAX), (360287970189639680,MIN,MIN ; 360287970189639680,MAX,MAX), (288230376151711744,MIN,
      MIN ; 288230376151711744,MAX,MAX), (1152921504606846976,MIN,MIN ; 1152921504606846976,MAX,MAX), (383950835169648257,MIN,MIN ; 383950835169648257,MAX,MAX)
alter table t1 modify c0 varchar(20);
explain SELECT /*+ index(t1 g) */ * from t1 where  ST_INTERSECTS(g,ST_GeomFromText('POINT(-1 -1)', 4326));
Query Plan
================================================
|ID|OPERATOR       |NAME |EST.ROWS|EST.TIME(us)|
------------------------------------------------
|0 |TABLE FULL SCAN|t1(g)|1       |159         |
================================================
Outputs & filters:
-------------------------------------
  0 - output([t1.c1], [t1.c0], [t1.g]), filter([ST_INTERSECTS(t1.g, ST_GeomFromText('POINT(-1 -1)', 4326))])
      access([t1.c1], [t1.g], [t1.c0]), partitions(p0)
      is_index_back=true, is_global_index=false, filter_before_indexback[false], 
      range_key([t1.__cellid_18], [t1.__mbr_18], [t1.c1]), range(383950835169648260,MIN,MIN ; 383950835169648260,MAX,MAX), (383950835169648272,MIN,MIN ; 
      383950835169648272,MAX,MAX), (383950835169648320,MIN,MIN ; 383950835169648320,MAX,MAX), (383950835169648384,MIN,MIN ; 383950835169648384,MAX,MAX), (383950835169647616,
      MIN,MIN ; 383950835169647616,MAX,MAX), (383950835169644544,MIN,MIN ; 383950835169644544,MAX,MAX), (383950835169640448,MIN,MIN ; 383950835169640448,MAX,MAX),
       (383950835169689600,MIN,MIN ; 383950835169689600,MAX,MAX), (383950835169886208,MIN,MIN ; 383950835169886208,MAX,MAX), (383950835170672640,MIN,MIN ; 383950835170672640,
      MAX,MAX), (383950835173818368,MIN,MIN ; 383950835173818368,MAX,MAX), (383950835161235456,MIN,MIN ; 383950835161235456,MAX,MAX), (383950835144458240,MIN,
      MIN ; 383950835144458240,MAX,MAX), (383950835077349376,MIN,MIN ; 383950835077349376,MAX,MAX), (383950835882655744,MIN,MIN ; 383950835882655744,MAX,MAX),
       (383950839103881216,MIN,MIN ; 383950839103881216,MAX,MAX), (383950851988783104,MIN,MIN ; 383950851988783104,MAX,MAX), (383950903528390656,MIN,MIN ; 383950903528390656,
      MAX,MAX), (383950834808913920,MIN,MIN ; 383950834808913920,MAX,MAX), (383950559931006976,MIN,MIN ; 383950559931006976,MAX,MAX), (383953858465890304,MIN,
      MIN ; 383953858465890304,MAX,MAX), (383949460419379200,MIN,MIN ; 383949460419379200,MAX,MAX), (384002236977512448,MIN,MIN ; 384002236977512448,MAX,MAX),
       (384213343210045440,MIN,MIN ; 384213343210045440,MAX,MAX), (383931868233334784,MIN,MIN ; 383931868233334784,MAX,MAX), (382805968326492160,MIN,MIN ; 382805968326492160,
      MAX,MAX), (378302368699121664,MIN,MIN ; 378302368699121664,MAX,MAX), (360287970189639680,MIN,MIN ; 360287970189639680,MAX,MAX), (288230376151711744,MIN,
      MIN ; 288230376151711744,MAX,MAX), (1152921504606846976,MIN,MIN ; 1152921504606846976,MAX,MAX), (383950835169648257,MIN,MIN ; 383950835169648257,MAX,MAX)
drop table t1;
drop table if exists tab;
Warnings:
Note	1051	Unknown table 'test.tab'
CREATE TABLE tab(c1 int NOT NULL PRIMARY KEY,c2 POINT NOT NULL,c3 LINESTRING NOT NULL,c4 POLYGON NOT NULL,c5 GEOMETRY NOT NULL);
CREATE INDEX index3 ON tab(c3) ;
ALTER TABLE tab CHANGE COLUMN c3 c33 LINESTRING;
drop table tab;
