drop table if exists t1,t2,t3,t4;
create table t1(pk1 int, pk2 int, pk3 int, extra int, primary key(pk1));
insert into t1(pk1,pk2,pk3) values(1,1,1),(2,2,2);
select * from t1;
pk1	pk2	pk3	extra
1	1	1	NULL
2	2	2	NULL
insert into t1 values(3,null,null,NULL);
select * from t1;
pk1	pk2	pk3	extra
1	1	1	NULL
2	2	2	NULL
3	NULL	NULL	NULL
select * from t1 where extra = NULL;
pk1	pk2	pk3	extra
select * from t1 where extra != NULL;
pk1	pk2	pk3	extra
select * from t1 where extra is NULL;
pk1	pk2	pk3	extra
1	1	1	NULL
2	2	2	NULL
3	NULL	NULL	NULL
select * from t1 where extra is not NULL;
pk1	pk2	pk3	extra
select * from t1 where pk1 is NULL and pk2 is NULL and pk3 is NULL;
pk1	pk2	pk3	extra
select * from t1 where pk1 = NULL and pk3 = NULL and pk3 = NULL;
pk1	pk2	pk3	extra
select * from t1 where pk1 != NULL and pk2 != NULL and pk3 != NULL;
pk1	pk2	pk3	extra
select * from t1 where pk1 is not NULL and pk2 is not NULL and pk3 is not NULL;
pk1	pk2	pk3	extra
1	1	1	NULL
2	2	2	NULL
select * from t1 where pk1 in (NULL) and pk2 in (NULL) and pk3 in (NULL);
pk1	pk2	pk3	extra
select * from t1 where pk1 in (NULL,1) and pk2 in (NULL, 1);
pk1	pk2	pk3	extra
1	1	1	NULL
update t1 set extra=4 where pk1 = NULL and pk2 = NULL and pk3 = NULL;
select * from t1;
pk1	pk2	pk3	extra
1	1	1	NULL
2	2	2	NULL
3	NULL	NULL	NULL
update t1 set extra=1 where pk1 is NULL;
select * from t1;
pk1	pk2	pk3	extra
1	1	1	NULL
2	2	2	NULL
3	NULL	NULL	NULL
update t1 set extra=2 where pk1 is NULL and pk2 is NULL and pk3 is NULL;
select * from t1;
pk1	pk2	pk3	extra
1	1	1	NULL
2	2	2	NULL
3	NULL	NULL	NULL
update t1 set extra=3 where pk1 is not NULL;
select * from t1;
pk1	pk2	pk3	extra
1	1	1	3
2	2	2	3
3	NULL	NULL	3
update t1 set extra=4 where pk1 is not NULL and pk2 is not NULL and pk3 is not NULL;
select * from t1;
pk1	pk2	pk3	extra
1	1	1	4
2	2	2	4
3	NULL	NULL	3
update t1 set extra=5 where pk1 != NULL;
select * from t1;
pk1	pk2	pk3	extra
1	1	1	4
2	2	2	4
3	NULL	NULL	3
update t1 set extra=6 where pk1 != NULL and pk2 != NULL and pk3 != NULL;
select * from t1;
pk1	pk2	pk3	extra
1	1	1	4
2	2	2	4
3	NULL	NULL	3
delete from t1 where pk1 != NULL;
select * from t1;
pk1	pk2	pk3	extra
1	1	1	4
2	2	2	4
3	NULL	NULL	3
delete from t1 where pk1 != NULL and pk2 != NULL and pk3 != NULL;
select * from t1;
pk1	pk2	pk3	extra
1	1	1	4
2	2	2	4
3	NULL	NULL	3
delete from t1 where pk1 = NULL and pk2 = NULL and pk3 = NULL;
select * from t1;
pk1	pk2	pk3	extra
1	1	1	4
2	2	2	4
3	NULL	NULL	3
delete from t1 where pk1 is NULL;
select * from t1;
pk1	pk2	pk3	extra
1	1	1	4
2	2	2	4
3	NULL	NULL	3
delete from t1 where pk1 is NULL and pk2 is NULL and pk3 is NULL;
select * from t1;
pk1	pk2	pk3	extra
1	1	1	4
2	2	2	4
3	NULL	NULL	3
delete from t1 where pk1 is not NULL and pk2 is not NULL and pk3 is not NULL;
select * from t1;
pk1	pk2	pk3	extra
3	NULL	NULL	3
delete from t1 where pk1 is not NULL;
select * from t1;
pk1	pk2	pk3	extra
drop table t1;
