set autocommit=0;
select * from t2 left join (select * from t1) as v  on t2.c1 = v.c2 where (v.c2 is null) and (v.c2 not between 1 and 2);
c1	c2	c3	c1	c2
select /*+ NO_REWRITE */* from t2 left join (select /*+ NO_REWRITE */* from t1) as v  on t2.c1 = v.c2 where (v.c2 is null) and (v.c2 not between 1 and 2);
c1	c2	c3	c1	c2
insert into t1_temp (select * from t2 left join (select * from t1) as v  on t2.c1 = v.c2 where (v.c2 is null) and (v.c2 not between 1 and 2));
rollback;
insert into t1_temp (select /*+ NO_REWRITE */* from t2 left join (select /*+ NO_REWRITE */* from t1) as v  on t2.c1 = v.c2 where (v.c2 is null) and (v.c2 not between 1 and 2));
rollback;
update t1 set c2 = (select v.c1 from t2 left join (select * from t1) as v  on t2.c1 = v.c2 where (v.c2 is null) and (v.c2 not between 1 and 2));
select stddev(c2) from t1;
stddev(c2)
NULL
rollback;
update t1 set c2 = (select /*+ NO_REWRITE */v.c1 from t2 left join (select /*+ NO_REWRITE */* from t1) as v  on t2.c1 = v.c2 where (v.c2 is null) and (v.c2 not between 1 and 2));
select stddev(c2) from t1;
stddev(c2)
NULL
rollback;
delete from t1 where c2 = (select v.c1 from t2 left join (select * from t1) as v  on t2.c1 = v.c2 where (v.c2 is null) and (v.c2 not between 1 and 2));
select stddev(c2) from t1;
stddev(c2)
2.1147629234082532
rollback;
delete from t1 where c2 = (select /*+ NO_REWRITE */v.c1 from t2 left join (select /*+ NO_REWRITE */* from t1) as v  on t2.c1 = v.c2 where (v.c2 is null) and (v.c2 not between 1 and 2));
select stddev(c2) from t1;
stddev(c2)
2.1147629234082532
rollback;
select * from t2 left join (select * from t1) as v  on t2.c1 = v.c2 where (v.c2 is null) and (v.c2 <=> null);
c1	c2	c3	c1	c2
3	5	b	NULL	NULL
select /*+ NO_REWRITE */* from t2 left join (select /*+ NO_REWRITE */* from t1) as v  on t2.c1 = v.c2 where (v.c2 is null) and (v.c2 <=> null);
c1	c2	c3	c1	c2
3	5	b	NULL	NULL
insert into t1_temp (select * from t2 left join (select * from t1) as v  on t2.c1 = v.c2 where (v.c2 is null) and (v.c2 <=> null));
rollback;
insert into t1_temp (select /*+ NO_REWRITE */* from t2 left join (select /*+ NO_REWRITE */* from t1) as v  on t2.c1 = v.c2 where (v.c2 is null) and (v.c2 <=> null));
rollback;
update t1 set c2 = (select v.c1 from t2 left join (select * from t1) as v  on t2.c1 = v.c2 where (v.c2 is null) and (v.c2 <=> null));
select stddev(c2) from t1;
stddev(c2)
NULL
rollback;
update t1 set c2 = (select /*+ NO_REWRITE */v.c1 from t2 left join (select /*+ NO_REWRITE */* from t1) as v  on t2.c1 = v.c2 where (v.c2 is null) and (v.c2 <=> null));
select stddev(c2) from t1;
stddev(c2)
NULL
rollback;
delete from t1 where c2 = (select v.c1 from t2 left join (select * from t1) as v  on t2.c1 = v.c2 where (v.c2 is null) and (v.c2 <=> null));
select stddev(c2) from t1;
stddev(c2)
2.1147629234082532
rollback;
delete from t1 where c2 = (select /*+ NO_REWRITE */v.c1 from t2 left join (select /*+ NO_REWRITE */* from t1) as v  on t2.c1 = v.c2 where (v.c2 is null) and (v.c2 <=> null));
select stddev(c2) from t1;
stddev(c2)
2.1147629234082532
rollback;
select * from t2 left join (select * from t1) as v  on t2.c1 = v.c2 where (v.c2 is null) and ((v.c2 + 2 > 1) + 2 < 0);
c1	c2	c3	c1	c2
select /*+ NO_REWRITE */* from t2 left join (select /*+ NO_REWRITE */* from t1) as v  on t2.c1 = v.c2 where (v.c2 is null) and ((v.c2 + 2 > 1) + 2 < 0);
c1	c2	c3	c1	c2
insert into t1_temp (select * from t2 left join (select * from t1) as v  on t2.c1 = v.c2 where (v.c2 is null) and ((v.c2 + 2 > 1) + 2 < 0));
rollback;
insert into t1_temp (select /*+ NO_REWRITE */* from t2 left join (select /*+ NO_REWRITE */* from t1) as v  on t2.c1 = v.c2 where (v.c2 is null) and ((v.c2 + 2 > 1) + 2 < 0));
rollback;
update t1 set c2 = (select v.c1 from t2 left join (select * from t1) as v  on t2.c1 = v.c2 where (v.c2 is null) and ((v.c2 + 2 > 1) + 2 < 0));
select stddev(c2) from t1;
stddev(c2)
NULL
rollback;
update t1 set c2 = (select /*+ NO_REWRITE */v.c1 from t2 left join (select /*+ NO_REWRITE */* from t1) as v  on t2.c1 = v.c2 where (v.c2 is null) and ((v.c2 + 2 > 1) + 2 < 0));
select stddev(c2) from t1;
stddev(c2)
NULL
rollback;
delete from t1 where c2 = (select v.c1 from t2 left join (select * from t1) as v  on t2.c1 = v.c2 where (v.c2 is null) and ((v.c2 + 2 > 1) + 2 < 0));
select stddev(c2) from t1;
stddev(c2)
2.1147629234082532
rollback;
delete from t1 where c2 = (select /*+ NO_REWRITE */v.c1 from t2 left join (select /*+ NO_REWRITE */* from t1) as v  on t2.c1 = v.c2 where (v.c2 is null) and ((v.c2 + 2 > 1) + 2 < 0));
select stddev(c2) from t1;
stddev(c2)
2.1147629234082532
rollback;
select * from t2 left join (select * from t1) as v  on t2.c1 = v.c2 where (v.c2 is null) and (not(v.c2 and false));
c1	c2	c3	c1	c2
3	5	b	NULL	NULL
select /*+ NO_REWRITE */* from t2 left join (select /*+ NO_REWRITE */* from t1) as v  on t2.c1 = v.c2 where (v.c2 is null) and (not(v.c2 and false));
c1	c2	c3	c1	c2
3	5	b	NULL	NULL
insert into t1_temp (select * from t2 left join (select * from t1) as v  on t2.c1 = v.c2 where (v.c2 is null) and (not(v.c2 and false)));
rollback;
insert into t1_temp (select /*+ NO_REWRITE */* from t2 left join (select /*+ NO_REWRITE */* from t1) as v  on t2.c1 = v.c2 where (v.c2 is null) and (not(v.c2 and false)));
rollback;
update t1 set c2 = (select t2.c1 from t2 left join (select * from t1) as v  on t2.c1 = v.c2 where (v.c2 is null) and (not(v.c2 and false)));
select stddev(c2) from t1;
stddev(c2)
0
rollback;
update t1 set c2 = (select /*+ NO_REWRITE */t2.c1 from t2 left join (select /*+ NO_REWRITE */* from t1) as v  on t2.c1 = v.c2 where (v.c2 is null) and (not(v.c2 and false)));
select stddev(c2) from t1;
stddev(c2)
0
rollback;
delete from t1 where c2 = (select t2.c1 from t2 left join (select * from t1) as v  on t2.c1 = v.c2 where (v.c2 is null) and (not(v.c2 and false)));
select stddev(c2) from t1;
stddev(c2)
2.1147629234082532
rollback;
delete from t1 where c2 = (select /*+ NO_REWRITE */t2.c1 from t2 left join (select /*+ NO_REWRITE */* from t1) as v  on t2.c1 = v.c2 where (v.c2 is null) and (not(v.c2 and false)));
select stddev(c2) from t1;
stddev(c2)
2.1147629234082532
rollback;
select * from t2 left join (select * from t1) as v  on t2.c1 = v.c2 where (v.c2 is null) and (not((1 + 2 > v.c2) and false));
c1	c2	c3	c1	c2
3	5	b	NULL	NULL
select /*+ NO_REWRITE */* from t2 left join (select * from t1) as v  on t2.c1 = v.c2 where (v.c2 is null) and (not((1 + 2 > v.c2) and false));
c1	c2	c3	c1	c2
3	5	b	NULL	NULL
insert into t1_temp (select * from t2 left join (select * from t1) as v  on t2.c1 = v.c2 where (v.c2 is null) and (not((1 + 2 > v.c2) and false)));
rollback;
insert into t1_temp (select /*+ NO_REWRITE */* from t2 left join (select * from t1) as v  on t2.c1 = v.c2 where (v.c2 is null) and (not((1 + 2 > v.c2) and false)));
rollback;
update t1 set c2 = (select v.c1 from t2 left join (select * from t1) as v  on t2.c1 = v.c2 where (v.c2 is null) and (not((1 + 2 > v.c2) and false)));
select stddev(c2) from t1;
stddev(c2)
NULL
rollback;
update t1 set c2 = (select /*+ NO_REWRITE */v.c1 from t2 left join (select * from t1) as v  on t2.c1 = v.c2 where (v.c2 is null) and (not((1 + 2 > v.c2) and false)));
select stddev(c2) from t1;
stddev(c2)
NULL
rollback;
delete from t1 where c2 = (select v.c1 from t2 left join (select * from t1) as v  on t2.c1 = v.c2 where (v.c2 is null) and (not((1 + 2 > v.c2) and false)));
select stddev(c2) from t1;
stddev(c2)
2.1147629234082532
rollback;
delete from t1 where c2 = (select /*+ NO_REWRITE */v.c1 from t2 left join (select * from t1) as v  on t2.c1 = v.c2 where (v.c2 is null) and (not((1 + 2 > v.c2) and false)));
select stddev(c2) from t1;
stddev(c2)
2.1147629234082532
rollback;
select * from t2 left join (select * from t1) as v  on t2.c1 = v.c2 where (v.c2 is null) and (((1 + 2 > v.c2) and false) + 2 > -2);
c1	c2	c3	c1	c2
3	5	b	NULL	NULL
select /*+ NO_REWRITE */* from t2 left join (select /*+ NO_REWRITE */* from t1) as v  on t2.c1 = v.c2 where (v.c2 is null) and (((1 + 2 > v.c2) and false) + 2 > -2);
c1	c2	c3	c1	c2
3	5	b	NULL	NULL
insert into t1_temp (select * from t2 left join (select * from t1) as v  on t2.c1 = v.c2 where (v.c2 is null) and (((1 + 2 > v.c2) and false) + 2 > -2));
rollback;
insert into t1_temp (select /*+ NO_REWRITE */* from t2 left join (select /*+ NO_REWRITE */* from t1) as v  on t2.c1 = v.c2 where (v.c2 is null) and (((1 + 2 > v.c2) and false) + 2 > -2));
rollback;
update t1 set c2 = (select t2.c1 from t2 left join (select * from t1) as v  on t2.c1 = v.c2 where (v.c2 is null) and (((1 + 2 > v.c2) and false) + 2 > -2));
select stddev(c2) from t1;
stddev(c2)
0
rollback;
update t1 set c2 = (select /*+ NO_REWRITE */t2.c1 from t2 left join (select /*+ NO_REWRITE */* from t1) as v  on t2.c1 = v.c2 where (v.c2 is null) and (((1 + 2 > v.c2) and false) + 2 > -2));
select stddev(c2) from t1;
stddev(c2)
0
rollback;
delete from t1 where c2 = (select t2.c1 from t2 left join (select * from t1) as v  on t2.c1 = v.c2 where (v.c2 is null) and (((1 + 2 > v.c2) and false) + 2 > -2));
select stddev(c2) from t1;
stddev(c2)
2.1147629234082532
rollback;
delete from t1 where c2 = (select /*+ NO_REWRITE */t2.c1 from t2 left join (select /*+ NO_REWRITE */* from t1) as v  on t2.c1 = v.c2 where (v.c2 is null) and (((1 + 2 > v.c2) and false) + 2 > -2));
select stddev(c2) from t1;
stddev(c2)
2.1147629234082532
rollback;
select * from t2 left join (select * from t1) as v  on t2.c1 = v.c2 where (v.c2 is null) and (1 + 2 > v.c2);
c1	c2	c3	c1	c2
select /*+ NO_REWRITE */* from t2 left join (select /*+ NO_REWRITE */* from t1) as v  on t2.c1 = v.c2 where (v.c2 is null) and (1 + 2 > v.c2);
c1	c2	c3	c1	c2
insert into t1_temp (select * from t2 left join (select * from t1) as v  on t2.c1 = v.c2 where (v.c2 is null) and (1 + 2 > v.c2));
rollback;
insert into t1_temp (select /*+ NO_REWRITE */* from t2 left join (select /*+ NO_REWRITE */* from t1) as v  on t2.c1 = v.c2 where (v.c2 is null) and (1 + 2 > v.c2));
rollback;
update t1 set c2 = (select v.c1 from t2 left join (select * from t1) as v  on t2.c1 = v.c2 where (v.c2 is null) and (1 + 2 > v.c2));
select stddev(c2) from t1;
stddev(c2)
NULL
rollback;
update t1 set c2 = (select /*+ NO_REWRITE */v.c1 from t2 left join (select /*+ NO_REWRITE */* from t1) as v  on t2.c1 = v.c2 where (v.c2 is null) and (1 + 2 > v.c2));
select stddev(c2) from t1;
stddev(c2)
NULL
rollback;
delete from t1 where c2 = (select v.c1 from t2 left join (select * from t1) as v  on t2.c1 = v.c2 where (v.c2 is null) and (1 + 2 > v.c2));
select stddev(c2) from t1;
stddev(c2)
2.1147629234082532
rollback;
delete from t1 where c2 = (select /*+ NO_REWRITE */v.c1 from t2 left join (select /*+ NO_REWRITE */* from t1) as v  on t2.c1 = v.c2 where (v.c2 is null) and (1 + 2 > v.c2));
select stddev(c2) from t1;
stddev(c2)
2.1147629234082532
rollback;
select * from t2 left join (select * from t1) as v  on t2.c1 = v.c2 where (v.c2 is null) and (1 + 2 > (v.c2 is not null));
c1	c2	c3	c1	c2
3	5	b	NULL	NULL
select /*+ NO_REWRITE */* from t2 left join (select /*+ NO_REWRITE */* from t1) as v  on t2.c1 = v.c2 where (v.c2 is null) and (1 + 2 > (v.c2 is not null));
c1	c2	c3	c1	c2
3	5	b	NULL	NULL
insert into t1_temp (select * from t2 left join (select * from t1) as v  on t2.c1 = v.c2 where (v.c2 is null) and (1 + 2 > (v.c2 is not null)));
rollback;
insert into t1_temp (select /*+ NO_REWRITE */* from t2 left join (select /*+ NO_REWRITE */* from t1) as v  on t2.c1 = v.c2 where (v.c2 is null) and (1 + 2 > (v.c2 is not null)));
rollback;
update t1 set c2 = (select v.c1 from t2 left join (select * from t1) as v  on t2.c1 = v.c2 where (v.c2 is null) and (1 + 2 > (v.c2 is not null)));
select stddev(c2) from t1;
stddev(c2)
NULL
rollback;
update t1 set c2 = (select /*+ NO_REWRITE */v.c1 from t2 left join (select /*+ NO_REWRITE */* from t1) as v  on t2.c1 = v.c2 where (v.c2 is null) and (1 + 2 > (v.c2 is not null)));
select stddev(c2) from t1;
stddev(c2)
NULL
rollback;
delete from t1 where c2 = (select v.c1 from t2 left join (select * from t1) as v  on t2.c1 = v.c2 where (v.c2 is null) and (1 + 2 > (v.c2 is not null)));
select stddev(c2) from t1;
stddev(c2)
2.1147629234082532
rollback;
delete from t1 where c2 = (select /*+ NO_REWRITE */v.c1 from t2 left join (select /*+ NO_REWRITE */* from t1) as v  on t2.c1 = v.c2 where (v.c2 is null) and (1 + 2 > (v.c2 is not null)));
select stddev(c2) from t1;
stddev(c2)
2.1147629234082532
rollback;
select * from t2 left join (select * from t1) as v  on t2.c1 = v.c2 where (v.c2 is null) and (1 + 2 > (v.c2 is not null) and (v.c1 is not null));
c1	c2	c3	c1	c2
select /*+ NO_REWRITE */* from t2 left join (select /*+ NO_REWRITE */* from t1) as v  on t2.c1 = v.c2 where (v.c2 is null) and (1 + 2 > (v.c2 is not null) and (v.c1 is not null));
c1	c2	c3	c1	c2
insert into t1_temp (select * from t2 left join (select * from t1) as v  on t2.c1 = v.c2 where (v.c2 is null) and (1 + 2 > (v.c2 is not null) and (v.c1 is not null)));
rollback;
insert into t1_temp (select /*+ NO_REWRITE */* from t2 left join (select /*+ NO_REWRITE */* from t1) as v  on t2.c1 = v.c2 where (v.c2 is null) and (1 + 2 > (v.c2 is not null) and (v.c1 is not null)));
rollback;
update t1 set c2 = (select t2.c1 from t2 left join (select * from t1) as v  on t2.c1 = v.c2 where (v.c2 is null) and (1 + 2 > (v.c2 is not null) and (v.c1 is not null)));
select stddev(c2) from t1;
stddev(c2)
NULL
rollback;
update t1 set c2 = (select /*+ NO_REWRITE */t2.c1 from t2 left join (select /*+ NO_REWRITE */* from t1) as v  on t2.c1 = v.c2 where (v.c2 is null) and (1 + 2 > (v.c2 is not null) and (v.c1 is not null)));
select stddev(c2) from t1;
stddev(c2)
NULL
rollback;
delete from t1 where c2 = (select t2.c1 from t2 left join (select * from t1) as v  on t2.c1 = v.c2 where (v.c2 is null) and (1 + 2 > (v.c2 is not null) and (v.c1 is not null)));
select stddev(c2) from t1;
stddev(c2)
2.1147629234082532
rollback;
delete from t1 where c2 = (select /*+ NO_REWRITE */t2.c1 from t2 left join (select /*+ NO_REWRITE */* from t1) as v  on t2.c1 = v.c2 where (v.c2 is null) and (1 + 2 > (v.c2 is not null) and (v.c1 is not null)));
select stddev(c2) from t1;
stddev(c2)
2.1147629234082532
rollback;
select * from t1 left join t2 using(c1) where (t2.c1 is not null)=0;
c1	c2	c2	c3
select /*+ NO_REWRITE */* from t1 left join t2 using(c1) where (t2.c1 is not null)=0;
c1	c2	c2	c3
insert into t3_temp (select * from t1 left join t2 using(c1) where (t2.c1 is not null)=0);
rollback;
insert into t3_temp (select /*+ NO_REWRITE */* from t1 left join t2 using(c1) where (t2.c1 is not null)=0);
rollback;
update t1 set c2 = (select t2.c1 from t1 left join t2 using(c1) where (t2.c1 is not null)=0);
select stddev(c2) from t1;
stddev(c2)
NULL
rollback;
update t1 set c2 = (select /*+ NO_REWRITE */t2.c1 from t1 left join t2 using(c1) where (t2.c1 is not null)=0);
select stddev(c2) from t1;
stddev(c2)
NULL
rollback;
delete from t1 where c2 = (select t2.c1 from t1 left join t2 using(c1) where (t2.c1 is not null)=0);
select stddev(c2) from t1;
stddev(c2)
2.1147629234082532
rollback;
delete from t1 where c2 = (select /*+ NO_REWRITE */t2.c1 from t1 left join t2 using(c1) where (t2.c1 is not null)=0);
select stddev(c2) from t1;
stddev(c2)
2.1147629234082532
rollback;
select * from t1 left join t2 using(c1) where (t2.c1 is not null) and (t2.c1 is null);
c1	c2	c2	c3
select /*+ NO_REWRITE */* from t1 left join t2 using(c1) where (t2.c1 is not null) and (t2.c1 is null);
c1	c2	c2	c3
insert into t3_temp (select * from t1 left join t2 using(c1) where (t2.c1 is not null) and (t2.c1 is null));
rollback;
insert into t3_temp (select /*+ NO_REWRITE */* from t1 left join t2 using(c1) where (t2.c1 is not null) and (t2.c1 is null));
rollback;
update t1 set c2 = (select t1.c1 from t1 left join t2 using(c1) where (t2.c1 is not null) and (t2.c1 is null));
select stddev(c2) from t1;
stddev(c2)
NULL
rollback;
update t1 set c2 = (select /*+ NO_REWRITE */t1.c1 from t1 left join t2 using(c1) where (t2.c1 is not null) and (t2.c1 is null));
select stddev(c2) from t1;
stddev(c2)
NULL
rollback;
delete from t1 where c2 = (select t2.c1 from t1 left join t2 using(c1) where (t2.c1 is not null) and (t2.c1 is null));
select stddev(c2) from t1;
stddev(c2)
2.1147629234082532
rollback;
delete from t1 where c2 = (select /*+ NO_REWRITE */t2.c1 from t1 left join t2 using(c1) where (t2.c1 is not null) and (t2.c1 is null));
select stddev(c2) from t1;
stddev(c2)
2.1147629234082532
rollback;
select * from t1 left join t2 using(c1) where (t2.c1 is null) and (t2.c1 > 0);
c1	c2	c2	c3
select /*+ NO_REWRITE */* from t1 left join t2 using(c1) where (t2.c1 is null) and (t2.c1 > 0);
c1	c2	c2	c3
insert into t3_temp (select * from t1 left join t2 using(c1) where (t2.c1 is null) and (t2.c1 > 0));
rollback;
insert into t3_temp (select /*+ NO_REWRITE */* from t1 left join t2 using(c1) where (t2.c1 is null) and (t2.c1 > 0));
rollback;
update t1 set c2 = (select t1.c1 from t1 left join t2 using(c1) where (t2.c1 is null) and (t2.c1 > 0));
select stddev(c2) from t1;
stddev(c2)
NULL
rollback;
update t1 set c2 = (select /*+ NO_REWRITE */t1.c1 from t1 left join t2 using(c1) where (t2.c1 is null) and (t2.c1 > 0));
select stddev(c2) from t1;
stddev(c2)
NULL
rollback;
delete from t1 where c2 = (select t1.c1 from t1 left join t2 using(c1) where (t2.c1 is null) and (t2.c1 > 0));
select stddev(c2) from t1;
stddev(c2)
2.1147629234082532
rollback;
delete from t1 where c2 = (select /*+ NO_REWRITE */t1.c1 from t1 left join t2 using(c1) where (t2.c1 is null) and (t2.c1 > 0));
select stddev(c2) from t1;
stddev(c2)
2.1147629234082532
rollback;
select * from t1 left join t2 using(c1) where (t2.c1 and false) < 1 + 1;
c1	c2	c2	c3
1	1	1	o
2	5	5	c
3	2	5	b
4	6	6	o
5	4	7	d
6	7	8	c
select /*+ NO_REWRITE */* from t1 left join t2 using(c1) where (t2.c1 and false) < 1 + 1;
c1	c2	c2	c3
1	1	1	o
2	5	5	c
3	2	5	b
4	6	6	o
5	4	7	d
6	7	8	c
insert into t3_temp (select * from t1 left join t2 using(c1) where (t2.c1 and false) < 1 + 1);
rollback;
insert into t3_temp (select /*+ NO_REWRITE */* from t1 left join t2 using(c1) where (t2.c1 and false) < 1 + 1);
rollback;
update t1 set c2 = (select t1.c1 from t1 left join t2 using(c1) where (t2.c1 and false) < 1 + 1 limit 1);
select stddev(c2) from t1;
stddev(c2)
0
rollback;
update t1 set c2 = (select /*+ NO_REWRITE */t1.c1 from t1 left join t2 using(c1) where (t2.c1 and false) < 1 + 1 limit 1);
select stddev(c2) from t1;
stddev(c2)
0
rollback;
delete from t1 where c2 = (select t1.c1 from t1 left join t2 using(c1) where (t2.c1 and false) < 1 + 1 limit 1);
select stddev(c2) from t1;
stddev(c2)
1.7204650534085253
rollback;
delete from t1 where c2 = (select /*+ NO_REWRITE */t1.c1 from t1 left join t2 using(c1) where (t2.c1 and false) < 1 + 1 limit 1);
select stddev(c2) from t1;
stddev(c2)
1.7204650534085253
rollback;
select * from t1 left join t2 on t1.c1 > t2.c1 where lnnvl(t2.c2) and 1 > 0;
c1	c2	c1	c2	c3
1	1	NULL	NULL	NULL
select /*+ NO_REWRITE */* from t1 left join t2 on t1.c1 > t2.c1 where lnnvl(t2.c2) and 1 > 0;
c1	c2	c1	c2	c3
1	1	NULL	NULL	NULL
insert into t1_temp (select * from t1 left join t2 on t1.c1 > t2.c1 where lnnvl(t2.c2) and 1 > 0);
rollback;
insert into t1_temp (select /*+ NO_REWRITE */* from t1 left join t2 on t1.c1 > t2.c1 where lnnvl(t2.c2) and 1 > 0);
rollback;
update t1 set c2 = (select t1.c1 from t1 left join t2 on t1.c1 > t2.c1 where lnnvl(t2.c2) and 1 > 0);
select stddev(c2) from t1;
stddev(c2)
0
rollback;
update t1 set c2 = (select /*+ NO_REWRITE */t1.c1 from t1 left join t2 on t1.c1 > t2.c1 where lnnvl(t2.c2) and 1 > 0);
select stddev(c2) from t1;
stddev(c2)
0
rollback;
delete from t1 where c2 = (select t2.c1 from t1 left join t2 on t1.c1 > t2.c1 where lnnvl(t2.c2) and 1 > 0);
select stddev(c2) from t1;
stddev(c2)
2.1147629234082532
rollback;
delete from t1 where c2 = (select /*+ NO_REWRITE */t2.c1 from t1 left join t2 on t1.c1 > t2.c1 where lnnvl(t2.c2) and 1 > 0);
select stddev(c2) from t1;
stddev(c2)
2.1147629234082532
rollback;
select * from t1 left join t2 on t1.c1 > t2.c1 where lnnvl(t2.c2 + 2 - 1) and 1 > 0;
c1	c2	c1	c2	c3
1	1	NULL	NULL	NULL
select /*+ NO_REWRITE */* from t1 left join t2 on t1.c1 > t2.c1 where lnnvl(t2.c2 + 2 - 1) and 1 > 0;
c1	c2	c1	c2	c3
1	1	NULL	NULL	NULL
insert into t1_temp (select * from t1 left join t2 on t1.c1 > t2.c1 where lnnvl(t2.c2 + 2 - 1) and 1 > 0);
rollback;
insert into t1_temp (select /*+ NO_REWRITE */* from t1 left join t2 on t1.c1 > t2.c1 where lnnvl(t2.c2 + 2 - 1) and 1 > 0);
rollback;
update t1 set c2 = (select t1.c1 from t1 left join t2 on t1.c1 > t2.c1 where lnnvl(t2.c2 + 2 - 1) and 1 > 0);
select stddev(c2) from t1;
stddev(c2)
0
rollback;
update t1 set c2 = (select /*+ NO_REWRITE */t1.c1 from t1 left join t2 on t1.c1 > t2.c1 where lnnvl(t2.c2 + 2 - 1) and 1 > 0);
select stddev(c2) from t1;
stddev(c2)
0
rollback;
delete from t1 where c2 = (select t1.c1 from t1 left join t2 on t1.c1 > t2.c1 where lnnvl(t2.c2 + 2 - 1) and 1 > 0);
select stddev(c2) from t1;
stddev(c2)
1.7204650534085253
rollback;
delete from t1 where c2 = (select /*+ NO_REWRITE */t1.c1 from t1 left join t2 on t1.c1 > t2.c1 where lnnvl(t2.c2 + 2 - 1) and 1 > 0);
select stddev(c2) from t1;
stddev(c2)
1.7204650534085253
rollback;
select * from t1 left join t2 on t1.c1 > t2.c1 where t2.c1 + 1 > all(select c1 from t3 group by c2);
c1	c2	c1	c2	c3
4	6	3	5	b
5	4	3	5	b
5	4	4	6	o
6	7	3	5	b
6	7	4	6	o
6	7	5	7	d
select /*+ NO_REWRITE */* from t1 left join t2 on t1.c1 > t2.c1 where t2.c1 + 1 > all(select /*+ NO_REWRITE */c1 from t3 group by c2);
c1	c2	c1	c2	c3
4	6	3	5	b
5	4	3	5	b
5	4	4	6	o
6	7	3	5	b
6	7	4	6	o
6	7	5	7	d
insert into t4_temp (select * from t1 left join t2 on t1.c1 > t2.c1 where t2.c1 + 1 > all(select c1 from t3 group by c2));
rollback;
insert into t4_temp (select /*+ NO_REWRITE */* from t1 left join t2 on t1.c1 > t2.c1 where t2.c1 + 1 > all(select /*+ NO_REWRITE */c1 from t3 group by c2));
rollback;
update t1 set c2 = (select t1.c1 from t1 left join t2 on t1.c1 > t2.c1 where t2.c1 + 1 > all(select c1 from t3 group by c2) and t2.c1=1);
select stddev(c2) from t1;
stddev(c2)
NULL
rollback;
update t1 set c2 = (select /*+ NO_REWRITE */t1.c1 from t1 left join t2 on t1.c1 > t2.c1 where t2.c1 + 1 > all(select /*+ NO_REWRITE */c1 from t3 group by c2) and t2.c1=1);
select stddev(c2) from t1;
stddev(c2)
NULL
rollback;
delete from t1 where c2 = (select t1.c1 from t1 left join t2 on t1.c1 > t2.c1 where t2.c1 + 1 > all(select c1 from t3 group by c2) and t2.c1=1);
select stddev(c2) from t1;
stddev(c2)
2.1147629234082532
rollback;
delete from t1 where c2 = (select /*+ NO_REWRITE */t1.c1 from t1 left join t2 on t1.c1 > t2.c1 where t2.c1 + 1 > all(select /*+ NO_REWRITE */c1 from t3 group by c2) and t2.c1=1);
select stddev(c2) from t1;
stddev(c2)
2.1147629234082532
rollback;
select * from t1 left join t2 on t1.c1 = t2.c1 left join t3 on t1.c2 = t3.c2 where t2.c1 > 0;
c1	c2	c1	c2	c3	c1	c2	c3
1	1	1	1	o	NULL	NULL	NULL
2	5	2	5	c	2	5	4
2	5	2	5	c	4	5	1
2	5	2	5	c	5	5	5
2	5	2	5	c	6	5	c
3	2	3	5	b	1	2	3
4	6	4	6	o	3	6	1
5	4	5	7	d	NULL	NULL	NULL
6	7	6	8	c	NULL	NULL	NULL
select /*+ NO_REWRITE */* from t1 left join t2 on t1.c1 = t2.c1 left join t3 on t1.c2 = t3.c2 where t2.c1 > 0;
c1	c2	c1	c2	c3	c1	c2	c3
1	1	1	1	o	NULL	NULL	NULL
2	5	2	5	c	2	5	4
2	5	2	5	c	4	5	1
2	5	2	5	c	5	5	5
2	5	2	5	c	6	5	c
3	2	3	5	b	1	2	3
4	6	4	6	o	3	6	1
5	4	5	7	d	NULL	NULL	NULL
6	7	6	8	c	NULL	NULL	NULL
insert into t5_temp (select * from t1 left join t2 on t1.c1 = t2.c1 left join t3 on t1.c2 = t3.c2 where t2.c1 > 0);
rollback;
insert into t5_temp (select /*+ NO_REWRITE */* from t1 left join t2 on t1.c1 = t2.c1 left join t3 on t1.c2 = t3.c2 where t2.c1 > 0);
rollback;
update t1 set c2 = (select t1.c1 from t1 left join t2 on t1.c1 = t2.c1 left join t3 on t1.c2 = t3.c2 where t2.c1 > 0 limit 1);
select stddev(c2) from t1;
stddev(c2)
0
rollback;
update t1 set c2 = (select /*+ NO_REWRITE */t1.c1 from t1 left join t2 on t1.c1 = t2.c1 left join t3 on t1.c2 = t3.c2 where t2.c1 > 0 limit 1);
select stddev(c2) from t1;
stddev(c2)
0
rollback;
delete from t1 where c2 = (select t1.c1 from t1 left join t2 on t1.c1 = t2.c1 left join t3 on t1.c2 = t3.c2 where t2.c1 > 0 limit 1);
select stddev(c2) from t1;
stddev(c2)
1.7204650534085253
rollback;
delete from t1 where c2 = (select /*+ NO_REWRITE */t1.c1 from t1 left join t2 on t1.c1 = t2.c1 left join t3 on t1.c2 = t3.c2 where t2.c1 > 0 limit 1);
select stddev(c2) from t1;
stddev(c2)
2.1147629234082532
rollback;
select * from t1 left join t2 on t1.c1 = t2.c1 left join t3 on t1.c2 = t3.c2 where (case t2.c2 when 0 then 1 end) = 1;
c1	c2	c1	c2	c3	c1	c2	c3
select /*+ NO_REWRITE */* from t1 left join t2 on t1.c1 = t2.c1 left join t3 on t1.c2 = t3.c2 where (case t2.c2 when 0 then 1 end) = 1;
c1	c2	c1	c2	c3	c1	c2	c3
insert into t5_temp (select * from t1 left join t2 on t1.c1 = t2.c1 left join t3 on t1.c2 = t3.c2 where (case t2.c2 when 0 then 1 end) = 1);
rollback;
insert into t5_temp (select /*+ NO_REWRITE */* from t1 left join t2 on t1.c1 = t2.c1 left join t3 on t1.c2 = t3.c2 where (case t2.c2 when 0 then 1 end) = 1);
rollback;
update t1 set c2 = (select t1.c1 from t1 left join t2 on t1.c1 = t2.c1 left join t3 on t1.c2 = t3.c2 where (case t2.c2 when 0 then 1 end) = 1);
select stddev(c2) from t1;
stddev(c2)
NULL
rollback;
update t1 set c2 = (select /*+ NO_REWRITE */t1.c1 from t1 left join t2 on t1.c1 = t2.c1 left join t3 on t1.c2 = t3.c2 where (case t2.c2 when 0 then 1 end) = 1);
select stddev(c2) from t1;
stddev(c2)
NULL
rollback;
delete from t1 where c2 = (select t1.c1 from t1 left join t2 on t1.c1 = t2.c1 left join t3 on t1.c2 = t3.c2 where (case t2.c2 when 0 then 1 end) = 1);
select stddev(c2) from t1;
stddev(c2)
2.1147629234082532
rollback;
delete from t1 where c2 = (select /*+ NO_REWRITE */t1.c1 from t1 left join t2 on t1.c1 = t2.c1 left join t3 on t1.c2 = t3.c2 where (case t2.c2 when 0 then 1 end) = 1);
select stddev(c2) from t1;
stddev(c2)
2.1147629234082532
rollback;
select * from t1, t1 as v join t2 on v.c1 = t2.c1;
c1	c2	c1	c2	c1	c2	c3
1	1	1	1	1	1	o
1	1	2	5	2	5	c
1	1	3	2	3	5	b
1	1	4	6	4	6	o
1	1	5	4	5	7	d
1	1	6	7	6	8	c
2	5	1	1	1	1	o
2	5	2	5	2	5	c
2	5	3	2	3	5	b
2	5	4	6	4	6	o
2	5	5	4	5	7	d
2	5	6	7	6	8	c
3	2	1	1	1	1	o
3	2	2	5	2	5	c
3	2	3	2	3	5	b
3	2	4	6	4	6	o
3	2	5	4	5	7	d
3	2	6	7	6	8	c
4	6	1	1	1	1	o
4	6	2	5	2	5	c
4	6	3	2	3	5	b
4	6	4	6	4	6	o
4	6	5	4	5	7	d
4	6	6	7	6	8	c
5	4	1	1	1	1	o
5	4	2	5	2	5	c
5	4	3	2	3	5	b
5	4	4	6	4	6	o
5	4	5	4	5	7	d
5	4	6	7	6	8	c
6	7	1	1	1	1	o
6	7	2	5	2	5	c
6	7	3	2	3	5	b
6	7	4	6	4	6	o
6	7	5	4	5	7	d
6	7	6	7	6	8	c
select /*+ NO_REWRITE */* from t1, t1 as v join t2 on v.c1 = t2.c1;
c1	c2	c1	c2	c1	c2	c3
1	1	1	1	1	1	o
1	1	2	5	2	5	c
1	1	3	2	3	5	b
1	1	4	6	4	6	o
1	1	5	4	5	7	d
1	1	6	7	6	8	c
2	5	1	1	1	1	o
2	5	2	5	2	5	c
2	5	3	2	3	5	b
2	5	4	6	4	6	o
2	5	5	4	5	7	d
2	5	6	7	6	8	c
3	2	1	1	1	1	o
3	2	2	5	2	5	c
3	2	3	2	3	5	b
3	2	4	6	4	6	o
3	2	5	4	5	7	d
3	2	6	7	6	8	c
4	6	1	1	1	1	o
4	6	2	5	2	5	c
4	6	3	2	3	5	b
4	6	4	6	4	6	o
4	6	5	4	5	7	d
4	6	6	7	6	8	c
5	4	1	1	1	1	o
5	4	2	5	2	5	c
5	4	3	2	3	5	b
5	4	4	6	4	6	o
5	4	5	4	5	7	d
5	4	6	7	6	8	c
6	7	1	1	1	1	o
6	7	2	5	2	5	c
6	7	3	2	3	5	b
6	7	4	6	4	6	o
6	7	5	4	5	7	d
6	7	6	7	6	8	c
insert into t6_temp (select * from t1, t1 as v join t2 on v.c1 = t2.c1);
rollback;
insert into t6_temp (select /*+ NO_REWRITE */* from t1, t1 as v join t2 on v.c1 = t2.c1);
rollback;
update t1 set c2 = (select t1.c1 from t1, t1 as v join t2 on v.c1 = t2.c1 limit 1);
select stddev(c2) from t1;
stddev(c2)
0
rollback;
update t1 set c2 = (select /*+ NO_REWRITE */t1.c1 from t1, t1 as v join t2 on v.c1 = t2.c1 limit 1);
select stddev(c2) from t1;
stddev(c2)
0
rollback;
delete from t1 where c2 = (select t1.c1 from t1, t1 as v join t2 on v.c1 = t2.c1 limit 1);
select stddev(c2) from t1;
stddev(c2)
1.7204650534085253
rollback;
delete from t1 where c2 = (select /*+ NO_REWRITE */t1.c1 from t1, t1 as v join t2 on v.c1 = t2.c1 limit 1);
select stddev(c2) from t1;
stddev(c2)
1.7204650534085253
rollback;
select * from t1 right join t2 on t1.c1 = t2.c1 right join t3 on t2.c2 = t3.c2;
c1	c2	c1	c2	c3	c1	c2	c3
2	5	2	5	c	2	5	4
2	5	2	5	c	4	5	1
2	5	2	5	c	5	5	5
2	5	2	5	c	6	5	c
3	2	3	5	b	2	5	4
3	2	3	5	b	4	5	1
3	2	3	5	b	5	5	5
3	2	3	5	b	6	5	c
4	6	4	6	o	3	6	1
NULL	NULL	NULL	NULL	NULL	1	2	3
select /*+ NO_REWRITE */* from t1 right join t2 on t1.c1 = t2.c1 right join t3 on t2.c2 = t3.c2;
c1	c2	c1	c2	c3	c1	c2	c3
2	5	2	5	c	2	5	4
2	5	2	5	c	4	5	1
2	5	2	5	c	5	5	5
2	5	2	5	c	6	5	c
3	2	3	5	b	2	5	4
3	2	3	5	b	4	5	1
3	2	3	5	b	5	5	5
3	2	3	5	b	6	5	c
4	6	4	6	o	3	6	1
NULL	NULL	NULL	NULL	NULL	1	2	3
insert into t5_temp (select * from t1 right join t2 on t1.c1 = t2.c1 right join t3 on t2.c2 = t3.c2);
rollback;
insert into t5_temp (select /*+ NO_REWRITE */* from t1 right join t2 on t1.c1 = t2.c1 right join t3 on t2.c2 = t3.c2);
rollback;
update t1 set c2 = (select t1.c1 from t1 right join t2 on t1.c1 = t2.c1 right join t3 on t2.c2 = t3.c2 limit 1);
select stddev(c2) from t1;
stddev(c2)
NULL
rollback;
update t1 set c2 = (select /*+ NO_REWRITE */t1.c1 from t1 right join t2 on t1.c1 = t2.c1 right join t3 on t2.c2 = t3.c2 limit 1);
select stddev(c2) from t1;
stddev(c2)
0
rollback;
delete from t1 where c2 = (select t1.c1 from t1 right join t2 on t1.c1 = t2.c1 right join t3 on t2.c2 = t3.c2 limit 1);
select stddev(c2) from t1;
stddev(c2)
2.1147629234082532
rollback;
delete from t1 where c2 = (select /*+ NO_REWRITE */t1.c1 from t1 right join t2 on t1.c1 = t2.c1 right join t3 on t2.c2 = t3.c2 limit 1);
select stddev(c2) from t1;
stddev(c2)
2.0591260281974
rollback;
select * from t1 right join t2 on t1.c1 = t2.c1, t2 as v, t3 where t3.c2 is not null;
c1	c2	c1	c2	c3	c1	c2	c3	c1	c2	c3
1	1	1	1	o	1	1	o	1	2	3
1	1	1	1	o	1	1	o	2	5	4
1	1	1	1	o	1	1	o	3	6	1
1	1	1	1	o	1	1	o	4	5	1
1	1	1	1	o	1	1	o	5	5	5
1	1	1	1	o	1	1	o	6	5	c
1	1	1	1	o	2	5	c	1	2	3
1	1	1	1	o	2	5	c	2	5	4
1	1	1	1	o	2	5	c	3	6	1
1	1	1	1	o	2	5	c	4	5	1
1	1	1	1	o	2	5	c	5	5	5
1	1	1	1	o	2	5	c	6	5	c
1	1	1	1	o	3	5	b	1	2	3
1	1	1	1	o	3	5	b	2	5	4
1	1	1	1	o	3	5	b	3	6	1
1	1	1	1	o	3	5	b	4	5	1
1	1	1	1	o	3	5	b	5	5	5
1	1	1	1	o	3	5	b	6	5	c
1	1	1	1	o	4	6	o	1	2	3
1	1	1	1	o	4	6	o	2	5	4
1	1	1	1	o	4	6	o	3	6	1
1	1	1	1	o	4	6	o	4	5	1
1	1	1	1	o	4	6	o	5	5	5
1	1	1	1	o	4	6	o	6	5	c
1	1	1	1	o	5	7	d	1	2	3
1	1	1	1	o	5	7	d	2	5	4
1	1	1	1	o	5	7	d	3	6	1
1	1	1	1	o	5	7	d	4	5	1
1	1	1	1	o	5	7	d	5	5	5
1	1	1	1	o	5	7	d	6	5	c
1	1	1	1	o	6	8	c	1	2	3
1	1	1	1	o	6	8	c	2	5	4
1	1	1	1	o	6	8	c	3	6	1
1	1	1	1	o	6	8	c	4	5	1
1	1	1	1	o	6	8	c	5	5	5
1	1	1	1	o	6	8	c	6	5	c
2	5	2	5	c	1	1	o	1	2	3
2	5	2	5	c	1	1	o	2	5	4
2	5	2	5	c	1	1	o	3	6	1
2	5	2	5	c	1	1	o	4	5	1
2	5	2	5	c	1	1	o	5	5	5
2	5	2	5	c	1	1	o	6	5	c
2	5	2	5	c	2	5	c	1	2	3
2	5	2	5	c	2	5	c	2	5	4
2	5	2	5	c	2	5	c	3	6	1
2	5	2	5	c	2	5	c	4	5	1
2	5	2	5	c	2	5	c	5	5	5
2	5	2	5	c	2	5	c	6	5	c
2	5	2	5	c	3	5	b	1	2	3
2	5	2	5	c	3	5	b	2	5	4
2	5	2	5	c	3	5	b	3	6	1
2	5	2	5	c	3	5	b	4	5	1
2	5	2	5	c	3	5	b	5	5	5
2	5	2	5	c	3	5	b	6	5	c
2	5	2	5	c	4	6	o	1	2	3
2	5	2	5	c	4	6	o	2	5	4
2	5	2	5	c	4	6	o	3	6	1
2	5	2	5	c	4	6	o	4	5	1
2	5	2	5	c	4	6	o	5	5	5
2	5	2	5	c	4	6	o	6	5	c
2	5	2	5	c	5	7	d	1	2	3
2	5	2	5	c	5	7	d	2	5	4
2	5	2	5	c	5	7	d	3	6	1
2	5	2	5	c	5	7	d	4	5	1
2	5	2	5	c	5	7	d	5	5	5
2	5	2	5	c	5	7	d	6	5	c
2	5	2	5	c	6	8	c	1	2	3
2	5	2	5	c	6	8	c	2	5	4
2	5	2	5	c	6	8	c	3	6	1
2	5	2	5	c	6	8	c	4	5	1
2	5	2	5	c	6	8	c	5	5	5
2	5	2	5	c	6	8	c	6	5	c
3	2	3	5	b	1	1	o	1	2	3
3	2	3	5	b	1	1	o	2	5	4
3	2	3	5	b	1	1	o	3	6	1
3	2	3	5	b	1	1	o	4	5	1
3	2	3	5	b	1	1	o	5	5	5
3	2	3	5	b	1	1	o	6	5	c
3	2	3	5	b	2	5	c	1	2	3
3	2	3	5	b	2	5	c	2	5	4
3	2	3	5	b	2	5	c	3	6	1
3	2	3	5	b	2	5	c	4	5	1
3	2	3	5	b	2	5	c	5	5	5
3	2	3	5	b	2	5	c	6	5	c
3	2	3	5	b	3	5	b	1	2	3
3	2	3	5	b	3	5	b	2	5	4
3	2	3	5	b	3	5	b	3	6	1
3	2	3	5	b	3	5	b	4	5	1
3	2	3	5	b	3	5	b	5	5	5
3	2	3	5	b	3	5	b	6	5	c
3	2	3	5	b	4	6	o	1	2	3
3	2	3	5	b	4	6	o	2	5	4
3	2	3	5	b	4	6	o	3	6	1
3	2	3	5	b	4	6	o	4	5	1
3	2	3	5	b	4	6	o	5	5	5
3	2	3	5	b	4	6	o	6	5	c
3	2	3	5	b	5	7	d	1	2	3
3	2	3	5	b	5	7	d	2	5	4
3	2	3	5	b	5	7	d	3	6	1
3	2	3	5	b	5	7	d	4	5	1
3	2	3	5	b	5	7	d	5	5	5
3	2	3	5	b	5	7	d	6	5	c
3	2	3	5	b	6	8	c	1	2	3
3	2	3	5	b	6	8	c	2	5	4
3	2	3	5	b	6	8	c	3	6	1
3	2	3	5	b	6	8	c	4	5	1
3	2	3	5	b	6	8	c	5	5	5
3	2	3	5	b	6	8	c	6	5	c
4	6	4	6	o	1	1	o	1	2	3
4	6	4	6	o	1	1	o	2	5	4
4	6	4	6	o	1	1	o	3	6	1
4	6	4	6	o	1	1	o	4	5	1
4	6	4	6	o	1	1	o	5	5	5
4	6	4	6	o	1	1	o	6	5	c
4	6	4	6	o	2	5	c	1	2	3
4	6	4	6	o	2	5	c	2	5	4
4	6	4	6	o	2	5	c	3	6	1
4	6	4	6	o	2	5	c	4	5	1
4	6	4	6	o	2	5	c	5	5	5
4	6	4	6	o	2	5	c	6	5	c
4	6	4	6	o	3	5	b	1	2	3
4	6	4	6	o	3	5	b	2	5	4
4	6	4	6	o	3	5	b	3	6	1
4	6	4	6	o	3	5	b	4	5	1
4	6	4	6	o	3	5	b	5	5	5
4	6	4	6	o	3	5	b	6	5	c
4	6	4	6	o	4	6	o	1	2	3
4	6	4	6	o	4	6	o	2	5	4
4	6	4	6	o	4	6	o	3	6	1
4	6	4	6	o	4	6	o	4	5	1
4	6	4	6	o	4	6	o	5	5	5
4	6	4	6	o	4	6	o	6	5	c
4	6	4	6	o	5	7	d	1	2	3
4	6	4	6	o	5	7	d	2	5	4
4	6	4	6	o	5	7	d	3	6	1
4	6	4	6	o	5	7	d	4	5	1
4	6	4	6	o	5	7	d	5	5	5
4	6	4	6	o	5	7	d	6	5	c
4	6	4	6	o	6	8	c	1	2	3
4	6	4	6	o	6	8	c	2	5	4
4	6	4	6	o	6	8	c	3	6	1
4	6	4	6	o	6	8	c	4	5	1
4	6	4	6	o	6	8	c	5	5	5
4	6	4	6	o	6	8	c	6	5	c
5	4	5	7	d	1	1	o	1	2	3
5	4	5	7	d	1	1	o	2	5	4
5	4	5	7	d	1	1	o	3	6	1
5	4	5	7	d	1	1	o	4	5	1
5	4	5	7	d	1	1	o	5	5	5
5	4	5	7	d	1	1	o	6	5	c
5	4	5	7	d	2	5	c	1	2	3
5	4	5	7	d	2	5	c	2	5	4
5	4	5	7	d	2	5	c	3	6	1
5	4	5	7	d	2	5	c	4	5	1
5	4	5	7	d	2	5	c	5	5	5
5	4	5	7	d	2	5	c	6	5	c
5	4	5	7	d	3	5	b	1	2	3
5	4	5	7	d	3	5	b	2	5	4
5	4	5	7	d	3	5	b	3	6	1
5	4	5	7	d	3	5	b	4	5	1
5	4	5	7	d	3	5	b	5	5	5
5	4	5	7	d	3	5	b	6	5	c
5	4	5	7	d	4	6	o	1	2	3
5	4	5	7	d	4	6	o	2	5	4
5	4	5	7	d	4	6	o	3	6	1
5	4	5	7	d	4	6	o	4	5	1
5	4	5	7	d	4	6	o	5	5	5
5	4	5	7	d	4	6	o	6	5	c
5	4	5	7	d	5	7	d	1	2	3
5	4	5	7	d	5	7	d	2	5	4
5	4	5	7	d	5	7	d	3	6	1
5	4	5	7	d	5	7	d	4	5	1
5	4	5	7	d	5	7	d	5	5	5
5	4	5	7	d	5	7	d	6	5	c
5	4	5	7	d	6	8	c	1	2	3
5	4	5	7	d	6	8	c	2	5	4
5	4	5	7	d	6	8	c	3	6	1
5	4	5	7	d	6	8	c	4	5	1
5	4	5	7	d	6	8	c	5	5	5
5	4	5	7	d	6	8	c	6	5	c
6	7	6	8	c	1	1	o	1	2	3
6	7	6	8	c	1	1	o	2	5	4
6	7	6	8	c	1	1	o	3	6	1
6	7	6	8	c	1	1	o	4	5	1
6	7	6	8	c	1	1	o	5	5	5
6	7	6	8	c	1	1	o	6	5	c
6	7	6	8	c	2	5	c	1	2	3
6	7	6	8	c	2	5	c	2	5	4
6	7	6	8	c	2	5	c	3	6	1
6	7	6	8	c	2	5	c	4	5	1
6	7	6	8	c	2	5	c	5	5	5
6	7	6	8	c	2	5	c	6	5	c
6	7	6	8	c	3	5	b	1	2	3
6	7	6	8	c	3	5	b	2	5	4
6	7	6	8	c	3	5	b	3	6	1
6	7	6	8	c	3	5	b	4	5	1
6	7	6	8	c	3	5	b	5	5	5
6	7	6	8	c	3	5	b	6	5	c
6	7	6	8	c	4	6	o	1	2	3
6	7	6	8	c	4	6	o	2	5	4
6	7	6	8	c	4	6	o	3	6	1
6	7	6	8	c	4	6	o	4	5	1
6	7	6	8	c	4	6	o	5	5	5
6	7	6	8	c	4	6	o	6	5	c
6	7	6	8	c	5	7	d	1	2	3
6	7	6	8	c	5	7	d	2	5	4
6	7	6	8	c	5	7	d	3	6	1
6	7	6	8	c	5	7	d	4	5	1
6	7	6	8	c	5	7	d	5	5	5
6	7	6	8	c	5	7	d	6	5	c
6	7	6	8	c	6	8	c	1	2	3
6	7	6	8	c	6	8	c	2	5	4
6	7	6	8	c	6	8	c	3	6	1
6	7	6	8	c	6	8	c	4	5	1
6	7	6	8	c	6	8	c	5	5	5
6	7	6	8	c	6	8	c	6	5	c
select /*+ NO_REWRITE */* from t1 right join t2 on t1.c1 = t2.c1, t2 as v, t3 where t3.c2 is not null;
c1	c2	c1	c2	c3	c1	c2	c3	c1	c2	c3
1	1	1	1	o	1	1	o	1	2	3
1	1	1	1	o	1	1	o	2	5	4
1	1	1	1	o	1	1	o	3	6	1
1	1	1	1	o	1	1	o	4	5	1
1	1	1	1	o	1	1	o	5	5	5
1	1	1	1	o	1	1	o	6	5	c
1	1	1	1	o	2	5	c	1	2	3
1	1	1	1	o	2	5	c	2	5	4
1	1	1	1	o	2	5	c	3	6	1
1	1	1	1	o	2	5	c	4	5	1
1	1	1	1	o	2	5	c	5	5	5
1	1	1	1	o	2	5	c	6	5	c
1	1	1	1	o	3	5	b	1	2	3
1	1	1	1	o	3	5	b	2	5	4
1	1	1	1	o	3	5	b	3	6	1
1	1	1	1	o	3	5	b	4	5	1
1	1	1	1	o	3	5	b	5	5	5
1	1	1	1	o	3	5	b	6	5	c
1	1	1	1	o	4	6	o	1	2	3
1	1	1	1	o	4	6	o	2	5	4
1	1	1	1	o	4	6	o	3	6	1
1	1	1	1	o	4	6	o	4	5	1
1	1	1	1	o	4	6	o	5	5	5
1	1	1	1	o	4	6	o	6	5	c
1	1	1	1	o	5	7	d	1	2	3
1	1	1	1	o	5	7	d	2	5	4
1	1	1	1	o	5	7	d	3	6	1
1	1	1	1	o	5	7	d	4	5	1
1	1	1	1	o	5	7	d	5	5	5
1	1	1	1	o	5	7	d	6	5	c
1	1	1	1	o	6	8	c	1	2	3
1	1	1	1	o	6	8	c	2	5	4
1	1	1	1	o	6	8	c	3	6	1
1	1	1	1	o	6	8	c	4	5	1
1	1	1	1	o	6	8	c	5	5	5
1	1	1	1	o	6	8	c	6	5	c
2	5	2	5	c	1	1	o	1	2	3
2	5	2	5	c	1	1	o	2	5	4
2	5	2	5	c	1	1	o	3	6	1
2	5	2	5	c	1	1	o	4	5	1
2	5	2	5	c	1	1	o	5	5	5
2	5	2	5	c	1	1	o	6	5	c
2	5	2	5	c	2	5	c	1	2	3
2	5	2	5	c	2	5	c	2	5	4
2	5	2	5	c	2	5	c	3	6	1
2	5	2	5	c	2	5	c	4	5	1
2	5	2	5	c	2	5	c	5	5	5
2	5	2	5	c	2	5	c	6	5	c
2	5	2	5	c	3	5	b	1	2	3
2	5	2	5	c	3	5	b	2	5	4
2	5	2	5	c	3	5	b	3	6	1
2	5	2	5	c	3	5	b	4	5	1
2	5	2	5	c	3	5	b	5	5	5
2	5	2	5	c	3	5	b	6	5	c
2	5	2	5	c	4	6	o	1	2	3
2	5	2	5	c	4	6	o	2	5	4
2	5	2	5	c	4	6	o	3	6	1
2	5	2	5	c	4	6	o	4	5	1
2	5	2	5	c	4	6	o	5	5	5
2	5	2	5	c	4	6	o	6	5	c
2	5	2	5	c	5	7	d	1	2	3
2	5	2	5	c	5	7	d	2	5	4
2	5	2	5	c	5	7	d	3	6	1
2	5	2	5	c	5	7	d	4	5	1
2	5	2	5	c	5	7	d	5	5	5
2	5	2	5	c	5	7	d	6	5	c
2	5	2	5	c	6	8	c	1	2	3
2	5	2	5	c	6	8	c	2	5	4
2	5	2	5	c	6	8	c	3	6	1
2	5	2	5	c	6	8	c	4	5	1
2	5	2	5	c	6	8	c	5	5	5
2	5	2	5	c	6	8	c	6	5	c
3	2	3	5	b	1	1	o	1	2	3
3	2	3	5	b	1	1	o	2	5	4
3	2	3	5	b	1	1	o	3	6	1
3	2	3	5	b	1	1	o	4	5	1
3	2	3	5	b	1	1	o	5	5	5
3	2	3	5	b	1	1	o	6	5	c
3	2	3	5	b	2	5	c	1	2	3
3	2	3	5	b	2	5	c	2	5	4
3	2	3	5	b	2	5	c	3	6	1
3	2	3	5	b	2	5	c	4	5	1
3	2	3	5	b	2	5	c	5	5	5
3	2	3	5	b	2	5	c	6	5	c
3	2	3	5	b	3	5	b	1	2	3
3	2	3	5	b	3	5	b	2	5	4
3	2	3	5	b	3	5	b	3	6	1
3	2	3	5	b	3	5	b	4	5	1
3	2	3	5	b	3	5	b	5	5	5
3	2	3	5	b	3	5	b	6	5	c
3	2	3	5	b	4	6	o	1	2	3
3	2	3	5	b	4	6	o	2	5	4
3	2	3	5	b	4	6	o	3	6	1
3	2	3	5	b	4	6	o	4	5	1
3	2	3	5	b	4	6	o	5	5	5
3	2	3	5	b	4	6	o	6	5	c
3	2	3	5	b	5	7	d	1	2	3
3	2	3	5	b	5	7	d	2	5	4
3	2	3	5	b	5	7	d	3	6	1
3	2	3	5	b	5	7	d	4	5	1
3	2	3	5	b	5	7	d	5	5	5
3	2	3	5	b	5	7	d	6	5	c
3	2	3	5	b	6	8	c	1	2	3
3	2	3	5	b	6	8	c	2	5	4
3	2	3	5	b	6	8	c	3	6	1
3	2	3	5	b	6	8	c	4	5	1
3	2	3	5	b	6	8	c	5	5	5
3	2	3	5	b	6	8	c	6	5	c
4	6	4	6	o	1	1	o	1	2	3
4	6	4	6	o	1	1	o	2	5	4
4	6	4	6	o	1	1	o	3	6	1
4	6	4	6	o	1	1	o	4	5	1
4	6	4	6	o	1	1	o	5	5	5
4	6	4	6	o	1	1	o	6	5	c
4	6	4	6	o	2	5	c	1	2	3
4	6	4	6	o	2	5	c	2	5	4
4	6	4	6	o	2	5	c	3	6	1
4	6	4	6	o	2	5	c	4	5	1
4	6	4	6	o	2	5	c	5	5	5
4	6	4	6	o	2	5	c	6	5	c
4	6	4	6	o	3	5	b	1	2	3
4	6	4	6	o	3	5	b	2	5	4
4	6	4	6	o	3	5	b	3	6	1
4	6	4	6	o	3	5	b	4	5	1
4	6	4	6	o	3	5	b	5	5	5
4	6	4	6	o	3	5	b	6	5	c
4	6	4	6	o	4	6	o	1	2	3
4	6	4	6	o	4	6	o	2	5	4
4	6	4	6	o	4	6	o	3	6	1
4	6	4	6	o	4	6	o	4	5	1
4	6	4	6	o	4	6	o	5	5	5
4	6	4	6	o	4	6	o	6	5	c
4	6	4	6	o	5	7	d	1	2	3
4	6	4	6	o	5	7	d	2	5	4
4	6	4	6	o	5	7	d	3	6	1
4	6	4	6	o	5	7	d	4	5	1
4	6	4	6	o	5	7	d	5	5	5
4	6	4	6	o	5	7	d	6	5	c
4	6	4	6	o	6	8	c	1	2	3
4	6	4	6	o	6	8	c	2	5	4
4	6	4	6	o	6	8	c	3	6	1
4	6	4	6	o	6	8	c	4	5	1
4	6	4	6	o	6	8	c	5	5	5
4	6	4	6	o	6	8	c	6	5	c
5	4	5	7	d	1	1	o	1	2	3
5	4	5	7	d	1	1	o	2	5	4
5	4	5	7	d	1	1	o	3	6	1
5	4	5	7	d	1	1	o	4	5	1
5	4	5	7	d	1	1	o	5	5	5
5	4	5	7	d	1	1	o	6	5	c
5	4	5	7	d	2	5	c	1	2	3
5	4	5	7	d	2	5	c	2	5	4
5	4	5	7	d	2	5	c	3	6	1
5	4	5	7	d	2	5	c	4	5	1
5	4	5	7	d	2	5	c	5	5	5
5	4	5	7	d	2	5	c	6	5	c
5	4	5	7	d	3	5	b	1	2	3
5	4	5	7	d	3	5	b	2	5	4
5	4	5	7	d	3	5	b	3	6	1
5	4	5	7	d	3	5	b	4	5	1
5	4	5	7	d	3	5	b	5	5	5
5	4	5	7	d	3	5	b	6	5	c
5	4	5	7	d	4	6	o	1	2	3
5	4	5	7	d	4	6	o	2	5	4
5	4	5	7	d	4	6	o	3	6	1
5	4	5	7	d	4	6	o	4	5	1
5	4	5	7	d	4	6	o	5	5	5
5	4	5	7	d	4	6	o	6	5	c
5	4	5	7	d	5	7	d	1	2	3
5	4	5	7	d	5	7	d	2	5	4
5	4	5	7	d	5	7	d	3	6	1
5	4	5	7	d	5	7	d	4	5	1
5	4	5	7	d	5	7	d	5	5	5
5	4	5	7	d	5	7	d	6	5	c
5	4	5	7	d	6	8	c	1	2	3
5	4	5	7	d	6	8	c	2	5	4
5	4	5	7	d	6	8	c	3	6	1
5	4	5	7	d	6	8	c	4	5	1
5	4	5	7	d	6	8	c	5	5	5
5	4	5	7	d	6	8	c	6	5	c
6	7	6	8	c	1	1	o	1	2	3
6	7	6	8	c	1	1	o	2	5	4
6	7	6	8	c	1	1	o	3	6	1
6	7	6	8	c	1	1	o	4	5	1
6	7	6	8	c	1	1	o	5	5	5
6	7	6	8	c	1	1	o	6	5	c
6	7	6	8	c	2	5	c	1	2	3
6	7	6	8	c	2	5	c	2	5	4
6	7	6	8	c	2	5	c	3	6	1
6	7	6	8	c	2	5	c	4	5	1
6	7	6	8	c	2	5	c	5	5	5
6	7	6	8	c	2	5	c	6	5	c
6	7	6	8	c	3	5	b	1	2	3
6	7	6	8	c	3	5	b	2	5	4
6	7	6	8	c	3	5	b	3	6	1
6	7	6	8	c	3	5	b	4	5	1
6	7	6	8	c	3	5	b	5	5	5
6	7	6	8	c	3	5	b	6	5	c
6	7	6	8	c	4	6	o	1	2	3
6	7	6	8	c	4	6	o	2	5	4
6	7	6	8	c	4	6	o	3	6	1
6	7	6	8	c	4	6	o	4	5	1
6	7	6	8	c	4	6	o	5	5	5
6	7	6	8	c	4	6	o	6	5	c
6	7	6	8	c	5	7	d	1	2	3
6	7	6	8	c	5	7	d	2	5	4
6	7	6	8	c	5	7	d	3	6	1
6	7	6	8	c	5	7	d	4	5	1
6	7	6	8	c	5	7	d	5	5	5
6	7	6	8	c	5	7	d	6	5	c
6	7	6	8	c	6	8	c	1	2	3
6	7	6	8	c	6	8	c	2	5	4
6	7	6	8	c	6	8	c	3	6	1
6	7	6	8	c	6	8	c	4	5	1
6	7	6	8	c	6	8	c	5	5	5
6	7	6	8	c	6	8	c	6	5	c
insert into t7_temp (select * from t1 right join t2 on t1.c1 = t2.c1, t2 as v, t3 where t3.c2 is not null);
rollback;
insert into t7_temp (select /*+ NO_REWRITE */* from t1 right join t2 on t1.c1 = t2.c1, t2 as v, t3 where t3.c2 is not null);
rollback;
update t1 set c2 = (select t1.c1 from t1 right join t2 on t1.c1 = t2.c1, t2 as v, t3 where t3.c2 is not null limit 1);
select stddev(c2) from t1;
stddev(c2)
0
rollback;
update t1 set c2 = (select /*+ NO_REWRITE */t1.c1 from t1 right join t2 on t1.c1 = t2.c1, t2 as v, t3 where t3.c2 is not null limit 1);
select stddev(c2) from t1;
stddev(c2)
0
rollback;
delete from t1 where c2 = (select t1.c1 from t1 right join t2 on t1.c1 = t2.c1, t2 as v, t3 where t3.c2 is not null limit 1);
select stddev(c2) from t1;
stddev(c2)
1.7204650534085253
rollback;
delete from t1 where c2 = (select /*+ NO_REWRITE */t1.c1 from t1 right join t2 on t1.c1 = t2.c1, t2 as v, t3 where t3.c2 is not null limit 1);
select stddev(c2) from t1;
stddev(c2)
1.7204650534085253
rollback;
select * from t1 as table1 left join t1 as table2 on table1.c2 = table2.c1 where table1.c1 < table2.c1 or table1.c1 = table2.c2;
c1	c2	c1	c2
1	1	1	1
2	5	5	4
4	6	6	7
select /*+ NO_REWRITE */* from t1 as table1 left join t1 as table2 on table1.c2 = table2.c1 where table1.c1 < table2.c1 or table1.c1 = table2.c2;
c1	c2	c1	c2
1	1	1	1
2	5	5	4
4	6	6	7
insert into t8_temp (select * from t1 as table1 left join t1 as table2 on table1.c2 = table2.c1 where table1.c1 < table2.c1 or table1.c1 = table2.c2);
rollback;
insert into t8_temp (select /*+ NO_REWRITE */* from t1 as table1 left join t1 as table2 on table1.c2 = table2.c1 where table1.c1 < table2.c1 or table1.c1 = table2.c2);
rollback;
update t1 set c2 = (select table1.c1 from t1 as table1 left join t1 as table2 on table1.c2 = table2.c1 where table1.c1 < table2.c1 or table1.c1 = table2.c2 limit 1);
select stddev(c2) from t1;
stddev(c2)
0
rollback;
update t1 set c2 = (select /*+ NO_REWRITE */table1.c1 from t1 as table1 left join t1 as table2 on table1.c2 = table2.c1 where table1.c1 < table2.c1 or table1.c1 = table2.c2 limit 1);
select stddev(c2) from t1;
stddev(c2)
0
rollback;
delete from t1 where c2 = (select table1.c1 from t1 as table1 left join t1 as table2 on table1.c2 = table2.c1 where table1.c1 < table2.c1 or table1.c1 = table2.c2 limit 1);
select stddev(c2) from t1;
stddev(c2)
1.7204650534085253
rollback;
delete from t1 where c2 = (select /*+ NO_REWRITE */table1.c1 from t1 as table1 left join t1 as table2 on table1.c2 = table2.c1 where table1.c1 < table2.c1 or table1.c1 = table2.c2 limit 1);
select stddev(c2) from t1;
stddev(c2)
1.7204650534085253
rollback;
select * from t1 as table1 left join t1 as table2 on table1.c2 = table2.c1 where table1.c1 < table2.c1 and table1.c1 = table2.c2;
c1	c2	c1	c2
select /*+ NO_REWRITE */* from t1 as table1 left join t1 as table2 on table1.c2 = table2.c1 where table1.c1 < table2.c1 and table1.c1 = table2.c2;
c1	c2	c1	c2
insert into t8_temp (select * from t1 as table1 left join t1 as table2 on table1.c2 = table2.c1 where table1.c1 < table2.c1 and table1.c1 = table2.c2);
rollback;
insert into t8_temp (select /*+ NO_REWRITE */* from t1 as table1 left join t1 as table2 on table1.c2 = table2.c1 where table1.c1 < table2.c1 and table1.c1 = table2.c2);
rollback;
update t1 set c2 = (select table1.c1 from t1 as table1 left join t1 as table2 on table1.c2 = table2.c1 where table1.c1 < table2.c1 and table1.c1 = table2.c2);
select stddev(c2) from t1;
stddev(c2)
NULL
rollback;
update t1 set c2 = (select /*+ NO_REWRITE */table1.c1 from t1 as table1 left join t1 as table2 on table1.c2 = table2.c1 where table1.c1 < table2.c1 and table1.c1 = table2.c2);
select stddev(c2) from t1;
stddev(c2)
NULL
rollback;
delete from t1 where c2 = (select table1.c1 from t1 as table1 left join t1 as table2 on table1.c2 = table2.c1 where table1.c1 < table2.c1 and table1.c1 = table2.c2);
select stddev(c2) from t1;
stddev(c2)
2.1147629234082532
rollback;
delete from t1 where c2 = (select /*+ NO_REWRITE */table1.c1 from t1 as table1 left join t1 as table2 on table1.c2 = table2.c1 where table1.c1 < table2.c1 and table1.c1 = table2.c2);
select stddev(c2) from t1;
stddev(c2)
2.1147629234082532
rollback;
select * from t1 join (select * from t2) as v on t1.c1 = v.c1 left join t3 on t1.c1 = t3.c1 where t3.c2 is not null;
c1	c2	c1	c2	c3	c1	c2	c3
1	1	1	1	o	1	2	3
2	5	2	5	c	2	5	4
3	2	3	5	b	3	6	1
4	6	4	6	o	4	5	1
5	4	5	7	d	5	5	5
6	7	6	8	c	6	5	c
select /*+ NO_REWRITE */* from t1 join (select /*+ NO_REWRITE */* from t2) as v on t1.c1 = v.c1 left join t3 on t1.c1 = t3.c1 where t3.c2 is not null;
c1	c2	c1	c2	c3	c1	c2	c3
1	1	1	1	o	1	2	3
2	5	2	5	c	2	5	4
3	2	3	5	b	3	6	1
4	6	4	6	o	4	5	1
5	4	5	7	d	5	5	5
6	7	6	8	c	6	5	c
insert into t5_temp (select * from t1 join (select * from t2) as v on t1.c1 = v.c1 left join t3 on t1.c1 = t3.c1 where t3.c2 is not null);
rollback;
insert into t5_temp (select /*+ NO_REWRITE */* from t1 join (select /*+ NO_REWRITE */* from t2) as v on t1.c1 = v.c1 left join t3 on t1.c1 = t3.c1 where t3.c2 is not null);
rollback;
update t1 set c2 = (select t1.c1 from t1 join (select * from t2) as v on t1.c1 = v.c1 left join t3 on t1.c1 = t3.c1 where t3.c2 is not null limit 1);
select stddev(c2) from t1;
stddev(c2)
0
rollback;
update t1 set c2 = (select /*+ NO_REWRITE */t1.c1 from t1 join (select /*+ NO_REWRITE */* from t2) as v on t1.c1 = v.c1 left join t3 on t1.c1 = t3.c1 where t3.c2 is not null limit 1);
select stddev(c2) from t1;
stddev(c2)
0
rollback;
delete from t1 where c2 = (select t1.c1 from t1 join (select * from t2) as v on t1.c1 = v.c1 left join t3 on t1.c1 = t3.c1 where t3.c2 is not null limit 1);
select stddev(c2) from t1;
stddev(c2)
1.7204650534085253
rollback;
delete from t1 where c2 = (select /*+ NO_REWRITE */t1.c1 from t1 join (select /*+ NO_REWRITE */* from t2) as v on t1.c1 = v.c1 left join t3 on t1.c1 = t3.c1 where t3.c2 is not null limit 1);
select stddev(c2) from t1;
stddev(c2)
1.7204650534085253
rollback;
select * from t1, t2, t3 where t1.c1 = t2.c1 and t1.c1 = t3.c1 and t3.c2 is not null;
c1	c2	c1	c2	c3	c1	c2	c3
1	1	1	1	o	1	2	3
2	5	2	5	c	2	5	4
3	2	3	5	b	3	6	1
4	6	4	6	o	4	5	1
5	4	5	7	d	5	5	5
6	7	6	8	c	6	5	c
select /*+ NO_REWRITE */* from t1, t2, t3 where t1.c1 = t2.c1 and t1.c1 = t3.c1 and t3.c2 is not null;
c1	c2	c1	c2	c3	c1	c2	c3
1	1	1	1	o	1	2	3
2	5	2	5	c	2	5	4
3	2	3	5	b	3	6	1
4	6	4	6	o	4	5	1
5	4	5	7	d	5	5	5
6	7	6	8	c	6	5	c
insert into t5_temp (select * from t1, t2, t3 where t1.c1 = t2.c1 and t1.c1 = t3.c1 and t3.c2 is not null);
rollback;
insert into t5_temp (select /*+ NO_REWRITE */* from t1, t2, t3 where t1.c1 = t2.c1 and t1.c1 = t3.c1 and t3.c2 is not null);
rollback;
update t1 set c2 = (select t1.c1 from t1, t2, t3 where t1.c1 = t2.c1 and t1.c1 = t3.c1 and t3.c2 is not null limit 1);
select stddev(c2) from t1;
stddev(c2)
0
rollback;
update t1 set c2 = (select /*+ NO_REWRITE */t1.c1 from t1, t2, t3 where t1.c1 = t2.c1 and t1.c1 = t3.c1 and t3.c2 is not null limit 1);
select stddev(c2) from t1;
stddev(c2)
0
rollback;
delete from t1 where c2 = (select t1.c1 from t1, t2, t3 where t1.c1 = t2.c1 and t1.c1 = t3.c1 and t3.c2 is not null limit 1);
select stddev(c2) from t1;
stddev(c2)
1.7204650534085253
rollback;
delete from t1 where c2 = (select /*+ NO_REWRITE */t1.c1 from t1, t2, t3 where t1.c1 = t2.c1 and t1.c1 = t3.c1 and t3.c2 is not null limit 1);
select stddev(c2) from t1;
stddev(c2)
1.7204650534085253
rollback;
select * from t1 left join t2 on t1.c1 = t2.c1 left join t3 on t1.c2 = t3.c2 where t3.c1 is not null and t2.c3 is not null;
c1	c2	c1	c2	c3	c1	c2	c3
2	5	2	5	c	2	5	4
2	5	2	5	c	4	5	1
2	5	2	5	c	5	5	5
2	5	2	5	c	6	5	c
3	2	3	5	b	1	2	3
4	6	4	6	o	3	6	1
select /*+ NO_REWRITE */* from t1 left join t2 on t1.c1 = t2.c1 left join t3 on t1.c2 = t3.c2 where t3.c1 is not null and t2.c3 is not null;
c1	c2	c1	c2	c3	c1	c2	c3
2	5	2	5	c	2	5	4
2	5	2	5	c	4	5	1
2	5	2	5	c	5	5	5
2	5	2	5	c	6	5	c
3	2	3	5	b	1	2	3
4	6	4	6	o	3	6	1
insert into t5_temp (select * from t1 left join t2 on t1.c1 = t2.c1 left join t3 on t1.c2 = t3.c2 where t3.c1 is not null and t2.c3 is not null);
rollback;
insert into t5_temp (select /*+ NO_REWRITE */* from t1 left join t2 on t1.c1 = t2.c1 left join t3 on t1.c2 = t3.c2 where t3.c1 is not null and t2.c3 is not null);
rollback;
update t1 set c2 = (select t1.c1 from t1 left join t2 on t1.c1 = t2.c1 left join t3 on t1.c2 = t3.c2 where t3.c1 is not null and t2.c3 is not null limit 1);
select stddev(c2) from t1;
stddev(c2)
0
rollback;
update t1 set c2 = (select /*+ NO_REWRITE */t1.c1 from t1 left join t2 on t1.c1 = t2.c1 left join t3 on t1.c2 = t3.c2 where t3.c1 is not null and t2.c3 is not null limit 1);
select stddev(c2) from t1;
stddev(c2)
0
rollback;
delete from t1 where c2 = (select t1.c1 from t1 left join t2 on t1.c1 = t2.c1 left join t3 on t1.c2 = t3.c2 where t3.c1 is not null and t2.c3 is not null limit 1);
select stddev(c2) from t1;
stddev(c2)
2.0591260281974
rollback;
delete from t1 where c2 = (select /*+ NO_REWRITE */t1.c1 from t1 left join t2 on t1.c1 = t2.c1 left join t3 on t1.c2 = t3.c2 where t3.c1 is not null and t2.c3 is not null limit 1);
select stddev(c2) from t1;
stddev(c2)
2.1147629234082532
rollback;
select * from t1, t2, t3 where t3.c1 is not null and t1.c2 = t3.c2 and t2.c3 is not null;
c1	c2	c1	c2	c3	c1	c2	c3
2	5	1	1	o	2	5	4
2	5	1	1	o	4	5	1
2	5	1	1	o	5	5	5
2	5	1	1	o	6	5	c
2	5	2	5	c	2	5	4
2	5	2	5	c	4	5	1
2	5	2	5	c	5	5	5
2	5	2	5	c	6	5	c
2	5	3	5	b	2	5	4
2	5	3	5	b	4	5	1
2	5	3	5	b	5	5	5
2	5	3	5	b	6	5	c
2	5	4	6	o	2	5	4
2	5	4	6	o	4	5	1
2	5	4	6	o	5	5	5
2	5	4	6	o	6	5	c
2	5	5	7	d	2	5	4
2	5	5	7	d	4	5	1
2	5	5	7	d	5	5	5
2	5	5	7	d	6	5	c
2	5	6	8	c	2	5	4
2	5	6	8	c	4	5	1
2	5	6	8	c	5	5	5
2	5	6	8	c	6	5	c
3	2	1	1	o	1	2	3
3	2	2	5	c	1	2	3
3	2	3	5	b	1	2	3
3	2	4	6	o	1	2	3
3	2	5	7	d	1	2	3
3	2	6	8	c	1	2	3
4	6	1	1	o	3	6	1
4	6	2	5	c	3	6	1
4	6	3	5	b	3	6	1
4	6	4	6	o	3	6	1
4	6	5	7	d	3	6	1
4	6	6	8	c	3	6	1
select /*+ NO_REWRITE */* from t1, t2, t3 where t3.c1 is not null and t1.c2 = t3.c2 and t2.c3 is not null;
c1	c2	c1	c2	c3	c1	c2	c3
2	5	1	1	o	2	5	4
2	5	1	1	o	4	5	1
2	5	1	1	o	5	5	5
2	5	1	1	o	6	5	c
2	5	2	5	c	2	5	4
2	5	2	5	c	4	5	1
2	5	2	5	c	5	5	5
2	5	2	5	c	6	5	c
2	5	3	5	b	2	5	4
2	5	3	5	b	4	5	1
2	5	3	5	b	5	5	5
2	5	3	5	b	6	5	c
2	5	4	6	o	2	5	4
2	5	4	6	o	4	5	1
2	5	4	6	o	5	5	5
2	5	4	6	o	6	5	c
2	5	5	7	d	2	5	4
2	5	5	7	d	4	5	1
2	5	5	7	d	5	5	5
2	5	5	7	d	6	5	c
2	5	6	8	c	2	5	4
2	5	6	8	c	4	5	1
2	5	6	8	c	5	5	5
2	5	6	8	c	6	5	c
3	2	1	1	o	1	2	3
3	2	2	5	c	1	2	3
3	2	3	5	b	1	2	3
3	2	4	6	o	1	2	3
3	2	5	7	d	1	2	3
3	2	6	8	c	1	2	3
4	6	1	1	o	3	6	1
4	6	2	5	c	3	6	1
4	6	3	5	b	3	6	1
4	6	4	6	o	3	6	1
4	6	5	7	d	3	6	1
4	6	6	8	c	3	6	1
insert into t5_temp (select * from t1, t2, t3 where t3.c1 is not null and t1.c2 = t3.c2 and t2.c3 is not null);
rollback;
insert into t5_temp (select /*+ NO_REWRITE */* from t1, t2, t3 where t3.c1 is not null and t1.c2 = t3.c2 and t2.c3 is not null);
rollback;
update t1 set c2 = (select t2.c1 from t1, t2, t3 where t3.c1 is not null and t1.c2 = t3.c2 and t2.c3 is not null limit 1);
select stddev(c2) from t1;
stddev(c2)
0
rollback;
update t1 set c2 = (select /*+ NO_REWRITE */t2.c1 from t1, t2, t3 where t3.c1 is not null and t1.c2 = t3.c2 and t2.c3 is not null limit 1);
select stddev(c2) from t1;
stddev(c2)
0
rollback;
delete from t1 where c2 = (select t2.c1 from t1, t2, t3 where t3.c1 is not null and t1.c2 = t3.c2 and t2.c3 is not null limit 1);
select stddev(c2) from t1;
stddev(c2)
1.7204650534085253
rollback;
delete from t1 where c2 = (select /*+ NO_REWRITE */t2.c1 from t1, t2, t3 where t3.c1 is not null and t1.c2 = t3.c2 and t2.c3 is not null limit 1);
select stddev(c2) from t1;
stddev(c2)
1.7204650534085253
rollback;
select * from t1 left join t2 on t1.c1 = t2.c1 left join t3 on t1.c2 = t3.c2 where t3.c1 is not null;
c1	c2	c1	c2	c3	c1	c2	c3
2	5	2	5	c	2	5	4
2	5	2	5	c	4	5	1
2	5	2	5	c	5	5	5
2	5	2	5	c	6	5	c
3	2	3	5	b	1	2	3
4	6	4	6	o	3	6	1
select /*+ NO_REWRITE */* from t1 left join t2 on t1.c1 = t2.c1 left join t3 on t1.c2 = t3.c2 where t3.c1 is not null;
c1	c2	c1	c2	c3	c1	c2	c3
2	5	2	5	c	2	5	4
2	5	2	5	c	4	5	1
2	5	2	5	c	5	5	5
2	5	2	5	c	6	5	c
3	2	3	5	b	1	2	3
4	6	4	6	o	3	6	1
insert into t5_temp (select * from t1 left join t2 on t1.c1 = t2.c1 left join t3 on t1.c2 = t3.c2 where t3.c1 is not null);
rollback;
insert into t5_temp (select /*+ NO_REWRITE */* from t1 left join t2 on t1.c1 = t2.c1 left join t3 on t1.c2 = t3.c2 where t3.c1 is not null);
rollback;
update t1 set c2 = (select t1.c1 from t1 left join t2 on t1.c1 = t2.c1 left join t3 on t1.c2 = t3.c2 where t3.c1 is not null limit 1);
select stddev(c2) from t1;
stddev(c2)
0
rollback;
update t1 set c2 = (select /*+ NO_REWRITE */t1.c1 from t1 left join t2 on t1.c1 = t2.c1 left join t3 on t1.c2 = t3.c2 where t3.c1 is not null limit 1);
select stddev(c2) from t1;
stddev(c2)
0
rollback;
delete from t1 where c2 = (select t1.c1 from t1 left join t2 on t1.c1 = t2.c1 left join t3 on t1.c2 = t3.c2 where t3.c1 is not null limit 1);
select stddev(c2) from t1;
stddev(c2)
2.0591260281974
rollback;
delete from t1 where c2 = (select /*+ NO_REWRITE */t1.c1 from t1 left join t2 on t1.c1 = t2.c1 left join t3 on t1.c2 = t3.c2 where t3.c1 is not null limit 1);
select stddev(c2) from t1;
stddev(c2)
2.1147629234082532
rollback;
select * from t1 left join t2 on t1.c1 = t2.c1, t3 where t3.c1 is not null and t1.c2 = t3.c2;
c1	c2	c1	c2	c3	c1	c2	c3
2	5	2	5	c	2	5	4
2	5	2	5	c	4	5	1
2	5	2	5	c	5	5	5
2	5	2	5	c	6	5	c
3	2	3	5	b	1	2	3
4	6	4	6	o	3	6	1
select /*+ NO_REWRITE */* from t1 left join t2 on t1.c1 = t2.c1, t3 where t3.c1 is not null and t1.c2 = t3.c2;
c1	c2	c1	c2	c3	c1	c2	c3
2	5	2	5	c	2	5	4
2	5	2	5	c	4	5	1
2	5	2	5	c	5	5	5
2	5	2	5	c	6	5	c
3	2	3	5	b	1	2	3
4	6	4	6	o	3	6	1
insert into t5_temp (select * from t1 left join t2 on t1.c1 = t2.c1, t3 where t3.c1 is not null and t1.c2 = t3.c2);
rollback;
insert into t5_temp (select /*+ NO_REWRITE */* from t1 left join t2 on t1.c1 = t2.c1, t3 where t3.c1 is not null and t1.c2 = t3.c2);
rollback;
update t1 set c2 = (select t1.c1 from t1 left join t2 on t1.c1 = t2.c1, t3 where t3.c1 is not null and t1.c2 = t3.c2 limit 1);
select stddev(c2) from t1;
stddev(c2)
0
rollback;
update t1 set c2 = (select /*+ NO_REWRITE */t1.c1 from t1 left join t2 on t1.c1 = t2.c1, t3 where t3.c1 is not null and t1.c2 = t3.c2 limit 1);
select stddev(c2) from t1;
stddev(c2)
0
rollback;
delete from t1 where c2 = (select t1.c1 from t1 left join t2 on t1.c1 = t2.c1, t3 where t3.c1 is not null and t1.c2 = t3.c2 limit 1);
select stddev(c2) from t1;
stddev(c2)
2.0591260281974
rollback;
delete from t1 where c2 = (select /*+ NO_REWRITE */t1.c1 from t1 left join t2 on t1.c1 = t2.c1, t3 where t3.c1 is not null and t1.c2 = t3.c2 limit 1);
select stddev(c2) from t1;
stddev(c2)
2.1147629234082532
rollback;
select * from t1 join t2 on t1.c1 = t2.c1;
c1	c2	c1	c2	c3
1	1	1	1	o
2	5	2	5	c
3	2	3	5	b
4	6	4	6	o
5	4	5	7	d
6	7	6	8	c
select /*+ NO_REWRITE */* from t1 join t2 on t1.c1 = t2.c1;
c1	c2	c1	c2	c3
1	1	1	1	o
2	5	2	5	c
3	2	3	5	b
4	6	4	6	o
5	4	5	7	d
6	7	6	8	c
insert into t4_temp (select * from t1 join t2 on t1.c1 = t2.c1);
rollback;
insert into t4_temp (select /*+ NO_REWRITE */* from t1 join t2 on t1.c1 = t2.c1);
rollback;
update t1 set c2 = (select t1.c1 from t1 join t2 on t1.c1 = t2.c1 limit 1);
select stddev(c2) from t1;
stddev(c2)
0
rollback;
update t1 set c2 = (select /*+ NO_REWRITE */t1.c1 from t1 join t2 on t1.c1 = t2.c1 limit 1);
select stddev(c2) from t1;
stddev(c2)
0
rollback;
delete from t1 where c2 = (select t1.c1 from t1 join t2 on t1.c1 = t2.c1 limit 1);
select stddev(c2) from t1;
stddev(c2)
1.7204650534085253
rollback;
delete from t1 where c2 = (select /*+ NO_REWRITE */t1.c1 from t1 join t2 on t1.c1 = t2.c1 limit 1);
select stddev(c2) from t1;
stddev(c2)
1.7204650534085253
rollback;
select * from t1, t2 where t1.c1 = t2.c1;
c1	c2	c1	c2	c3
1	1	1	1	o
2	5	2	5	c
3	2	3	5	b
4	6	4	6	o
5	4	5	7	d
6	7	6	8	c
select /*+ NO_REWRITE */* from t1, t2 where t1.c1 = t2.c1;
c1	c2	c1	c2	c3
1	1	1	1	o
2	5	2	5	c
3	2	3	5	b
4	6	4	6	o
5	4	5	7	d
6	7	6	8	c
insert into t4_temp (select * from t1, t2 where t1.c1 = t2.c1);
rollback;
insert into t4_temp (select /*+ NO_REWRITE */* from t1, t2 where t1.c1 = t2.c1);
rollback;
update t1 set c2 = (select t1.c1 from t1, t2 where t1.c1 = t2.c1 limit 1);
select stddev(c2) from t1;
stddev(c2)
0
rollback;
update t1 set c2 = (select /*+ NO_REWRITE */t1.c1 from t1, t2 where t1.c1 = t2.c1 limit 1);
select stddev(c2) from t1;
stddev(c2)
0
rollback;
delete from t1 where c2 = (select t1.c1 from t1, t2 where t1.c1 = t2.c1 limit 1);
select stddev(c2) from t1;
stddev(c2)
1.7204650534085253
rollback;
delete from t1 where c2 = (select /*+ NO_REWRITE */t1.c1 from t1, t2 where t1.c1 = t2.c1 limit 1);
select stddev(c2) from t1;
stddev(c2)
1.7204650534085253
rollback;
select * from t1 join t2 on t1.c1 = t2.c1 join t3 on t2.c1 = t3.c1;
c1	c2	c1	c2	c3	c1	c2	c3
1	1	1	1	o	1	2	3
2	5	2	5	c	2	5	4
3	2	3	5	b	3	6	1
4	6	4	6	o	4	5	1
5	4	5	7	d	5	5	5
6	7	6	8	c	6	5	c
select /*+ NO_REWRITE */* from t1 join t2 on t1.c1 = t2.c1 join t3 on t2.c1 = t3.c1;
c1	c2	c1	c2	c3	c1	c2	c3
1	1	1	1	o	1	2	3
2	5	2	5	c	2	5	4
3	2	3	5	b	3	6	1
4	6	4	6	o	4	5	1
5	4	5	7	d	5	5	5
6	7	6	8	c	6	5	c
insert into t5_temp (select * from t1 join t2 on t1.c1 = t2.c1 join t3 on t2.c1 = t3.c1);
rollback;
insert into t5_temp (select /*+ NO_REWRITE */* from t1 join t2 on t1.c1 = t2.c1 join t3 on t2.c1 = t3.c1);
rollback;
update t1 set c2 = (select t1.c1 from t1 join t2 on t1.c1 = t2.c1 join t3 on t2.c1 = t3.c1 limit 1);
select stddev(c2) from t1;
stddev(c2)
0
rollback;
update t1 set c2 = (select /*+ NO_REWRITE */t1.c1 from t1 join t2 on t1.c1 = t2.c1 join t3 on t2.c1 = t3.c1 limit 1);
select stddev(c2) from t1;
stddev(c2)
0
rollback;
delete from t1 where c2 = (select t1.c1 from t1 join t2 on t1.c1 = t2.c1 join t3 on t2.c1 = t3.c1 limit 1);
select stddev(c2) from t1;
stddev(c2)
1.7204650534085253
rollback;
delete from t1 where c2 = (select /*+ NO_REWRITE */t1.c1 from t1 join t2 on t1.c1 = t2.c1 join t3 on t2.c1 = t3.c1 limit 1);
select stddev(c2) from t1;
stddev(c2)
1.7204650534085253
rollback;
select * from t1, t2, t3 where t1.c1 = t2.c1 and t2.c1 = t3.c1;
c1	c2	c1	c2	c3	c1	c2	c3
1	1	1	1	o	1	2	3
2	5	2	5	c	2	5	4
3	2	3	5	b	3	6	1
4	6	4	6	o	4	5	1
5	4	5	7	d	5	5	5
6	7	6	8	c	6	5	c
select /*+ NO_REWRITE */* from t1, t2, t3 where t1.c1 = t2.c1 and t2.c1 = t3.c1;
c1	c2	c1	c2	c3	c1	c2	c3
1	1	1	1	o	1	2	3
2	5	2	5	c	2	5	4
3	2	3	5	b	3	6	1
4	6	4	6	o	4	5	1
5	4	5	7	d	5	5	5
6	7	6	8	c	6	5	c
insert into t5_temp (select * from t1, t2, t3 where t1.c1 = t2.c1 and t2.c1 = t3.c1);
rollback;
insert into t5_temp (select /*+ NO_REWRITE */* from t1, t2, t3 where t1.c1 = t2.c1 and t2.c1 = t3.c1);
rollback;
update t1 set c2 = (select t1.c1 from t1, t2, t3 where t1.c1 = t2.c1 and t2.c1 = t3.c1 limit 1);
select stddev(c2) from t1;
stddev(c2)
0
rollback;
update t1 set c2 = (select /*+ NO_REWRITE */t1.c1 from t1, t2, t3 where t1.c1 = t2.c1 and t2.c1 = t3.c1 limit 1);
select stddev(c2) from t1;
stddev(c2)
0
rollback;
delete from t1 where c2 = (select t1.c1 from t1, t2, t3 where t1.c1 = t2.c1 and t2.c1 = t3.c1 limit 1);
select stddev(c2) from t1;
stddev(c2)
1.7204650534085253
rollback;
delete from t1 where c2 = (select /*+ NO_REWRITE */t1.c1 from t1, t2, t3 where t1.c1 = t2.c1 and t2.c1 = t3.c1 limit 1);
select stddev(c2) from t1;
stddev(c2)
1.7204650534085253
rollback;
select * from t1 left join t2 on t1.c1 = t2.c1 where t2.c1 is not null;
c1	c2	c1	c2	c3
1	1	1	1	o
2	5	2	5	c
3	2	3	5	b
4	6	4	6	o
5	4	5	7	d
6	7	6	8	c
select /*+ NO_REWRITE */* from t1 left join t2 on t1.c1 = t2.c1 where t2.c1 is not null;
c1	c2	c1	c2	c3
1	1	1	1	o
2	5	2	5	c
3	2	3	5	b
4	6	4	6	o
5	4	5	7	d
6	7	6	8	c
insert into t4_temp (select * from t1 left join t2 on t1.c1 = t2.c1 where t2.c1 is not null);
rollback;
insert into t4_temp (select /*+ NO_REWRITE */* from t1 left join t2 on t1.c1 = t2.c1 where t2.c1 is not null);
rollback;
update t1 set c2 = (select t1.c1 from t1 left join t2 on t1.c1 = t2.c1 where t2.c1 is not null limit 1);
select stddev(c2) from t1;
stddev(c2)
0
rollback;
update t1 set c2 = (select /*+ NO_REWRITE */t1.c1 from t1 left join t2 on t1.c1 = t2.c1 where t2.c1 is not null limit 1);
select stddev(c2) from t1;
stddev(c2)
0
rollback;
delete from t1 where c2 = (select t1.c1 from t1 left join t2 on t1.c1 = t2.c1 where t2.c1 is not null limit 1);
select stddev(c2) from t1;
stddev(c2)
1.7204650534085253
rollback;
delete from t1 where c2 = (select /*+ NO_REWRITE */t1.c1 from t1 left join t2 on t1.c1 = t2.c1 where t2.c1 is not null limit 1);
select stddev(c2) from t1;
stddev(c2)
1.7204650534085253
rollback;
select * from t1, t2 where t2.c1 is not null and t1.c1 = t2.c1;
c1	c2	c1	c2	c3
1	1	1	1	o
2	5	2	5	c
3	2	3	5	b
4	6	4	6	o
5	4	5	7	d
6	7	6	8	c
select /*+ NO_REWRITE */* from t1, t2 where t2.c1 is not null and t1.c1 = t2.c1;
c1	c2	c1	c2	c3
1	1	1	1	o
2	5	2	5	c
3	2	3	5	b
4	6	4	6	o
5	4	5	7	d
6	7	6	8	c
insert into t4_temp (select * from t1, t2 where t2.c1 is not null and t1.c1 = t2.c1);
rollback;
insert into t4_temp (select /*+ NO_REWRITE */* from t1, t2 where t2.c1 is not null and t1.c1 = t2.c1);
rollback;
update t1 set c2 = (select t1.c1 from t1, t2 where t2.c1 is not null and t1.c1 = t2.c1 limit 1);
select stddev(c2) from t1;
stddev(c2)
0
rollback;
update t1 set c2 = (select /*+ NO_REWRITE */t1.c1 from t1, t2 where t2.c1 is not null and t1.c1 = t2.c1 limit 1);
select stddev(c2) from t1;
stddev(c2)
0
rollback;
delete from t1 where c2 = (select t1.c1 from t1, t2 where t2.c1 is not null and t1.c1 = t2.c1 limit 1);
select stddev(c2) from t1;
stddev(c2)
1.7204650534085253
rollback;
delete from t1 where c2 = (select /*+ NO_REWRITE */t1.c1 from t1, t2 where t2.c1 is not null and t1.c1 = t2.c1 limit 1);
select stddev(c2) from t1;
stddev(c2)
1.7204650534085253
rollback;
select * from t1 left join t2 on t1.c1>1 where t2.c1 is not null;
c1	c2	c1	c2	c3
2	5	1	1	o
2	5	2	5	c
2	5	3	5	b
2	5	4	6	o
2	5	5	7	d
2	5	6	8	c
3	2	1	1	o
3	2	2	5	c
3	2	3	5	b
3	2	4	6	o
3	2	5	7	d
3	2	6	8	c
4	6	1	1	o
4	6	2	5	c
4	6	3	5	b
4	6	4	6	o
4	6	5	7	d
4	6	6	8	c
5	4	1	1	o
5	4	2	5	c
5	4	3	5	b
5	4	4	6	o
5	4	5	7	d
5	4	6	8	c
6	7	1	1	o
6	7	2	5	c
6	7	3	5	b
6	7	4	6	o
6	7	5	7	d
6	7	6	8	c
select /*+ NO_REWRITE */* from t1 left join t2 on t1.c1>1 where t2.c1 is not null;
c1	c2	c1	c2	c3
2	5	1	1	o
2	5	2	5	c
2	5	3	5	b
2	5	4	6	o
2	5	5	7	d
2	5	6	8	c
3	2	1	1	o
3	2	2	5	c
3	2	3	5	b
3	2	4	6	o
3	2	5	7	d
3	2	6	8	c
4	6	1	1	o
4	6	2	5	c
4	6	3	5	b
4	6	4	6	o
4	6	5	7	d
4	6	6	8	c
5	4	1	1	o
5	4	2	5	c
5	4	3	5	b
5	4	4	6	o
5	4	5	7	d
5	4	6	8	c
6	7	1	1	o
6	7	2	5	c
6	7	3	5	b
6	7	4	6	o
6	7	5	7	d
6	7	6	8	c
insert into t4_temp (select * from t1 left join t2 on t1.c1>1 where t2.c1 is not null);
rollback;
insert into t4_temp (select /*+ NO_REWRITE */* from t1 left join t2 on t1.c1>1 where t2.c1 is not null);
rollback;
update t1 set c2 = (select t1.c1 from t1 left join t2 on t1.c1>1 where t2.c1 is not null limit 1);
select stddev(c2) from t1;
stddev(c2)
0
rollback;
update t1 set c2 = (select /*+ NO_REWRITE */t1.c1 from t1 left join t2 on t1.c1>1 where t2.c1 is not null limit 1);
select stddev(c2) from t1;
stddev(c2)
0
rollback;
delete from t1 where c2 = (select t1.c1 from t1 left join t2 on t1.c1>1 where t2.c1 is not null limit 1);
select stddev(c2) from t1;
stddev(c2)
2.0591260281974
rollback;
delete from t1 where c2 = (select /*+ NO_REWRITE */t1.c1 from t1 left join t2 on t1.c1>1 where t2.c1 is not null limit 1);
select stddev(c2) from t1;
stddev(c2)
2.0591260281974
rollback;
select * from t1, t2 where t1.c1 > 1 and t2.c1 is not null;
c1	c2	c1	c2	c3
2	5	1	1	o
2	5	2	5	c
2	5	3	5	b
2	5	4	6	o
2	5	5	7	d
2	5	6	8	c
3	2	1	1	o
3	2	2	5	c
3	2	3	5	b
3	2	4	6	o
3	2	5	7	d
3	2	6	8	c
4	6	1	1	o
4	6	2	5	c
4	6	3	5	b
4	6	4	6	o
4	6	5	7	d
4	6	6	8	c
5	4	1	1	o
5	4	2	5	c
5	4	3	5	b
5	4	4	6	o
5	4	5	7	d
5	4	6	8	c
6	7	1	1	o
6	7	2	5	c
6	7	3	5	b
6	7	4	6	o
6	7	5	7	d
6	7	6	8	c
select /*+ NO_REWRITE */* from t1, t2 where t1.c1 > 1 and t2.c1 is not null;
c1	c2	c1	c2	c3
2	5	1	1	o
2	5	2	5	c
2	5	3	5	b
2	5	4	6	o
2	5	5	7	d
2	5	6	8	c
3	2	1	1	o
3	2	2	5	c
3	2	3	5	b
3	2	4	6	o
3	2	5	7	d
3	2	6	8	c
4	6	1	1	o
4	6	2	5	c
4	6	3	5	b
4	6	4	6	o
4	6	5	7	d
4	6	6	8	c
5	4	1	1	o
5	4	2	5	c
5	4	3	5	b
5	4	4	6	o
5	4	5	7	d
5	4	6	8	c
6	7	1	1	o
6	7	2	5	c
6	7	3	5	b
6	7	4	6	o
6	7	5	7	d
6	7	6	8	c
insert into t4_temp (select * from t1, t2 where t1.c1 > 1 and t2.c1 is not null);
rollback;
insert into t4_temp (select /*+ NO_REWRITE */* from t1, t2 where t1.c1 > 1 and t2.c1 is not null);
rollback;
update t1 set c2 = (select t1.c1 from t1, t2 where t1.c1 > 1 and t2.c1 is not null limit 1);
select stddev(c2) from t1;
stddev(c2)
0
rollback;
update t1 set c2 = (select /*+ NO_REWRITE */t1.c1 from t1, t2 where t1.c1 > 1 and t2.c1 is not null limit 1);
select stddev(c2) from t1;
stddev(c2)
0
rollback;
delete from t1 where c2 = (select t1.c1 from t1, t2 where t1.c1 > 1 and t2.c1 is not null limit 1);
select stddev(c2) from t1;
stddev(c2)
2.0591260281974
rollback;
delete from t1 where c2 = (select /*+ NO_REWRITE */t1.c1 from t1, t2 where t1.c1 > 1 and t2.c1 is not null limit 1);
select stddev(c2) from t1;
stddev(c2)
2.0591260281974
rollback;
select t1.c1 from t1 left join t2 on t1.c1 = t2.c1 and t1.c2 = t2.c2 where t2.c2 is not null;
c1
1
2
4
select /*+ NO_REWRITE */t1.c1 from t1 left join t2 on t1.c1 = t2.c1 and t1.c2 = t2.c2 where t2.c2 is not null;
c1
1
2
4
insert into t12_temp (select t1.c1 from t1 left join t2 on t1.c1 = t2.c1 and t1.c2 = t2.c2 where t2.c2 is not null);
rollback;
insert into t12_temp (select /*+ NO_REWRITE */t1.c1 from t1 left join t2 on t1.c1 = t2.c1 and t1.c2 = t2.c2 where t2.c2 is not null);
rollback;
update t1 set c2 = (select t1.c1 from t1 left join t2 on t1.c1 = t2.c1 and t1.c2 = t2.c2 where t2.c2 is not null limit 1);
select stddev(c2) from t1;
stddev(c2)
0
rollback;
update t1 set c2 = (select /*+ NO_REWRITE */t1.c1 from t1 left join t2 on t1.c1 = t2.c1 and t1.c2 = t2.c2 where t2.c2 is not null limit 1);
select stddev(c2) from t1;
stddev(c2)
0
rollback;
delete from t1 where c2 = (select t1.c1 from t1 left join t2 on t1.c1 = t2.c1 and t1.c2 = t2.c2 where t2.c2 is not null limit 1);
select stddev(c2) from t1;
stddev(c2)
1.7204650534085253
rollback;
delete from t1 where c2 = (select /*+ NO_REWRITE */t1.c1 from t1 left join t2 on t1.c1 = t2.c1 and t1.c2 = t2.c2 where t2.c2 is not null limit 1);
select stddev(c2) from t1;
stddev(c2)
1.7204650534085253
rollback;
select t1.c1 from t1, t2 where t1.c1 = t2.c1 and t1.c2 = t2.c2 and t2.c2 is not null;
c1
1
2
4
select /*+ NO_REWRITE */t1.c1 from t1, t2 where t1.c1 = t2.c1 and t1.c2 = t2.c2 and t2.c2 is not null;
c1
1
2
4
insert into t12_temp (select t1.c1 from t1, t2 where t1.c1 = t2.c1 and t1.c2 = t2.c2 and t2.c2 is not null);
rollback;
insert into t12_temp (select /*+ NO_REWRITE */t1.c1 from t1, t2 where t1.c1 = t2.c1 and t1.c2 = t2.c2 and t2.c2 is not null);
rollback;
update t1 set c2 = (select t1.c1 from t1, t2 where t1.c1 = t2.c1 and t1.c2 = t2.c2 and t2.c2 is not null limit 1);
select stddev(c2) from t1;
stddev(c2)
0
rollback;
update t1 set c2 = (select /*+ NO_REWRITE */t1.c1 from t1, t2 where t1.c1 = t2.c1 and t1.c2 = t2.c2 and t2.c2 is not null limit 1);
select stddev(c2) from t1;
stddev(c2)
0
rollback;
delete from t1 where c2 = (select t1.c1 from t1, t2 where t1.c1 = t2.c1 and t1.c2 = t2.c2 and t2.c2 is not null limit 1);
select stddev(c2) from t1;
stddev(c2)
1.7204650534085253
rollback;
delete from t1 where c2 = (select /*+ NO_REWRITE */t1.c1 from t1, t2 where t1.c1 = t2.c1 and t1.c2 = t2.c2 and t2.c2 is not null limit 1);
select stddev(c2) from t1;
stddev(c2)
1.7204650534085253
rollback;
select * from t1 inner join t2 on t1.c1>1 where t2.c3 is not null;
c1	c2	c1	c2	c3
2	5	1	1	o
2	5	2	5	c
2	5	3	5	b
2	5	4	6	o
2	5	5	7	d
2	5	6	8	c
3	2	1	1	o
3	2	2	5	c
3	2	3	5	b
3	2	4	6	o
3	2	5	7	d
3	2	6	8	c
4	6	1	1	o
4	6	2	5	c
4	6	3	5	b
4	6	4	6	o
4	6	5	7	d
4	6	6	8	c
5	4	1	1	o
5	4	2	5	c
5	4	3	5	b
5	4	4	6	o
5	4	5	7	d
5	4	6	8	c
6	7	1	1	o
6	7	2	5	c
6	7	3	5	b
6	7	4	6	o
6	7	5	7	d
6	7	6	8	c
select /*+ NO_REWRITE */* from t1 inner join t2 on t1.c1>1 where t2.c3 is not null;
c1	c2	c1	c2	c3
2	5	1	1	o
2	5	2	5	c
2	5	3	5	b
2	5	4	6	o
2	5	5	7	d
2	5	6	8	c
3	2	1	1	o
3	2	2	5	c
3	2	3	5	b
3	2	4	6	o
3	2	5	7	d
3	2	6	8	c
4	6	1	1	o
4	6	2	5	c
4	6	3	5	b
4	6	4	6	o
4	6	5	7	d
4	6	6	8	c
5	4	1	1	o
5	4	2	5	c
5	4	3	5	b
5	4	4	6	o
5	4	5	7	d
5	4	6	8	c
6	7	1	1	o
6	7	2	5	c
6	7	3	5	b
6	7	4	6	o
6	7	5	7	d
6	7	6	8	c
insert into t4_temp (select * from t1 inner join t2 on t1.c1>1 where t2.c3 is not null);
rollback;
insert into t4_temp (select /*+ NO_REWRITE */* from t1 inner join t2 on t1.c1>1 where t2.c3 is not null);
rollback;
update t1 set c2 = (select t1.c1 from t1 inner join t2 on t1.c1>1 where t2.c3 is not null limit 1);
select stddev(c2) from t1;
stddev(c2)
0
rollback;
update t1 set c2 = (select /*+ NO_REWRITE */t1.c1 from t1 inner join t2 on t1.c1>1 where t2.c3 is not null limit 1);
select stddev(c2) from t1;
stddev(c2)
0
rollback;
delete from t1 where c2 = (select t1.c1 from t1 inner join t2 on t1.c1>1 where t2.c3 is not null limit 1);
select stddev(c2) from t1;
stddev(c2)
2.0591260281974
rollback;
delete from t1 where c2 = (select /*+ NO_REWRITE */t1.c1 from t1 inner join t2 on t1.c1>1 where t2.c3 is not null limit 1);
select stddev(c2) from t1;
stddev(c2)
2.0591260281974
rollback;
select * from t1, t2 where t1.c1 > 1 and t2.c3 is not null;
c1	c2	c1	c2	c3
2	5	1	1	o
2	5	2	5	c
2	5	3	5	b
2	5	4	6	o
2	5	5	7	d
2	5	6	8	c
3	2	1	1	o
3	2	2	5	c
3	2	3	5	b
3	2	4	6	o
3	2	5	7	d
3	2	6	8	c
4	6	1	1	o
4	6	2	5	c
4	6	3	5	b
4	6	4	6	o
4	6	5	7	d
4	6	6	8	c
5	4	1	1	o
5	4	2	5	c
5	4	3	5	b
5	4	4	6	o
5	4	5	7	d
5	4	6	8	c
6	7	1	1	o
6	7	2	5	c
6	7	3	5	b
6	7	4	6	o
6	7	5	7	d
6	7	6	8	c
select /*+ NO_REWRITE */* from t1, t2 where t1.c1 > 1 and t2.c3 is not null;
c1	c2	c1	c2	c3
2	5	1	1	o
2	5	2	5	c
2	5	3	5	b
2	5	4	6	o
2	5	5	7	d
2	5	6	8	c
3	2	1	1	o
3	2	2	5	c
3	2	3	5	b
3	2	4	6	o
3	2	5	7	d
3	2	6	8	c
4	6	1	1	o
4	6	2	5	c
4	6	3	5	b
4	6	4	6	o
4	6	5	7	d
4	6	6	8	c
5	4	1	1	o
5	4	2	5	c
5	4	3	5	b
5	4	4	6	o
5	4	5	7	d
5	4	6	8	c
6	7	1	1	o
6	7	2	5	c
6	7	3	5	b
6	7	4	6	o
6	7	5	7	d
6	7	6	8	c
insert into t4_temp (select * from t1, t2 where t1.c1 > 1 and t2.c3 is not null);
rollback;
insert into t4_temp (select /*+ NO_REWRITE */* from t1, t2 where t1.c1 > 1 and t2.c3 is not null);
rollback;
update t1 set c2 = (select t1.c1 from t1, t2 where t1.c1 > 1 and t2.c3 is not null limit 1);
select stddev(c2) from t1;
stddev(c2)
0
rollback;
update t1 set c2 = (select /*+ NO_REWRITE */t1.c1 from t1, t2 where t1.c1 > 1 and t2.c3 is not null limit 1);
select stddev(c2) from t1;
stddev(c2)
0
rollback;
delete from t1 where c2 = (select t1.c1 from t1, t2 where t1.c1 > 1 and t2.c3 is not null limit 1);
select stddev(c2) from t1;
stddev(c2)
2.0591260281974
rollback;
delete from t1 where c2 = (select /*+ NO_REWRITE */t1.c1 from t1, t2 where t1.c1 > 1 and t2.c3 is not null limit 1);
select stddev(c2) from t1;
stddev(c2)
2.0591260281974
rollback;
select * from t1 inner join t2 on t1.c1>1 where t2.c2 is not null;
c1	c2	c1	c2	c3
2	5	1	1	o
2	5	2	5	c
2	5	3	5	b
2	5	4	6	o
2	5	5	7	d
2	5	6	8	c
3	2	1	1	o
3	2	2	5	c
3	2	3	5	b
3	2	4	6	o
3	2	5	7	d
3	2	6	8	c
4	6	1	1	o
4	6	2	5	c
4	6	3	5	b
4	6	4	6	o
4	6	5	7	d
4	6	6	8	c
5	4	1	1	o
5	4	2	5	c
5	4	3	5	b
5	4	4	6	o
5	4	5	7	d
5	4	6	8	c
6	7	1	1	o
6	7	2	5	c
6	7	3	5	b
6	7	4	6	o
6	7	5	7	d
6	7	6	8	c
select /*+ NO_REWRITE */* from t1 inner join t2 on t1.c1>1 where t2.c2 is not null;
c1	c2	c1	c2	c3
2	5	1	1	o
2	5	2	5	c
2	5	3	5	b
2	5	4	6	o
2	5	5	7	d
2	5	6	8	c
3	2	1	1	o
3	2	2	5	c
3	2	3	5	b
3	2	4	6	o
3	2	5	7	d
3	2	6	8	c
4	6	1	1	o
4	6	2	5	c
4	6	3	5	b
4	6	4	6	o
4	6	5	7	d
4	6	6	8	c
5	4	1	1	o
5	4	2	5	c
5	4	3	5	b
5	4	4	6	o
5	4	5	7	d
5	4	6	8	c
6	7	1	1	o
6	7	2	5	c
6	7	3	5	b
6	7	4	6	o
6	7	5	7	d
6	7	6	8	c
insert into t4_temp (select * from t1 inner join t2 on t1.c1>1 where t2.c2 is not null);
rollback;
insert into t4_temp (select /*+ NO_REWRITE */* from t1 inner join t2 on t1.c1>1 where t2.c2 is not null);
rollback;
update t1 set c2 = (select t1.c1 from t1 inner join t2 on t1.c1>1 where t2.c2 is not null limit 1);
select stddev(c2) from t1;
stddev(c2)
0
rollback;
update t1 set c2 = (select /*+ NO_REWRITE */t1.c1 from t1 inner join t2 on t1.c1>1 where t2.c2 is not null limit 1);
select stddev(c2) from t1;
stddev(c2)
0
rollback;
delete from t1 where c2 = (select t1.c1 from t1 inner join t2 on t1.c1>1 where t2.c2 is not null limit 1);
select stddev(c2) from t1;
stddev(c2)
2.0591260281974
rollback;
delete from t1 where c2 = (select /*+ NO_REWRITE */t1.c1 from t1 inner join t2 on t1.c1>1 where t2.c2 is not null limit 1);
select stddev(c2) from t1;
stddev(c2)
2.0591260281974
rollback;
select * from t1, t2 where t1.c1 > 1 and t2.c2 is not null;
c1	c2	c1	c2	c3
2	5	1	1	o
2	5	2	5	c
2	5	3	5	b
2	5	4	6	o
2	5	5	7	d
2	5	6	8	c
3	2	1	1	o
3	2	2	5	c
3	2	3	5	b
3	2	4	6	o
3	2	5	7	d
3	2	6	8	c
4	6	1	1	o
4	6	2	5	c
4	6	3	5	b
4	6	4	6	o
4	6	5	7	d
4	6	6	8	c
5	4	1	1	o
5	4	2	5	c
5	4	3	5	b
5	4	4	6	o
5	4	5	7	d
5	4	6	8	c
6	7	1	1	o
6	7	2	5	c
6	7	3	5	b
6	7	4	6	o
6	7	5	7	d
6	7	6	8	c
select /*+ NO_REWRITE */* from t1, t2 where t1.c1 > 1 and t2.c2 is not null;
c1	c2	c1	c2	c3
2	5	1	1	o
2	5	2	5	c
2	5	3	5	b
2	5	4	6	o
2	5	5	7	d
2	5	6	8	c
3	2	1	1	o
3	2	2	5	c
3	2	3	5	b
3	2	4	6	o
3	2	5	7	d
3	2	6	8	c
4	6	1	1	o
4	6	2	5	c
4	6	3	5	b
4	6	4	6	o
4	6	5	7	d
4	6	6	8	c
5	4	1	1	o
5	4	2	5	c
5	4	3	5	b
5	4	4	6	o
5	4	5	7	d
5	4	6	8	c
6	7	1	1	o
6	7	2	5	c
6	7	3	5	b
6	7	4	6	o
6	7	5	7	d
6	7	6	8	c
insert into t4_temp (select * from t1, t2 where t1.c1 > 1 and t2.c2 is not null);
rollback;
insert into t4_temp (select /*+ NO_REWRITE */* from t1, t2 where t1.c1 > 1 and t2.c2 is not null);
rollback;
update t1 set c2 = (select t1.c1 from t1, t2 where t1.c1 > 1 and t2.c2 is not null limit 1);
select stddev(c2) from t1;
stddev(c2)
0
rollback;
update t1 set c2 = (select /*+ NO_REWRITE */t1.c1 from t1, t2 where t1.c1 > 1 and t2.c2 is not null limit 1);
select stddev(c2) from t1;
stddev(c2)
0
rollback;
delete from t1 where c2 = (select t1.c1 from t1, t2 where t1.c1 > 1 and t2.c2 is not null limit 1);
select stddev(c2) from t1;
stddev(c2)
2.0591260281974
rollback;
delete from t1 where c2 = (select /*+ NO_REWRITE */t1.c1 from t1, t2 where t1.c1 > 1 and t2.c2 is not null limit 1);
select stddev(c2) from t1;
stddev(c2)
2.0591260281974
rollback;
select * from t1 inner join t2 on t1.c1 = t2.c1 where t2.c1 is not null;
c1	c2	c1	c2	c3
1	1	1	1	o
2	5	2	5	c
3	2	3	5	b
4	6	4	6	o
5	4	5	7	d
6	7	6	8	c
select /*+ NO_REWRITE */* from t1 inner join t2 on t1.c1 = t2.c1 where t2.c1 is not null;
c1	c2	c1	c2	c3
1	1	1	1	o
2	5	2	5	c
3	2	3	5	b
4	6	4	6	o
5	4	5	7	d
6	7	6	8	c
insert into t4_temp (select * from t1 inner join t2 on t1.c1 = t2.c1 where t2.c1 is not null);
rollback;
insert into t4_temp (select /*+ NO_REWRITE */* from t1 inner join t2 on t1.c1 = t2.c1 where t2.c1 is not null);
rollback;
update t1 set c2 = (select t1.c1 from t1 inner join t2 on t1.c1 = t2.c1 where t2.c1 is not null limit 1);
select stddev(c2) from t1;
stddev(c2)
0
rollback;
update t1 set c2 = (select /*+ NO_REWRITE */t1.c1 from t1 inner join t2 on t1.c1 = t2.c1 where t2.c1 is not null limit 1);
select stddev(c2) from t1;
stddev(c2)
0
rollback;
delete from t1 where c2 = (select t1.c1 from t1 inner join t2 on t1.c1 = t2.c1 where t2.c1 is not null limit 1);
select stddev(c2) from t1;
stddev(c2)
1.7204650534085253
rollback;
delete from t1 where c2 = (select /*+ NO_REWRITE */t1.c1 from t1 inner join t2 on t1.c1 = t2.c1 where t2.c1 is not null limit 1);
select stddev(c2) from t1;
stddev(c2)
1.7204650534085253
rollback;
select * from t1, t2 where t1.c1=t2.c1 and t2.c1 is not null;
c1	c2	c1	c2	c3
1	1	1	1	o
2	5	2	5	c
3	2	3	5	b
4	6	4	6	o
5	4	5	7	d
6	7	6	8	c
select /*+ NO_REWRITE */* from t1, t2 where t1.c1=t2.c1 and t2.c1 is not null;
c1	c2	c1	c2	c3
1	1	1	1	o
2	5	2	5	c
3	2	3	5	b
4	6	4	6	o
5	4	5	7	d
6	7	6	8	c
insert into t4_temp (select * from t1, t2 where t1.c1=t2.c1 and t2.c1 is not null);
rollback;
insert into t4_temp (select /*+ NO_REWRITE */* from t1, t2 where t1.c1=t2.c1 and t2.c1 is not null);
rollback;
update t1 set c2 = (select t1.c1 from t1, t2 where t1.c1=t2.c1 and t2.c1 is not null limit 1);
select stddev(c2) from t1;
stddev(c2)
0
rollback;
update t1 set c2 = (select /*+ NO_REWRITE */t1.c1 from t1, t2 where t1.c1=t2.c1 and t2.c1 is not null limit 1);
select stddev(c2) from t1;
stddev(c2)
0
rollback;
delete from t1 where c2 = (select t1.c1 from t1, t2 where t1.c1=t2.c1 and t2.c1 is not null limit 1);
select stddev(c2) from t1;
stddev(c2)
1.7204650534085253
rollback;
delete from t1 where c2 = (select /*+ NO_REWRITE */t1.c1 from t1, t2 where t1.c1=t2.c1 and t2.c1 is not null limit 1);
select stddev(c2) from t1;
stddev(c2)
1.7204650534085253
rollback;
select t1.c1 from t1 inner join t2 on t1.c1 = t2.c1 and t1.c2 = t2.c2 where t2.c2 is not null;
c1
1
2
4
select /*+ NO_REWRITE */t1.c1 from t1 inner join t2 on t1.c1 = t2.c1 and t1.c2 = t2.c2 where t2.c2 is not null;
c1
1
2
4
insert into t12_temp (select t1.c1 from t1 inner join t2 on t1.c1 = t2.c1 and t1.c2 = t2.c2 where t2.c2 is not null);
rollback;
insert into t12_temp (select /*+ NO_REWRITE */t1.c1 from t1 inner join t2 on t1.c1 = t2.c1 and t1.c2 = t2.c2 where t2.c2 is not null);
rollback;
update t1 set c2 = (select t1.c1 from t1 inner join t2 on t1.c1 = t2.c1 and t1.c2 = t2.c2 where t2.c2 is not null limit 1);
select stddev(c2) from t1;
stddev(c2)
0
rollback;
update t1 set c2 = (select /*+ NO_REWRITE */t1.c1 from t1 inner join t2 on t1.c1 = t2.c1 and t1.c2 = t2.c2 where t2.c2 is not null limit 1);
select stddev(c2) from t1;
stddev(c2)
0
rollback;
delete from t1 where c2 = (select t1.c1 from t1 inner join t2 on t1.c1 = t2.c1 and t1.c2 = t2.c2 where t2.c2 is not null limit 1);
select stddev(c2) from t1;
stddev(c2)
1.7204650534085253
rollback;
delete from t1 where c2 = (select /*+ NO_REWRITE */t1.c1 from t1 inner join t2 on t1.c1 = t2.c1 and t1.c2 = t2.c2 where t2.c2 is not null limit 1);
select stddev(c2) from t1;
stddev(c2)
1.7204650534085253
rollback;
select t1.c1 from t1, t2 where t1.c1=t2.c1 and t1.c2=t2.c2 and t2.c2 is not null;
c1
1
2
4
select /*+ NO_REWRITE */t1.c1 from t1, t2 where t1.c1=t2.c1 and t1.c2=t2.c2 and t2.c2 is not null;
c1
1
2
4
insert into t12_temp (select t1.c1 from t1, t2 where t1.c1=t2.c1 and t1.c2=t2.c2 and t2.c2 is not null);
rollback;
insert into t12_temp (select /*+ NO_REWRITE */t1.c1 from t1, t2 where t1.c1=t2.c1 and t1.c2=t2.c2 and t2.c2 is not null);
rollback;
update t1 set c2 = (select t1.c1 from t1, t2 where t1.c1=t2.c1 and t1.c2=t2.c2 and t2.c2 is not null limit 1);
select stddev(c2) from t1;
stddev(c2)
0
rollback;
update t1 set c2 = (select /*+ NO_REWRITE */t1.c1 from t1, t2 where t1.c1=t2.c1 and t1.c2=t2.c2 and t2.c2 is not null limit 1);
select stddev(c2) from t1;
stddev(c2)
0
rollback;
delete from t1 where c2 = (select t1.c1 from t1, t2 where t1.c1=t2.c1 and t1.c2=t2.c2 and t2.c2 is not null limit 1);
select stddev(c2) from t1;
stddev(c2)
1.7204650534085253
rollback;
delete from t1 where c2 = (select /*+ NO_REWRITE */t1.c1 from t1, t2 where t1.c1=t2.c1 and t1.c2=t2.c2 and t2.c2 is not null limit 1);
select stddev(c2) from t1;
stddev(c2)
1.7204650534085253
rollback;
select * from t1 inner join t2 on t1.c1>1 where t2.c1 is not null;
c1	c2	c1	c2	c3
2	5	1	1	o
2	5	2	5	c
2	5	3	5	b
2	5	4	6	o
2	5	5	7	d
2	5	6	8	c
3	2	1	1	o
3	2	2	5	c
3	2	3	5	b
3	2	4	6	o
3	2	5	7	d
3	2	6	8	c
4	6	1	1	o
4	6	2	5	c
4	6	3	5	b
4	6	4	6	o
4	6	5	7	d
4	6	6	8	c
5	4	1	1	o
5	4	2	5	c
5	4	3	5	b
5	4	4	6	o
5	4	5	7	d
5	4	6	8	c
6	7	1	1	o
6	7	2	5	c
6	7	3	5	b
6	7	4	6	o
6	7	5	7	d
6	7	6	8	c
select /*+ NO_REWRITE */* from t1 inner join t2 on t1.c1>1 where t2.c1 is not null;
c1	c2	c1	c2	c3
2	5	1	1	o
2	5	2	5	c
2	5	3	5	b
2	5	4	6	o
2	5	5	7	d
2	5	6	8	c
3	2	1	1	o
3	2	2	5	c
3	2	3	5	b
3	2	4	6	o
3	2	5	7	d
3	2	6	8	c
4	6	1	1	o
4	6	2	5	c
4	6	3	5	b
4	6	4	6	o
4	6	5	7	d
4	6	6	8	c
5	4	1	1	o
5	4	2	5	c
5	4	3	5	b
5	4	4	6	o
5	4	5	7	d
5	4	6	8	c
6	7	1	1	o
6	7	2	5	c
6	7	3	5	b
6	7	4	6	o
6	7	5	7	d
6	7	6	8	c
insert into t4_temp (select * from t1 inner join t2 on t1.c1>1 where t2.c1 is not null);
rollback;
insert into t4_temp (select /*+ NO_REWRITE */* from t1 inner join t2 on t1.c1>1 where t2.c1 is not null);
rollback;
update t1 set c2 = (select t1.c1 from t1 inner join t2 on t1.c1>1 where t2.c1 is not null limit 1);
select stddev(c2) from t1;
stddev(c2)
0
rollback;
update t1 set c2 = (select /*+ NO_REWRITE */t1.c1 from t1 inner join t2 on t1.c1>1 where t2.c1 is not null limit 1);
select stddev(c2) from t1;
stddev(c2)
0
rollback;
delete from t1 where c2 = (select t1.c1 from t1 inner join t2 on t1.c1>1 where t2.c1 is not null limit 1);
select stddev(c2) from t1;
stddev(c2)
2.0591260281974
rollback;
delete from t1 where c2 = (select /*+ NO_REWRITE */t1.c1 from t1 inner join t2 on t1.c1>1 where t2.c1 is not null limit 1);
select stddev(c2) from t1;
stddev(c2)
2.0591260281974
rollback;
select * from t1, t2 where t1.c1 > 1 and t2.c1 is not null;
c1	c2	c1	c2	c3
2	5	1	1	o
2	5	2	5	c
2	5	3	5	b
2	5	4	6	o
2	5	5	7	d
2	5	6	8	c
3	2	1	1	o
3	2	2	5	c
3	2	3	5	b
3	2	4	6	o
3	2	5	7	d
3	2	6	8	c
4	6	1	1	o
4	6	2	5	c
4	6	3	5	b
4	6	4	6	o
4	6	5	7	d
4	6	6	8	c
5	4	1	1	o
5	4	2	5	c
5	4	3	5	b
5	4	4	6	o
5	4	5	7	d
5	4	6	8	c
6	7	1	1	o
6	7	2	5	c
6	7	3	5	b
6	7	4	6	o
6	7	5	7	d
6	7	6	8	c
select /*+ NO_REWRITE */* from t1, t2 where t1.c1 > 1 and t2.c1 is not null;
c1	c2	c1	c2	c3
2	5	1	1	o
2	5	2	5	c
2	5	3	5	b
2	5	4	6	o
2	5	5	7	d
2	5	6	8	c
3	2	1	1	o
3	2	2	5	c
3	2	3	5	b
3	2	4	6	o
3	2	5	7	d
3	2	6	8	c
4	6	1	1	o
4	6	2	5	c
4	6	3	5	b
4	6	4	6	o
4	6	5	7	d
4	6	6	8	c
5	4	1	1	o
5	4	2	5	c
5	4	3	5	b
5	4	4	6	o
5	4	5	7	d
5	4	6	8	c
6	7	1	1	o
6	7	2	5	c
6	7	3	5	b
6	7	4	6	o
6	7	5	7	d
6	7	6	8	c
insert into t4_temp (select * from t1, t2 where t1.c1 > 1 and t2.c1 is not null);
rollback;
insert into t4_temp (select /*+ NO_REWRITE */* from t1, t2 where t1.c1 > 1 and t2.c1 is not null);
rollback;
update t1 set c2 = (select t1.c1 from t1, t2 where t1.c1 > 1 and t2.c1 is not null limit 1);
select stddev(c2) from t1;
stddev(c2)
0
rollback;
update t1 set c2 = (select /*+ NO_REWRITE */t1.c1 from t1, t2 where t1.c1 > 1 and t2.c1 is not null limit 1);
select stddev(c2) from t1;
stddev(c2)
0
rollback;
delete from t1 where c2 = (select t1.c1 from t1, t2 where t1.c1 > 1 and t2.c1 is not null limit 1);
select stddev(c2) from t1;
stddev(c2)
2.0591260281974
rollback;
delete from t1 where c2 = (select /*+ NO_REWRITE */t1.c1 from t1, t2 where t1.c1 > 1 and t2.c1 is not null limit 1);
select stddev(c2) from t1;
stddev(c2)
2.0591260281974
rollback;
select * from t1 inner join t2 on t1.c1>1 where t2.c2 is not null;
c1	c2	c1	c2	c3
2	5	1	1	o
2	5	2	5	c
2	5	3	5	b
2	5	4	6	o
2	5	5	7	d
2	5	6	8	c
3	2	1	1	o
3	2	2	5	c
3	2	3	5	b
3	2	4	6	o
3	2	5	7	d
3	2	6	8	c
4	6	1	1	o
4	6	2	5	c
4	6	3	5	b
4	6	4	6	o
4	6	5	7	d
4	6	6	8	c
5	4	1	1	o
5	4	2	5	c
5	4	3	5	b
5	4	4	6	o
5	4	5	7	d
5	4	6	8	c
6	7	1	1	o
6	7	2	5	c
6	7	3	5	b
6	7	4	6	o
6	7	5	7	d
6	7	6	8	c
select /*+ NO_REWRITE */* from t1 inner join t2 on t1.c1>1 where t2.c2 is not null;
c1	c2	c1	c2	c3
2	5	1	1	o
2	5	2	5	c
2	5	3	5	b
2	5	4	6	o
2	5	5	7	d
2	5	6	8	c
3	2	1	1	o
3	2	2	5	c
3	2	3	5	b
3	2	4	6	o
3	2	5	7	d
3	2	6	8	c
4	6	1	1	o
4	6	2	5	c
4	6	3	5	b
4	6	4	6	o
4	6	5	7	d
4	6	6	8	c
5	4	1	1	o
5	4	2	5	c
5	4	3	5	b
5	4	4	6	o
5	4	5	7	d
5	4	6	8	c
6	7	1	1	o
6	7	2	5	c
6	7	3	5	b
6	7	4	6	o
6	7	5	7	d
6	7	6	8	c
insert into t4_temp (select * from t1 inner join t2 on t1.c1>1 where t2.c2 is not null);
rollback;
insert into t4_temp (select /*+ NO_REWRITE */* from t1 inner join t2 on t1.c1>1 where t2.c2 is not null);
rollback;
update t1 set c2 = (select t1.c1 from t1 inner join t2 on t1.c1>1 where t2.c2 is not null limit 1);
select stddev(c2) from t1;
stddev(c2)
0
rollback;
update t1 set c2 = (select /*+ NO_REWRITE */t1.c1 from t1 inner join t2 on t1.c1>1 where t2.c2 is not null limit 1);
select stddev(c2) from t1;
stddev(c2)
0
rollback;
delete from t1 where c2 = (select t1.c1 from t1 inner join t2 on t1.c1>1 where t2.c2 is not null limit 1);
select stddev(c2) from t1;
stddev(c2)
2.0591260281974
rollback;
delete from t1 where c2 = (select /*+ NO_REWRITE */t1.c1 from t1 inner join t2 on t1.c1>1 where t2.c2 is not null limit 1);
select stddev(c2) from t1;
stddev(c2)
2.0591260281974
rollback;
select * from t1, t2 where t1.c1 > 1 and t2.c2 is not null;
c1	c2	c1	c2	c3
2	5	1	1	o
2	5	2	5	c
2	5	3	5	b
2	5	4	6	o
2	5	5	7	d
2	5	6	8	c
3	2	1	1	o
3	2	2	5	c
3	2	3	5	b
3	2	4	6	o
3	2	5	7	d
3	2	6	8	c
4	6	1	1	o
4	6	2	5	c
4	6	3	5	b
4	6	4	6	o
4	6	5	7	d
4	6	6	8	c
5	4	1	1	o
5	4	2	5	c
5	4	3	5	b
5	4	4	6	o
5	4	5	7	d
5	4	6	8	c
6	7	1	1	o
6	7	2	5	c
6	7	3	5	b
6	7	4	6	o
6	7	5	7	d
6	7	6	8	c
select /*+ NO_REWRITE */* from t1, t2 where t1.c1 > 1 and t2.c2 is not null;
c1	c2	c1	c2	c3
2	5	1	1	o
2	5	2	5	c
2	5	3	5	b
2	5	4	6	o
2	5	5	7	d
2	5	6	8	c
3	2	1	1	o
3	2	2	5	c
3	2	3	5	b
3	2	4	6	o
3	2	5	7	d
3	2	6	8	c
4	6	1	1	o
4	6	2	5	c
4	6	3	5	b
4	6	4	6	o
4	6	5	7	d
4	6	6	8	c
5	4	1	1	o
5	4	2	5	c
5	4	3	5	b
5	4	4	6	o
5	4	5	7	d
5	4	6	8	c
6	7	1	1	o
6	7	2	5	c
6	7	3	5	b
6	7	4	6	o
6	7	5	7	d
6	7	6	8	c
insert into t4_temp (select * from t1, t2 where t1.c1 > 1 and t2.c2 is not null);
rollback;
insert into t4_temp (select /*+ NO_REWRITE */* from t1, t2 where t1.c1 > 1 and t2.c2 is not null);
rollback;
update t1 set c2 = (select t1.c1 from t1, t2 where t1.c1 > 1 and t2.c2 is not null limit 1);
select stddev(c2) from t1;
stddev(c2)
0
rollback;
update t1 set c2 = (select /*+ NO_REWRITE */t1.c1 from t1, t2 where t1.c1 > 1 and t2.c2 is not null limit 1);
select stddev(c2) from t1;
stddev(c2)
0
rollback;
delete from t1 where c2 = (select t1.c1 from t1, t2 where t1.c1 > 1 and t2.c2 is not null limit 1);
select stddev(c2) from t1;
stddev(c2)
2.0591260281974
rollback;
delete from t1 where c2 = (select /*+ NO_REWRITE */t1.c1 from t1, t2 where t1.c1 > 1 and t2.c2 is not null limit 1);
select stddev(c2) from t1;
stddev(c2)
2.0591260281974
rollback;
select * from t1 inner join t2 on t1.c1>1 where t2.c3 is not null;
c1	c2	c1	c2	c3
2	5	1	1	o
2	5	2	5	c
2	5	3	5	b
2	5	4	6	o
2	5	5	7	d
2	5	6	8	c
3	2	1	1	o
3	2	2	5	c
3	2	3	5	b
3	2	4	6	o
3	2	5	7	d
3	2	6	8	c
4	6	1	1	o
4	6	2	5	c
4	6	3	5	b
4	6	4	6	o
4	6	5	7	d
4	6	6	8	c
5	4	1	1	o
5	4	2	5	c
5	4	3	5	b
5	4	4	6	o
5	4	5	7	d
5	4	6	8	c
6	7	1	1	o
6	7	2	5	c
6	7	3	5	b
6	7	4	6	o
6	7	5	7	d
6	7	6	8	c
select /*+ NO_REWRITE */* from t1 inner join t2 on t1.c1>1 where t2.c3 is not null;
c1	c2	c1	c2	c3
2	5	1	1	o
2	5	2	5	c
2	5	3	5	b
2	5	4	6	o
2	5	5	7	d
2	5	6	8	c
3	2	1	1	o
3	2	2	5	c
3	2	3	5	b
3	2	4	6	o
3	2	5	7	d
3	2	6	8	c
4	6	1	1	o
4	6	2	5	c
4	6	3	5	b
4	6	4	6	o
4	6	5	7	d
4	6	6	8	c
5	4	1	1	o
5	4	2	5	c
5	4	3	5	b
5	4	4	6	o
5	4	5	7	d
5	4	6	8	c
6	7	1	1	o
6	7	2	5	c
6	7	3	5	b
6	7	4	6	o
6	7	5	7	d
6	7	6	8	c
insert into t4_temp (select * from t1 inner join t2 on t1.c1>1 where t2.c3 is not null);
rollback;
insert into t4_temp (select /*+ NO_REWRITE */* from t1 inner join t2 on t1.c1>1 where t2.c3 is not null);
rollback;
update t1 set c2 = (select t1.c1 from t1 inner join t2 on t1.c1>1 where t2.c3 is not null limit 1);
select stddev(c2) from t1;
stddev(c2)
0
rollback;
update t1 set c2 = (select /*+ NO_REWRITE */t1.c1 from t1 inner join t2 on t1.c1>1 where t2.c3 is not null limit 1);
select stddev(c2) from t1;
stddev(c2)
0
rollback;
delete from t1 where c2 = (select t1.c1 from t1 inner join t2 on t1.c1>1 where t2.c3 is not null limit 1);
select stddev(c2) from t1;
stddev(c2)
2.0591260281974
rollback;
delete from t1 where c2 = (select /*+ NO_REWRITE */t1.c1 from t1 inner join t2 on t1.c1>1 where t2.c3 is not null limit 1);
select stddev(c2) from t1;
stddev(c2)
2.0591260281974
rollback;
select * from t1, t2 where t1.c1 > 1 and t2.c3 is not null;
c1	c2	c1	c2	c3
2	5	1	1	o
2	5	2	5	c
2	5	3	5	b
2	5	4	6	o
2	5	5	7	d
2	5	6	8	c
3	2	1	1	o
3	2	2	5	c
3	2	3	5	b
3	2	4	6	o
3	2	5	7	d
3	2	6	8	c
4	6	1	1	o
4	6	2	5	c
4	6	3	5	b
4	6	4	6	o
4	6	5	7	d
4	6	6	8	c
5	4	1	1	o
5	4	2	5	c
5	4	3	5	b
5	4	4	6	o
5	4	5	7	d
5	4	6	8	c
6	7	1	1	o
6	7	2	5	c
6	7	3	5	b
6	7	4	6	o
6	7	5	7	d
6	7	6	8	c
select /*+ NO_REWRITE */* from t1, t2 where t1.c1 > 1 and t2.c3 is not null;
c1	c2	c1	c2	c3
2	5	1	1	o
2	5	2	5	c
2	5	3	5	b
2	5	4	6	o
2	5	5	7	d
2	5	6	8	c
3	2	1	1	o
3	2	2	5	c
3	2	3	5	b
3	2	4	6	o
3	2	5	7	d
3	2	6	8	c
4	6	1	1	o
4	6	2	5	c
4	6	3	5	b
4	6	4	6	o
4	6	5	7	d
4	6	6	8	c
5	4	1	1	o
5	4	2	5	c
5	4	3	5	b
5	4	4	6	o
5	4	5	7	d
5	4	6	8	c
6	7	1	1	o
6	7	2	5	c
6	7	3	5	b
6	7	4	6	o
6	7	5	7	d
6	7	6	8	c
insert into t4_temp (select * from t1, t2 where t1.c1 > 1 and t2.c3 is not null);
rollback;
insert into t4_temp (select /*+ NO_REWRITE */* from t1, t2 where t1.c1 > 1 and t2.c3 is not null);
rollback;
update t1 set c2 = (select t1.c1 from t1, t2 where t1.c1 > 1 and t2.c3 is not null limit 1);
select stddev(c2) from t1;
stddev(c2)
0
rollback;
update t1 set c2 = (select /*+ NO_REWRITE */t1.c1 from t1, t2 where t1.c1 > 1 and t2.c3 is not null limit 1);
select stddev(c2) from t1;
stddev(c2)
0
rollback;
delete from t1 where c2 = (select t1.c1 from t1, t2 where t1.c1 > 1 and t2.c3 is not null limit 1);
select stddev(c2) from t1;
stddev(c2)
2.0591260281974
rollback;
delete from t1 where c2 = (select /*+ NO_REWRITE */t1.c1 from t1, t2 where t1.c1 > 1 and t2.c3 is not null limit 1);
select stddev(c2) from t1;
stddev(c2)
2.0591260281974
rollback;
select * from t1 left join t2 on t1.c1=t2.c1 left join t3 on t1.c1=t2.c1;
c1	c2	c1	c2	c3	c1	c2	c3
1	1	1	1	o	1	2	3
1	1	1	1	o	2	5	4
1	1	1	1	o	3	6	1
1	1	1	1	o	4	5	1
1	1	1	1	o	5	5	5
1	1	1	1	o	6	5	c
2	5	2	5	c	1	2	3
2	5	2	5	c	2	5	4
2	5	2	5	c	3	6	1
2	5	2	5	c	4	5	1
2	5	2	5	c	5	5	5
2	5	2	5	c	6	5	c
3	2	3	5	b	1	2	3
3	2	3	5	b	2	5	4
3	2	3	5	b	3	6	1
3	2	3	5	b	4	5	1
3	2	3	5	b	5	5	5
3	2	3	5	b	6	5	c
4	6	4	6	o	1	2	3
4	6	4	6	o	2	5	4
4	6	4	6	o	3	6	1
4	6	4	6	o	4	5	1
4	6	4	6	o	5	5	5
4	6	4	6	o	6	5	c
5	4	5	7	d	1	2	3
5	4	5	7	d	2	5	4
5	4	5	7	d	3	6	1
5	4	5	7	d	4	5	1
5	4	5	7	d	5	5	5
5	4	5	7	d	6	5	c
6	7	6	8	c	1	2	3
6	7	6	8	c	2	5	4
6	7	6	8	c	3	6	1
6	7	6	8	c	4	5	1
6	7	6	8	c	5	5	5
6	7	6	8	c	6	5	c
select /*+ NO_REWRITE */* from t1 left join t2 on t1.c1=t2.c1 left join t3 on t1.c1=t2.c1;
c1	c2	c1	c2	c3	c1	c2	c3
1	1	1	1	o	1	2	3
1	1	1	1	o	2	5	4
1	1	1	1	o	3	6	1
1	1	1	1	o	4	5	1
1	1	1	1	o	5	5	5
1	1	1	1	o	6	5	c
2	5	2	5	c	1	2	3
2	5	2	5	c	2	5	4
2	5	2	5	c	3	6	1
2	5	2	5	c	4	5	1
2	5	2	5	c	5	5	5
2	5	2	5	c	6	5	c
3	2	3	5	b	1	2	3
3	2	3	5	b	2	5	4
3	2	3	5	b	3	6	1
3	2	3	5	b	4	5	1
3	2	3	5	b	5	5	5
3	2	3	5	b	6	5	c
4	6	4	6	o	1	2	3
4	6	4	6	o	2	5	4
4	6	4	6	o	3	6	1
4	6	4	6	o	4	5	1
4	6	4	6	o	5	5	5
4	6	4	6	o	6	5	c
5	4	5	7	d	1	2	3
5	4	5	7	d	2	5	4
5	4	5	7	d	3	6	1
5	4	5	7	d	4	5	1
5	4	5	7	d	5	5	5
5	4	5	7	d	6	5	c
6	7	6	8	c	1	2	3
6	7	6	8	c	2	5	4
6	7	6	8	c	3	6	1
6	7	6	8	c	4	5	1
6	7	6	8	c	5	5	5
6	7	6	8	c	6	5	c
insert into t5_temp (select * from t1 left join t2 on t1.c1=t2.c1 left join t3 on t1.c1=t2.c1);
rollback;
insert into t5_temp (select /*+ NO_REWRITE */* from t1 left join t2 on t1.c1=t2.c1 left join t3 on t1.c1=t2.c1);
rollback;
update t1 set c2 = (select t1.c1 from t1 left join t2 on t1.c1=t2.c1 left join t3 on t1.c1=t2.c1 limit 1);
select stddev(c2) from t1;
stddev(c2)
0
rollback;
update t1 set c2 = (select /*+ NO_REWRITE */t1.c1 from t1 left join t2 on t1.c1=t2.c1 left join t3 on t1.c1=t2.c1 limit 1);
select stddev(c2) from t1;
stddev(c2)
0
rollback;
delete from t1 where c2 = (select t1.c1 from t1 left join t2 on t1.c1=t2.c1 left join t3 on t1.c1=t2.c1 limit 1);
select stddev(c2) from t1;
stddev(c2)
1.7204650534085253
rollback;
delete from t1 where c2 = (select /*+ NO_REWRITE */t1.c1 from t1 left join t2 on t1.c1=t2.c1 left join t3 on t1.c1=t2.c1 limit 1);
select stddev(c2) from t1;
stddev(c2)
1.7204650534085253
rollback;
select * from t1 left join t2 t on t1.c1=t.c1,t2 left join t3 on t2.c1=t3.c1, t1 tt where t1.c1 is not null;
c1	c2	c1	c2	c3	c1	c2	c3	c1	c2	c3	c1	c2
1	1	1	1	o	1	1	o	1	2	3	1	1
1	1	1	1	o	1	1	o	1	2	3	2	5
1	1	1	1	o	1	1	o	1	2	3	3	2
1	1	1	1	o	1	1	o	1	2	3	4	6
1	1	1	1	o	1	1	o	1	2	3	5	4
1	1	1	1	o	1	1	o	1	2	3	6	7
1	1	1	1	o	2	5	c	2	5	4	1	1
1	1	1	1	o	2	5	c	2	5	4	2	5
1	1	1	1	o	2	5	c	2	5	4	3	2
1	1	1	1	o	2	5	c	2	5	4	4	6
1	1	1	1	o	2	5	c	2	5	4	5	4
1	1	1	1	o	2	5	c	2	5	4	6	7
1	1	1	1	o	3	5	b	3	6	1	1	1
1	1	1	1	o	3	5	b	3	6	1	2	5
1	1	1	1	o	3	5	b	3	6	1	3	2
1	1	1	1	o	3	5	b	3	6	1	4	6
1	1	1	1	o	3	5	b	3	6	1	5	4
1	1	1	1	o	3	5	b	3	6	1	6	7
1	1	1	1	o	4	6	o	4	5	1	1	1
1	1	1	1	o	4	6	o	4	5	1	2	5
1	1	1	1	o	4	6	o	4	5	1	3	2
1	1	1	1	o	4	6	o	4	5	1	4	6
1	1	1	1	o	4	6	o	4	5	1	5	4
1	1	1	1	o	4	6	o	4	5	1	6	7
1	1	1	1	o	5	7	d	5	5	5	1	1
1	1	1	1	o	5	7	d	5	5	5	2	5
1	1	1	1	o	5	7	d	5	5	5	3	2
1	1	1	1	o	5	7	d	5	5	5	4	6
1	1	1	1	o	5	7	d	5	5	5	5	4
1	1	1	1	o	5	7	d	5	5	5	6	7
1	1	1	1	o	6	8	c	6	5	c	1	1
1	1	1	1	o	6	8	c	6	5	c	2	5
1	1	1	1	o	6	8	c	6	5	c	3	2
1	1	1	1	o	6	8	c	6	5	c	4	6
1	1	1	1	o	6	8	c	6	5	c	5	4
1	1	1	1	o	6	8	c	6	5	c	6	7
2	5	2	5	c	1	1	o	1	2	3	1	1
2	5	2	5	c	1	1	o	1	2	3	2	5
2	5	2	5	c	1	1	o	1	2	3	3	2
2	5	2	5	c	1	1	o	1	2	3	4	6
2	5	2	5	c	1	1	o	1	2	3	5	4
2	5	2	5	c	1	1	o	1	2	3	6	7
2	5	2	5	c	2	5	c	2	5	4	1	1
2	5	2	5	c	2	5	c	2	5	4	2	5
2	5	2	5	c	2	5	c	2	5	4	3	2
2	5	2	5	c	2	5	c	2	5	4	4	6
2	5	2	5	c	2	5	c	2	5	4	5	4
2	5	2	5	c	2	5	c	2	5	4	6	7
2	5	2	5	c	3	5	b	3	6	1	1	1
2	5	2	5	c	3	5	b	3	6	1	2	5
2	5	2	5	c	3	5	b	3	6	1	3	2
2	5	2	5	c	3	5	b	3	6	1	4	6
2	5	2	5	c	3	5	b	3	6	1	5	4
2	5	2	5	c	3	5	b	3	6	1	6	7
2	5	2	5	c	4	6	o	4	5	1	1	1
2	5	2	5	c	4	6	o	4	5	1	2	5
2	5	2	5	c	4	6	o	4	5	1	3	2
2	5	2	5	c	4	6	o	4	5	1	4	6
2	5	2	5	c	4	6	o	4	5	1	5	4
2	5	2	5	c	4	6	o	4	5	1	6	7
2	5	2	5	c	5	7	d	5	5	5	1	1
2	5	2	5	c	5	7	d	5	5	5	2	5
2	5	2	5	c	5	7	d	5	5	5	3	2
2	5	2	5	c	5	7	d	5	5	5	4	6
2	5	2	5	c	5	7	d	5	5	5	5	4
2	5	2	5	c	5	7	d	5	5	5	6	7
2	5	2	5	c	6	8	c	6	5	c	1	1
2	5	2	5	c	6	8	c	6	5	c	2	5
2	5	2	5	c	6	8	c	6	5	c	3	2
2	5	2	5	c	6	8	c	6	5	c	4	6
2	5	2	5	c	6	8	c	6	5	c	5	4
2	5	2	5	c	6	8	c	6	5	c	6	7
3	2	3	5	b	1	1	o	1	2	3	1	1
3	2	3	5	b	1	1	o	1	2	3	2	5
3	2	3	5	b	1	1	o	1	2	3	3	2
3	2	3	5	b	1	1	o	1	2	3	4	6
3	2	3	5	b	1	1	o	1	2	3	5	4
3	2	3	5	b	1	1	o	1	2	3	6	7
3	2	3	5	b	2	5	c	2	5	4	1	1
3	2	3	5	b	2	5	c	2	5	4	2	5
3	2	3	5	b	2	5	c	2	5	4	3	2
3	2	3	5	b	2	5	c	2	5	4	4	6
3	2	3	5	b	2	5	c	2	5	4	5	4
3	2	3	5	b	2	5	c	2	5	4	6	7
3	2	3	5	b	3	5	b	3	6	1	1	1
3	2	3	5	b	3	5	b	3	6	1	2	5
3	2	3	5	b	3	5	b	3	6	1	3	2
3	2	3	5	b	3	5	b	3	6	1	4	6
3	2	3	5	b	3	5	b	3	6	1	5	4
3	2	3	5	b	3	5	b	3	6	1	6	7
3	2	3	5	b	4	6	o	4	5	1	1	1
3	2	3	5	b	4	6	o	4	5	1	2	5
3	2	3	5	b	4	6	o	4	5	1	3	2
3	2	3	5	b	4	6	o	4	5	1	4	6
3	2	3	5	b	4	6	o	4	5	1	5	4
3	2	3	5	b	4	6	o	4	5	1	6	7
3	2	3	5	b	5	7	d	5	5	5	1	1
3	2	3	5	b	5	7	d	5	5	5	2	5
3	2	3	5	b	5	7	d	5	5	5	3	2
3	2	3	5	b	5	7	d	5	5	5	4	6
3	2	3	5	b	5	7	d	5	5	5	5	4
3	2	3	5	b	5	7	d	5	5	5	6	7
3	2	3	5	b	6	8	c	6	5	c	1	1
3	2	3	5	b	6	8	c	6	5	c	2	5
3	2	3	5	b	6	8	c	6	5	c	3	2
3	2	3	5	b	6	8	c	6	5	c	4	6
3	2	3	5	b	6	8	c	6	5	c	5	4
3	2	3	5	b	6	8	c	6	5	c	6	7
4	6	4	6	o	1	1	o	1	2	3	1	1
4	6	4	6	o	1	1	o	1	2	3	2	5
4	6	4	6	o	1	1	o	1	2	3	3	2
4	6	4	6	o	1	1	o	1	2	3	4	6
4	6	4	6	o	1	1	o	1	2	3	5	4
4	6	4	6	o	1	1	o	1	2	3	6	7
4	6	4	6	o	2	5	c	2	5	4	1	1
4	6	4	6	o	2	5	c	2	5	4	2	5
4	6	4	6	o	2	5	c	2	5	4	3	2
4	6	4	6	o	2	5	c	2	5	4	4	6
4	6	4	6	o	2	5	c	2	5	4	5	4
4	6	4	6	o	2	5	c	2	5	4	6	7
4	6	4	6	o	3	5	b	3	6	1	1	1
4	6	4	6	o	3	5	b	3	6	1	2	5
4	6	4	6	o	3	5	b	3	6	1	3	2
4	6	4	6	o	3	5	b	3	6	1	4	6
4	6	4	6	o	3	5	b	3	6	1	5	4
4	6	4	6	o	3	5	b	3	6	1	6	7
4	6	4	6	o	4	6	o	4	5	1	1	1
4	6	4	6	o	4	6	o	4	5	1	2	5
4	6	4	6	o	4	6	o	4	5	1	3	2
4	6	4	6	o	4	6	o	4	5	1	4	6
4	6	4	6	o	4	6	o	4	5	1	5	4
4	6	4	6	o	4	6	o	4	5	1	6	7
4	6	4	6	o	5	7	d	5	5	5	1	1
4	6	4	6	o	5	7	d	5	5	5	2	5
4	6	4	6	o	5	7	d	5	5	5	3	2
4	6	4	6	o	5	7	d	5	5	5	4	6
4	6	4	6	o	5	7	d	5	5	5	5	4
4	6	4	6	o	5	7	d	5	5	5	6	7
4	6	4	6	o	6	8	c	6	5	c	1	1
4	6	4	6	o	6	8	c	6	5	c	2	5
4	6	4	6	o	6	8	c	6	5	c	3	2
4	6	4	6	o	6	8	c	6	5	c	4	6
4	6	4	6	o	6	8	c	6	5	c	5	4
4	6	4	6	o	6	8	c	6	5	c	6	7
5	4	5	7	d	1	1	o	1	2	3	1	1
5	4	5	7	d	1	1	o	1	2	3	2	5
5	4	5	7	d	1	1	o	1	2	3	3	2
5	4	5	7	d	1	1	o	1	2	3	4	6
5	4	5	7	d	1	1	o	1	2	3	5	4
5	4	5	7	d	1	1	o	1	2	3	6	7
5	4	5	7	d	2	5	c	2	5	4	1	1
5	4	5	7	d	2	5	c	2	5	4	2	5
5	4	5	7	d	2	5	c	2	5	4	3	2
5	4	5	7	d	2	5	c	2	5	4	4	6
5	4	5	7	d	2	5	c	2	5	4	5	4
5	4	5	7	d	2	5	c	2	5	4	6	7
5	4	5	7	d	3	5	b	3	6	1	1	1
5	4	5	7	d	3	5	b	3	6	1	2	5
5	4	5	7	d	3	5	b	3	6	1	3	2
5	4	5	7	d	3	5	b	3	6	1	4	6
5	4	5	7	d	3	5	b	3	6	1	5	4
5	4	5	7	d	3	5	b	3	6	1	6	7
5	4	5	7	d	4	6	o	4	5	1	1	1
5	4	5	7	d	4	6	o	4	5	1	2	5
5	4	5	7	d	4	6	o	4	5	1	3	2
5	4	5	7	d	4	6	o	4	5	1	4	6
5	4	5	7	d	4	6	o	4	5	1	5	4
5	4	5	7	d	4	6	o	4	5	1	6	7
5	4	5	7	d	5	7	d	5	5	5	1	1
5	4	5	7	d	5	7	d	5	5	5	2	5
5	4	5	7	d	5	7	d	5	5	5	3	2
5	4	5	7	d	5	7	d	5	5	5	4	6
5	4	5	7	d	5	7	d	5	5	5	5	4
5	4	5	7	d	5	7	d	5	5	5	6	7
5	4	5	7	d	6	8	c	6	5	c	1	1
5	4	5	7	d	6	8	c	6	5	c	2	5
5	4	5	7	d	6	8	c	6	5	c	3	2
5	4	5	7	d	6	8	c	6	5	c	4	6
5	4	5	7	d	6	8	c	6	5	c	5	4
5	4	5	7	d	6	8	c	6	5	c	6	7
6	7	6	8	c	1	1	o	1	2	3	1	1
6	7	6	8	c	1	1	o	1	2	3	2	5
6	7	6	8	c	1	1	o	1	2	3	3	2
6	7	6	8	c	1	1	o	1	2	3	4	6
6	7	6	8	c	1	1	o	1	2	3	5	4
6	7	6	8	c	1	1	o	1	2	3	6	7
6	7	6	8	c	2	5	c	2	5	4	1	1
6	7	6	8	c	2	5	c	2	5	4	2	5
6	7	6	8	c	2	5	c	2	5	4	3	2
6	7	6	8	c	2	5	c	2	5	4	4	6
6	7	6	8	c	2	5	c	2	5	4	5	4
6	7	6	8	c	2	5	c	2	5	4	6	7
6	7	6	8	c	3	5	b	3	6	1	1	1
6	7	6	8	c	3	5	b	3	6	1	2	5
6	7	6	8	c	3	5	b	3	6	1	3	2
6	7	6	8	c	3	5	b	3	6	1	4	6
6	7	6	8	c	3	5	b	3	6	1	5	4
6	7	6	8	c	3	5	b	3	6	1	6	7
6	7	6	8	c	4	6	o	4	5	1	1	1
6	7	6	8	c	4	6	o	4	5	1	2	5
6	7	6	8	c	4	6	o	4	5	1	3	2
6	7	6	8	c	4	6	o	4	5	1	4	6
6	7	6	8	c	4	6	o	4	5	1	5	4
6	7	6	8	c	4	6	o	4	5	1	6	7
6	7	6	8	c	5	7	d	5	5	5	1	1
6	7	6	8	c	5	7	d	5	5	5	2	5
6	7	6	8	c	5	7	d	5	5	5	3	2
6	7	6	8	c	5	7	d	5	5	5	4	6
6	7	6	8	c	5	7	d	5	5	5	5	4
6	7	6	8	c	5	7	d	5	5	5	6	7
6	7	6	8	c	6	8	c	6	5	c	1	1
6	7	6	8	c	6	8	c	6	5	c	2	5
6	7	6	8	c	6	8	c	6	5	c	3	2
6	7	6	8	c	6	8	c	6	5	c	4	6
6	7	6	8	c	6	8	c	6	5	c	5	4
6	7	6	8	c	6	8	c	6	5	c	6	7
select /*+ NO_REWRITE */* from t1 left join t2 t on t1.c1=t.c1,t2 left join t3 on t2.c1=t3.c1, t1 tt where t1.c1 is not null;
c1	c2	c1	c2	c3	c1	c2	c3	c1	c2	c3	c1	c2
1	1	1	1	o	1	1	o	1	2	3	1	1
1	1	1	1	o	1	1	o	1	2	3	2	5
1	1	1	1	o	1	1	o	1	2	3	3	2
1	1	1	1	o	1	1	o	1	2	3	4	6
1	1	1	1	o	1	1	o	1	2	3	5	4
1	1	1	1	o	1	1	o	1	2	3	6	7
1	1	1	1	o	2	5	c	2	5	4	1	1
1	1	1	1	o	2	5	c	2	5	4	2	5
1	1	1	1	o	2	5	c	2	5	4	3	2
1	1	1	1	o	2	5	c	2	5	4	4	6
1	1	1	1	o	2	5	c	2	5	4	5	4
1	1	1	1	o	2	5	c	2	5	4	6	7
1	1	1	1	o	3	5	b	3	6	1	1	1
1	1	1	1	o	3	5	b	3	6	1	2	5
1	1	1	1	o	3	5	b	3	6	1	3	2
1	1	1	1	o	3	5	b	3	6	1	4	6
1	1	1	1	o	3	5	b	3	6	1	5	4
1	1	1	1	o	3	5	b	3	6	1	6	7
1	1	1	1	o	4	6	o	4	5	1	1	1
1	1	1	1	o	4	6	o	4	5	1	2	5
1	1	1	1	o	4	6	o	4	5	1	3	2
1	1	1	1	o	4	6	o	4	5	1	4	6
1	1	1	1	o	4	6	o	4	5	1	5	4
1	1	1	1	o	4	6	o	4	5	1	6	7
1	1	1	1	o	5	7	d	5	5	5	1	1
1	1	1	1	o	5	7	d	5	5	5	2	5
1	1	1	1	o	5	7	d	5	5	5	3	2
1	1	1	1	o	5	7	d	5	5	5	4	6
1	1	1	1	o	5	7	d	5	5	5	5	4
1	1	1	1	o	5	7	d	5	5	5	6	7
1	1	1	1	o	6	8	c	6	5	c	1	1
1	1	1	1	o	6	8	c	6	5	c	2	5
1	1	1	1	o	6	8	c	6	5	c	3	2
1	1	1	1	o	6	8	c	6	5	c	4	6
1	1	1	1	o	6	8	c	6	5	c	5	4
1	1	1	1	o	6	8	c	6	5	c	6	7
2	5	2	5	c	1	1	o	1	2	3	1	1
2	5	2	5	c	1	1	o	1	2	3	2	5
2	5	2	5	c	1	1	o	1	2	3	3	2
2	5	2	5	c	1	1	o	1	2	3	4	6
2	5	2	5	c	1	1	o	1	2	3	5	4
2	5	2	5	c	1	1	o	1	2	3	6	7
2	5	2	5	c	2	5	c	2	5	4	1	1
2	5	2	5	c	2	5	c	2	5	4	2	5
2	5	2	5	c	2	5	c	2	5	4	3	2
2	5	2	5	c	2	5	c	2	5	4	4	6
2	5	2	5	c	2	5	c	2	5	4	5	4
2	5	2	5	c	2	5	c	2	5	4	6	7
2	5	2	5	c	3	5	b	3	6	1	1	1
2	5	2	5	c	3	5	b	3	6	1	2	5
2	5	2	5	c	3	5	b	3	6	1	3	2
2	5	2	5	c	3	5	b	3	6	1	4	6
2	5	2	5	c	3	5	b	3	6	1	5	4
2	5	2	5	c	3	5	b	3	6	1	6	7
2	5	2	5	c	4	6	o	4	5	1	1	1
2	5	2	5	c	4	6	o	4	5	1	2	5
2	5	2	5	c	4	6	o	4	5	1	3	2
2	5	2	5	c	4	6	o	4	5	1	4	6
2	5	2	5	c	4	6	o	4	5	1	5	4
2	5	2	5	c	4	6	o	4	5	1	6	7
2	5	2	5	c	5	7	d	5	5	5	1	1
2	5	2	5	c	5	7	d	5	5	5	2	5
2	5	2	5	c	5	7	d	5	5	5	3	2
2	5	2	5	c	5	7	d	5	5	5	4	6
2	5	2	5	c	5	7	d	5	5	5	5	4
2	5	2	5	c	5	7	d	5	5	5	6	7
2	5	2	5	c	6	8	c	6	5	c	1	1
2	5	2	5	c	6	8	c	6	5	c	2	5
2	5	2	5	c	6	8	c	6	5	c	3	2
2	5	2	5	c	6	8	c	6	5	c	4	6
2	5	2	5	c	6	8	c	6	5	c	5	4
2	5	2	5	c	6	8	c	6	5	c	6	7
3	2	3	5	b	1	1	o	1	2	3	1	1
3	2	3	5	b	1	1	o	1	2	3	2	5
3	2	3	5	b	1	1	o	1	2	3	3	2
3	2	3	5	b	1	1	o	1	2	3	4	6
3	2	3	5	b	1	1	o	1	2	3	5	4
3	2	3	5	b	1	1	o	1	2	3	6	7
3	2	3	5	b	2	5	c	2	5	4	1	1
3	2	3	5	b	2	5	c	2	5	4	2	5
3	2	3	5	b	2	5	c	2	5	4	3	2
3	2	3	5	b	2	5	c	2	5	4	4	6
3	2	3	5	b	2	5	c	2	5	4	5	4
3	2	3	5	b	2	5	c	2	5	4	6	7
3	2	3	5	b	3	5	b	3	6	1	1	1
3	2	3	5	b	3	5	b	3	6	1	2	5
3	2	3	5	b	3	5	b	3	6	1	3	2
3	2	3	5	b	3	5	b	3	6	1	4	6
3	2	3	5	b	3	5	b	3	6	1	5	4
3	2	3	5	b	3	5	b	3	6	1	6	7
3	2	3	5	b	4	6	o	4	5	1	1	1
3	2	3	5	b	4	6	o	4	5	1	2	5
3	2	3	5	b	4	6	o	4	5	1	3	2
3	2	3	5	b	4	6	o	4	5	1	4	6
3	2	3	5	b	4	6	o	4	5	1	5	4
3	2	3	5	b	4	6	o	4	5	1	6	7
3	2	3	5	b	5	7	d	5	5	5	1	1
3	2	3	5	b	5	7	d	5	5	5	2	5
3	2	3	5	b	5	7	d	5	5	5	3	2
3	2	3	5	b	5	7	d	5	5	5	4	6
3	2	3	5	b	5	7	d	5	5	5	5	4
3	2	3	5	b	5	7	d	5	5	5	6	7
3	2	3	5	b	6	8	c	6	5	c	1	1
3	2	3	5	b	6	8	c	6	5	c	2	5
3	2	3	5	b	6	8	c	6	5	c	3	2
3	2	3	5	b	6	8	c	6	5	c	4	6
3	2	3	5	b	6	8	c	6	5	c	5	4
3	2	3	5	b	6	8	c	6	5	c	6	7
4	6	4	6	o	1	1	o	1	2	3	1	1
4	6	4	6	o	1	1	o	1	2	3	2	5
4	6	4	6	o	1	1	o	1	2	3	3	2
4	6	4	6	o	1	1	o	1	2	3	4	6
4	6	4	6	o	1	1	o	1	2	3	5	4
4	6	4	6	o	1	1	o	1	2	3	6	7
4	6	4	6	o	2	5	c	2	5	4	1	1
4	6	4	6	o	2	5	c	2	5	4	2	5
4	6	4	6	o	2	5	c	2	5	4	3	2
4	6	4	6	o	2	5	c	2	5	4	4	6
4	6	4	6	o	2	5	c	2	5	4	5	4
4	6	4	6	o	2	5	c	2	5	4	6	7
4	6	4	6	o	3	5	b	3	6	1	1	1
4	6	4	6	o	3	5	b	3	6	1	2	5
4	6	4	6	o	3	5	b	3	6	1	3	2
4	6	4	6	o	3	5	b	3	6	1	4	6
4	6	4	6	o	3	5	b	3	6	1	5	4
4	6	4	6	o	3	5	b	3	6	1	6	7
4	6	4	6	o	4	6	o	4	5	1	1	1
4	6	4	6	o	4	6	o	4	5	1	2	5
4	6	4	6	o	4	6	o	4	5	1	3	2
4	6	4	6	o	4	6	o	4	5	1	4	6
4	6	4	6	o	4	6	o	4	5	1	5	4
4	6	4	6	o	4	6	o	4	5	1	6	7
4	6	4	6	o	5	7	d	5	5	5	1	1
4	6	4	6	o	5	7	d	5	5	5	2	5
4	6	4	6	o	5	7	d	5	5	5	3	2
4	6	4	6	o	5	7	d	5	5	5	4	6
4	6	4	6	o	5	7	d	5	5	5	5	4
4	6	4	6	o	5	7	d	5	5	5	6	7
4	6	4	6	o	6	8	c	6	5	c	1	1
4	6	4	6	o	6	8	c	6	5	c	2	5
4	6	4	6	o	6	8	c	6	5	c	3	2
4	6	4	6	o	6	8	c	6	5	c	4	6
4	6	4	6	o	6	8	c	6	5	c	5	4
4	6	4	6	o	6	8	c	6	5	c	6	7
5	4	5	7	d	1	1	o	1	2	3	1	1
5	4	5	7	d	1	1	o	1	2	3	2	5
5	4	5	7	d	1	1	o	1	2	3	3	2
5	4	5	7	d	1	1	o	1	2	3	4	6
5	4	5	7	d	1	1	o	1	2	3	5	4
5	4	5	7	d	1	1	o	1	2	3	6	7
5	4	5	7	d	2	5	c	2	5	4	1	1
5	4	5	7	d	2	5	c	2	5	4	2	5
5	4	5	7	d	2	5	c	2	5	4	3	2
5	4	5	7	d	2	5	c	2	5	4	4	6
5	4	5	7	d	2	5	c	2	5	4	5	4
5	4	5	7	d	2	5	c	2	5	4	6	7
5	4	5	7	d	3	5	b	3	6	1	1	1
5	4	5	7	d	3	5	b	3	6	1	2	5
5	4	5	7	d	3	5	b	3	6	1	3	2
5	4	5	7	d	3	5	b	3	6	1	4	6
5	4	5	7	d	3	5	b	3	6	1	5	4
5	4	5	7	d	3	5	b	3	6	1	6	7
5	4	5	7	d	4	6	o	4	5	1	1	1
5	4	5	7	d	4	6	o	4	5	1	2	5
5	4	5	7	d	4	6	o	4	5	1	3	2
5	4	5	7	d	4	6	o	4	5	1	4	6
5	4	5	7	d	4	6	o	4	5	1	5	4
5	4	5	7	d	4	6	o	4	5	1	6	7
5	4	5	7	d	5	7	d	5	5	5	1	1
5	4	5	7	d	5	7	d	5	5	5	2	5
5	4	5	7	d	5	7	d	5	5	5	3	2
5	4	5	7	d	5	7	d	5	5	5	4	6
5	4	5	7	d	5	7	d	5	5	5	5	4
5	4	5	7	d	5	7	d	5	5	5	6	7
5	4	5	7	d	6	8	c	6	5	c	1	1
5	4	5	7	d	6	8	c	6	5	c	2	5
5	4	5	7	d	6	8	c	6	5	c	3	2
5	4	5	7	d	6	8	c	6	5	c	4	6
5	4	5	7	d	6	8	c	6	5	c	5	4
5	4	5	7	d	6	8	c	6	5	c	6	7
6	7	6	8	c	1	1	o	1	2	3	1	1
6	7	6	8	c	1	1	o	1	2	3	2	5
6	7	6	8	c	1	1	o	1	2	3	3	2
6	7	6	8	c	1	1	o	1	2	3	4	6
6	7	6	8	c	1	1	o	1	2	3	5	4
6	7	6	8	c	1	1	o	1	2	3	6	7
6	7	6	8	c	2	5	c	2	5	4	1	1
6	7	6	8	c	2	5	c	2	5	4	2	5
6	7	6	8	c	2	5	c	2	5	4	3	2
6	7	6	8	c	2	5	c	2	5	4	4	6
6	7	6	8	c	2	5	c	2	5	4	5	4
6	7	6	8	c	2	5	c	2	5	4	6	7
6	7	6	8	c	3	5	b	3	6	1	1	1
6	7	6	8	c	3	5	b	3	6	1	2	5
6	7	6	8	c	3	5	b	3	6	1	3	2
6	7	6	8	c	3	5	b	3	6	1	4	6
6	7	6	8	c	3	5	b	3	6	1	5	4
6	7	6	8	c	3	5	b	3	6	1	6	7
6	7	6	8	c	4	6	o	4	5	1	1	1
6	7	6	8	c	4	6	o	4	5	1	2	5
6	7	6	8	c	4	6	o	4	5	1	3	2
6	7	6	8	c	4	6	o	4	5	1	4	6
6	7	6	8	c	4	6	o	4	5	1	5	4
6	7	6	8	c	4	6	o	4	5	1	6	7
6	7	6	8	c	5	7	d	5	5	5	1	1
6	7	6	8	c	5	7	d	5	5	5	2	5
6	7	6	8	c	5	7	d	5	5	5	3	2
6	7	6	8	c	5	7	d	5	5	5	4	6
6	7	6	8	c	5	7	d	5	5	5	5	4
6	7	6	8	c	5	7	d	5	5	5	6	7
6	7	6	8	c	6	8	c	6	5	c	1	1
6	7	6	8	c	6	8	c	6	5	c	2	5
6	7	6	8	c	6	8	c	6	5	c	3	2
6	7	6	8	c	6	8	c	6	5	c	4	6
6	7	6	8	c	6	8	c	6	5	c	5	4
6	7	6	8	c	6	8	c	6	5	c	6	7
insert into t10_temp (select * from t1 left join t2 t on t1.c1=t.c1,t2 left join t3 on t2.c1=t3.c1, t1 tt where t1.c1 is not null);
rollback;
insert into t10_temp (select /*+ NO_REWRITE */* from t1 left join t2 t on t1.c1=t.c1,t2 left join t3 on t2.c1=t3.c1, t1 tt where t1.c1 is not null);
rollback;
update t1 set c2 = (select t1.c1 from t1 left join t2 t on t1.c1=t.c1,t2 left join t3 on t2.c1=t3.c1, t1 tt where t1.c1 is not null limit 1);
select stddev(c2) from t1;
stddev(c2)
0
rollback;
update t1 set c2 = (select /*+ NO_REWRITE */t1.c1 from t1 left join t2 t on t1.c1=t.c1,t2 left join t3 on t2.c1=t3.c1, t1 tt where t1.c1 is not null limit 1);
select stddev(c2) from t1;
stddev(c2)
0
rollback;
delete from t1 where c2 = (select t1.c1 from t1 left join t2 t on t1.c1=t.c1,t2 left join t3 on t2.c1=t3.c1, t1 tt where t1.c1 is not null limit 1);
select stddev(c2) from t1;
stddev(c2)
1.7204650534085253
rollback;
delete from t1 where c2 = (select /*+ NO_REWRITE */t1.c1 from t1 left join t2 t on t1.c1=t.c1,t2 left join t3 on t2.c1=t3.c1, t1 tt where t1.c1 is not null limit 1);
select stddev(c2) from t1;
stddev(c2)
1.7204650534085253
rollback;
select t1.c1 from t1,t2,t3, t1 tt where t1.c1=t3.c1 and t1.c2=tt.c2 and t1.c1+t2.c1=tt.c1;
c1
select /*+ NO_REWRITE */t1.c1 from t1,t2,t3, t1 tt where t1.c1=t3.c1 and t1.c2=tt.c2 and t1.c1+t2.c1=tt.c1;
c1
insert into t12_temp (select t1.c1 from t1,t2,t3, t1 tt where t1.c1=t3.c1 and t1.c2=tt.c2 and t1.c1+t2.c1=tt.c1);
rollback;
insert into t12_temp (select /*+ NO_REWRITE */t1.c1 from t1,t2,t3, t1 tt where t1.c1=t3.c1 and t1.c2=tt.c2 and t1.c1+t2.c1=tt.c1);
rollback;
update t1 set c2 = (select t1.c1 from t1,t2,t3, t1 tt where t1.c1=t3.c1 and t1.c2=tt.c2 and t1.c1+t2.c1=tt.c1 limit 1);
select stddev(c2) from t1;
stddev(c2)
NULL
rollback;
update t1 set c2 = (select /*+ NO_REWRITE */t1.c1 from t1,t2,t3, t1 tt where t1.c1=t3.c1 and t1.c2=tt.c2 and t1.c1+t2.c1=tt.c1 limit 1);
select stddev(c2) from t1;
stddev(c2)
NULL
rollback;
delete from t1 where c2 = (select t1.c1 from t1,t2,t3, t1 tt where t1.c1=t3.c1 and t1.c2=tt.c2 and t1.c1+t2.c1=tt.c1 limit 1);
select stddev(c2) from t1;
stddev(c2)
2.1147629234082532
rollback;
delete from t1 where c2 = (select /*+ NO_REWRITE */t1.c1 from t1,t2,t3, t1 tt where t1.c1=t3.c1 and t1.c2=tt.c2 and t1.c1+t2.c1=tt.c1 limit 1);
select stddev(c2) from t1;
stddev(c2)
2.1147629234082532
rollback;
select * from t1 left join t2 t on t1.c1=t.c1,t2 left join t3 on t2.c1=t3.c1;
c1	c2	c1	c2	c3	c1	c2	c3	c1	c2	c3
1	1	1	1	o	1	1	o	1	2	3
1	1	1	1	o	2	5	c	2	5	4
1	1	1	1	o	3	5	b	3	6	1
1	1	1	1	o	4	6	o	4	5	1
1	1	1	1	o	5	7	d	5	5	5
1	1	1	1	o	6	8	c	6	5	c
2	5	2	5	c	1	1	o	1	2	3
2	5	2	5	c	2	5	c	2	5	4
2	5	2	5	c	3	5	b	3	6	1
2	5	2	5	c	4	6	o	4	5	1
2	5	2	5	c	5	7	d	5	5	5
2	5	2	5	c	6	8	c	6	5	c
3	2	3	5	b	1	1	o	1	2	3
3	2	3	5	b	2	5	c	2	5	4
3	2	3	5	b	3	5	b	3	6	1
3	2	3	5	b	4	6	o	4	5	1
3	2	3	5	b	5	7	d	5	5	5
3	2	3	5	b	6	8	c	6	5	c
4	6	4	6	o	1	1	o	1	2	3
4	6	4	6	o	2	5	c	2	5	4
4	6	4	6	o	3	5	b	3	6	1
4	6	4	6	o	4	6	o	4	5	1
4	6	4	6	o	5	7	d	5	5	5
4	6	4	6	o	6	8	c	6	5	c
5	4	5	7	d	1	1	o	1	2	3
5	4	5	7	d	2	5	c	2	5	4
5	4	5	7	d	3	5	b	3	6	1
5	4	5	7	d	4	6	o	4	5	1
5	4	5	7	d	5	7	d	5	5	5
5	4	5	7	d	6	8	c	6	5	c
6	7	6	8	c	1	1	o	1	2	3
6	7	6	8	c	2	5	c	2	5	4
6	7	6	8	c	3	5	b	3	6	1
6	7	6	8	c	4	6	o	4	5	1
6	7	6	8	c	5	7	d	5	5	5
6	7	6	8	c	6	8	c	6	5	c
select /*+ NO_REWRITE */* from t1 left join t2 t on t1.c1=t.c1,t2 left join t3 on t2.c1=t3.c1;
c1	c2	c1	c2	c3	c1	c2	c3	c1	c2	c3
1	1	1	1	o	1	1	o	1	2	3
1	1	1	1	o	2	5	c	2	5	4
1	1	1	1	o	3	5	b	3	6	1
1	1	1	1	o	4	6	o	4	5	1
1	1	1	1	o	5	7	d	5	5	5
1	1	1	1	o	6	8	c	6	5	c
2	5	2	5	c	1	1	o	1	2	3
2	5	2	5	c	2	5	c	2	5	4
2	5	2	5	c	3	5	b	3	6	1
2	5	2	5	c	4	6	o	4	5	1
2	5	2	5	c	5	7	d	5	5	5
2	5	2	5	c	6	8	c	6	5	c
3	2	3	5	b	1	1	o	1	2	3
3	2	3	5	b	2	5	c	2	5	4
3	2	3	5	b	3	5	b	3	6	1
3	2	3	5	b	4	6	o	4	5	1
3	2	3	5	b	5	7	d	5	5	5
3	2	3	5	b	6	8	c	6	5	c
4	6	4	6	o	1	1	o	1	2	3
4	6	4	6	o	2	5	c	2	5	4
4	6	4	6	o	3	5	b	3	6	1
4	6	4	6	o	4	6	o	4	5	1
4	6	4	6	o	5	7	d	5	5	5
4	6	4	6	o	6	8	c	6	5	c
5	4	5	7	d	1	1	o	1	2	3
5	4	5	7	d	2	5	c	2	5	4
5	4	5	7	d	3	5	b	3	6	1
5	4	5	7	d	4	6	o	4	5	1
5	4	5	7	d	5	7	d	5	5	5
5	4	5	7	d	6	8	c	6	5	c
6	7	6	8	c	1	1	o	1	2	3
6	7	6	8	c	2	5	c	2	5	4
6	7	6	8	c	3	5	b	3	6	1
6	7	6	8	c	4	6	o	4	5	1
6	7	6	8	c	5	7	d	5	5	5
6	7	6	8	c	6	8	c	6	5	c
insert into t7_temp (select * from t1 left join t2 t on t1.c1=t.c1,t2 left join t3 on t2.c1=t3.c1);
rollback;
insert into t7_temp (select /*+ NO_REWRITE */* from t1 left join t2 t on t1.c1=t.c1,t2 left join t3 on t2.c1=t3.c1);
rollback;
update t1 set c2 = (select t1.c1 from t1 left join t2 t on t1.c1=t.c1,t2 left join t3 on t2.c1=t3.c1 limit 1);
select stddev(c2) from t1;
stddev(c2)
0
rollback;
update t1 set c2 = (select /*+ NO_REWRITE */t1.c1 from t1 left join t2 t on t1.c1=t.c1,t2 left join t3 on t2.c1=t3.c1 limit 1);
select stddev(c2) from t1;
stddev(c2)
0
rollback;
delete from t1 where c2 = (select t1.c1 from t1 left join t2 t on t1.c1=t.c1,t2 left join t3 on t2.c1=t3.c1 limit 1);
select stddev(c2) from t1;
stddev(c2)
1.7204650534085253
rollback;
delete from t1 where c2 = (select /*+ NO_REWRITE */t1.c1 from t1 left join t2 t on t1.c1=t.c1,t2 left join t3 on t2.c1=t3.c1 limit 1);
select stddev(c2) from t1;
stddev(c2)
1.7204650534085253
rollback;
select * from t1 left join t2 t on t1.c1=t.c1,t2 left join t3 on t2.c1=t3.c1, t1 tt where t1.c1=t3.c1 and t1.c2=tt.c2 and t1.c1+t2.c1=tt.c1;
c1	c2	c1	c2	c3	c1	c2	c3	c1	c2	c3	c1	c2
select /*+ NO_REWRITE */* from t1 left join t2 t on t1.c1=t.c1,t2 left join t3 on t2.c1=t3.c1, t1 tt where t1.c1=t3.c1 and t1.c2=tt.c2 and t1.c1+t2.c1=tt.c1;
c1	c2	c1	c2	c3	c1	c2	c3	c1	c2	c3	c1	c2
insert into t10_temp (select * from t1 left join t2 t on t1.c1=t.c1,t2 left join t3 on t2.c1=t3.c1, t1 tt where t1.c1=t3.c1 and t1.c2=tt.c2 and t1.c1+t2.c1=tt.c1);
rollback;
insert into t10_temp (select /*+ NO_REWRITE */* from t1 left join t2 t on t1.c1=t.c1,t2 left join t3 on t2.c1=t3.c1, t1 tt where t1.c1=t3.c1 and t1.c2=tt.c2 and t1.c1+t2.c1=tt.c1);
rollback;
update t1 set c2 = (select t1.c1 from t1 left join t2 t on t1.c1=t.c1,t2 left join t3 on t2.c1=t3.c1, t1 tt where t1.c1=t3.c1 and t1.c2=tt.c2 and t1.c1+t2.c1=tt.c1 limit 1);
select stddev(c2) from t1;
stddev(c2)
NULL
rollback;
update t1 set c2 = (select /*+ NO_REWRITE */t1.c1 from t1 left join t2 t on t1.c1=t.c1,t2 left join t3 on t2.c1=t3.c1, t1 tt where t1.c1=t3.c1 and t1.c2=tt.c2 and t1.c1+t2.c1=tt.c1 limit 1);
select stddev(c2) from t1;
stddev(c2)
NULL
rollback;
delete from t1 where c2 = (select t1.c1 from t1 left join t2 t on t1.c1=t.c1,t2 left join t3 on t2.c1=t3.c1, t1 tt where t1.c1=t3.c1 and t1.c2=tt.c2 and t1.c1+t2.c1=tt.c1 limit 1);
select stddev(c2) from t1;
stddev(c2)
2.1147629234082532
rollback;
delete from t1 where c2 = (select /*+ NO_REWRITE */t1.c1 from t1 left join t2 t on t1.c1=t.c1,t2 left join t3 on t2.c1=t3.c1, t1 tt where t1.c1=t3.c1 and t1.c2=tt.c2 and t1.c1+t2.c1=tt.c1 limit 1);
select stddev(c2) from t1;
stddev(c2)
2.1147629234082532
rollback;
select t1.c1 from t1, t2 where t1.c1=t2.c1 limit 100;
c1
1
2
3
4
5
6
select /*+ NO_REWRITE */t1.c1 from t1, t2 where t1.c1=t2.c1 limit 100;
c1
1
2
3
4
5
6
insert into t4_temp (select * from t1, t2 where t1.c1=t2.c1 limit 100);
rollback;
insert into t4_temp (select /*+ NO_REWRITE */* from t1, t2 where t1.c1=t2.c1 limit 100);
rollback;
update t1 set c2 = (select t1.c1 from t1, t2 where t1.c1=t2.c1 limit 1);
select stddev(c2) from t1;
stddev(c2)
0
rollback;
update t1 set c2 = (select /*+ NO_REWRITE */t1.c1 from t1, t2 where t1.c1=t2.c1 limit 1);
select stddev(c2) from t1;
stddev(c2)
0
rollback;
delete from t1 where c2 = (select t1.c1 from t1, t2 where t1.c1=t2.c1 limit 1);
select stddev(c2) from t1;
stddev(c2)
1.7204650534085253
rollback;
delete from t1 where c2 = (select /*+ NO_REWRITE */t1.c1 from t1, t2 where t1.c1=t2.c1 limit 1);
select stddev(c2) from t1;
stddev(c2)
1.7204650534085253
rollback;
select sum(c1), count(*) from t1 group by c2 order by c2 limit 100;
sum(c1)	count(*)
1	1
2	1
3	1
4	1
5	1
6	1
select /*+ NO_REWRITE */sum(c1), count(*) from t1 group by c2 order by c2 limit 100;
sum(c1)	count(*)
1	1
2	1
3	1
4	1
5	1
6	1
insert into t11_temp (select sum(c1), count(*) from t1 group by c2 order by c2 limit 100);
rollback;
insert into t11_temp (select /*+ NO_REWRITE */sum(c1), count(*) from t1 group by c2 order by c2 limit 100);
rollback;
update t1 set c2 = (select sum(c1) from t1 group by c2 order by c2 limit 1);
select stddev(c2) from t1;
stddev(c2)
0
rollback;
update t1 set c2 = (select /*+ NO_REWRITE */sum(c1) from t1 group by c2 order by c2 limit 1);
select stddev(c2) from t1;
stddev(c2)
0
rollback;
delete from t1 where c2 = (select sum(c1) from t1 group by c2 order by c2 limit 1);
select stddev(c2) from t1;
stddev(c2)
1.7204650534085253
rollback;
delete from t1 where c2 = (select /*+ NO_REWRITE */sum(c1) from t1 group by c2 order by c2 limit 1);
select stddev(c2) from t1;
stddev(c2)
1.7204650534085253
rollback;
select c1 from t1 as t order by c1;
c1
1
2
3
4
5
6
select /*+ NO_REWRITE */c1 from t1 as t order by c1;
c1
1
2
3
4
5
6
insert into t12_temp (select c1 from t1 as t order by c1);
rollback;
insert into t12_temp (select /*+ NO_REWRITE */c1 from t1 as t order by c1);
rollback;
update t1 set c2 = (select c1 from t1 as t order by c1 limit 1);
select stddev(c2) from t1;
stddev(c2)
0
rollback;
update t1 set c2 = (select /*+ NO_REWRITE */c1 from t1 as t order by c1 limit 1);
select stddev(c2) from t1;
stddev(c2)
0
rollback;
delete from t1 where c2 = (select c1 from t1 as t order by c1 limit 1);
select stddev(c2) from t1;
stddev(c2)
1.7204650534085253
rollback;
delete from t1 where c2 = (select /*+ NO_REWRITE */c1 from t1 as t order by c1 limit 1);
select stddev(c2) from t1;
stddev(c2)
1.7204650534085253
rollback;
select * from t2 left join t3 on t2.c1=t3.c1 and t2.c2<t3.c2 where t2.c3>t3.c3;
c1	c2	c3	c1	c2	c3
1	1	o	1	2	3
3	5	b	3	6	1
select /*+ NO_REWRITE */* from t2 left join t3 on t2.c1=t3.c1 and t2.c2<t3.c2 where t2.c3>t3.c3;
c1	c2	c3	c1	c2	c3
1	1	o	1	2	3
3	5	b	3	6	1
insert into t13_temp (select * from t2 left join t3 on t2.c1=t3.c1 and t2.c2<t3.c2 where t2.c3>t3.c3);
rollback;
insert into t13_temp (select /*+ NO_REWRITE */* from t2 left join t3 on t2.c1=t3.c1 and t2.c2<t3.c2 where t2.c3>t3.c3);
rollback;
update t1 set c2 = (select t2.c1 from t2 left join t3 on t2.c1=t3.c1 and t2.c2<t3.c2 where t2.c3>t3.c3 limit 1);
select stddev(c2) from t1;
stddev(c2)
0
rollback;
update t1 set c2 = (select /*+ NO_REWRITE */t2.c1 from t2 left join t3 on t2.c1=t3.c1 and t2.c2<t3.c2 where t2.c3>t3.c3 limit 1);
select stddev(c2) from t1;
stddev(c2)
0
rollback;
delete from t1 where c2 = (select t2.c1 from t2 left join t3 on t2.c1=t3.c1 and t2.c2<t3.c2 where t2.c3>t3.c3 limit 1);
select stddev(c2) from t1;
stddev(c2)
1.7204650534085253
rollback;
delete from t1 where c2 = (select /*+ NO_REWRITE */t2.c1 from t2 left join t3 on t2.c1=t3.c1 and t2.c2<t3.c2 where t2.c3>t3.c3 limit 1);
select stddev(c2) from t1;
stddev(c2)
1.7204650534085253
rollback;
select t1.c1 from t1,t2,t3 where t1.c1=t3.c1 and t1.c2=t2.c2 and t2.c3=t3.c3;
c1
select /*+ NO_REWRITE */t1.c1 from t1,t2,t3 where t1.c1=t3.c1 and t1.c2=t2.c2 and t2.c3=t3.c3;
c1
insert into t12_temp (select t1.c1 from t1,t2,t3 where t1.c1=t3.c1 and t1.c2=t2.c2 and t2.c3=t3.c3);
rollback;
insert into t12_temp (select /*+ NO_REWRITE */t1.c1 from t1,t2,t3 where t1.c1=t3.c1 and t1.c2=t2.c2 and t2.c3=t3.c3);
rollback;
update t1 set c2 = (select t1.c1 from t1,t2,t3 where t1.c1=t3.c1 and t1.c2=t2.c2 and t2.c3=t3.c3 limit 1);
select stddev(c2) from t1;
stddev(c2)
NULL
rollback;
update t1 set c2 = (select /*+ NO_REWRITE */t1.c1 from t1,t2,t3 where t1.c1=t3.c1 and t1.c2=t2.c2 and t2.c3=t3.c3 limit 1);
select stddev(c2) from t1;
stddev(c2)
NULL
rollback;
delete from t1 where c2 = (select t1.c1 from t1,t2,t3 where t1.c1=t3.c1 and t1.c2=t2.c2 and t2.c3=t3.c3 limit 1);
select stddev(c2) from t1;
stddev(c2)
2.1147629234082532
rollback;
delete from t1 where c2 = (select /*+ NO_REWRITE */t1.c1 from t1,t2,t3 where t1.c1=t3.c1 and t1.c2=t2.c2 and t2.c3=t3.c3 limit 1);
select stddev(c2) from t1;
stddev(c2)
2.1147629234082532
rollback;
select * from t1 left join t2 t on t1.c1=t.c1,t2 left join t3 on t2.c1=t3.c1 where t1.c1=t3.c1;
c1	c2	c1	c2	c3	c1	c2	c3	c1	c2	c3
1	1	1	1	o	1	1	o	1	2	3
2	5	2	5	c	2	5	c	2	5	4
3	2	3	5	b	3	5	b	3	6	1
4	6	4	6	o	4	6	o	4	5	1
5	4	5	7	d	5	7	d	5	5	5
6	7	6	8	c	6	8	c	6	5	c
select /*+ NO_REWRITE */* from t1 left join t2 t on t1.c1=t.c1,t2 left join t3 on t2.c1=t3.c1 where t1.c1=t3.c1;
c1	c2	c1	c2	c3	c1	c2	c3	c1	c2	c3
1	1	1	1	o	1	1	o	1	2	3
2	5	2	5	c	2	5	c	2	5	4
3	2	3	5	b	3	5	b	3	6	1
4	6	4	6	o	4	6	o	4	5	1
5	4	5	7	d	5	7	d	5	5	5
6	7	6	8	c	6	8	c	6	5	c
insert into t7_temp (select * from t1 left join t2 t on t1.c1=t.c1,t2 left join t3 on t2.c1=t3.c1 where t1.c1=t3.c1);
rollback;
insert into t7_temp (select /*+ NO_REWRITE */* from t1 left join t2 t on t1.c1=t.c1,t2 left join t3 on t2.c1=t3.c1 where t1.c1=t3.c1);
rollback;
update t1 set c2 = (select t1.c1 from t1 left join t2 t on t1.c1=t.c1,t2 left join t3 on t2.c1=t3.c1 where t1.c1=t3.c1 limit 1);
select stddev(c2) from t1;
stddev(c2)
0
rollback;
update t1 set c2 = (select /*+ NO_REWRITE */t1.c1 from t1 left join t2 t on t1.c1=t.c1,t2 left join t3 on t2.c1=t3.c1 where t1.c1=t3.c1 limit 1);
select stddev(c2) from t1;
stddev(c2)
0
rollback;
delete from t1 where c2 = (select t1.c1 from t1 left join t2 t on t1.c1=t.c1,t2 left join t3 on t2.c1=t3.c1 where t1.c1=t3.c1 limit 1);
select stddev(c2) from t1;
stddev(c2)
1.7204650534085253
rollback;
delete from t1 where c2 = (select /*+ NO_REWRITE */t1.c1 from t1 left join t2 t on t1.c1=t.c1,t2 left join t3 on t2.c1=t3.c1 where t1.c1=t3.c1 limit 1);
select stddev(c2) from t1;
stddev(c2)
1.7204650534085253
rollback;
select * from t1 left join t2 on t1.c1=t2.c1 where false;
c1	c2	c1	c2	c3
select /*+ NO_REWRITE */* from t1 left join t2 on t1.c1=t2.c1 where false;
c1	c2	c1	c2	c3
insert into t4_temp (select * from t1 left join t2 on t1.c1=t2.c1 where false);
rollback;
insert into t4_temp (select /*+ NO_REWRITE */* from t1 left join t2 on t1.c1=t2.c1 where false);
rollback;
update t1 set c2 = (select t1.c1 from t1 left join t2 on t1.c1=t2.c1 where false limit 1);
select stddev(c2) from t1;
stddev(c2)
NULL
rollback;
update t1 set c2 = (select /*+ NO_REWRITE */t1.c1 from t1 left join t2 on t1.c1=t2.c1 where false limit 1);
select stddev(c2) from t1;
stddev(c2)
NULL
rollback;
delete from t1 where c2 = (select t1.c1 from t1 left join t2 on t1.c1=t2.c1 where false limit 1);
select stddev(c2) from t1;
stddev(c2)
2.1147629234082532
rollback;
delete from t1 where c2 = (select /*+ NO_REWRITE */t1.c1 from t1 left join t2 on t1.c1=t2.c1 where false limit 1);
select stddev(c2) from t1;
stddev(c2)
2.1147629234082532
rollback;
select * from t1 left join t2 on t1.c1>1 where t2.c1 is null and t2.c2>1;
c1	c2	c1	c2	c3
select /*+ NO_REWRITE */* from t1 left join t2 on t1.c1>1 where t2.c1 is null and t2.c2>1;
c1	c2	c1	c2	c3
insert into t4_temp (select * from t1 left join t2 on t1.c1>1 where t2.c1 is null and t2.c2>1);
rollback;
insert into t4_temp (select /*+ NO_REWRITE */* from t1 left join t2 on t1.c1>1 where t2.c1 is null and t2.c2>1);
rollback;
update t1 set c2 = (select t1.c1 from t1 left join t2 on t1.c1>1 where t2.c1 is null and t2.c2>1 limit 1);
select stddev(c2) from t1;
stddev(c2)
NULL
rollback;
update t1 set c2 = (select /*+ NO_REWRITE */t1.c1 from t1 left join t2 on t1.c1>1 where t2.c1 is null and t2.c2>1 limit 1);
select stddev(c2) from t1;
stddev(c2)
NULL
rollback;
delete from t1 where c2 = (select t1.c1 from t1 left join t2 on t1.c1>1 where t2.c1 is null and t2.c2>1 limit 1);
select stddev(c2) from t1;
stddev(c2)
2.1147629234082532
rollback;
delete from t1 where c2 = (select /*+ NO_REWRITE */t1.c1 from t1 left join t2 on t1.c1>1 where t2.c1 is null and t2.c2>1 limit 1);
select stddev(c2) from t1;
stddev(c2)
2.1147629234082532
rollback;
select * from t1 right join t2 on t1.c1 = t2.c2;
c1	c2	c1	c2	c3
1	1	1	1	o
5	4	2	5	c
5	4	3	5	b
6	7	4	6	o
NULL	NULL	5	7	d
NULL	NULL	6	8	c
select /*+ NO_REWRITE */* from t1 right join t2 on t1.c1 = t2.c2;
c1	c2	c1	c2	c3
1	1	1	1	o
5	4	2	5	c
5	4	3	5	b
6	7	4	6	o
NULL	NULL	5	7	d
NULL	NULL	6	8	c
insert into t4_temp (select * from t1 right join t2 on t1.c1 = t2.c2);
rollback;
insert into t4_temp (select /*+ NO_REWRITE */* from t1 right join t2 on t1.c1 = t2.c2);
rollback;
update t1 set c2 = (select t1.c1 from t1 right join t2 on t1.c1 = t2.c2 limit 1);
select stddev(c2) from t1;
stddev(c2)
0
rollback;
update t1 set c2 = (select /*+ NO_REWRITE */t1.c1 from t1 right join t2 on t1.c1 = t2.c2 limit 1);
select stddev(c2) from t1;
stddev(c2)
0
rollback;
delete from t1 where c2 = (select t1.c1 from t1 right join t2 on t1.c1 = t2.c2 limit 1);
select stddev(c2) from t1;
stddev(c2)
1.7204650534085253
rollback;
delete from t1 where c2 = (select /*+ NO_REWRITE */t1.c1 from t1 right join t2 on t1.c1 = t2.c2 limit 1);
select stddev(c2) from t1;
stddev(c2)
1.7204650534085253
rollback;
select * from t1 inner join t2 on t1.c1 = t2.c2;
c1	c2	c1	c2	c3
1	1	1	1	o
5	4	2	5	c
5	4	3	5	b
6	7	4	6	o
select /*+ NO_REWRITE */* from t1 inner join t2 on t1.c1 = t2.c2;
c1	c2	c1	c2	c3
1	1	1	1	o
5	4	2	5	c
5	4	3	5	b
6	7	4	6	o
insert into t4_temp (select * from t1 inner join t2 on t1.c1 = t2.c2);
rollback;
insert into t4_temp (select /*+ NO_REWRITE */* from t1 inner join t2 on t1.c1 = t2.c2);
rollback;
update t1 set c2 = (select t1.c1 from t1 inner join t2 on t1.c1 = t2.c2 limit 1);
select stddev(c2) from t1;
stddev(c2)
0
rollback;
update t1 set c2 = (select /*+ NO_REWRITE */t1.c1 from t1 inner join t2 on t1.c1 = t2.c2 limit 1);
select stddev(c2) from t1;
stddev(c2)
0
rollback;
delete from t1 where c2 = (select t1.c1 from t1 inner join t2 on t1.c1 = t2.c2 limit 1);
select stddev(c2) from t1;
stddev(c2)
1.7204650534085253
rollback;
delete from t1 where c2 = (select /*+ NO_REWRITE */t1.c1 from t1 inner join t2 on t1.c1 = t2.c2 limit 1);
select stddev(c2) from t1;
stddev(c2)
1.7204650534085253
rollback;
select c1 from t1 where c1 > 0 and c2 < 0 order by c2 limit 100;
c1
select /*+ NO_REWRITE */c1 from t1 where c1 > 0 and c2 < 0 order by c2 limit 100;
c1
insert into t12_temp (select c1 from t1 where c1 > 0 and c2 < 0 order by c2 limit 100);
rollback;
insert into t12_temp (select /*+ NO_REWRITE */c1 from t1 where c1 > 0 and c2 < 0 order by c2 limit 100);
rollback;
update t1 set c2 = (select c1 from t1 where c1 > 0 and c2 < 0 order by c2 limit 1);
select stddev(c2) from t1;
stddev(c2)
NULL
rollback;
update t1 set c2 = (select /*+ NO_REWRITE */c1 from t1 where c1 > 0 and c2 < 0 order by c2 limit 1);
select stddev(c2) from t1;
stddev(c2)
NULL
rollback;
delete from t1 where c2 = (select c1 from t1 where c1 > 0 and c2 < 0 order by c2 limit 1);
select stddev(c2) from t1;
stddev(c2)
2.1147629234082532
rollback;
delete from t1 where c2 = (select /*+ NO_REWRITE */c1 from t1 where c1 > 0 and c2 < 0 order by c2 limit 1);
select stddev(c2) from t1;
stddev(c2)
2.1147629234082532
rollback;
select t1.c1 from t1, t2 limit 100;
c1
1
1
1
1
1
1
2
2
2
2
2
2
3
3
3
3
3
3
4
4
4
4
4
4
5
5
5
5
5
5
6
6
6
6
6
6
select /*+ NO_REWRITE */t1.c1 from t1, t2 limit 100;
c1
1
1
1
1
1
1
2
2
2
2
2
2
3
3
3
3
3
3
4
4
4
4
4
4
5
5
5
5
5
5
6
6
6
6
6
6
insert into t12_temp (select t1.c1 from t1, t2 limit 100);
rollback;
insert into t12_temp (select /*+ NO_REWRITE */t1.c1 from t1, t2 limit 100);
rollback;
update t1 set c2 = (select t1.c1 from t1, t2 limit 1);
select stddev(c2) from t1;
stddev(c2)
0
rollback;
update t1 set c2 = (select /*+ NO_REWRITE */t1.c1 from t1, t2 limit 1);
select stddev(c2) from t1;
stddev(c2)
0
rollback;
delete from t1 where c2 = (select t1.c1 from t1, t2 limit 1);
select stddev(c2) from t1;
stddev(c2)
1.7204650534085253
rollback;
delete from t1 where c2 = (select /*+ NO_REWRITE */t1.c1 from t1, t2 limit 1);
select stddev(c2) from t1;
stddev(c2)
1.7204650534085253
rollback;
select t1.c1 from t1, t2 where t1.c1=t2.c1 limit 100;
c1
1
2
3
4
5
6
select /*+ NO_REWRITE */t1.c1 from t1, t2 where t1.c1=t2.c1 limit 100;
c1
1
2
3
4
5
6
insert into t12_temp (select t1.c1 from t1, t2 where t1.c1=t2.c1 limit 100);
rollback;
insert into t12_temp (select /*+ NO_REWRITE */t1.c1 from t1, t2 where t1.c1=t2.c1 limit 100);
rollback;
update t1 set c2 = (select t1.c1 from t1, t2 where t1.c1=t2.c1 limit 1);
select stddev(c2) from t1;
stddev(c2)
0
rollback;
update t1 set c2 = (select /*+ NO_REWRITE */t1.c1 from t1, t2 where t1.c1=t2.c1 limit 1);
select stddev(c2) from t1;
stddev(c2)
0
rollback;
delete from t1 where c2 = (select t1.c1 from t1, t2 where t1.c1=t2.c1 limit 1);
select stddev(c2) from t1;
stddev(c2)
1.7204650534085253
rollback;
delete from t1 where c2 = (select /*+ NO_REWRITE */t1.c1 from t1, t2 where t1.c1=t2.c1 limit 1);
select stddev(c2) from t1;
stddev(c2)
1.7204650534085253
rollback;
select * from t1 left join t2 on t1.c1 = t2.c1 ;
c1	c2	c1	c2	c3
1	1	1	1	o
2	5	2	5	c
3	2	3	5	b
4	6	4	6	o
5	4	5	7	d
6	7	6	8	c
select /*+ NO_REWRITE */* from t1 left join t2 on t1.c1 = t2.c1 ;
c1	c2	c1	c2	c3
1	1	1	1	o
2	5	2	5	c
3	2	3	5	b
4	6	4	6	o
5	4	5	7	d
6	7	6	8	c
insert into t4_temp (select * from t1 left join t2 on t1.c1 = t2.c1);
rollback;
insert into t4_temp (select /*+ NO_REWRITE */* from t1 left join t2 on t1.c1 = t2.c1 );
rollback;
update t1 set c2 = (select t1.c1 from t1 left join t2 on t1.c1 = t2.c1 limit 1);
select stddev(c2) from t1;
stddev(c2)
0
rollback;
update t1 set c2 = (select /*+ NO_REWRITE */t1.c1 from t1 left join t2 on t1.c1 = t2.c1  limit 1);
select stddev(c2) from t1;
stddev(c2)
0
rollback;
delete from t1 where c2 = (select t1.c1 from t1 left join t2 on t1.c1 = t2.c1 limit 1);
select stddev(c2) from t1;
stddev(c2)
1.7204650534085253
rollback;
delete from t1 where c2 = (select /*+ NO_REWRITE */t1.c1 from t1 left join t2 on t1.c1 = t2.c1  limit 1);
select stddev(c2) from t1;
stddev(c2)
1.7204650534085253
rollback;
select t1.c1 from t1, t2 where t1.c1=t2.c1 limit 100;
c1
1
2
3
4
5
6
select /*+ NO_REWRITE */t1.c1 from t1, t2 where t1.c1=t2.c1 limit 100;
c1
1
2
3
4
5
6
insert into t12_temp (select t1.c1 from t1, t2 where t1.c1=t2.c1 limit 100);
rollback;
insert into t12_temp (select /*+ NO_REWRITE */t1.c1 from t1, t2 where t1.c1=t2.c1 limit 100);
rollback;
update t1 set c2 = (select t1.c1 from t1, t2 where t1.c1=t2.c1 limit 1);
select stddev(c2) from t1;
stddev(c2)
0
rollback;
update t1 set c2 = (select /*+ NO_REWRITE */t1.c1 from t1, t2 where t1.c1=t2.c1 limit 1);
select stddev(c2) from t1;
stddev(c2)
0
rollback;
delete from t1 where c2 = (select t1.c1 from t1, t2 where t1.c1=t2.c1 limit 1);
select stddev(c2) from t1;
stddev(c2)
1.7204650534085253
rollback;
delete from t1 where c2 = (select /*+ NO_REWRITE */t1.c1 from t1, t2 where t1.c1=t2.c1 limit 1);
select stddev(c2) from t1;
stddev(c2)
1.7204650534085253
rollback;
select t1.c1 from t1, t2, t3 where t1.c1=t2.c1 and t1.c2>t2.c2 and t2.c3=t3.c3 and t3.c1>1;
c1
select /*+ NO_REWRITE */t1.c1 from t1, t2, t3 where t1.c1=t2.c1 and t1.c2>t2.c2 and t2.c3=t3.c3 and t3.c1>1;
c1
insert into t12_temp (select t1.c1 from t1, t2, t3 where t1.c1=t2.c1 and t1.c2>t2.c2 and t2.c3=t3.c3 and t3.c1>1);
rollback;
insert into t12_temp (select /*+ NO_REWRITE */t1.c1 from t1, t2, t3 where t1.c1=t2.c1 and t1.c2>t2.c2 and t2.c3=t3.c3 and t3.c1>1);
rollback;
update t1 set c2 = (select t1.c1 from t1, t2, t3 where t1.c1=t2.c1 and t1.c2>t2.c2 and t2.c3=t3.c3 and t3.c1>1 limit 1);
select stddev(c2) from t1;
stddev(c2)
NULL
rollback;
update t1 set c2 = (select /*+ NO_REWRITE */t1.c1 from t1, t2, t3 where t1.c1=t2.c1 and t1.c2>t2.c2 and t2.c3=t3.c3 and t3.c1>1 limit 1);
select stddev(c2) from t1;
stddev(c2)
NULL
rollback;
delete from t1 where c2 = (select t1.c1 from t1, t2, t3 where t1.c1=t2.c1 and t1.c2>t2.c2 and t2.c3=t3.c3 and t3.c1>1 limit 1);
select stddev(c2) from t1;
stddev(c2)
2.1147629234082532
rollback;
delete from t1 where c2 = (select /*+ NO_REWRITE */t1.c1 from t1, t2, t3 where t1.c1=t2.c1 and t1.c2>t2.c2 and t2.c3=t3.c3 and t3.c1>1 limit 1);
select stddev(c2) from t1;
stddev(c2)
2.1147629234082532
rollback;
select * from t2 left join t3 on t2.c1=t3.c1 and t2.c2<t3.c2 where t2.c3>t3.c3;
c1	c2	c3	c1	c2	c3
1	1	o	1	2	3
3	5	b	3	6	1
select /*+ NO_REWRITE */* from t2 left join t3 on t2.c1=t3.c1 and t2.c2<t3.c2 where t2.c3>t3.c3;
c1	c2	c3	c1	c2	c3
1	1	o	1	2	3
3	5	b	3	6	1
insert into t13_temp (select * from t2 left join t3 on t2.c1=t3.c1 and t2.c2<t3.c2 where t2.c3>t3.c3);
rollback;
insert into t13_temp (select /*+ NO_REWRITE */* from t2 left join t3 on t2.c1=t3.c1 and t2.c2<t3.c2 where t2.c3>t3.c3);
rollback;
update t1 set c2 = (select t2.c1 from t2 left join t3 on t2.c1=t3.c1 and t2.c2<t3.c2 where t2.c3>t3.c3 limit 1);
select stddev(c2) from t1;
stddev(c2)
0
rollback;
update t1 set c2 = (select /*+ NO_REWRITE */t2.c1 from t2 left join t3 on t2.c1=t3.c1 and t2.c2<t3.c2 where t2.c3>t3.c3 limit 1);
select stddev(c2) from t1;
stddev(c2)
0
rollback;
delete from t1 where c2 = (select t2.c1 from t2 left join t3 on t2.c1=t3.c1 and t2.c2<t3.c2 where t2.c3>t3.c3 limit 1);
select stddev(c2) from t1;
stddev(c2)
1.7204650534085253
rollback;
delete from t1 where c2 = (select /*+ NO_REWRITE */t2.c1 from t2 left join t3 on t2.c1=t3.c1 and t2.c2<t3.c2 where t2.c3>t3.c3 limit 1);
select stddev(c2) from t1;
stddev(c2)
1.7204650534085253
rollback;
select t1.c1 from t1 left join t2 on t1.c1=t2.c1 where t2.c2>1;
c1
2
3
4
5
6
select /*+ NO_REWRITE */t1.c1 from t1 left join t2 on t1.c1=t2.c1 where t2.c2>1;
c1
2
3
4
5
6
insert into t12_temp (select t1.c1 from t1 left join t2 on t1.c1=t2.c1 where t2.c2>1);
rollback;
insert into t12_temp (select /*+ NO_REWRITE */t1.c1 from t1 left join t2 on t1.c1=t2.c1 where t2.c2>1);
rollback;
update t1 set c2 = (select t1.c1 from t1 left join t2 on t1.c1=t2.c1 where t2.c2>1 limit 1);
select stddev(c2) from t1;
stddev(c2)
0
rollback;
update t1 set c2 = (select /*+ NO_REWRITE */t1.c1 from t1 left join t2 on t1.c1=t2.c1 where t2.c2>1 limit 1);
select stddev(c2) from t1;
stddev(c2)
0
rollback;
delete from t1 where c2 = (select t1.c1 from t1 left join t2 on t1.c1=t2.c1 where t2.c2>1 limit 1);
select stddev(c2) from t1;
stddev(c2)
2.0591260281974
rollback;
delete from t1 where c2 = (select /*+ NO_REWRITE */t1.c1 from t1 left join t2 on t1.c1=t2.c1 where t2.c2>1 limit 1);
select stddev(c2) from t1;
stddev(c2)
2.0591260281974
rollback;
select * from t1 left join t2 on t1.c1=t2.c1 and t1.c1>1;
c1	c2	c1	c2	c3
1	1	NULL	NULL	NULL
2	5	2	5	c
3	2	3	5	b
4	6	4	6	o
5	4	5	7	d
6	7	6	8	c
select /*+ NO_REWRITE */* from t1 left join t2 on t1.c1=t2.c1 and t1.c1>1;
c1	c2	c1	c2	c3
1	1	NULL	NULL	NULL
2	5	2	5	c
3	2	3	5	b
4	6	4	6	o
5	4	5	7	d
6	7	6	8	c
insert into t4_temp (select * from t1 left join t2 on t1.c1=t2.c1 and t1.c1>1);
rollback;
insert into t4_temp (select /*+ NO_REWRITE */* from t1 left join t2 on t1.c1=t2.c1 and t1.c1>1);
rollback;
update t1 set c2 = (select t1.c1 from t1 left join t2 on t1.c1=t2.c1 and t1.c1>1 limit 1);
select stddev(c2) from t1;
stddev(c2)
0
rollback;
update t1 set c2 = (select /*+ NO_REWRITE */t1.c1 from t1 left join t2 on t1.c1=t2.c1 and t1.c1>1 limit 1);
select stddev(c2) from t1;
stddev(c2)
0
rollback;
delete from t1 where c2 = (select t1.c1 from t1 left join t2 on t1.c1=t2.c1 and t1.c1>1 limit 1);
select stddev(c2) from t1;
stddev(c2)
1.7204650534085253
rollback;
delete from t1 where c2 = (select /*+ NO_REWRITE */t1.c1 from t1 left join t2 on t1.c1=t2.c1 and t1.c1>1 limit 1);
select stddev(c2) from t1;
stddev(c2)
1.7204650534085253
rollback;
select * from t1 join t2 on t1.c1 = t2.c1 join t3 on t2.c2 = t3.c2;
c1	c2	c1	c2	c3	c1	c2	c3
2	5	2	5	c	2	5	4
2	5	2	5	c	4	5	1
2	5	2	5	c	5	5	5
2	5	2	5	c	6	5	c
3	2	3	5	b	2	5	4
3	2	3	5	b	4	5	1
3	2	3	5	b	5	5	5
3	2	3	5	b	6	5	c
4	6	4	6	o	3	6	1
select /*+ NO_REWRITE */* from t1 join t2 on t1.c1 = t2.c1 join t3 on t2.c2 = t3.c2;
c1	c2	c1	c2	c3	c1	c2	c3
2	5	2	5	c	2	5	4
2	5	2	5	c	4	5	1
2	5	2	5	c	5	5	5
2	5	2	5	c	6	5	c
3	2	3	5	b	2	5	4
3	2	3	5	b	4	5	1
3	2	3	5	b	5	5	5
3	2	3	5	b	6	5	c
4	6	4	6	o	3	6	1
insert into t5_temp (select * from t1 join t2 on t1.c1 = t2.c1 join t3 on t2.c2 = t3.c2);
rollback;
insert into t5_temp (select /*+ NO_REWRITE */* from t1 join t2 on t1.c1 = t2.c1 join t3 on t2.c2 = t3.c2);
rollback;
update t1 set c2 = (select t1.c1 from t1 join t2 on t1.c1 = t2.c1 join t3 on t2.c2 = t3.c2 limit 1);
select stddev(c2) from t1;
stddev(c2)
0
rollback;
update t1 set c2 = (select /*+ NO_REWRITE */t1.c1 from t1 join t2 on t1.c1 = t2.c1 join t3 on t2.c2 = t3.c2 limit 1);
select stddev(c2) from t1;
stddev(c2)
0
rollback;
delete from t1 where c2 = (select t1.c1 from t1 join t2 on t1.c1 = t2.c1 join t3 on t2.c2 = t3.c2 limit 1);
select stddev(c2) from t1;
stddev(c2)
2.0591260281974
rollback;
delete from t1 where c2 = (select /*+ NO_REWRITE */t1.c1 from t1 join t2 on t1.c1 = t2.c1 join t3 on t2.c2 = t3.c2 limit 1);
select stddev(c2) from t1;
stddev(c2)
2.0591260281974
rollback;
select * from t1 right join t2 on t1.c1 = t2.c1 right join t3 on t3.c2 = t1.c2 where t2.c2 = 1;
c1	c2	c1	c2	c3	c1	c2	c3
select /*+ NO_REWRITE */* from t1 right join t2 on t1.c1 = t2.c1 right join t3 on t3.c2 = t1.c2 where t2.c2 = 1;
c1	c2	c1	c2	c3	c1	c2	c3
insert into t5_temp (select * from t1 join t2 on t1.c1 = t2.c1 join t3 on t2.c2 = t3.c2);
rollback;
insert into t5_temp (select /*+ NO_REWRITE */* from t1 join t2 on t1.c1 = t2.c1 join t3 on t2.c2 = t3.c2);
rollback;
update t1 set c2 = (select t1.c1 from t1 join t2 on t1.c1 = t2.c1 join t3 on t2.c2 = t3.c2 limit 1);
select stddev(c2) from t1;
stddev(c2)
0
rollback;
update t1 set c2 = (select /*+ NO_REWRITE */t1.c1 from t1 join t2 on t1.c1 = t2.c1 join t3 on t2.c2 = t3.c2 limit 1);
select stddev(c2) from t1;
stddev(c2)
0
rollback;
delete from t1 where c2 = (select t1.c1 from t1 join t2 on t1.c1 = t2.c1 join t3 on t2.c2 = t3.c2 limit 1);
select stddev(c2) from t1;
stddev(c2)
2.0591260281974
rollback;
delete from t1 where c2 = (select /*+ NO_REWRITE */t1.c1 from t1 join t2 on t1.c1 = t2.c1 join t3 on t2.c2 = t3.c2 limit 1);
select stddev(c2) from t1;
stddev(c2)
2.0591260281974
rollback;
select * from t1 right join t2 on t1.c1 = t2.c1 right join t3 on t3.c2 = t2.c2 where t2.c2 = 1;
c1	c2	c1	c2	c3	c1	c2	c3
select /*+ NO_REWRITE */* from t1 right join t2 on t1.c1 = t2.c1 right join t3 on t3.c2 = t2.c2 where t2.c2 = 1;
c1	c2	c1	c2	c3	c1	c2	c3
insert into t5_temp (select * from t1 right join t2 on t1.c1 = t2.c1 right join t3 on t3.c2 = t2.c2 where t2.c2 = 1);
rollback;
insert into t5_temp (select /*+ NO_REWRITE */* from t1 right join t2 on t1.c1 = t2.c1 right join t3 on t3.c2 = t2.c2 where t2.c2 = 1);
rollback;
update t1 set c2 = (select t1.c1 from t1 right join t2 on t1.c1 = t2.c1 right join t3 on t3.c2 = t2.c2 where t2.c2 = 1 limit 1);
select stddev(c2) from t1;
stddev(c2)
NULL
rollback;
update t1 set c2 = (select /*+ NO_REWRITE */t1.c1 from t1 right join t2 on t1.c1 = t2.c1 right join t3 on t3.c2 = t2.c2 where t2.c2 = 1 limit 1);
select stddev(c2) from t1;
stddev(c2)
NULL
rollback;
delete from t1 where c2 = (select t1.c1 from t1 right join t2 on t1.c1 = t2.c1 right join t3 on t3.c2 = t2.c2 where t2.c2 = 1 limit 1);
select stddev(c2) from t1;
stddev(c2)
2.1147629234082532
rollback;
delete from t1 where c2 = (select /*+ NO_REWRITE */t1.c1 from t1 right join t2 on t1.c1 = t2.c1 right join t3 on t3.c2 = t2.c2 where t2.c2 = 1 limit 1);
select stddev(c2) from t1;
stddev(c2)
2.1147629234082532
rollback;
select * from t1 right join t2 on t1.c1 = t2.c1 right join t3 on t3.c2 = t2.c2 where t1.c2 = 1;
c1	c2	c1	c2	c3	c1	c2	c3
select /*+ NO_REWRITE */* from t1 right join t2 on t1.c1 = t2.c1 right join t3 on t3.c2 = t2.c2 where t1.c2 = 1;
c1	c2	c1	c2	c3	c1	c2	c3
insert into t5_temp (select * from t1 right join t2 on t1.c1 = t2.c1 right join t3 on t3.c2 = t2.c2 where t1.c2 = 1);
rollback;
insert into t5_temp (select /*+ NO_REWRITE */* from t1 right join t2 on t1.c1 = t2.c1 right join t3 on t3.c2 = t2.c2 where t1.c2 = 1);
rollback;
update t1 set c2 = (select t1.c1 from t1 right join t2 on t1.c1 = t2.c1 right join t3 on t3.c2 = t2.c2 where t1.c2 = 1 limit 1);
select stddev(c2) from t1;
stddev(c2)
NULL
rollback;
update t1 set c2 = (select /*+ NO_REWRITE */t1.c1 from t1 right join t2 on t1.c1 = t2.c1 right join t3 on t3.c2 = t2.c2 where t1.c2 = 1 limit 1);
select stddev(c2) from t1;
stddev(c2)
NULL
rollback;
delete from t1 where c2 = (select t1.c1 from t1 right join t2 on t1.c1 = t2.c1 right join t3 on t3.c2 = t2.c2 where t1.c2 = 1 limit 1);
select stddev(c2) from t1;
stddev(c2)
2.1147629234082532
rollback;
delete from t1 where c2 = (select /*+ NO_REWRITE */t1.c1 from t1 right join t2 on t1.c1 = t2.c1 right join t3 on t3.c2 = t2.c2 where t1.c2 = 1 limit 1);
select stddev(c2) from t1;
stddev(c2)
2.1147629234082532
rollback;
select t1.c1 as a1, t2.c1 as a2 from t1 left join t2 on t1.c1 != t2.c1 where t2.c2 in (1, 2, 3);
a1	a2
2	1
3	1
4	1
5	1
6	1
select /*+ NO_REWRITE */t1.c1 as a1, t2.c1 as a2 from t1 left join t2 on t1.c1 != t2.c1 where t2.c2 in (1, 2, 3);
a1	a2
2	1
3	1
4	1
5	1
6	1
insert into t11_temp (select t1.c1 as a1, t2.c1 as a2 from t1 left join t2 on t1.c1 != t2.c1 where t2.c2 in (1, 2, 3));
rollback;
insert into t11_temp (select /*+ NO_REWRITE */t1.c1 as a1, t2.c1 as a2 from t1 left join t2 on t1.c1 != t2.c1 where t2.c2 in (1, 2, 3));
rollback;
update t1 set c2 = (select t1.c1 as a1 from t1 left join t2 on t1.c1 != t2.c1 where t2.c2 in (1, 2, 3) limit 1);
select stddev(c2) from t1;
stddev(c2)
0
rollback;
update t1 set c2 = (select /*+ NO_REWRITE */t1.c1 as a1 from t1 left join t2 on t1.c1 != t2.c1 where t2.c2 in (1, 2, 3) limit 1);
select stddev(c2) from t1;
stddev(c2)
0
rollback;
delete from t1 where c2 = (select t1.c1 as a1 from t1 left join t2 on t1.c1 != t2.c1 where t2.c2 in (1, 2, 3) limit 1);
select stddev(c2) from t1;
stddev(c2)
2.0591260281974
rollback;
delete from t1 where c2 = (select /*+ NO_REWRITE */t1.c1 as a1 from t1 left join t2 on t1.c1 != t2.c1 where t2.c2 in (1, 2, 3) limit 1);
select stddev(c2) from t1;
stddev(c2)
2.0591260281974
rollback;
select t1.c1 as a1, t2.c1 as a2 from t1 left join t2 on t1.c1 != t2.c1 where t2.c2 not in (1, 2, 3);
a1	a2
1	2
1	3
1	4
1	5
1	6
2	3
2	4
2	5
2	6
3	2
3	4
3	5
3	6
4	2
4	3
4	5
4	6
5	2
5	3
5	4
5	6
6	2
6	3
6	4
6	5
select /*+ NO_REWRITE */t1.c1 as a1, t2.c1 as a2 from t1 left join t2 on t1.c1 != t2.c1 where t2.c2 not in (1, 2, 3);
a1	a2
1	2
1	3
1	4
1	5
1	6
2	3
2	4
2	5
2	6
3	2
3	4
3	5
3	6
4	2
4	3
4	5
4	6
5	2
5	3
5	4
5	6
6	2
6	3
6	4
6	5
insert into t11_temp (select t1.c1 as a1, t2.c1 as a2 from t1 left join t2 on t1.c1 != t2.c1 where t2.c2 not in (1, 2, 3));
rollback;
insert into t11_temp (select /*+ NO_REWRITE */t1.c1 as a1, t2.c1 as a2 from t1 left join t2 on t1.c1 != t2.c1 where t2.c2 not in (1, 2, 3));
rollback;
update t1 set c2 = (select t1.c1 as a1 from t1 left join t2 on t1.c1 != t2.c1 where t2.c2 not in (1, 2, 3) limit 1);
select stddev(c2) from t1;
stddev(c2)
0
rollback;
update t1 set c2 = (select /*+ NO_REWRITE */t1.c1 as a1 from t1 left join t2 on t1.c1 != t2.c1 where t2.c2 not in (1, 2, 3) limit 1);
select stddev(c2) from t1;
stddev(c2)
0
rollback;
delete from t1 where c2 = (select t1.c1 as a1 from t1 left join t2 on t1.c1 != t2.c1 where t2.c2 not in (1, 2, 3) limit 1);
select stddev(c2) from t1;
stddev(c2)
1.7204650534085253
rollback;
delete from t1 where c2 = (select /*+ NO_REWRITE */t1.c1 as a1 from t1 left join t2 on t1.c1 != t2.c1 where t2.c2 not in (1, 2, 3) limit 1);
select stddev(c2) from t1;
stddev(c2)
1.7204650534085253
rollback;
select t1.c1 as a1, t2.c1 as a2 from t1 left join t2 on t1.c1 != t2.c1 where t1.c2 in (1, 2, t2.c2);
a1	a2
1	2
1	3
1	4
1	5
1	6
2	3
3	1
3	2
3	4
3	5
3	6
6	5
select /*+ NO_REWRITE */t1.c1 as a1, t2.c1 as a2 from t1 left join t2 on t1.c1 != t2.c1 where t1.c2 in (1, 2, t2.c2);
a1	a2
1	2
1	3
1	4
1	5
1	6
2	3
3	1
3	2
3	4
3	5
3	6
6	5
insert into t11_temp (select t1.c1 as a1, t2.c1 as a2 from t1 left join t2 on t1.c1 != t2.c1 where t1.c2 in (1, 2, t2.c2));
rollback;
insert into t11_temp (select /*+ NO_REWRITE */t1.c1 as a1, t2.c1 as a2 from t1 left join t2 on t1.c1 != t2.c1 where t1.c2 in (1, 2, t2.c2));
rollback;
update t1 set c2 = (select t1.c1 as a1 from t1 left join t2 on t1.c1 != t2.c1 where t1.c2 in (1, 2, t2.c2) limit 1);
select stddev(c2) from t1;
stddev(c2)
0
rollback;
update t1 set c2 = (select /*+ NO_REWRITE */t1.c1 as a1 from t1 left join t2 on t1.c1 != t2.c1 where t1.c2 in (1, 2, t2.c2) limit 1);
select stddev(c2) from t1;
stddev(c2)
0
rollback;
delete from t1 where c2 = (select t1.c1 as a1  from t1 left join t2 on t1.c1 != t2.c1 where t1.c2 in (1, 2, t2.c2) limit 1);
select stddev(c2) from t1;
stddev(c2)
1.7204650534085253
rollback;
delete from t1 where c2 = (select /*+ NO_REWRITE */t1.c1 as a1 from t1 left join t2 on t1.c1 != t2.c1 where t1.c2 in (1, 2, t2.c2) limit 1);
select stddev(c2) from t1;
stddev(c2)
1.7204650534085253
rollback;
select t1.c1 as a1, t2.c1 as a2 from t1 left join t2 on t1.c1 != t2.c1 where t2.c2 in (1, 2, NULL);
a1	a2
2	1
3	1
4	1
5	1
6	1
select /*+ NO_REWRITE */t1.c1 as a1, t2.c1 as a2 from t1 left join t2 on t1.c1 != t2.c1 where t2.c2 in (1, 2, NULL);
a1	a2
2	1
3	1
4	1
5	1
6	1
insert into t11_temp (select t1.c1 as a1, t2.c1 as a2 from t1 left join t2 on t1.c1 != t2.c1 where t2.c2 in (1, 2, NULL));
rollback;
insert into t11_temp (select /*+ NO_REWRITE */t1.c1 as a1, t2.c1 as a2 from t1 left join t2 on t1.c1 != t2.c1 where t2.c2 in (1, 2, NULL));
rollback;
update t1 set c2 = (select t1.c1 as a1 from t1 left join t2 on t1.c1 != t2.c1 where t2.c2 in (1, 2, NULL) limit 1);
select stddev(c2) from t1;
stddev(c2)
0
rollback;
update t1 set c2 = (select /*+ NO_REWRITE */t1.c1 as a1 from t1 left join t2 on t1.c1 != t2.c1 where t2.c2 in (1, 2, NULL) limit 1);
select stddev(c2) from t1;
stddev(c2)
0
rollback;
delete from t1 where c2 = (select t1.c1 as a1 from t1 left join t2 on t1.c1 != t2.c1 where t2.c2 in (1, 2, NULL) limit 1);
select stddev(c2) from t1;
stddev(c2)
2.0591260281974
rollback;
delete from t1 where c2 = (select /*+ NO_REWRITE */t1.c1 as a1 from t1 left join t2 on t1.c1 != t2.c1 where t2.c2 in (1, 2, NULL) limit 1);
select stddev(c2) from t1;
stddev(c2)
2.0591260281974
rollback;
select t1.c1 as a1, t2.c1 as a2 from t1 left join t2 on t1.c1 != t2.c1 where t2.c2 not in (1, 2, NULL);
a1	a2
select /*+ NO_REWRITE */t1.c1 as a1, t2.c1 as a2 from t1 left join t2 on t1.c1 != t2.c1 where t2.c2 not in (1, 2, NULL);
a1	a2
insert into t11_temp (select t1.c1 as a1, t2.c1 as a2 from t1 left join t2 on t1.c1 != t2.c1 where t2.c2 not in (1, 2, NULL));
rollback;
insert into t11_temp (select /*+ NO_REWRITE */t1.c1 as a1, t2.c1 as a2 from t1 left join t2 on t1.c1 != t2.c1 where t2.c2 not in (1, 2, NULL));
rollback;
update t1 set c2 = (select t1.c1 as a1 from t1 left join t2 on t1.c1 != t2.c1 where t2.c2 not in (1, 2, NULL) limit 1);
select stddev(c2) from t1;
stddev(c2)
NULL
rollback;
update t1 set c2 = (select /*+ NO_REWRITE */t1.c1 as a1 from t1 left join t2 on t1.c1 != t2.c1 where t2.c2 not in (1, 2, NULL) limit 1);
select stddev(c2) from t1;
stddev(c2)
NULL
rollback;
delete from t1 where c2 = (select t1.c1 as a1 from t1 left join t2 on t1.c1 != t2.c1 where t2.c2 not in (1, 2, NULL) limit 1);
select stddev(c2) from t1;
stddev(c2)
2.1147629234082532
rollback;
delete from t1 where c2 = (select /*+ NO_REWRITE */t1.c1 as a1 from t1 left join t2 on t1.c1 != t2.c1 where t2.c2 not in (1, 2, NULL) limit 1);
select stddev(c2) from t1;
stddev(c2)
2.1147629234082532
rollback;
select * from t1 left join t2 on t1.c1 != t2.c1 left join t3 on t1.c1 != t3.c1 left join t4 on t1.c1 != t4.c1 where t2.c1 is NULL and t3.c1 is NULL and t4.c1 is NULL;
c1	c2	c1	c2	c3	c1	c2	c3	c1	c2	c3
select /*+ NO_REWRITE */* from t1 left join t2 on t1.c1 != t2.c1 left join t3 on t1.c1 != t3.c1 left join t4 on t1.c1 != t4.c1 where t2.c1 is NULL and t3.c1 is NULL and t4.c1 is NULL;
c1	c2	c1	c2	c3	c1	c2	c3	c1	c2	c3
insert into t7_temp (select * from t1 left join t2 on t1.c1 != t2.c1 left join t3 on t1.c1 != t3.c1 left join t4 on t1.c1 != t4.c1 where t2.c1 is NULL and t3.c1 is NULL and t4.c1 is NULL);
rollback;
insert into t7_temp (select /*+ NO_REWRITE */* from t1 left join t2 on t1.c1 != t2.c1 left join t3 on t1.c1 != t3.c1 left join t4 on t1.c1 != t4.c1 where t2.c1 is NULL and t3.c1 is NULL and t4.c1 is NULL);
rollback;
update t1 set c2 = (select t1.c1 from t1 left join t2 on t1.c1 != t2.c1 left join t3 on t1.c1 != t3.c1 left join t4 on t1.c1 != t4.c1 where t2.c1 is NULL and t3.c1 is NULL and t4.c1 is NULL limit 1);
select stddev(c2) from t1;
stddev(c2)
NULL
rollback;
update t1 set c2 = (select /*+ NO_REWRITE */t1.c1 from t1 left join t2 on t1.c1 != t2.c1 left join t3 on t1.c1 != t3.c1 left join t4 on t1.c1 != t4.c1 where t2.c1 is NULL and t3.c1 is NULL and t4.c1 is NULL limit 1);
select stddev(c2) from t1;
stddev(c2)
NULL
rollback;
delete from t1 where c2 = (select t1.c1 from t1 left join t2 on t1.c1 != t2.c1 left join t3 on t1.c1 != t3.c1 left join t4 on t1.c1 != t4.c1 where t2.c1 is NULL and t3.c1 is NULL and t4.c1 is NULL limit 1);
select stddev(c2) from t1;
stddev(c2)
2.1147629234082532
rollback;
delete from t1 where c2 = (select /*+ NO_REWRITE */t1.c1 from t1 left join t2 on t1.c1 != t2.c1 left join t3 on t1.c1 != t3.c1 left join t4 on t1.c1 != t4.c1 where t2.c1 is NULL and t3.c1 is NULL and t4.c1 is NULL limit 1);
select stddev(c2) from t1;
stddev(c2)
2.1147629234082532
rollback;
select * from t1 left join t2 on t1.c1 != t2.c1 left join t3 on t1.c1 != t3.c1 left join t4 on t1.c1 != t4.c1 where t2.c1 is NULL and t3.c1 is NULL and t4.c1 = 0;
c1	c2	c1	c2	c3	c1	c2	c3	c1	c2	c3
select /*+ NO_REWRITE */* from t1 left join t2 on t1.c1 != t2.c1 left join t3 on t1.c1 != t3.c1 left join t4 on t1.c1 != t4.c1 where t2.c1 is NULL and t3.c1 is NULL and t4.c1 = 0;
c1	c2	c1	c2	c3	c1	c2	c3	c1	c2	c3
insert into t7_temp (select * from t1 left join t2 on t1.c1 != t2.c1 left join t3 on t1.c1 != t3.c1 left join t4 on t1.c1 != t4.c1 where t2.c1 is NULL and t3.c1 is NULL and t4.c1 = 0);
rollback;
insert into t7_temp (select /*+ NO_REWRITE */* from t1 left join t2 on t1.c1 != t2.c1 left join t3 on t1.c1 != t3.c1 left join t4 on t1.c1 != t4.c1 where t2.c1 is NULL and t3.c1 is NULL and t4.c1 = 0);
rollback;
update t1 set c2 = (select t1.c1 from t1 left join t2 on t1.c1 != t2.c1 left join t3 on t1.c1 != t3.c1 left join t4 on t1.c1 != t4.c1 where t2.c1 is NULL and t3.c1 is NULL and t4.c1 = 0 limit 1);
select stddev(c2) from t1;
stddev(c2)
NULL
rollback;
update t1 set c2 = (select /*+ NO_REWRITE */t1.c1 from t1 left join t2 on t1.c1 != t2.c1 left join t3 on t1.c1 != t3.c1 left join t4 on t1.c1 != t4.c1 where t2.c1 is NULL and t3.c1 is NULL and t4.c1 = 0 limit 1);
select stddev(c2) from t1;
stddev(c2)
NULL
rollback;
delete from t1 where c2 = (select t1.c1 from t1 left join t2 on t1.c1 != t2.c1 left join t3 on t1.c1 != t3.c1 left join t4 on t1.c1 != t4.c1 where t2.c1 is NULL and t3.c1 is NULL and t4.c1 = 0 limit 1);
select stddev(c2) from t1;
stddev(c2)
2.1147629234082532
rollback;
delete from t1 where c2 = (select /*+ NO_REWRITE */t1.c1 from t1 left join t2 on t1.c1 != t2.c1 left join t3 on t1.c1 != t3.c1 left join t4 on t1.c1 != t4.c1 where t2.c1 is NULL and t3.c1 is NULL and t4.c1 = 0 limit 1);
select stddev(c2) from t1;
stddev(c2)
2.1147629234082532
rollback;
select * from t1 left join t2 on t1.c1 != t2.c1 left join t3 on t1.c1 != t3.c1 left join t4 on t1.c1 != t4.c1 where t2.c1 is NULL and t3.c1 = 0 and t4.c1 is NULL;
c1	c2	c1	c2	c3	c1	c2	c3	c1	c2	c3
select /*+ NO_REWRITE */* from t1 left join t2 on t1.c1 != t2.c1 left join t3 on t1.c1 != t3.c1 left join t4 on t1.c1 != t4.c1 where t2.c1 is NULL and t3.c1 = 0 and t4.c1 is NULL;
c1	c2	c1	c2	c3	c1	c2	c3	c1	c2	c3
insert into t7_temp (select * from t1 left join t2 on t1.c1 != t2.c1 left join t3 on t1.c1 != t3.c1 left join t4 on t1.c1 != t4.c1 where t2.c1 is NULL and t3.c1 = 0 and t4.c1 is NULL);
rollback;
insert into t7_temp (select /*+ NO_REWRITE */* from t1 left join t2 on t1.c1 != t2.c1 left join t3 on t1.c1 != t3.c1 left join t4 on t1.c1 != t4.c1 where t2.c1 is NULL and t3.c1 = 0 and t4.c1 is NULL);
rollback;
update t1 set c2 = (select t1.c1 from t1 left join t2 on t1.c1 != t2.c1 left join t3 on t1.c1 != t3.c1 left join t4 on t1.c1 != t4.c1 where t2.c1 is NULL and t3.c1 = 0 and t4.c1 is NULL limit 1);
select stddev(c2) from t1;
stddev(c2)
NULL
rollback;
update t1 set c2 = (select /*+ NO_REWRITE */t1.c1 from t1 left join t2 on t1.c1 != t2.c1 left join t3 on t1.c1 != t3.c1 left join t4 on t1.c1 != t4.c1 where t2.c1 is NULL and t3.c1 = 0 and t4.c1 is NULL limit 1);
select stddev(c2) from t1;
stddev(c2)
NULL
rollback;
delete from t1 where c2 = (select t1.c1 from t1 left join t2 on t1.c1 != t2.c1 left join t3 on t1.c1 != t3.c1 left join t4 on t1.c1 != t4.c1 where t2.c1 is NULL and t3.c1 = 0 and t4.c1 is NULL limit 1);
select stddev(c2) from t1;
stddev(c2)
2.1147629234082532
rollback;
delete from t1 where c2 = (select /*+ NO_REWRITE */t1.c1 from t1 left join t2 on t1.c1 != t2.c1 left join t3 on t1.c1 != t3.c1 left join t4 on t1.c1 != t4.c1 where t2.c1 is NULL and t3.c1 = 0 and t4.c1 is NULL limit 1);
select stddev(c2) from t1;
stddev(c2)
2.1147629234082532
rollback;
select * from t1 left join t2 on t1.c1 != t2.c1 left join t3 on t1.c1 != t3.c1 left join t4 on t1.c1 != t4.c1 where t2.c1 is NULL and t3.c1 = 0 and t4.c1 = 0;
c1	c2	c1	c2	c3	c1	c2	c3	c1	c2	c3
select /*+ NO_REWRITE */* from t1 left join t2 on t1.c1 != t2.c1 left join t3 on t1.c1 != t3.c1 left join t4 on t1.c1 != t4.c1 where t2.c1 is NULL and t3.c1 = 0 and t4.c1 = 0;
c1	c2	c1	c2	c3	c1	c2	c3	c1	c2	c3
insert into t7_temp (select * from t1 left join t2 on t1.c1 != t2.c1 left join t3 on t1.c1 != t3.c1 left join t4 on t1.c1 != t4.c1 where t2.c1 is NULL and t3.c1 = 0 and t4.c1 = 0);
rollback;
insert into t7_temp (select /*+ NO_REWRITE */* from t1 left join t2 on t1.c1 != t2.c1 left join t3 on t1.c1 != t3.c1 left join t4 on t1.c1 != t4.c1 where t2.c1 is NULL and t3.c1 = 0 and t4.c1 = 0);
rollback;
update t1 set c2 = (select t1.c1 from t1 left join t2 on t1.c1 != t2.c1 left join t3 on t1.c1 != t3.c1 left join t4 on t1.c1 != t4.c1 where t2.c1 is NULL and t3.c1 = 0 and t4.c1 = 0 limit 1);
select stddev(c2) from t1;
stddev(c2)
NULL
rollback;
update t1 set c2 = (select /*+ NO_REWRITE */t1.c1 from t1 left join t2 on t1.c1 != t2.c1 left join t3 on t1.c1 != t3.c1 left join t4 on t1.c1 != t4.c1 where t2.c1 is NULL and t3.c1 = 0 and t4.c1 = 0 limit 1);
select stddev(c2) from t1;
stddev(c2)
NULL
rollback;
delete from t1 where c2 = (select t1.c1 from t1 left join t2 on t1.c1 != t2.c1 left join t3 on t1.c1 != t3.c1 left join t4 on t1.c1 != t4.c1 where t2.c1 is NULL and t3.c1 = 0 and t4.c1 = 0 limit 1);
select stddev(c2) from t1;
stddev(c2)
2.1147629234082532
rollback;
delete from t1 where c2 = (select /*+ NO_REWRITE */t1.c1 from t1 left join t2 on t1.c1 != t2.c1 left join t3 on t1.c1 != t3.c1 left join t4 on t1.c1 != t4.c1 where t2.c1 is NULL and t3.c1 = 0 and t4.c1 = 0 limit 1);
select stddev(c2) from t1;
stddev(c2)
2.1147629234082532
rollback;
select * from t1 left join t2 on t1.c1 != t2.c1 left join t3 on t1.c1 != t3.c1 left join t4 on t1.c1 != t4.c1 where t2.c1 = 0 and t3.c1 is NULL and t4.c1 is NULL;
c1	c2	c1	c2	c3	c1	c2	c3	c1	c2	c3
select /*+ NO_REWRITE */* from t1 left join t2 on t1.c1 != t2.c1 left join t3 on t1.c1 != t3.c1 left join t4 on t1.c1 != t4.c1 where t2.c1 = 0 and t3.c1 is NULL and t4.c1 is NULL;
c1	c2	c1	c2	c3	c1	c2	c3	c1	c2	c3
insert into t7_temp (select * from t1 left join t2 on t1.c1 != t2.c1 left join t3 on t1.c1 != t3.c1 left join t4 on t1.c1 != t4.c1 where t2.c1 = 0 and t3.c1 is NULL and t4.c1 is NULL);
rollback;
insert into t7_temp (select /*+ NO_REWRITE */* from t1 left join t2 on t1.c1 != t2.c1 left join t3 on t1.c1 != t3.c1 left join t4 on t1.c1 != t4.c1 where t2.c1 = 0 and t3.c1 is NULL and t4.c1 is NULL);
rollback;
update t1 set c2 = (select t1.c1 from t1 left join t2 on t1.c1 != t2.c1 left join t3 on t1.c1 != t3.c1 left join t4 on t1.c1 != t4.c1 where t2.c1 = 0 and t3.c1 is NULL and t4.c1 is NULL limit 1);
select stddev(c2) from t1;
stddev(c2)
NULL
rollback;
update t1 set c2 = (select /*+ NO_REWRITE */t1.c1 from t1 left join t2 on t1.c1 != t2.c1 left join t3 on t1.c1 != t3.c1 left join t4 on t1.c1 != t4.c1 where t2.c1 = 0 and t3.c1 is NULL and t4.c1 is NULL limit 1);
select stddev(c2) from t1;
stddev(c2)
NULL
rollback;
delete from t1 where c2 = (select t1.c1 from t1 left join t2 on t1.c1 != t2.c1 left join t3 on t1.c1 != t3.c1 left join t4 on t1.c1 != t4.c1 where t2.c1 = 0 and t3.c1 is NULL and t4.c1 is NULL limit 1);
select stddev(c2) from t1;
stddev(c2)
2.1147629234082532
rollback;
delete from t1 where c2 = (select /*+ NO_REWRITE */t1.c1 from t1 left join t2 on t1.c1 != t2.c1 left join t3 on t1.c1 != t3.c1 left join t4 on t1.c1 != t4.c1 where t2.c1 = 0 and t3.c1 is NULL and t4.c1 is NULL limit 1);
select stddev(c2) from t1;
stddev(c2)
2.1147629234082532
rollback;
select * from t1 left join t2 on t1.c1 != t2.c1 left join t3 on t1.c1 != t3.c1 left join t4 on t1.c1 != t4.c1 where t2.c1 = 0 and t3.c1 is NULL and t4.c1 = 0;
c1	c2	c1	c2	c3	c1	c2	c3	c1	c2	c3
select /*+ NO_REWRITE */* from t1 left join t2 on t1.c1 != t2.c1 left join t3 on t1.c1 != t3.c1 left join t4 on t1.c1 != t4.c1 where t2.c1 = 0 and t3.c1 is NULL and t4.c1 = 0;
c1	c2	c1	c2	c3	c1	c2	c3	c1	c2	c3
insert into t7_temp (select * from t1 left join t2 on t1.c1 != t2.c1 left join t3 on t1.c1 != t3.c1 left join t4 on t1.c1 != t4.c1 where t2.c1 = 0 and t3.c1 is NULL and t4.c1 = 0);
rollback;
insert into t7_temp (select /*+ NO_REWRITE */* from t1 left join t2 on t1.c1 != t2.c1 left join t3 on t1.c1 != t3.c1 left join t4 on t1.c1 != t4.c1 where t2.c1 = 0 and t3.c1 is NULL and t4.c1 = 0);
rollback;
update t1 set c2 = (select t1.c1 from t1 left join t2 on t1.c1 != t2.c1 left join t3 on t1.c1 != t3.c1 left join t4 on t1.c1 != t4.c1 where t2.c1 = 0 and t3.c1 is NULL and t4.c1 = 0 limit 1);
select stddev(c2) from t1;
stddev(c2)
NULL
rollback;
update t1 set c2 = (select /*+ NO_REWRITE */t1.c1 from t1 left join t2 on t1.c1 != t2.c1 left join t3 on t1.c1 != t3.c1 left join t4 on t1.c1 != t4.c1 where t2.c1 = 0 and t3.c1 is NULL and t4.c1 = 0 limit 1);
select stddev(c2) from t1;
stddev(c2)
NULL
rollback;
delete from t1 where c2 = (select t1.c1 from t1 left join t2 on t1.c1 != t2.c1 left join t3 on t1.c1 != t3.c1 left join t4 on t1.c1 != t4.c1 where t2.c1 = 0 and t3.c1 is NULL and t4.c1 = 0 limit 1);
select stddev(c2) from t1;
stddev(c2)
2.1147629234082532
rollback;
delete from t1 where c2 = (select /*+ NO_REWRITE */t1.c1 from t1 left join t2 on t1.c1 != t2.c1 left join t3 on t1.c1 != t3.c1 left join t4 on t1.c1 != t4.c1 where t2.c1 = 0 and t3.c1 is NULL and t4.c1 = 0 limit 1);
select stddev(c2) from t1;
stddev(c2)
2.1147629234082532
rollback;
select * from t1 left join t2 on t1.c1 != t2.c1 left join t3 on t1.c1 != t3.c1 left join t4 on t1.c1 != t4.c1 where t2.c1 = 0 and t3.c1 = 0 and t4.c1 IS NULL;
c1	c2	c1	c2	c3	c1	c2	c3	c1	c2	c3
select /*+ NO_REWRITE */* from t1 left join t2 on t1.c1 != t2.c1 left join t3 on t1.c1 != t3.c1 left join t4 on t1.c1 != t4.c1 where t2.c1 = 0 and t3.c1 = 0 and t4.c1 IS NULL;
c1	c2	c1	c2	c3	c1	c2	c3	c1	c2	c3
insert into t7_temp (select * from t1 left join t2 on t1.c1 != t2.c1 left join t3 on t1.c1 != t3.c1 left join t4 on t1.c1 != t4.c1 where t2.c1 = 0 and t3.c1 = 0 and t4.c1 IS NULL);
rollback;
insert into t7_temp (select /*+ NO_REWRITE */* from t1 left join t2 on t1.c1 != t2.c1 left join t3 on t1.c1 != t3.c1 left join t4 on t1.c1 != t4.c1 where t2.c1 = 0 and t3.c1 = 0 and t4.c1 IS NULL);
rollback;
update t1 set c2 = (select t1.c1 from t1 left join t2 on t1.c1 != t2.c1 left join t3 on t1.c1 != t3.c1 left join t4 on t1.c1 != t4.c1 where t2.c1 = 0 and t3.c1 = 0 and t4.c1 IS NULL limit 1);
select stddev(c2) from t1;
stddev(c2)
NULL
rollback;
update t1 set c2 = (select /*+ NO_REWRITE */t1.c1 from t1 left join t2 on t1.c1 != t2.c1 left join t3 on t1.c1 != t3.c1 left join t4 on t1.c1 != t4.c1 where t2.c1 = 0 and t3.c1 = 0 and t4.c1 IS NULL limit 1);
select stddev(c2) from t1;
stddev(c2)
NULL
rollback;
delete from t1 where c2 = (select t1.c1 from t1 left join t2 on t1.c1 != t2.c1 left join t3 on t1.c1 != t3.c1 left join t4 on t1.c1 != t4.c1 where t2.c1 = 0 and t3.c1 = 0 and t4.c1 IS NULL limit 1);
select stddev(c2) from t1;
stddev(c2)
2.1147629234082532
rollback;
delete from t1 where c2 = (select /*+ NO_REWRITE */t1.c1 from t1 left join t2 on t1.c1 != t2.c1 left join t3 on t1.c1 != t3.c1 left join t4 on t1.c1 != t4.c1 where t2.c1 = 0 and t3.c1 = 0 and t4.c1 IS NULL limit 1);
select stddev(c2) from t1;
stddev(c2)
2.1147629234082532
rollback;
select * from t1 left join t2 on t1.c1 != t2.c1 left join t3 on t1.c1 != t3.c1 left join t4 on t1.c1 != t4.c1 where t2.c1 = 0 and t3.c1 = 0 and t4.c1 = 0;
c1	c2	c1	c2	c3	c1	c2	c3	c1	c2	c3
select /*+ NO_REWRITE */* from t1 left join t2 on t1.c1 != t2.c1 left join t3 on t1.c1 != t3.c1 left join t4 on t1.c1 != t4.c1 where t2.c1 = 0 and t3.c1 = 0 and t4.c1 = 0;
c1	c2	c1	c2	c3	c1	c2	c3	c1	c2	c3
insert into t7_temp (select * from t1 left join t2 on t1.c1 != t2.c1 left join t3 on t1.c1 != t3.c1 left join t4 on t1.c1 != t4.c1 where t2.c1 = 0 and t3.c1 = 0 and t4.c1 = 0);
rollback;
insert into t7_temp (select /*+ NO_REWRITE */* from t1 left join t2 on t1.c1 != t2.c1 left join t3 on t1.c1 != t3.c1 left join t4 on t1.c1 != t4.c1 where t2.c1 = 0 and t3.c1 = 0 and t4.c1 = 0);
rollback;
update t1 set c2 = (select t1.c1 from t1 left join t2 on t1.c1 != t2.c1 left join t3 on t1.c1 != t3.c1 left join t4 on t1.c1 != t4.c1 where t2.c1 = 0 and t3.c1 = 0 and t4.c1 = 0 limit 1);
select stddev(c2) from t1;
stddev(c2)
NULL
rollback;
update t1 set c2 = (select /*+ NO_REWRITE */t1.c1 from t1 left join t2 on t1.c1 != t2.c1 left join t3 on t1.c1 != t3.c1 left join t4 on t1.c1 != t4.c1 where t2.c1 = 0 and t3.c1 = 0 and t4.c1 = 0 limit 1);
select stddev(c2) from t1;
stddev(c2)
NULL
rollback;
delete from t1 where c2 = (select t1.c1 from t1 left join t2 on t1.c1 != t2.c1 left join t3 on t1.c1 != t3.c1 left join t4 on t1.c1 != t4.c1 where t2.c1 = 0 and t3.c1 = 0 and t4.c1 = 0 limit 1);
select stddev(c2) from t1;
stddev(c2)
2.1147629234082532
rollback;
delete from t1 where c2 = (select /*+ NO_REWRITE */t1.c1 from t1 left join t2 on t1.c1 != t2.c1 left join t3 on t1.c1 != t3.c1 left join t4 on t1.c1 != t4.c1 where t2.c1 = 0 and t3.c1 = 0 and t4.c1 = 0 limit 1);
select stddev(c2) from t1;
stddev(c2)
2.1147629234082532
rollback;
select * from (t1 left join t2 on t1.c1 != t2.c1) left join (t3 left join t4 on t4.c1 != t3.c1) on t1.c1 != t4.c1 where t2.c1 is NULL and t3.c1 is NULL and t4.c1 is NULL;
c1	c2	c1	c2	c3	c1	c2	c3	c1	c2	c3
select /*+ NO_REWRITE */* from (t1 left join t2 on t1.c1 != t2.c1) left join (t3 left join t4 on t4.c1 != t3.c1) on t1.c1 != t4.c1 where t2.c1 is NULL and t3.c1 is NULL and t4.c1 is NULL;
c1	c2	c1	c2	c3	c1	c2	c3	c1	c2	c3
insert into t7_temp (select * from (t1 left join t2 on t1.c1 != t2.c1) left join (t3 left join t4 on t4.c1 != t3.c1) on t1.c1 != t4.c1 where t2.c1 is NULL and t3.c1 is NULL and t4.c1 is NULL);
rollback;
insert into t7_temp (select /*+ NO_REWRITE */* from (t1 left join t2 on t1.c1 != t2.c1) left join (t3 left join t4 on t4.c1 != t3.c1) on t1.c1 != t4.c1 where t2.c1 is NULL and t3.c1 is NULL and t4.c1 is NULL);
rollback;
update t1 set c2 = (select t1.c1 from (t1 left join t2 on t1.c1 != t2.c1) left join (t3 left join t4 on t4.c1 != t3.c1) on t1.c1 != t4.c1 where t2.c1 is NULL and t3.c1 is NULL and t4.c1 is NULL limit 1);
select stddev(c2) from t1;
stddev(c2)
NULL
rollback;
update t1 set c2 = (select /*+ NO_REWRITE */t1.c1 from (t1 left join t2 on t1.c1 != t2.c1) left join (t3 left join t4 on t4.c1 != t3.c1) on t1.c1 != t4.c1 where t2.c1 is NULL and t3.c1 is NULL and t4.c1 is NULL limit 1);
select stddev(c2) from t1;
stddev(c2)
NULL
rollback;
delete from t1 where c2 = (select t1.c1 from (t1 left join t2 on t1.c1 != t2.c1) left join (t3 left join t4 on t4.c1 != t3.c1) on t1.c1 != t4.c1 where t2.c1 is NULL and t3.c1 is NULL and t4.c1 is NULL limit 1);
select stddev(c2) from t1;
stddev(c2)
2.1147629234082532
rollback;
delete from t1 where c2 = (select /*+ NO_REWRITE */t1.c1 from (t1 left join t2 on t1.c1 != t2.c1) left join (t3 left join t4 on t4.c1 != t3.c1) on t1.c1 != t4.c1 where t2.c1 is NULL and t3.c1 is NULL and t4.c1 is NULL limit 1);
select stddev(c2) from t1;
stddev(c2)
2.1147629234082532
rollback;
select * from (t1 left join t2 on t1.c1 != t2.c1) left join (t3 left join t4 on t4.c1 != t3.c1) on t1.c1 != t4.c1 where t2.c1 is NULL and t3.c1 is NULL and t4.c1 = 0;
c1	c2	c1	c2	c3	c1	c2	c3	c1	c2	c3
select /*+ NO_REWRITE */* from (t1 left join t2 on t1.c1 != t2.c1) left join (t3 left join t4 on t4.c1 != t3.c1) on t1.c1 != t4.c1 where t2.c1 is NULL and t3.c1 is NULL and t4.c1 = 0;
c1	c2	c1	c2	c3	c1	c2	c3	c1	c2	c3
insert into t7_temp (select * from (t1 left join t2 on t1.c1 != t2.c1) left join (t3 left join t4 on t4.c1 != t3.c1) on t1.c1 != t4.c1 where t2.c1 is NULL and t3.c1 is NULL and t4.c1 = 0);
rollback;
insert into t7_temp (select /*+ NO_REWRITE */* from (t1 left join t2 on t1.c1 != t2.c1) left join (t3 left join t4 on t4.c1 != t3.c1) on t1.c1 != t4.c1 where t2.c1 is NULL and t3.c1 is NULL and t4.c1 = 0);
rollback;
update t1 set c2 = (select t1.c1 from (t1 left join t2 on t1.c1 != t2.c1) left join (t3 left join t4 on t4.c1 != t3.c1) on t1.c1 != t4.c1 where t2.c1 is NULL and t3.c1 is NULL and t4.c1 = 0 limit 1);
select stddev(c2) from t1;
stddev(c2)
NULL
rollback;
update t1 set c2 = (select /*+ NO_REWRITE */t1.c1 from (t1 left join t2 on t1.c1 != t2.c1) left join (t3 left join t4 on t4.c1 != t3.c1) on t1.c1 != t4.c1 where t2.c1 is NULL and t3.c1 is NULL and t4.c1 = 0 limit 1);
select stddev(c2) from t1;
stddev(c2)
NULL
rollback;
delete from t1 where c2 = (select t1.c1 from (t1 left join t2 on t1.c1 != t2.c1) left join (t3 left join t4 on t4.c1 != t3.c1) on t1.c1 != t4.c1 where t2.c1 is NULL and t3.c1 is NULL and t4.c1 = 0 limit 1);
select stddev(c2) from t1;
stddev(c2)
2.1147629234082532
rollback;
delete from t1 where c2 = (select /*+ NO_REWRITE */t1.c1 from (t1 left join t2 on t1.c1 != t2.c1) left join (t3 left join t4 on t4.c1 != t3.c1) on t1.c1 != t4.c1 where t2.c1 is NULL and t3.c1 is NULL and t4.c1 = 0 limit 1);
select stddev(c2) from t1;
stddev(c2)
2.1147629234082532
rollback;
select * from (t1 left join t2 on t1.c1 != t2.c1) left join (t3 left join t4 on t4.c1 != t3.c1) on t1.c1 != t4.c1 where t2.c1 is NULL and t3.c1 = 0 and t4.c1 is NULL;
c1	c2	c1	c2	c3	c1	c2	c3	c1	c2	c3
select /*+ NO_REWRITE */* from (t1 left join t2 on t1.c1 != t2.c1) left join (t3 left join t4 on t4.c1 != t3.c1) on t1.c1 != t4.c1 where t2.c1 is NULL and t3.c1 = 0 and t4.c1 is NULL;
c1	c2	c1	c2	c3	c1	c2	c3	c1	c2	c3
insert into t7_temp (select * from (t1 left join t2 on t1.c1 != t2.c1) left join (t3 left join t4 on t4.c1 != t3.c1) on t1.c1 != t4.c1 where t2.c1 is NULL and t3.c1 = 0 and t4.c1 is NULL);
rollback;
insert into t7_temp (select /*+ NO_REWRITE */* from (t1 left join t2 on t1.c1 != t2.c1) left join (t3 left join t4 on t4.c1 != t3.c1) on t1.c1 != t4.c1 where t2.c1 is NULL and t3.c1 = 0 and t4.c1 is NULL);
rollback;
update t1 set c2 = (select t1.c1 from (t1 left join t2 on t1.c1 != t2.c1) left join (t3 left join t4 on t4.c1 != t3.c1) on t1.c1 != t4.c1 where t2.c1 is NULL and t3.c1 = 0 and t4.c1 is NULL limit 1);
select stddev(c2) from t1;
stddev(c2)
NULL
rollback;
update t1 set c2 = (select /*+ NO_REWRITE */t1.c1 from (t1 left join t2 on t1.c1 != t2.c1) left join (t3 left join t4 on t4.c1 != t3.c1) on t1.c1 != t4.c1 where t2.c1 is NULL and t3.c1 = 0 and t4.c1 is NULL limit 1);
select stddev(c2) from t1;
stddev(c2)
NULL
rollback;
delete from t1 where c2 = (select t1.c1 from (t1 left join t2 on t1.c1 != t2.c1) left join (t3 left join t4 on t4.c1 != t3.c1) on t1.c1 != t4.c1 where t2.c1 is NULL and t3.c1 = 0 and t4.c1 is NULL limit 1);
select stddev(c2) from t1;
stddev(c2)
2.1147629234082532
rollback;
delete from t1 where c2 = (select /*+ NO_REWRITE */t1.c1 from (t1 left join t2 on t1.c1 != t2.c1) left join (t3 left join t4 on t4.c1 != t3.c1) on t1.c1 != t4.c1 where t2.c1 is NULL and t3.c1 = 0 and t4.c1 is NULL limit 1);
select stddev(c2) from t1;
stddev(c2)
2.1147629234082532
rollback;
select * from (t1 left join t2 on t1.c1 != t2.c1) left join (t3 left join t4 on t4.c1 != t3.c1) on t1.c1 != t4.c1 where t2.c1 is NULL and t3.c1 = 0 and t4.c1 = 0;
c1	c2	c1	c2	c3	c1	c2	c3	c1	c2	c3
select /*+ NO_REWRITE */* from (t1 left join t2 on t1.c1 != t2.c1) left join (t3 left join t4 on t4.c1 != t3.c1) on t1.c1 != t4.c1 where t2.c1 is NULL and t3.c1 = 0 and t4.c1 = 0;
c1	c2	c1	c2	c3	c1	c2	c3	c1	c2	c3
insert into t7_temp (select * from (t1 left join t2 on t1.c1 != t2.c1) left join (t3 left join t4 on t4.c1 != t3.c1) on t1.c1 != t4.c1 where t2.c1 is NULL and t3.c1 = 0 and t4.c1 = 0);
rollback;
insert into t7_temp (select /*+ NO_REWRITE */* from (t1 left join t2 on t1.c1 != t2.c1) left join (t3 left join t4 on t4.c1 != t3.c1) on t1.c1 != t4.c1 where t2.c1 is NULL and t3.c1 = 0 and t4.c1 = 0);
rollback;
update t1 set c2 = (select t1.c1 from (t1 left join t2 on t1.c1 != t2.c1) left join (t3 left join t4 on t4.c1 != t3.c1) on t1.c1 != t4.c1 where t2.c1 is NULL and t3.c1 = 0 and t4.c1 = 0 limit 1);
select stddev(c2) from t1;
stddev(c2)
NULL
rollback;
update t1 set c2 = (select /*+ NO_REWRITE */t1.c1 from (t1 left join t2 on t1.c1 != t2.c1) left join (t3 left join t4 on t4.c1 != t3.c1) on t1.c1 != t4.c1 where t2.c1 is NULL and t3.c1 = 0 and t4.c1 = 0 limit 1);
select stddev(c2) from t1;
stddev(c2)
NULL
rollback;
delete from t1 where c2 = (select t1.c1 from (t1 left join t2 on t1.c1 != t2.c1) left join (t3 left join t4 on t4.c1 != t3.c1) on t1.c1 != t4.c1 where t2.c1 is NULL and t3.c1 = 0 and t4.c1 = 0 limit 1);
select stddev(c2) from t1;
stddev(c2)
2.1147629234082532
rollback;
delete from t1 where c2 = (select /*+ NO_REWRITE */t1.c1 from (t1 left join t2 on t1.c1 != t2.c1) left join (t3 left join t4 on t4.c1 != t3.c1) on t1.c1 != t4.c1 where t2.c1 is NULL and t3.c1 = 0 and t4.c1 = 0 limit 1);
select stddev(c2) from t1;
stddev(c2)
2.1147629234082532
rollback;
select * from (t1 left join t2 on t1.c1 != t2.c1) left join (t3 left join t4 on t4.c1 != t3.c1) on t1.c1 != t4.c1 where t2.c1 = 0 and t3.c1 is NULL and t4.c1 is NULL;
c1	c2	c1	c2	c3	c1	c2	c3	c1	c2	c3
select /*+ NO_REWRITE */* from (t1 left join t2 on t1.c1 != t2.c1) left join (t3 left join t4 on t4.c1 != t3.c1) on t1.c1 != t4.c1 where t2.c1 = 0 and t3.c1 is NULL and t4.c1 is NULL;
c1	c2	c1	c2	c3	c1	c2	c3	c1	c2	c3
insert into t7_temp (select * from (t1 left join t2 on t1.c1 != t2.c1) left join (t3 left join t4 on t4.c1 != t3.c1) on t1.c1 != t4.c1 where t2.c1 = 0 and t3.c1 is NULL and t4.c1 is NULL);
rollback;
insert into t7_temp (select /*+ NO_REWRITE */* from (t1 left join t2 on t1.c1 != t2.c1) left join (t3 left join t4 on t4.c1 != t3.c1) on t1.c1 != t4.c1 where t2.c1 = 0 and t3.c1 is NULL and t4.c1 is NULL);
rollback;
update t1 set c2 = (select t1.c1 from (t1 left join t2 on t1.c1 != t2.c1) left join (t3 left join t4 on t4.c1 != t3.c1) on t1.c1 != t4.c1 where t2.c1 = 0 and t3.c1 is NULL and t4.c1 is NULL limit 1);
select stddev(c2) from t1;
stddev(c2)
NULL
rollback;
update t1 set c2 = (select /*+ NO_REWRITE */t1.c1 from (t1 left join t2 on t1.c1 != t2.c1) left join (t3 left join t4 on t4.c1 != t3.c1) on t1.c1 != t4.c1 where t2.c1 = 0 and t3.c1 is NULL and t4.c1 is NULL limit 1);
select stddev(c2) from t1;
stddev(c2)
NULL
rollback;
delete from t1 where c2 = (select t1.c1 from (t1 left join t2 on t1.c1 != t2.c1) left join (t3 left join t4 on t4.c1 != t3.c1) on t1.c1 != t4.c1 where t2.c1 = 0 and t3.c1 is NULL and t4.c1 is NULL limit 1);
select stddev(c2) from t1;
stddev(c2)
2.1147629234082532
rollback;
delete from t1 where c2 = (select /*+ NO_REWRITE */t1.c1 from (t1 left join t2 on t1.c1 != t2.c1) left join (t3 left join t4 on t4.c1 != t3.c1) on t1.c1 != t4.c1 where t2.c1 = 0 and t3.c1 is NULL and t4.c1 is NULL limit 1);
select stddev(c2) from t1;
stddev(c2)
2.1147629234082532
rollback;
select * from (t1 left join t2 on t1.c1 != t2.c1) left join (t3 left join t4 on t4.c1 != t3.c1) on t1.c1 != t4.c1 where t2.c1 = 0 and t3.c1 is NULL and t4.c1 = 0;
c1	c2	c1	c2	c3	c1	c2	c3	c1	c2	c3
select /*+ NO_REWRITE */* from (t1 left join t2 on t1.c1 != t2.c1) left join (t3 left join t4 on t4.c1 != t3.c1) on t1.c1 != t4.c1 where t2.c1 = 0 and t3.c1 is NULL and t4.c1 = 0;
c1	c2	c1	c2	c3	c1	c2	c3	c1	c2	c3
insert into t7_temp (select * from (t1 left join t2 on t1.c1 != t2.c1) left join (t3 left join t4 on t4.c1 != t3.c1) on t1.c1 != t4.c1 where t2.c1 = 0 and t3.c1 is NULL and t4.c1 = 0);
rollback;
insert into t7_temp (select /*+ NO_REWRITE */* from (t1 left join t2 on t1.c1 != t2.c1) left join (t3 left join t4 on t4.c1 != t3.c1) on t1.c1 != t4.c1 where t2.c1 = 0 and t3.c1 is NULL and t4.c1 = 0);
rollback;
update t1 set c2 = (select t1.c1 from (t1 left join t2 on t1.c1 != t2.c1) left join (t3 left join t4 on t4.c1 != t3.c1) on t1.c1 != t4.c1 where t2.c1 = 0 and t3.c1 is NULL and t4.c1 = 0 limit 1);
select stddev(c2) from t1;
stddev(c2)
NULL
rollback;
update t1 set c2 = (select /*+ NO_REWRITE */t1.c1 from (t1 left join t2 on t1.c1 != t2.c1) left join (t3 left join t4 on t4.c1 != t3.c1) on t1.c1 != t4.c1 where t2.c1 = 0 and t3.c1 is NULL and t4.c1 = 0 limit 1);
select stddev(c2) from t1;
stddev(c2)
NULL
rollback;
delete from t1 where c2 = (select t1.c1 from (t1 left join t2 on t1.c1 != t2.c1) left join (t3 left join t4 on t4.c1 != t3.c1) on t1.c1 != t4.c1 where t2.c1 = 0 and t3.c1 is NULL and t4.c1 = 0 limit 1);
select stddev(c2) from t1;
stddev(c2)
2.1147629234082532
rollback;
delete from t1 where c2 = (select /*+ NO_REWRITE */t1.c1 from (t1 left join t2 on t1.c1 != t2.c1) left join (t3 left join t4 on t4.c1 != t3.c1) on t1.c1 != t4.c1 where t2.c1 = 0 and t3.c1 is NULL and t4.c1 = 0 limit 1);
select stddev(c2) from t1;
stddev(c2)
2.1147629234082532
rollback;
select * from (t1 left join t2 on t1.c1 != t2.c1) left join (t3 left join t4 on t4.c1 != t3.c1) on t1.c1 != t4.c1 where t2.c1 = 0 and t3.c1 = 0 and t4.c1 IS NULL;
c1	c2	c1	c2	c3	c1	c2	c3	c1	c2	c3
select /*+ NO_REWRITE */* from (t1 left join t2 on t1.c1 != t2.c1) left join (t3 left join t4 on t4.c1 != t3.c1) on t1.c1 != t4.c1 where t2.c1 = 0 and t3.c1 = 0 and t4.c1 IS NULL;
c1	c2	c1	c2	c3	c1	c2	c3	c1	c2	c3
insert into t7_temp (select * from (t1 left join t2 on t1.c1 != t2.c1) left join (t3 left join t4 on t4.c1 != t3.c1) on t1.c1 != t4.c1 where t2.c1 = 0 and t3.c1 = 0 and t4.c1 IS NULL);
rollback;
insert into t7_temp (select /*+ NO_REWRITE */* from (t1 left join t2 on t1.c1 != t2.c1) left join (t3 left join t4 on t4.c1 != t3.c1) on t1.c1 != t4.c1 where t2.c1 = 0 and t3.c1 = 0 and t4.c1 IS NULL);
rollback;
update t1 set c2 = (select t1.c1 from (t1 left join t2 on t1.c1 != t2.c1) left join (t3 left join t4 on t4.c1 != t3.c1) on t1.c1 != t4.c1 where t2.c1 = 0 and t3.c1 = 0 and t4.c1 IS NULL limit 1);
select stddev(c2) from t1;
stddev(c2)
NULL
rollback;
update t1 set c2 = (select /*+ NO_REWRITE */t1.c1 from (t1 left join t2 on t1.c1 != t2.c1) left join (t3 left join t4 on t4.c1 != t3.c1) on t1.c1 != t4.c1 where t2.c1 = 0 and t3.c1 = 0 and t4.c1 IS NULL limit 1);
select stddev(c2) from t1;
stddev(c2)
NULL
rollback;
delete from t1 where c2 = (select t1.c1 from (t1 left join t2 on t1.c1 != t2.c1) left join (t3 left join t4 on t4.c1 != t3.c1) on t1.c1 != t4.c1 where t2.c1 = 0 and t3.c1 = 0 and t4.c1 IS NULL limit 1);
select stddev(c2) from t1;
stddev(c2)
2.1147629234082532
rollback;
delete from t1 where c2 = (select /*+ NO_REWRITE */t1.c1 from (t1 left join t2 on t1.c1 != t2.c1) left join (t3 left join t4 on t4.c1 != t3.c1) on t1.c1 != t4.c1 where t2.c1 = 0 and t3.c1 = 0 and t4.c1 IS NULL limit 1);
select stddev(c2) from t1;
stddev(c2)
2.1147629234082532
rollback;
select * from (t1 left join t2 on t1.c1 != t2.c1) left join (t3 left join t4 on t4.c1 != t3.c1) on t1.c1 != t4.c1 where t2.c1 = 0 and t3.c1 = 0 and t4.c1 = 0;
c1	c2	c1	c2	c3	c1	c2	c3	c1	c2	c3
select /*+ NO_REWRITE */* from (t1 left join t2 on t1.c1 != t2.c1) left join (t3 left join t4 on t4.c1 != t3.c1) on t1.c1 != t4.c1 where t2.c1 = 0 and t3.c1 = 0 and t4.c1 = 0;
c1	c2	c1	c2	c3	c1	c2	c3	c1	c2	c3
insert into t7_temp (select * from (t1 left join t2 on t1.c1 != t2.c1) left join (t3 left join t4 on t4.c1 != t3.c1) on t1.c1 != t4.c1 where t2.c1 = 0 and t3.c1 = 0 and t4.c1 = 0);
rollback;
insert into t7_temp (select /*+ NO_REWRITE */* from (t1 left join t2 on t1.c1 != t2.c1) left join (t3 left join t4 on t4.c1 != t3.c1) on t1.c1 != t4.c1 where t2.c1 = 0 and t3.c1 = 0 and t4.c1 = 0);
rollback;
update t1 set c2 = (select t1.c1 from (t1 left join t2 on t1.c1 != t2.c1) left join (t3 left join t4 on t4.c1 != t3.c1) on t1.c1 != t4.c1 where t2.c1 = 0 and t3.c1 = 0 and t4.c1 = 0 limit 1);
select stddev(c2) from t1;
stddev(c2)
NULL
rollback;
update t1 set c2 = (select /*+ NO_REWRITE */t1.c1 from (t1 left join t2 on t1.c1 != t2.c1) left join (t3 left join t4 on t4.c1 != t3.c1) on t1.c1 != t4.c1 where t2.c1 = 0 and t3.c1 = 0 and t4.c1 = 0 limit 1);
select stddev(c2) from t1;
stddev(c2)
NULL
rollback;
delete from t1 where c2 = (select t1.c1 from (t1 left join t2 on t1.c1 != t2.c1) left join (t3 left join t4 on t4.c1 != t3.c1) on t1.c1 != t4.c1 where t2.c1 = 0 and t3.c1 = 0 and t4.c1 = 0 limit 1);
select stddev(c2) from t1;
stddev(c2)
2.1147629234082532
rollback;
delete from t1 where c2 = (select /*+ NO_REWRITE */t1.c1 from (t1 left join t2 on t1.c1 != t2.c1) left join (t3 left join t4 on t4.c1 != t3.c1) on t1.c1 != t4.c1 where t2.c1 = 0 and t3.c1 = 0 and t4.c1 = 0 limit 1);
select stddev(c2) from t1;
stddev(c2)
2.1147629234082532
rollback;
select * from (t1 full join t2 on t1.c1 = t2.c1) left join (t3 left join t4 on t4.c1 = t3.c1) on t1.c1 = t4.c1 where t2.c1 is NULL and t3.c1 is NULL and t4.c1 is NULL;
c1	c2	c1	c2	c3	c1	c2	c3	c1	c2	c3
select /*+ NO_REWRITE */* from (t1 full join t2 on t1.c1 = t2.c1) left join (t3 left join t4 on t4.c1 = t3.c1) on t1.c1 = t4.c1 where t2.c1 is NULL and t3.c1 is NULL and t4.c1 is NULL;
c1	c2	c1	c2	c3	c1	c2	c3	c1	c2	c3
insert into t7_temp (select * from (t1 full join t2 on t1.c1 = t2.c1) left join (t3 left join t4 on t4.c1 = t3.c1) on t1.c1 = t4.c1 where t2.c1 is NULL and t3.c1 is NULL and t4.c1 is NULL);
rollback;
insert into t7_temp (select /*+ NO_REWRITE */* from (t1 full join t2 on t1.c1 = t2.c1) left join (t3 left join t4 on t4.c1 = t3.c1) on t1.c1 = t4.c1 where t2.c1 is NULL and t3.c1 is NULL and t4.c1 is NULL);
rollback;
update t1 set c2 = (select t1.c1 from (t1 full join t2 on t1.c1 = t2.c1) left join (t3 left join t4 on t4.c1 = t3.c1) on t1.c1 = t4.c1 where t2.c1 is NULL and t3.c1 is NULL and t4.c1 is NULL limit 1);
select stddev(c2) from t1;
stddev(c2)
NULL
rollback;
update t1 set c2 = (select /*+ NO_REWRITE */t1.c1 from (t1 full join t2 on t1.c1 = t2.c1) left join (t3 left join t4 on t4.c1 = t3.c1) on t1.c1 = t4.c1 where t2.c1 is NULL and t3.c1 is NULL and t4.c1 is NULL limit 1);
select stddev(c2) from t1;
stddev(c2)
NULL
rollback;
delete from t1 where c2 = (select t1.c1 from (t1 full join t2 on t1.c1 = t2.c1) left join (t3 left join t4 on t4.c1 = t3.c1) on t1.c1 = t4.c1 where t2.c1 is NULL and t3.c1 is NULL and t4.c1 is NULL limit 1);
select stddev(c2) from t1;
stddev(c2)
2.1147629234082532
rollback;
delete from t1 where c2 = (select /*+ NO_REWRITE */t1.c1 from (t1 full join t2 on t1.c1 = t2.c1) left join (t3 left join t4 on t4.c1 = t3.c1) on t1.c1 = t4.c1 where t2.c1 is NULL and t3.c1 is NULL and t4.c1 is NULL limit 1);
select stddev(c2) from t1;
stddev(c2)
2.1147629234082532
rollback;
select * from (t1 full join t2 on t1.c1 = t2.c1) left join (t3 left join t4 on t4.c1 = t3.c1) on t1.c1 = t4.c1 where t2.c1 is NULL and t3.c1 is NULL and t4.c1 = 0;
c1	c2	c1	c2	c3	c1	c2	c3	c1	c2	c3
select /*+ NO_REWRITE */* from (t1 full join t2 on t1.c1 = t2.c1) left join (t3 left join t4 on t4.c1 = t3.c1) on t1.c1 = t4.c1 where t2.c1 is NULL and t3.c1 is NULL and t4.c1 = 0;
c1	c2	c1	c2	c3	c1	c2	c3	c1	c2	c3
insert into t7_temp (select * from (t1 full join t2 on t1.c1 = t2.c1) left join (t3 left join t4 on t4.c1 = t3.c1) on t1.c1 = t4.c1 where t2.c1 is NULL and t3.c1 is NULL and t4.c1 = 0);
rollback;
insert into t7_temp (select /*+ NO_REWRITE */* from (t1 full join t2 on t1.c1 = t2.c1) left join (t3 left join t4 on t4.c1 = t3.c1) on t1.c1 = t4.c1 where t2.c1 is NULL and t3.c1 is NULL and t4.c1 = 0);
rollback;
update t1 set c2 = (select t1.c1 from (t1 full join t2 on t1.c1 = t2.c1) left join (t3 left join t4 on t4.c1 = t3.c1) on t1.c1 = t4.c1 where t2.c1 is NULL and t3.c1 is NULL and t4.c1 = 0 limit 1);
select stddev(c2) from t1;
stddev(c2)
NULL
rollback;
update t1 set c2 = (select /*+ NO_REWRITE */t1.c1 from (t1 full join t2 on t1.c1 = t2.c1) left join (t3 left join t4 on t4.c1 = t3.c1) on t1.c1 = t4.c1 where t2.c1 is NULL and t3.c1 is NULL and t4.c1 = 0 limit 1);
select stddev(c2) from t1;
stddev(c2)
NULL
rollback;
delete from t1 where c2 = (select t1.c1 from (t1 full join t2 on t1.c1 = t2.c1) left join (t3 left join t4 on t4.c1 = t3.c1) on t1.c1 = t4.c1 where t2.c1 is NULL and t3.c1 is NULL and t4.c1 = 0 limit 1);
select stddev(c2) from t1;
stddev(c2)
2.1147629234082532
rollback;
delete from t1 where c2 = (select /*+ NO_REWRITE */t1.c1 from (t1 full join t2 on t1.c1 = t2.c1) left join (t3 left join t4 on t4.c1 = t3.c1) on t1.c1 = t4.c1 where t2.c1 is NULL and t3.c1 is NULL and t4.c1 = 0 limit 1);
select stddev(c2) from t1;
stddev(c2)
2.1147629234082532
rollback;
select * from (t1 full join t2 on t1.c1 = t2.c1) left join (t3 left join t4 on t4.c1 = t3.c1) on t1.c1 = t4.c1 where t2.c1 is NULL and t3.c1 = 0 and t4.c1 is NULL;
c1	c2	c1	c2	c3	c1	c2	c3	c1	c2	c3
select /*+ NO_REWRITE */* from (t1 full join t2 on t1.c1 = t2.c1) left join (t3 left join t4 on t4.c1 = t3.c1) on t1.c1 = t4.c1 where t2.c1 is NULL and t3.c1 = 0 and t4.c1 is NULL;
c1	c2	c1	c2	c3	c1	c2	c3	c1	c2	c3
insert into t7_temp (select * from (t1 full join t2 on t1.c1 = t2.c1) left join (t3 left join t4 on t4.c1 = t3.c1) on t1.c1 = t4.c1 where t2.c1 is NULL and t3.c1 = 0 and t4.c1 is NULL);
rollback;
insert into t7_temp (select /*+ NO_REWRITE */* from (t1 full join t2 on t1.c1 = t2.c1) left join (t3 left join t4 on t4.c1 = t3.c1) on t1.c1 = t4.c1 where t2.c1 is NULL and t3.c1 = 0 and t4.c1 is NULL);
rollback;
update t1 set c2 = (select t1.c1 from (t1 full join t2 on t1.c1 = t2.c1) left join (t3 left join t4 on t4.c1 = t3.c1) on t1.c1 = t4.c1 where t2.c1 is NULL and t3.c1 = 0 and t4.c1 is NULL limit 1);
select stddev(c2) from t1;
stddev(c2)
NULL
rollback;
update t1 set c2 = (select /*+ NO_REWRITE */t1.c1 from (t1 full join t2 on t1.c1 = t2.c1) left join (t3 left join t4 on t4.c1 = t3.c1) on t1.c1 = t4.c1 where t2.c1 is NULL and t3.c1 = 0 and t4.c1 is NULL limit 1);
select stddev(c2) from t1;
stddev(c2)
NULL
rollback;
delete from t1 where c2 = (select t1.c1 from (t1 full join t2 on t1.c1 = t2.c1) left join (t3 left join t4 on t4.c1 = t3.c1) on t1.c1 = t4.c1 where t2.c1 is NULL and t3.c1 = 0 and t4.c1 is NULL limit 1);
select stddev(c2) from t1;
stddev(c2)
2.1147629234082532
rollback;
delete from t1 where c2 = (select /*+ NO_REWRITE */t1.c1 from (t1 full join t2 on t1.c1 = t2.c1) left join (t3 left join t4 on t4.c1 = t3.c1) on t1.c1 = t4.c1 where t2.c1 is NULL and t3.c1 = 0 and t4.c1 is NULL limit 1);
select stddev(c2) from t1;
stddev(c2)
2.1147629234082532
rollback;
select * from (t1 full join t2 on t1.c1 = t2.c1) left join (t3 left join t4 on t4.c1 = t3.c1) on t1.c1 = t4.c1 where t2.c1 is NULL and t3.c1 = 0 and t4.c1 = 0;
c1	c2	c1	c2	c3	c1	c2	c3	c1	c2	c3
select /*+ NO_REWRITE */* from (t1 full join t2 on t1.c1 = t2.c1) left join (t3 left join t4 on t4.c1 = t3.c1) on t1.c1 = t4.c1 where t2.c1 is NULL and t3.c1 = 0 and t4.c1 = 0;
c1	c2	c1	c2	c3	c1	c2	c3	c1	c2	c3
insert into t7_temp (select * from (t1 full join t2 on t1.c1 = t2.c1) left join (t3 left join t4 on t4.c1 = t3.c1) on t1.c1 = t4.c1 where t2.c1 is NULL and t3.c1 = 0 and t4.c1 = 0);
rollback;
insert into t7_temp (select /*+ NO_REWRITE */* from (t1 full join t2 on t1.c1 = t2.c1) left join (t3 left join t4 on t4.c1 = t3.c1) on t1.c1 = t4.c1 where t2.c1 is NULL and t3.c1 = 0 and t4.c1 = 0);
rollback;
update t1 set c2 = (select t1.c1 from (t1 full join t2 on t1.c1 = t2.c1) left join (t3 left join t4 on t4.c1 = t3.c1) on t1.c1 = t4.c1 where t2.c1 is NULL and t3.c1 = 0 and t4.c1 = 0 limit 1);
select stddev(c2) from t1;
stddev(c2)
NULL
rollback;
update t1 set c2 = (select /*+ NO_REWRITE */t1.c1 from (t1 full join t2 on t1.c1 = t2.c1) left join (t3 left join t4 on t4.c1 = t3.c1) on t1.c1 = t4.c1 where t2.c1 is NULL and t3.c1 = 0 and t4.c1 = 0 limit 1);
select stddev(c2) from t1;
stddev(c2)
NULL
rollback;
delete from t1 where c2 = (select t1.c1 from (t1 full join t2 on t1.c1 = t2.c1) left join (t3 left join t4 on t4.c1 = t3.c1) on t1.c1 = t4.c1 where t2.c1 is NULL and t3.c1 = 0 and t4.c1 = 0 limit 1);
select stddev(c2) from t1;
stddev(c2)
2.1147629234082532
rollback;
delete from t1 where c2 = (select /*+ NO_REWRITE */t1.c1 from (t1 full join t2 on t1.c1 = t2.c1) left join (t3 left join t4 on t4.c1 = t3.c1) on t1.c1 = t4.c1 where t2.c1 is NULL and t3.c1 = 0 and t4.c1 = 0 limit 1);
select stddev(c2) from t1;
stddev(c2)
2.1147629234082532
rollback;
select * from (t1 full join t2 on t1.c1 = t2.c1) left join (t3 left join t4 on t4.c1 = t3.c1) on t1.c1 = t4.c1 where t2.c1 = 0 and t3.c1 is NULL and t4.c1 is NULL;
c1	c2	c1	c2	c3	c1	c2	c3	c1	c2	c3
select /*+ NO_REWRITE */* from (t1 full join t2 on t1.c1 = t2.c1) left join (t3 left join t4 on t4.c1 = t3.c1) on t1.c1 = t4.c1 where t2.c1 = 0 and t3.c1 is NULL and t4.c1 is NULL;
c1	c2	c1	c2	c3	c1	c2	c3	c1	c2	c3
insert into t7_temp (select * from (t1 full join t2 on t1.c1 = t2.c1) left join (t3 left join t4 on t4.c1 = t3.c1) on t1.c1 = t4.c1 where t2.c1 = 0 and t3.c1 is NULL and t4.c1 is NULL);
rollback;
insert into t7_temp (select /*+ NO_REWRITE */* from (t1 full join t2 on t1.c1 = t2.c1) left join (t3 left join t4 on t4.c1 = t3.c1) on t1.c1 = t4.c1 where t2.c1 = 0 and t3.c1 is NULL and t4.c1 is NULL);
rollback;
update t1 set c2 = (select t1.c1 from (t1 full join t2 on t1.c1 = t2.c1) left join (t3 left join t4 on t4.c1 = t3.c1) on t1.c1 = t4.c1 where t2.c1 = 0 and t3.c1 is NULL and t4.c1 is NULL limit 1);
select stddev(c2) from t1;
stddev(c2)
NULL
rollback;
update t1 set c2 = (select /*+ NO_REWRITE */t1.c1 from (t1 full join t2 on t1.c1 = t2.c1) left join (t3 left join t4 on t4.c1 = t3.c1) on t1.c1 = t4.c1 where t2.c1 = 0 and t3.c1 is NULL and t4.c1 is NULL limit 1);
select stddev(c2) from t1;
stddev(c2)
NULL
rollback;
delete from t1 where c2 = (select t1.c1 from (t1 full join t2 on t1.c1 = t2.c1) left join (t3 left join t4 on t4.c1 = t3.c1) on t1.c1 = t4.c1 where t2.c1 = 0 and t3.c1 is NULL and t4.c1 is NULL limit 1);
select stddev(c2) from t1;
stddev(c2)
2.1147629234082532
rollback;
delete from t1 where c2 = (select /*+ NO_REWRITE */t1.c1 from (t1 full join t2 on t1.c1 = t2.c1) left join (t3 left join t4 on t4.c1 = t3.c1) on t1.c1 = t4.c1 where t2.c1 = 0 and t3.c1 is NULL and t4.c1 is NULL limit 1);
select stddev(c2) from t1;
stddev(c2)
2.1147629234082532
rollback;
select * from (t1 full join t2 on t1.c1 = t2.c1) left join (t3 left join t4 on t4.c1 = t3.c1) on t1.c1 = t4.c1 where t2.c1 = 0 and t3.c1 is NULL and t4.c1 = 0;
c1	c2	c1	c2	c3	c1	c2	c3	c1	c2	c3
select /*+ NO_REWRITE */* from (t1 full join t2 on t1.c1 = t2.c1) left join (t3 left join t4 on t4.c1 = t3.c1) on t1.c1 = t4.c1 where t2.c1 = 0 and t3.c1 is NULL and t4.c1 = 0;
c1	c2	c1	c2	c3	c1	c2	c3	c1	c2	c3
insert into t7_temp (select * from (t1 full join t2 on t1.c1 = t2.c1) left join (t3 left join t4 on t4.c1 = t3.c1) on t1.c1 = t4.c1 where t2.c1 = 0 and t3.c1 is NULL and t4.c1 = 0);
rollback;
insert into t7_temp (select /*+ NO_REWRITE */* from (t1 full join t2 on t1.c1 = t2.c1) left join (t3 left join t4 on t4.c1 = t3.c1) on t1.c1 = t4.c1 where t2.c1 = 0 and t3.c1 is NULL and t4.c1 = 0);
rollback;
update t1 set c2 = (select t1.c1 from (t1 full join t2 on t1.c1 = t2.c1) left join (t3 left join t4 on t4.c1 = t3.c1) on t1.c1 = t4.c1 where t2.c1 = 0 and t3.c1 is NULL and t4.c1 = 0 limit 1);
select stddev(c2) from t1;
stddev(c2)
NULL
rollback;
update t1 set c2 = (select /*+ NO_REWRITE */t1.c1 from (t1 full join t2 on t1.c1 = t2.c1) left join (t3 left join t4 on t4.c1 = t3.c1) on t1.c1 = t4.c1 where t2.c1 = 0 and t3.c1 is NULL and t4.c1 = 0 limit 1);
select stddev(c2) from t1;
stddev(c2)
NULL
rollback;
delete from t1 where c2 = (select t1.c1 from (t1 full join t2 on t1.c1 = t2.c1) left join (t3 left join t4 on t4.c1 = t3.c1) on t1.c1 = t4.c1 where t2.c1 = 0 and t3.c1 is NULL and t4.c1 = 0 limit 1);
select stddev(c2) from t1;
stddev(c2)
2.1147629234082532
rollback;
delete from t1 where c2 = (select /*+ NO_REWRITE */t1.c1 from (t1 full join t2 on t1.c1 = t2.c1) left join (t3 left join t4 on t4.c1 = t3.c1) on t1.c1 = t4.c1 where t2.c1 = 0 and t3.c1 is NULL and t4.c1 = 0 limit 1);
select stddev(c2) from t1;
stddev(c2)
2.1147629234082532
rollback;
select * from (t1 full join t2 on t1.c1 = t2.c1) left join (t3 left join t4 on t4.c1 = t3.c1) on t1.c1 = t4.c1 where t2.c1 = 0 and t3.c1 = 0 and t4.c1 IS NULL;
c1	c2	c1	c2	c3	c1	c2	c3	c1	c2	c3
select /*+ NO_REWRITE */* from (t1 full join t2 on t1.c1 = t2.c1) left join (t3 left join t4 on t4.c1 = t3.c1) on t1.c1 = t4.c1 where t2.c1 = 0 and t3.c1 = 0 and t4.c1 IS NULL;
c1	c2	c1	c2	c3	c1	c2	c3	c1	c2	c3
insert into t7_temp (select * from (t1 full join t2 on t1.c1 = t2.c1) left join (t3 left join t4 on t4.c1 = t3.c1) on t1.c1 = t4.c1 where t2.c1 = 0 and t3.c1 = 0 and t4.c1 IS NULL);
rollback;
insert into t7_temp (select /*+ NO_REWRITE */* from (t1 full join t2 on t1.c1 = t2.c1) left join (t3 left join t4 on t4.c1 = t3.c1) on t1.c1 = t4.c1 where t2.c1 = 0 and t3.c1 = 0 and t4.c1 IS NULL);
rollback;
update t1 set c2 = (select t1.c1 from (t1 full join t2 on t1.c1 = t2.c1) left join (t3 left join t4 on t4.c1 = t3.c1) on t1.c1 = t4.c1 where t2.c1 = 0 and t3.c1 = 0 and t4.c1 IS NULL limit 1);
select stddev(c2) from t1;
stddev(c2)
NULL
rollback;
update t1 set c2 = (select /*+ NO_REWRITE */t1.c1 from (t1 full join t2 on t1.c1 = t2.c1) left join (t3 left join t4 on t4.c1 = t3.c1) on t1.c1 = t4.c1 where t2.c1 = 0 and t3.c1 = 0 and t4.c1 IS NULL limit 1);
select stddev(c2) from t1;
stddev(c2)
NULL
rollback;
delete from t1 where c2 = (select t1.c1 from (t1 full join t2 on t1.c1 = t2.c1) left join (t3 left join t4 on t4.c1 = t3.c1) on t1.c1 = t4.c1 where t2.c1 = 0 and t3.c1 = 0 and t4.c1 IS NULL limit 1);
select stddev(c2) from t1;
stddev(c2)
2.1147629234082532
rollback;
delete from t1 where c2 = (select /*+ NO_REWRITE */t1.c1 from (t1 full join t2 on t1.c1 = t2.c1) left join (t3 left join t4 on t4.c1 = t3.c1) on t1.c1 = t4.c1 where t2.c1 = 0 and t3.c1 = 0 and t4.c1 IS NULL limit 1);
select stddev(c2) from t1;
stddev(c2)
2.1147629234082532
rollback;
select * from (t1 full join t2 on t1.c1 = t2.c1) left join (t3 left join t4 on t4.c1 = t3.c1) on t1.c1 = t4.c1 where t2.c1 = 0 and t3.c1 = 0 and t4.c1 = 0;
c1	c2	c1	c2	c3	c1	c2	c3	c1	c2	c3
select /*+ NO_REWRITE */* from (t1 full join t2 on t1.c1 = t2.c1) left join (t3 left join t4 on t4.c1 = t3.c1) on t1.c1 = t4.c1 where t2.c1 = 0 and t3.c1 = 0 and t4.c1 = 0;
c1	c2	c1	c2	c3	c1	c2	c3	c1	c2	c3
insert into t7_temp (select * from (t1 full join t2 on t1.c1 = t2.c1) left join (t3 left join t4 on t4.c1 = t3.c1) on t1.c1 = t4.c1 where t2.c1 = 0 and t3.c1 = 0 and t4.c1 = 0);
rollback;
insert into t7_temp (select /*+ NO_REWRITE */* from (t1 full join t2 on t1.c1 = t2.c1) left join (t3 left join t4 on t4.c1 = t3.c1) on t1.c1 = t4.c1 where t2.c1 = 0 and t3.c1 = 0 and t4.c1 = 0);
rollback;
update t1 set c2 = (select t1.c1 from (t1 full join t2 on t1.c1 = t2.c1) left join (t3 left join t4 on t4.c1 = t3.c1) on t1.c1 = t4.c1 where t2.c1 = 0 and t3.c1 = 0 and t4.c1 = 0 limit 1);
select stddev(c2) from t1;
stddev(c2)
NULL
rollback;
update t1 set c2 = (select /*+ NO_REWRITE */t1.c1 from (t1 full join t2 on t1.c1 = t2.c1) left join (t3 left join t4 on t4.c1 = t3.c1) on t1.c1 = t4.c1 where t2.c1 = 0 and t3.c1 = 0 and t4.c1 = 0 limit 1);
select stddev(c2) from t1;
stddev(c2)
NULL
rollback;
delete from t1 where c2 = (select t1.c1 from (t1 full join t2 on t1.c1 = t2.c1) left join (t3 left join t4 on t4.c1 = t3.c1) on t1.c1 = t4.c1 where t2.c1 = 0 and t3.c1 = 0 and t4.c1 = 0 limit 1);
select stddev(c2) from t1;
stddev(c2)
2.1147629234082532
rollback;
delete from t1 where c2 = (select /*+ NO_REWRITE */t1.c1 from (t1 full join t2 on t1.c1 = t2.c1) left join (t3 left join t4 on t4.c1 = t3.c1) on t1.c1 = t4.c1 where t2.c1 = 0 and t3.c1 = 0 and t4.c1 = 0 limit 1);
select stddev(c2) from t1;
stddev(c2)
2.1147629234082532
rollback;
select * from (t1 left join t2 on t1.c1 = t2.c1) full join (t3 left join t4 on t4.c1 = t3.c1) on t1.c1 = t4.c1 where t2.c1 is NULL and t3.c1 is NULL and t4.c1 is NULL;
c1	c2	c1	c2	c3	c1	c2	c3	c1	c2	c3
select /*+ NO_REWRITE */* from (t1 left join t2 on t1.c1 = t2.c1) full join (t3 left join t4 on t4.c1 = t3.c1) on t1.c1 = t4.c1 where t2.c1 is NULL and t3.c1 is NULL and t4.c1 is NULL;
c1	c2	c1	c2	c3	c1	c2	c3	c1	c2	c3
insert into t7_temp (select * from (t1 left join t2 on t1.c1 = t2.c1) full join (t3 left join t4 on t4.c1 = t3.c1) on t1.c1 = t4.c1 where t2.c1 is NULL and t3.c1 is NULL and t4.c1 is NULL);
rollback;
insert into t7_temp (select /*+ NO_REWRITE */* from (t1 left join t2 on t1.c1 = t2.c1) full join (t3 left join t4 on t4.c1 = t3.c1) on t1.c1 = t4.c1 where t2.c1 is NULL and t3.c1 is NULL and t4.c1 is NULL);
rollback;
update t1 set c2 = (select t1.c1 from (t1 left join t2 on t1.c1 = t2.c1) full join (t3 left join t4 on t4.c1 = t3.c1) on t1.c1 = t4.c1 where t2.c1 is NULL and t3.c1 is NULL and t4.c1 is NULL limit 1);
select stddev(c2) from t1;
stddev(c2)
NULL
rollback;
update t1 set c2 = (select /*+ NO_REWRITE */t1.c1 from (t1 left join t2 on t1.c1 = t2.c1) full join (t3 left join t4 on t4.c1 = t3.c1) on t1.c1 = t4.c1 where t2.c1 is NULL and t3.c1 is NULL and t4.c1 is NULL limit 1);
select stddev(c2) from t1;
stddev(c2)
NULL
rollback;
delete from t1 where c2 = (select t1.c1 from (t1 left join t2 on t1.c1 = t2.c1) full join (t3 left join t4 on t4.c1 = t3.c1) on t1.c1 = t4.c1 where t2.c1 is NULL and t3.c1 is NULL and t4.c1 is NULL limit 1);
select stddev(c2) from t1;
stddev(c2)
2.1147629234082532
rollback;
delete from t1 where c2 = (select /*+ NO_REWRITE */t1.c1 from (t1 left join t2 on t1.c1 = t2.c1) full join (t3 left join t4 on t4.c1 = t3.c1) on t1.c1 = t4.c1 where t2.c1 is NULL and t3.c1 is NULL and t4.c1 is NULL limit 1);
select stddev(c2) from t1;
stddev(c2)
2.1147629234082532
rollback;
select * from (t1 left join t2 on t1.c1 = t2.c1) full join (t3 left join t4 on t4.c1 = t3.c1) on t1.c1 = t4.c1 where t2.c1 is NULL and t3.c1 is NULL and t4.c1 = 0;
c1	c2	c1	c2	c3	c1	c2	c3	c1	c2	c3
select /*+ NO_REWRITE */* from (t1 left join t2 on t1.c1 = t2.c1) full join (t3 left join t4 on t4.c1 = t3.c1) on t1.c1 = t4.c1 where t2.c1 is NULL and t3.c1 is NULL and t4.c1 = 0;
c1	c2	c1	c2	c3	c1	c2	c3	c1	c2	c3
insert into t7_temp (select * from (t1 left join t2 on t1.c1 = t2.c1) full join (t3 left join t4 on t4.c1 = t3.c1) on t1.c1 = t4.c1 where t2.c1 is NULL and t3.c1 is NULL and t4.c1 = 0);
rollback;
insert into t7_temp (select /*+ NO_REWRITE */* from (t1 left join t2 on t1.c1 = t2.c1) full join (t3 left join t4 on t4.c1 = t3.c1) on t1.c1 = t4.c1 where t2.c1 is NULL and t3.c1 is NULL and t4.c1 = 0);
rollback;
update t1 set c2 = (select t1.c1 from (t1 left join t2 on t1.c1 = t2.c1) full join (t3 left join t4 on t4.c1 = t3.c1) on t1.c1 = t4.c1 where t2.c1 is NULL and t3.c1 is NULL and t4.c1 = 0 limit 1);
select stddev(c2) from t1;
stddev(c2)
NULL
rollback;
update t1 set c2 = (select /*+ NO_REWRITE */t1.c1 from (t1 left join t2 on t1.c1 = t2.c1) full join (t3 left join t4 on t4.c1 = t3.c1) on t1.c1 = t4.c1 where t2.c1 is NULL and t3.c1 is NULL and t4.c1 = 0 limit 1);
select stddev(c2) from t1;
stddev(c2)
NULL
rollback;
delete from t1 where c2 = (select t1.c1 from (t1 left join t2 on t1.c1 = t2.c1) full join (t3 left join t4 on t4.c1 = t3.c1) on t1.c1 = t4.c1 where t2.c1 is NULL and t3.c1 is NULL and t4.c1 = 0 limit 1);
select stddev(c2) from t1;
stddev(c2)
2.1147629234082532
rollback;
delete from t1 where c2 = (select /*+ NO_REWRITE */t1.c1 from (t1 left join t2 on t1.c1 = t2.c1) full join (t3 left join t4 on t4.c1 = t3.c1) on t1.c1 = t4.c1 where t2.c1 is NULL and t3.c1 is NULL and t4.c1 = 0 limit 1);
select stddev(c2) from t1;
stddev(c2)
2.1147629234082532
rollback;
select * from (t1 left join t2 on t1.c1 = t2.c1) full join (t3 left join t4 on t4.c1 = t3.c1) on t1.c1 = t4.c1 where t2.c1 is NULL and t3.c1 = 0 and t4.c1 is NULL;
c1	c2	c1	c2	c3	c1	c2	c3	c1	c2	c3
select /*+ NO_REWRITE */* from (t1 left join t2 on t1.c1 = t2.c1) full join (t3 left join t4 on t4.c1 = t3.c1) on t1.c1 = t4.c1 where t2.c1 is NULL and t3.c1 = 0 and t4.c1 is NULL;
c1	c2	c1	c2	c3	c1	c2	c3	c1	c2	c3
insert into t7_temp (select * from (t1 left join t2 on t1.c1 = t2.c1) full join (t3 left join t4 on t4.c1 = t3.c1) on t1.c1 = t4.c1 where t2.c1 is NULL and t3.c1 = 0 and t4.c1 is NULL);
rollback;
insert into t7_temp (select /*+ NO_REWRITE */* from (t1 left join t2 on t1.c1 = t2.c1) full join (t3 left join t4 on t4.c1 = t3.c1) on t1.c1 = t4.c1 where t2.c1 is NULL and t3.c1 = 0 and t4.c1 is NULL);
rollback;
update t1 set c2 = (select t1.c1 from (t1 left join t2 on t1.c1 = t2.c1) full join (t3 left join t4 on t4.c1 = t3.c1) on t1.c1 = t4.c1 where t2.c1 is NULL and t3.c1 = 0 and t4.c1 is NULL limit 1);
select stddev(c2) from t1;
stddev(c2)
NULL
rollback;
update t1 set c2 = (select /*+ NO_REWRITE */t1.c1 from (t1 left join t2 on t1.c1 = t2.c1) full join (t3 left join t4 on t4.c1 = t3.c1) on t1.c1 = t4.c1 where t2.c1 is NULL and t3.c1 = 0 and t4.c1 is NULL limit 1);
select stddev(c2) from t1;
stddev(c2)
NULL
rollback;
delete from t1 where c2 = (select t1.c1 from (t1 left join t2 on t1.c1 = t2.c1) full join (t3 left join t4 on t4.c1 = t3.c1) on t1.c1 = t4.c1 where t2.c1 is NULL and t3.c1 = 0 and t4.c1 is NULL limit 1);
select stddev(c2) from t1;
stddev(c2)
2.1147629234082532
rollback;
delete from t1 where c2 = (select /*+ NO_REWRITE */t1.c1 from (t1 left join t2 on t1.c1 = t2.c1) full join (t3 left join t4 on t4.c1 = t3.c1) on t1.c1 = t4.c1 where t2.c1 is NULL and t3.c1 = 0 and t4.c1 is NULL limit 1);
select stddev(c2) from t1;
stddev(c2)
2.1147629234082532
rollback;
select * from (t1 left join t2 on t1.c1 = t2.c1) full join (t3 left join t4 on t4.c1 = t3.c1) on t1.c1 = t4.c1 where t2.c1 is NULL and t3.c1 = 0 and t4.c1 = 0;
c1	c2	c1	c2	c3	c1	c2	c3	c1	c2	c3
select /*+ NO_REWRITE */* from (t1 left join t2 on t1.c1 = t2.c1) full join (t3 left join t4 on t4.c1 = t3.c1) on t1.c1 = t4.c1 where t2.c1 is NULL and t3.c1 = 0 and t4.c1 = 0;
c1	c2	c1	c2	c3	c1	c2	c3	c1	c2	c3
insert into t7_temp (select * from (t1 left join t2 on t1.c1 = t2.c1) full join (t3 left join t4 on t4.c1 = t3.c1) on t1.c1 = t4.c1 where t2.c1 is NULL and t3.c1 = 0 and t4.c1 = 0);
rollback;
insert into t7_temp (select /*+ NO_REWRITE */* from (t1 left join t2 on t1.c1 = t2.c1) full join (t3 left join t4 on t4.c1 = t3.c1) on t1.c1 = t4.c1 where t2.c1 is NULL and t3.c1 = 0 and t4.c1 = 0);
rollback;
update t1 set c2 = (select t1.c1 from (t1 left join t2 on t1.c1 = t2.c1) full join (t3 left join t4 on t4.c1 = t3.c1) on t1.c1 = t4.c1 where t2.c1 is NULL and t3.c1 = 0 and t4.c1 = 0 limit 1);
select stddev(c2) from t1;
stddev(c2)
NULL
rollback;
update t1 set c2 = (select /*+ NO_REWRITE */t1.c1 from (t1 left join t2 on t1.c1 = t2.c1) full join (t3 left join t4 on t4.c1 = t3.c1) on t1.c1 = t4.c1 where t2.c1 is NULL and t3.c1 = 0 and t4.c1 = 0 limit 1);
select stddev(c2) from t1;
stddev(c2)
NULL
rollback;
delete from t1 where c2 = (select t1.c1 from (t1 left join t2 on t1.c1 = t2.c1) full join (t3 left join t4 on t4.c1 = t3.c1) on t1.c1 = t4.c1 where t2.c1 is NULL and t3.c1 = 0 and t4.c1 = 0 limit 1);
select stddev(c2) from t1;
stddev(c2)
2.1147629234082532
rollback;
delete from t1 where c2 = (select /*+ NO_REWRITE */t1.c1 from (t1 left join t2 on t1.c1 = t2.c1) full join (t3 left join t4 on t4.c1 = t3.c1) on t1.c1 = t4.c1 where t2.c1 is NULL and t3.c1 = 0 and t4.c1 = 0 limit 1);
select stddev(c2) from t1;
stddev(c2)
2.1147629234082532
rollback;
select * from (t1 left join t2 on t1.c1 = t2.c1) full join (t3 left join t4 on t4.c1 = t3.c1) on t1.c1 = t4.c1 where t2.c1 = 0 and t3.c1 is NULL and t4.c1 is NULL;
c1	c2	c1	c2	c3	c1	c2	c3	c1	c2	c3
select /*+ NO_REWRITE */* from (t1 left join t2 on t1.c1 = t2.c1) full join (t3 left join t4 on t4.c1 = t3.c1) on t1.c1 = t4.c1 where t2.c1 = 0 and t3.c1 is NULL and t4.c1 is NULL;
c1	c2	c1	c2	c3	c1	c2	c3	c1	c2	c3
insert into t7_temp (select * from (t1 left join t2 on t1.c1 = t2.c1) full join (t3 left join t4 on t4.c1 = t3.c1) on t1.c1 = t4.c1 where t2.c1 = 0 and t3.c1 is NULL and t4.c1 is NULL);
rollback;
insert into t7_temp (select /*+ NO_REWRITE */* from (t1 left join t2 on t1.c1 = t2.c1) full join (t3 left join t4 on t4.c1 = t3.c1) on t1.c1 = t4.c1 where t2.c1 = 0 and t3.c1 is NULL and t4.c1 is NULL);
rollback;
update t1 set c2 = (select t1.c1 from (t1 left join t2 on t1.c1 = t2.c1) full join (t3 left join t4 on t4.c1 = t3.c1) on t1.c1 = t4.c1 where t2.c1 = 0 and t3.c1 is NULL and t4.c1 is NULL limit 1);
select stddev(c2) from t1;
stddev(c2)
NULL
rollback;
update t1 set c2 = (select /*+ NO_REWRITE */t1.c1 from (t1 left join t2 on t1.c1 = t2.c1) full join (t3 left join t4 on t4.c1 = t3.c1) on t1.c1 = t4.c1 where t2.c1 = 0 and t3.c1 is NULL and t4.c1 is NULL limit 1);
select stddev(c2) from t1;
stddev(c2)
NULL
rollback;
delete from t1 where c2 = (select t1.c1 from (t1 left join t2 on t1.c1 = t2.c1) full join (t3 left join t4 on t4.c1 = t3.c1) on t1.c1 = t4.c1 where t2.c1 = 0 and t3.c1 is NULL and t4.c1 is NULL limit 1);
select stddev(c2) from t1;
stddev(c2)
2.1147629234082532
rollback;
delete from t1 where c2 = (select /*+ NO_REWRITE */t1.c1 from (t1 left join t2 on t1.c1 = t2.c1) full join (t3 left join t4 on t4.c1 = t3.c1) on t1.c1 = t4.c1 where t2.c1 = 0 and t3.c1 is NULL and t4.c1 is NULL limit 1);
select stddev(c2) from t1;
stddev(c2)
2.1147629234082532
rollback;
select * from (t1 left join t2 on t1.c1 = t2.c1) full join (t3 left join t4 on t4.c1 = t3.c1) on t1.c1 = t4.c1 where t2.c1 = 0 and t3.c1 is NULL and t4.c1 = 0;
c1	c2	c1	c2	c3	c1	c2	c3	c1	c2	c3
select /*+ NO_REWRITE */* from (t1 left join t2 on t1.c1 = t2.c1) full join (t3 left join t4 on t4.c1 = t3.c1) on t1.c1 = t4.c1 where t2.c1 = 0 and t3.c1 is NULL and t4.c1 = 0;
c1	c2	c1	c2	c3	c1	c2	c3	c1	c2	c3
insert into t7_temp (select * from (t1 left join t2 on t1.c1 = t2.c1) full join (t3 left join t4 on t4.c1 = t3.c1) on t1.c1 = t4.c1 where t2.c1 = 0 and t3.c1 is NULL and t4.c1 = 0);
rollback;
insert into t7_temp (select /*+ NO_REWRITE */* from (t1 left join t2 on t1.c1 = t2.c1) full join (t3 left join t4 on t4.c1 = t3.c1) on t1.c1 = t4.c1 where t2.c1 = 0 and t3.c1 is NULL and t4.c1 = 0);
rollback;
update t1 set c2 = (select t1.c1 from (t1 left join t2 on t1.c1 = t2.c1) full join (t3 left join t4 on t4.c1 = t3.c1) on t1.c1 = t4.c1 where t2.c1 = 0 and t3.c1 is NULL and t4.c1 = 0 limit 1);
select stddev(c2) from t1;
stddev(c2)
NULL
rollback;
update t1 set c2 = (select /*+ NO_REWRITE */t1.c1 from (t1 left join t2 on t1.c1 = t2.c1) full join (t3 left join t4 on t4.c1 = t3.c1) on t1.c1 = t4.c1 where t2.c1 = 0 and t3.c1 is NULL and t4.c1 = 0 limit 1);
select stddev(c2) from t1;
stddev(c2)
NULL
rollback;
delete from t1 where c2 = (select t1.c1 from (t1 left join t2 on t1.c1 = t2.c1) full join (t3 left join t4 on t4.c1 = t3.c1) on t1.c1 = t4.c1 where t2.c1 = 0 and t3.c1 is NULL and t4.c1 = 0 limit 1);
select stddev(c2) from t1;
stddev(c2)
2.1147629234082532
rollback;
delete from t1 where c2 = (select /*+ NO_REWRITE */t1.c1 from (t1 left join t2 on t1.c1 = t2.c1) full join (t3 left join t4 on t4.c1 = t3.c1) on t1.c1 = t4.c1 where t2.c1 = 0 and t3.c1 is NULL and t4.c1 = 0 limit 1);
select stddev(c2) from t1;
stddev(c2)
2.1147629234082532
rollback;
select * from (t1 left join t2 on t1.c1 = t2.c1) full join (t3 left join t4 on t4.c1 = t3.c1) on t1.c1 = t4.c1 where t2.c1 = 0 and t3.c1 = 0 and t4.c1 IS NULL;
c1	c2	c1	c2	c3	c1	c2	c3	c1	c2	c3
select /*+ NO_REWRITE */* from (t1 left join t2 on t1.c1 = t2.c1) full join (t3 left join t4 on t4.c1 = t3.c1) on t1.c1 = t4.c1 where t2.c1 = 0 and t3.c1 = 0 and t4.c1 IS NULL;
c1	c2	c1	c2	c3	c1	c2	c3	c1	c2	c3
insert into t7_temp (select * from (t1 left join t2 on t1.c1 = t2.c1) full join (t3 left join t4 on t4.c1 = t3.c1) on t1.c1 = t4.c1 where t2.c1 = 0 and t3.c1 = 0 and t4.c1 IS NULL);
rollback;
insert into t7_temp (select /*+ NO_REWRITE */* from (t1 left join t2 on t1.c1 = t2.c1) full join (t3 left join t4 on t4.c1 = t3.c1) on t1.c1 = t4.c1 where t2.c1 = 0 and t3.c1 = 0 and t4.c1 IS NULL);
rollback;
update t1 set c2 = (select t1.c1 from (t1 left join t2 on t1.c1 = t2.c1) full join (t3 left join t4 on t4.c1 = t3.c1) on t1.c1 = t4.c1 where t2.c1 = 0 and t3.c1 = 0 and t4.c1 IS NULL limit 1);
select stddev(c2) from t1;
stddev(c2)
NULL
rollback;
update t1 set c2 = (select /*+ NO_REWRITE */t1.c1 from (t1 left join t2 on t1.c1 = t2.c1) full join (t3 left join t4 on t4.c1 = t3.c1) on t1.c1 = t4.c1 where t2.c1 = 0 and t3.c1 = 0 and t4.c1 IS NULL limit 1);
select stddev(c2) from t1;
stddev(c2)
NULL
rollback;
delete from t1 where c2 = (select t1.c1 from (t1 left join t2 on t1.c1 = t2.c1) full join (t3 left join t4 on t4.c1 = t3.c1) on t1.c1 = t4.c1 where t2.c1 = 0 and t3.c1 = 0 and t4.c1 IS NULL limit 1);
select stddev(c2) from t1;
stddev(c2)
2.1147629234082532
rollback;
delete from t1 where c2 = (select /*+ NO_REWRITE */t1.c1 from (t1 left join t2 on t1.c1 = t2.c1) full join (t3 left join t4 on t4.c1 = t3.c1) on t1.c1 = t4.c1 where t2.c1 = 0 and t3.c1 = 0 and t4.c1 IS NULL limit 1);
select stddev(c2) from t1;
stddev(c2)
2.1147629234082532
rollback;
select * from (t1 left join t2 on t1.c1 = t2.c1) full join (t3 left join t4 on t4.c1 = t3.c1) on t1.c1 = t4.c1 where t2.c1 = 0 and t3.c1 = 0 and t4.c1 = 0;
c1	c2	c1	c2	c3	c1	c2	c3	c1	c2	c3
select /*+ NO_REWRITE */* from (t1 left join t2 on t1.c1 = t2.c1) full join (t3 left join t4 on t4.c1 = t3.c1) on t1.c1 = t4.c1 where t2.c1 = 0 and t3.c1 = 0 and t4.c1 = 0;
c1	c2	c1	c2	c3	c1	c2	c3	c1	c2	c3
insert into t7_temp (select * from (t1 left join t2 on t1.c1 = t2.c1) full join (t3 left join t4 on t4.c1 = t3.c1) on t1.c1 = t4.c1 where t2.c1 = 0 and t3.c1 = 0 and t4.c1 = 0);
rollback;
insert into t7_temp (select /*+ NO_REWRITE */* from (t1 left join t2 on t1.c1 = t2.c1) full join (t3 left join t4 on t4.c1 = t3.c1) on t1.c1 = t4.c1 where t2.c1 = 0 and t3.c1 = 0 and t4.c1 = 0);
rollback;
update t1 set c2 = (select t1.c1 from (t1 left join t2 on t1.c1 = t2.c1) full join (t3 left join t4 on t4.c1 = t3.c1) on t1.c1 = t4.c1 where t2.c1 = 0 and t3.c1 = 0 and t4.c1 = 0 limit 1);
select stddev(c2) from t1;
stddev(c2)
NULL
rollback;
update t1 set c2 = (select /*+ NO_REWRITE */t1.c1 from (t1 left join t2 on t1.c1 = t2.c1) full join (t3 left join t4 on t4.c1 = t3.c1) on t1.c1 = t4.c1 where t2.c1 = 0 and t3.c1 = 0 and t4.c1 = 0 limit 1);
select stddev(c2) from t1;
stddev(c2)
NULL
rollback;
delete from t1 where c2 = (select t1.c1 from (t1 left join t2 on t1.c1 = t2.c1) full join (t3 left join t4 on t4.c1 = t3.c1) on t1.c1 = t4.c1 where t2.c1 = 0 and t3.c1 = 0 and t4.c1 = 0 limit 1);
select stddev(c2) from t1;
stddev(c2)
2.1147629234082532
rollback;
delete from t1 where c2 = (select /*+ NO_REWRITE */t1.c1 from (t1 left join t2 on t1.c1 = t2.c1) full join (t3 left join t4 on t4.c1 = t3.c1) on t1.c1 = t4.c1 where t2.c1 = 0 and t3.c1 = 0 and t4.c1 = 0 limit 1);
select stddev(c2) from t1;
stddev(c2)
2.1147629234082532
rollback;
select * from t1 left join t2 on t1.c1 = t2.c1 where abs(t2.c2) > 2 or sqrt(t2.c2) > 2 or log2(t2.c2) > 2 or (t2.c2 xor t2.c1 > 2);
c1	c2	c1	c2	c3
1	1	1	1	o
2	5	2	5	c
3	2	3	5	b
4	6	4	6	o
5	4	5	7	d
6	7	6	8	c
select /*+ NO_REWRITE*/ * from t1 left join t2 on t1.c1 = t2.c1 where abs(t2.c2) > 2 or sqrt(t2.c2) > 2 or log2(t2.c2) > 2 or (t2.c2 xor t2.c1 > 2);
c1	c2	c1	c2	c3
1	1	1	1	o
2	5	2	5	c
3	2	3	5	b
4	6	4	6	o
5	4	5	7	d
6	7	6	8	c
insert into t4_temp (select * from t1 left join t2 on t1.c1 = t2.c1 where abs(t2.c2) > 2 or sqrt(t2.c2) > 2 or log2(t2.c2) > 2 or (t2.c2 xor t2.c1 > 2));
rollback;
insert into t4_temp (select /*+ NO_REWRITE*/ * from t1 left join t2 on t1.c1 = t2.c1 where abs(t2.c2) > 2 or sqrt(t2.c2) > 2 or log2(t2.c2) > 2 or (t2.c2 xor t2.c1 > 2));
rollback;
update t1 set c2 = (select t1.c1 from t1 left join t2 on t1.c1 = t2.c1 where abs(t2.c2) > 2 or sqrt(t2.c2) > 2 or log2(t2.c2) > 2 or (t2.c2 xor t2.c1 > 2) limit 1);
select stddev(c2) from t1;
stddev(c2)
0
rollback;
update t1 set c2 = (select /*+ NO_REWRITE */t1.c1 from t1 left join t2 on t1.c1 = t2.c1 where abs(t2.c2) > 2 or sqrt(t2.c2) > 2 or log2(t2.c2) > 2 or (t2.c2 xor t2.c1 > 2) limit 1);
select stddev(c2) from t1;
stddev(c2)
0
rollback;
delete from t1 where c2 = (select t1.c1 from t1 left join t2 on t1.c1 = t2.c1 where abs(t2.c2) > 2 or sqrt(t2.c2) > 2 or log2(t2.c2) > 2 or (t2.c2 xor t2.c1 > 2) limit 1);
select stddev(c2) from t1;
stddev(c2)
1.7204650534085253
rollback;
delete from t1 where c2 = (select /*+ NO_REWRITE */t1.c1 from t1 left join t2 on t1.c1 = t2.c1 where abs(t2.c2) > 2 or sqrt(t2.c2) > 2 or log2(t2.c2) > 2 or (t2.c2 xor t2.c1 > 2) limit 1);
select stddev(c2) from t1;
stddev(c2)
1.7204650534085253
rollback;
select * from t1 left join t2 on t1.c1 = t2.c1 where t2.c2 > 4 or t2.c2 < 1;
c1	c2	c1	c2	c3
2	5	2	5	c
3	2	3	5	b
4	6	4	6	o
5	4	5	7	d
6	7	6	8	c
select /*+ NO_REWRITE*/ * from t1 left join t2 on t1.c1 = t2.c1 where t2.c2 > 4 or t2.c2 < 1;
c1	c2	c1	c2	c3
2	5	2	5	c
3	2	3	5	b
4	6	4	6	o
5	4	5	7	d
6	7	6	8	c
insert into t4_temp (select * from t1 left join t2 on t1.c1 = t2.c1 where t2.c2 > 4 or t2.c2 < 1);
rollback;
insert into t4_temp (select /*+ NO_REWRITE*/ * from t1 left join t2 on t1.c1 = t2.c1 where t2.c2 > 4 or t2.c2 < 1);
rollback;
update t1 set c2 = (select t1.c1 from t1 left join t2 on t1.c1 = t2.c1 where t2.c2 > 4 or t2.c2 < 1 limit 1);
select stddev(c2) from t1;
stddev(c2)
0
rollback;
update t1 set c2 = (select /*+ NO_REWRITE */t1.c1 from t1 left join t2 on t1.c1 = t2.c1 where t2.c2 > 4 or t2.c2 < 1 limit 1);
select stddev(c2) from t1;
stddev(c2)
0
rollback;
delete from t1 where c2 = (select t1.c1 from t1 left join t2 on t1.c1 = t2.c1 where t2.c2 > 4 or t2.c2 < 1 limit 1);
select stddev(c2) from t1;
stddev(c2)
2.0591260281974
rollback;
delete from t1 where c2 = (select /*+ NO_REWRITE */t1.c1 from t1 left join t2 on t1.c1 = t2.c1 where t2.c2 > 4 or t2.c2 < 1 limit 1);
select stddev(c2) from t1;
stddev(c2)
2.0591260281974
rollback;
select * from t1 left join t2 on t1.c1 = t2.c1 where t2.c2 is true;
c1	c2	c1	c2	c3
1	1	1	1	o
2	5	2	5	c
3	2	3	5	b
4	6	4	6	o
5	4	5	7	d
6	7	6	8	c
select /*+ NO_REWRITE*/ * from t1 left join t2 on t1.c1 = t2.c1 where t2.c2 is true;
c1	c2	c1	c2	c3
1	1	1	1	o
2	5	2	5	c
3	2	3	5	b
4	6	4	6	o
5	4	5	7	d
6	7	6	8	c
insert into t4_temp (select * from t1 left join t2 on t1.c1 = t2.c1 where t2.c2 is true);
rollback;
insert into t4_temp (select /*+ NO_REWRITE*/ * from t1 left join t2 on t1.c1 = t2.c1 where t2.c2 is true);
rollback;
update t1 set c2 = (select t1.c1 from t1 left join t2 on t1.c1 = t2.c1 where t2.c2 is true limit 1);
select stddev(c2) from t1;
stddev(c2)
0
rollback;
update t1 set c2 = (select /*+ NO_REWRITE */t1.c1 from t1 left join t2 on t1.c1 = t2.c1 where t2.c2 is true limit 1);
select stddev(c2) from t1;
stddev(c2)
0
rollback;
delete from t1 where c2 = (select t1.c1 from t1 left join t2 on t1.c1 = t2.c1 where t2.c2 is true limit 1);
select stddev(c2) from t1;
stddev(c2)
1.7204650534085253
rollback;
delete from t1 where c2 = (select /*+ NO_REWRITE */t1.c1 from t1 left join t2 on t1.c1 = t2.c1 where t2.c2 is true limit 1);
select stddev(c2) from t1;
stddev(c2)
1.7204650534085253
rollback;
select * from t1 left join t2 on t1.c1 = t2.c1 where t2.c2 > any (select c2 from t1);
c1	c2	c1	c2	c3
2	5	2	5	c
3	2	3	5	b
4	6	4	6	o
5	4	5	7	d
6	7	6	8	c
select /*+ NO_REWRITE*/ * from t1 left join t2 on t1.c1 = t2.c1 where t2.c2 > any (select c2 from t1);
c1	c2	c1	c2	c3
2	5	2	5	c
3	2	3	5	b
4	6	4	6	o
5	4	5	7	d
6	7	6	8	c
insert into t4_temp (select * from t1 left join t2 on t1.c1 = t2.c1 where t2.c2 > any (select c2 from t1));
rollback;
insert into t4_temp (select /*+ NO_REWRITE*/ * from t1 left join t2 on t1.c1 = t2.c1 where t2.c2 > any (select c2 from t1));
rollback;
update t1 set c2 = (select t1.c1 from t1 left join t2 on t1.c1 = t2.c1 where t2.c2 > any (select c2 from t1) limit 1);
select stddev(c2) from t1;
stddev(c2)
0
rollback;
update t1 set c2 = (select /*+ NO_REWRITE */t1.c1 from t1 left join t2 on t1.c1 = t2.c1 where t2.c2 > any (select c2 from t1) limit 1);
select stddev(c2) from t1;
stddev(c2)
0
rollback;
delete from t1 where c2 = (select t1.c1 from t1 left join t2 on t1.c1 = t2.c1 where t2.c2 > any (select c2 from t1) limit 1);
select stddev(c2) from t1;
stddev(c2)
2.0591260281974
rollback;
delete from t1 where c2 = (select /*+ NO_REWRITE */t1.c1 from t1 left join t2 on t1.c1 = t2.c1 where t2.c2 > any (select c2 from t1) limit 1);
select stddev(c2) from t1;
stddev(c2)
2.0591260281974
rollback;
select * from t1 left join t2 on t1.c1 = t2.c1 where t2.c2 != any (select c2 from t1 where c2 > 1000);
c1	c2	c1	c2	c3
select /*+ NO_REWRITE*/ * from t1 left join t2 on t1.c1 = t2.c1 where t2.c2 != any (select c2 from t1 where c2 > 1000);
c1	c2	c1	c2	c3
insert into t4_temp (select * from t1 left join t2 on t1.c1 = t2.c1 where t2.c2 != any (select c2 from t1 where c2 > 1000));
rollback;
insert into t4_temp (select /*+ NO_REWRITE*/ * from t1 left join t2 on t1.c1 = t2.c1 where t2.c2 != any (select c2 from t1 where c2 > 1000));
rollback;
update t1 set c2 = (select t1.c1 from t1 left join t2 on t1.c1 = t2.c1 where t2.c2 != any (select c2 from t1 where c2 > 1000) limit 1);
select stddev(c2) from t1;
stddev(c2)
NULL
rollback;
update t1 set c2 = (select /*+ NO_REWRITE */t1.c1 from t1 left join t2 on t1.c1 = t2.c1 where t2.c2 != any (select c2 from t1 where c2 > 1000) limit 1);
select stddev(c2) from t1;
stddev(c2)
NULL
rollback;
delete from t1 where c2 = (select t1.c1 from t1 left join t2 on t1.c1 = t2.c1 where t2.c2 != any (select c2 from t1 where c2 > 1000) limit 1);
select stddev(c2) from t1;
stddev(c2)
2.1147629234082532
rollback;
delete from t1 where c2 = (select /*+ NO_REWRITE */t1.c1 from t1 left join t2 on t1.c1 = t2.c1 where t2.c2 != any (select c2 from t1 where c2 > 1000) limit 1);
select stddev(c2) from t1;
stddev(c2)
2.1147629234082532
rollback;
select * from t1 left join t2 on t1.c1 = t2.c1 where (t2.c2 not between 1 and 4) or (t2.c2 between 3 and 3) or (t2.c2 like 2);
c1	c2	c1	c2	c3
2	5	2	5	c
3	2	3	5	b
4	6	4	6	o
5	4	5	7	d
6	7	6	8	c
select /*+ NO_REWRITE*/ * from t1 left join t2 on t1.c1 = t2.c1 where (t2.c2 not between 1 and 4) or (t2.c2 between 3 and 3) or (t2.c2 like 2);
c1	c2	c1	c2	c3
2	5	2	5	c
3	2	3	5	b
4	6	4	6	o
5	4	5	7	d
6	7	6	8	c
insert into t4_temp (select * from t1 left join t2 on t1.c1 = t2.c1 where (t2.c2 not between 1 and 4) or (t2.c2 between 3 and 3) or (t2.c2 like 2));
rollback;
insert into t4_temp (select /*+ NO_REWRITE*/ * from t1 left join t2 on t1.c1 = t2.c1 where (t2.c2 not between 1 and 4) or (t2.c2 between 3 and 3) or (t2.c2 like 2));
rollback;
update t1 set c2 = (select t1.c1 from t1 left join t2 on t1.c1 = t2.c1 where (t2.c2 not between 1 and 4) or (t2.c2 between 3 and 3) or (t2.c2 like 2) limit 1);
select stddev(c2) from t1;
stddev(c2)
0
rollback;
update t1 set c2 = (select /*+ NO_REWRITE */t1.c1 from t1 left join t2 on t1.c1 = t2.c1 where (t2.c2 not between 1 and 4) or (t2.c2 between 3 and 3) or (t2.c2 like 2) limit 1);
select stddev(c2) from t1;
stddev(c2)
0
rollback;
delete from t1 where c2 = (select t1.c1 from t1 left join t2 on t1.c1 = t2.c1 where (t2.c2 not between 1 and 4) or (t2.c2 between 3 and 3) or (t2.c2 like 2) limit 1);
select stddev(c2) from t1;
stddev(c2)
2.0591260281974
rollback;
delete from t1 where c2 = (select /*+ NO_REWRITE */t1.c1 from t1 left join t2 on t1.c1 = t2.c1 where (t2.c2 not between 1 and 4) or (t2.c2 between 3 and 3) or (t2.c2 like 2) limit 1);
select stddev(c2) from t1;
stddev(c2)
2.0591260281974
rollback;
select * from t1 left join t2 on t1.c1 = t2.c1 where ((t2.c2 > 2) or (t2.c2 < 4)) is true;
c1	c2	c1	c2	c3
1	1	1	1	o
2	5	2	5	c
3	2	3	5	b
4	6	4	6	o
5	4	5	7	d
6	7	6	8	c
select /*+ NO_REWRITE*/ * from t1 left join t2 on t1.c1 = t2.c1 where ((t2.c2 > 2) or (t2.c2 < 4)) is true;
c1	c2	c1	c2	c3
1	1	1	1	o
2	5	2	5	c
3	2	3	5	b
4	6	4	6	o
5	4	5	7	d
6	7	6	8	c
insert into t4_temp (select * from t1 left join t2 on t1.c1 = t2.c1 where ((t2.c2 > 2) or (t2.c2 < 4)) is true);
rollback;
insert into t4_temp (select /*+ NO_REWRITE*/ * from t1 left join t2 on t1.c1 = t2.c1 where ((t2.c2 > 2) or (t2.c2 < 4)) is true);
rollback;
update t1 set c2 = (select t1.c1 from t1 left join t2 on t1.c1 = t2.c1 where ((t2.c2 > 2) or (t2.c2 < 4)) is true limit 1);
select stddev(c2) from t1;
stddev(c2)
0
rollback;
update t1 set c2 = (select /*+ NO_REWRITE */t1.c1 from t1 left join t2 on t1.c1 = t2.c1 where ((t2.c2 > 2) or (t2.c2 < 4)) is true limit 1);
select stddev(c2) from t1;
stddev(c2)
0
rollback;
delete from t1 where c2 = (select t1.c1 from t1 left join t2 on t1.c1 = t2.c1 where ((t2.c2 > 2) or (t2.c2 < 4)) is true limit 1);
select stddev(c2) from t1;
stddev(c2)
1.7204650534085253
rollback;
delete from t1 where c2 = (select /*+ NO_REWRITE */t1.c1 from t1 left join t2 on t1.c1 = t2.c1 where ((t2.c2 > 2) or (t2.c2 < 4)) is true limit 1);
select stddev(c2) from t1;
stddev(c2)
1.7204650534085253
rollback;
select * from t1 left join t2 on t1.c1 = t2.c1 where ((t2.c1 > 2) and (t2.c2 < 4)) is true;
c1	c2	c1	c2	c3
select /*+ NO_REWRITE*/ * from t1 left join t2 on t1.c1 = t2.c1 where ((t2.c1 > 2) and (t2.c2 < 4)) is true;
c1	c2	c1	c2	c3
insert into t4_temp (select * from t1 left join t2 on t1.c1 = t2.c1 where ((t2.c1 > 2) and (t2.c2 < 4)) is true);
rollback;
insert into t4_temp (select /*+ NO_REWRITE*/ * from t1 left join t2 on t1.c1 = t2.c1 where ((t2.c1 > 2) and (t2.c2 < 4)) is true);
rollback;
update t1 set c2 = (select t1.c1 from t1 left join t2 on t1.c1 = t2.c1 where ((t2.c1 > 2) and (t2.c2 < 4)) is true limit 1);
select stddev(c2) from t1;
stddev(c2)
NULL
rollback;
update t1 set c2 = (select /*+ NO_REWRITE */t1.c1 from t1 left join t2 on t1.c1 = t2.c1 where ((t2.c1 > 2) and (t2.c2 < 4)) is true limit 1);
select stddev(c2) from t1;
stddev(c2)
NULL
rollback;
delete from t1 where c2 = (select t1.c1 from t1 left join t2 on t1.c1 = t2.c1 where ((t2.c1 > 2) and (t2.c2 < 4)) is true limit 1);
select stddev(c2) from t1;
stddev(c2)
2.1147629234082532
rollback;
delete from t1 where c2 = (select /*+ NO_REWRITE */t1.c1 from t1 left join t2 on t1.c1 = t2.c1 where ((t2.c1 > 2) and (t2.c2 < 4)) is true limit 1);
select stddev(c2) from t1;
stddev(c2)
2.1147629234082532
rollback;
select * from t1 left join t2 on t1.c1 = t2.c1 where ((t2.c2 > 2) or (t2.c2 < 4)) is false;
c1	c2	c1	c2	c3
select /*+ NO_REWRITE*/ * from t1 left join t2 on t1.c1 = t2.c1 where ((t2.c2 > 2) or (t2.c2 < 4)) is false;
c1	c2	c1	c2	c3
insert into t4_temp (select * from t1 left join t2 on t1.c1 = t2.c1 where ((t2.c2 > 2) or (t2.c2 < 4)) is false);
rollback;
insert into t4_temp (select /*+ NO_REWRITE*/ * from t1 left join t2 on t1.c1 = t2.c1 where ((t2.c2 > 2) or (t2.c2 < 4)) is false);
rollback;
update t1 set c2 = (select t1.c1 from t1 left join t2 on t1.c1 = t2.c1 where ((t2.c2 > 2) or (t2.c2 < 4)) is false limit 1);
select stddev(c2) from t1;
stddev(c2)
NULL
rollback;
update t1 set c2 = (select /*+ NO_REWRITE */t1.c1 from t1 left join t2 on t1.c1 = t2.c1 where ((t2.c2 > 2) or (t2.c2 < 4)) is false limit 1);
select stddev(c2) from t1;
stddev(c2)
NULL
rollback;
delete from t1 where c2 = (select t1.c1 from t1 left join t2 on t1.c1 = t2.c1 where ((t2.c2 > 2) or (t2.c2 < 4)) is false limit 1);
select stddev(c2) from t1;
stddev(c2)
2.1147629234082532
rollback;
delete from t1 where c2 = (select /*+ NO_REWRITE */t1.c1 from t1 left join t2 on t1.c1 = t2.c1 where ((t2.c2 > 2) or (t2.c2 < 4)) is false limit 1);
select stddev(c2) from t1;
stddev(c2)
2.1147629234082532
rollback;
select * from t1 left join t2 on t1.c1 = t2.c1 where ((t2.c2 > 2) or (t2.c2 < 4)) is not null;
c1	c2	c1	c2	c3
1	1	1	1	o
2	5	2	5	c
3	2	3	5	b
4	6	4	6	o
5	4	5	7	d
6	7	6	8	c
select /*+ NO_REWRITE*/ * from t1 left join t2 on t1.c1 = t2.c1 where ((t2.c2 > 2) or (t2.c2 < 4)) is not null;
c1	c2	c1	c2	c3
1	1	1	1	o
2	5	2	5	c
3	2	3	5	b
4	6	4	6	o
5	4	5	7	d
6	7	6	8	c
insert into t4_temp (select * from t1 left join t2 on t1.c1 = t2.c1 where ((t2.c2 > 2) or (t2.c2 < 4)) is not null);
rollback;
insert into t4_temp (select /*+ NO_REWRITE*/ * from t1 left join t2 on t1.c1 = t2.c1 where ((t2.c2 > 2) or (t2.c2 < 4)) is not null);
rollback;
update t1 set c2 = (select t1.c1 from t1 left join t2 on t1.c1 = t2.c1 where ((t2.c2 > 2) or (t2.c2 < 4)) is not null limit 1);
select stddev(c2) from t1;
stddev(c2)
0
rollback;
update t1 set c2 = (select /*+ NO_REWRITE */t1.c1 from t1 left join t2 on t1.c1 = t2.c1 where ((t2.c2 > 2) or (t2.c2 < 4)) is not null limit 1);
select stddev(c2) from t1;
stddev(c2)
0
rollback;
delete from t1 where c2 = (select t1.c1 from t1 left join t2 on t1.c1 = t2.c1 where ((t2.c2 > 2) or (t2.c2 < 4)) is not null limit 1);
select stddev(c2) from t1;
stddev(c2)
1.7204650534085253
rollback;
delete from t1 where c2 = (select /*+ NO_REWRITE */t1.c1 from t1 left join t2 on t1.c1 = t2.c1 where ((t2.c2 > 2) or (t2.c2 < 4)) is not null limit 1);
select stddev(c2) from t1;
stddev(c2)
1.7204650534085253
rollback;
select * from t1 left join t2 on t1.c1 = t2.c1 where (3 not between t2.c2 and 4);
c1	c2	c1	c2	c3
2	5	2	5	c
3	2	3	5	b
4	6	4	6	o
5	4	5	7	d
6	7	6	8	c
select /*+ NO_REWRITE*/ * from t1 left join t2 on t1.c1 = t2.c1 where (3 not between t2.c2 and 4);
c1	c2	c1	c2	c3
2	5	2	5	c
3	2	3	5	b
4	6	4	6	o
5	4	5	7	d
6	7	6	8	c
insert into t4_temp (select * from t1 left join t2 on t1.c1 = t2.c1 where (3 not between t2.c2 and 4));
rollback;
insert into t4_temp (select /*+ NO_REWRITE*/ * from t1 left join t2 on t1.c1 = t2.c1 where (3 not between t2.c2 and 4));
rollback;
update t1 set c2 = (select t1.c1 from t1 left join t2 on t1.c1 = t2.c1 where (3 not between t2.c2 and 4) limit 1);
select stddev(c2) from t1;
stddev(c2)
0
rollback;
update t1 set c2 = (select /*+ NO_REWRITE */t1.c1 from t1 left join t2 on t1.c1 = t2.c1 where (3 not between t2.c2 and 4) limit 1);
select stddev(c2) from t1;
stddev(c2)
0
rollback;
delete from t1 where c2 = (select t1.c1 from t1 left join t2 on t1.c1 = t2.c1 where (3 not between t2.c2 and 4) limit 1);
select stddev(c2) from t1;
stddev(c2)
2.0591260281974
rollback;
delete from t1 where c2 = (select /*+ NO_REWRITE */t1.c1 from t1 left join t2 on t1.c1 = t2.c1 where (3 not between t2.c2 and 4) limit 1);
select stddev(c2) from t1;
stddev(c2)
2.0591260281974
rollback;
select * from t1 left join t2 on t1.c1 = t2.c1 where t2.c2 > 4 or nvl(t2.c2, 1);
c1	c2	c1	c2	c3
1	1	1	1	o
2	5	2	5	c
3	2	3	5	b
4	6	4	6	o
5	4	5	7	d
6	7	6	8	c
select /*+ NO_REWRITE */ * from t1 left join t2 on t1.c1 = t2.c1 where t2.c2 > 4 or nvl(t2.c2, 1);
c1	c2	c1	c2	c3
1	1	1	1	o
2	5	2	5	c
3	2	3	5	b
4	6	4	6	o
5	4	5	7	d
6	7	6	8	c
insert into t4_temp (select * from t1 left join t2 on t1.c1 = t2.c1 where t2.c2 > 4 or nvl(t2.c2, 1));
rollback;
insert into t4_temp (select /*+ NO_REWRITE */ * from t1 left join t2 on t1.c1 = t2.c1 where t2.c2 > 4 or nvl(t2.c2, 1));
rollback;
update t1 set c2 = (select t1.c1 from t1 left join t2 on t1.c1 = t2.c1 where t2.c2 > 4 or nvl(t2.c2, 1) limit 1);
select stddev(c2) from t1;
stddev(c2)
0
rollback;
update t1 set c2 = (select /*+ NO_REWRITE */ t1.c1 from t1 left join t2 on t1.c1 = t2.c1 where t2.c2 > 4 or nvl(t2.c2, 1) limit 1);
select stddev(c2) from t1;
stddev(c2)
0
rollback;
delete from t1 where c2 = (select t1.c1 from t1 left join t2 on t1.c1 = t2.c1 where t2.c2 > 4 or nvl(t2.c2, 1) limit 1);
select stddev(c2) from t1;
stddev(c2)
1.7204650534085253
rollback;
delete from t1 where c2 = (select /*+ NO_REWRITE */ t1.c1 from t1 left join t2 on t1.c1 = t2.c1 where t2.c2 > 4 or nvl(t2.c2, 1) limit 1);
select stddev(c2) from t1;
stddev(c2)
1.7204650534085253
rollback;
select * from t1 left join t2 on t1.c1 = t2.c1 where (case t2.c2 when 0 then 1 else 0 end);
c1	c2	c1	c2	c3
select /*+ NO_REWRITE*/ * from t1 left join t2 on t1.c1 = t2.c1 where (case t2.c2 when 0 then 1 else 0 end);
c1	c2	c1	c2	c3
insert into t4_temp (select * from t1 left join t2 on t1.c1 = t2.c1 where (case t2.c2 when 0 then 1 else 0 end));
rollback;
insert into t4_temp (select /*+ NO_REWRITE*/ * from t1 left join t2 on t1.c1 = t2.c1 where (case t2.c2 when 0 then 1 else 0 end));
rollback;
update t1 set c2 = (select t1.c1 from t1 left join t2 on t1.c1 = t2.c1 where (case t2.c2 when 0 then 1 else 0 end) limit 1);
select stddev(c2) from t1;
stddev(c2)
NULL
rollback;
update t1 set c2 = (select /*+ NO_REWRITE */t1.c1 from t1 left join t2 on t1.c1 = t2.c1 where (case t2.c2 when 0 then 1 else 0 end) limit 1);
select stddev(c2) from t1;
stddev(c2)
NULL
rollback;
delete from t1 where c2 = (select t1.c1 from t1 left join t2 on t1.c1 = t2.c1 where (case t2.c2 when 0 then 1 else 0 end) limit 1);
select stddev(c2) from t1;
stddev(c2)
2.1147629234082532
rollback;
delete from t1 where c2 = (select /*+ NO_REWRITE */t1.c1 from t1 left join t2 on t1.c1 = t2.c1 where (case t2.c2 when 0 then 1 else 0 end) limit 1);
select stddev(c2) from t1;
stddev(c2)
2.1147629234082532
rollback;
select * from t1 left join t2 on t1.c1 = t2.c1 where t2.c2 > all (select c2 from t1);
c1	c2	c1	c2	c3
6	7	6	8	c
select /*+ NO_REWRITE*/ * from t1 left join t2 on t1.c1 = t2.c1 where t2.c2 > all (select c2 from t1);
c1	c2	c1	c2	c3
6	7	6	8	c
insert into t4_temp (select * from t1 left join t2 on t1.c1 = t2.c1 where t2.c2 > all (select c2 from t1));
rollback;
insert into t4_temp (select /*+ NO_REWRITE*/ * from t1 left join t2 on t1.c1 = t2.c1 where t2.c2 > all (select c2 from t1));
rollback;
update t1 set c2 = (select t1.c1 from t1 left join t2 on t1.c1 = t2.c1 where t2.c2 > all (select c2 from t1) limit 1);
select stddev(c2) from t1;
stddev(c2)
0
rollback;
update t1 set c2 = (select /*+ NO_REWRITE */t1.c1 from t1 left join t2 on t1.c1 = t2.c1 where t2.c2 > all (select c2 from t1) limit 1);
select stddev(c2) from t1;
stddev(c2)
0
rollback;
delete from t1 where c2 = (select t1.c1 from t1 left join t2 on t1.c1 = t2.c1 where t2.c2 > all (select c2 from t1) limit 1);
select stddev(c2) from t1;
stddev(c2)
2.1354156504062622
rollback;
delete from t1 where c2 = (select /*+ NO_REWRITE */t1.c1 from t1 left join t2 on t1.c1 = t2.c1 where t2.c2 > all (select c2 from t1) limit 1);
select stddev(c2) from t1;
stddev(c2)
2.1354156504062622
rollback;
select * from t1 left join t2 on t1.c1 = t2.c1 where ((t2.c1 > 2) and (t2.c2 < 4)) is false;
c1	c2	c1	c2	c3
1	1	1	1	o
2	5	2	5	c
3	2	3	5	b
4	6	4	6	o
5	4	5	7	d
6	7	6	8	c
select /*+ NO_REWRITE*/ * from t1 left join t2 on t1.c1 = t2.c1 where ((t2.c1 > 2) and (t2.c2 < 4)) is false;
c1	c2	c1	c2	c3
1	1	1	1	o
2	5	2	5	c
3	2	3	5	b
4	6	4	6	o
5	4	5	7	d
6	7	6	8	c
insert into t4_temp (select * from t1 left join t2 on t1.c1 = t2.c1 where ((t2.c1 > 2) and (t2.c2 < 4)) is false);
rollback;
insert into t4_temp (select /*+ NO_REWRITE*/ * from t1 left join t2 on t1.c1 = t2.c1 where ((t2.c1 > 2) and (t2.c2 < 4)) is false);
rollback;
update t1 set c2 = (select t1.c1 from t1 left join t2 on t1.c1 = t2.c1 where ((t2.c1 > 2) and (t2.c2 < 4)) is false limit 1);
select stddev(c2) from t1;
stddev(c2)
0
rollback;
update t1 set c2 = (select /*+ NO_REWRITE */t1.c1 from t1 left join t2 on t1.c1 = t2.c1 where ((t2.c1 > 2) and (t2.c2 < 4)) is false limit 1);
select stddev(c2) from t1;
stddev(c2)
0
rollback;
delete from t1 where c2 = (select t1.c1 from t1 left join t2 on t1.c1 = t2.c1 where ((t2.c1 > 2) and (t2.c2 < 4)) is false limit 1);
select stddev(c2) from t1;
stddev(c2)
1.7204650534085253
rollback;
delete from t1 where c2 = (select /*+ NO_REWRITE */t1.c1 from t1 left join t2 on t1.c1 = t2.c1 where ((t2.c1 > 2) and (t2.c2 < 4)) is false limit 1);
select stddev(c2) from t1;
stddev(c2)
1.7204650534085253
rollback;
select * from t1 left join t2 on t1.c1 = t2.c1 where ((t2.c1 > 2) and (t2.c2 < 4)) is not null;
c1	c2	c1	c2	c3
1	1	1	1	o
2	5	2	5	c
3	2	3	5	b
4	6	4	6	o
5	4	5	7	d
6	7	6	8	c
select /*+ NO_REWRITE*/ * from t1 left join t2 on t1.c1 = t2.c1 where ((t2.c1 > 2) and (t2.c2 < 4)) is not null;
c1	c2	c1	c2	c3
1	1	1	1	o
2	5	2	5	c
3	2	3	5	b
4	6	4	6	o
5	4	5	7	d
6	7	6	8	c
insert into t4_temp (select * from t1 left join t2 on t1.c1 = t2.c1 where ((t2.c1 > 2) and (t2.c2 < 4)) is not null);
rollback;
insert into t4_temp (select /*+ NO_REWRITE*/ * from t1 left join t2 on t1.c1 = t2.c1 where ((t2.c1 > 2) and (t2.c2 < 4)) is not null);
rollback;
update t1 set c2 = (select t1.c1 from t1 left join t2 on t1.c1 = t2.c1 where ((t2.c1 > 2) and (t2.c2 < 4)) is not null limit 1);
select stddev(c2) from t1;
stddev(c2)
0
rollback;
update t1 set c2 = (select /*+ NO_REWRITE */t1.c1 from t1 left join t2 on t1.c1 = t2.c1 where ((t2.c1 > 2) and (t2.c2 < 4)) is not null limit 1);
select stddev(c2) from t1;
stddev(c2)
0
rollback;
delete from t1 where c2 = (select t1.c1 from t1 left join t2 on t1.c1 = t2.c1 where ((t2.c1 > 2) and (t2.c2 < 4)) is not null limit 1);
select stddev(c2) from t1;
stddev(c2)
1.7204650534085253
rollback;
delete from t1 where c2 = (select /*+ NO_REWRITE */t1.c1 from t1 left join t2 on t1.c1 = t2.c1 where ((t2.c1 > 2) and (t2.c2 < 4)) is not null limit 1);
select stddev(c2) from t1;
stddev(c2)
1.7204650534085253
rollback;
set autocommit=1;
drop table if exists t1, t2, t3, t4, t5, t6;
drop table t1_temp, t2_temp, t3_temp, t4_temp, t5_temp, t6_temp, t7_temp, t8_temp, t9_temp, t10_temp, t11_temp, t12_temp, t13_temp, t14_temp, t15_temp;
create table t1 (c1 int, c2 int);
create table t2 (c1 int, c2 int);
create table t3 (c1 int, c2 int);
create table t4 (c1 int, c2 int);
create table t5 (c1 int, c2 int);
create table t6 (c1 int, c2 int);
create table t1_temp(a int, b int, d int, e int);
create table t2_temp(a int, b int);
create table t3_temp(a int, b int, c int);
create table t4_temp(a int, b int, c int, d int);
create table t5_temp(a int, b int, c int, d int, f int, g int);
create table t6_temp(a int, b int, c int, d int, e int, f int);
create table t7_temp(a int, b int, c int, d int, f int, g int, i int, j int);
create table t8_temp(a int, b int, c int, d int);
create table t9_temp(a int, b int, c int, d int, f int, g int, i int, j int);
create table t10_temp(a int, b int, c int, d int, f int, g int, i int, j int, l int, m int);
create table t11_temp(a int, b int);
create table t12_temp(a int);
create table t13_temp(a int, b int, d int, e int);
create table t14_temp(a int, b int, c int);
create table t15_temp(a int, b int, c int, d int, f int, g int, i int, j int, l int, m int);
set autocommit=0;
select * from t1 right join t2 on t1.c1 = t2.c1 join t3 on t2.c1 = t3.c1;
c1	c2	c1	c2	c1	c2
NULL	NULL	1	1	1	1
select /*+NO_REWRITE*/ * from t1 right join t2 on t1.c1 = t2.c1 join t3 on t2.c1 = t3.c1;
c1	c2	c1	c2	c1	c2
NULL	NULL	1	1	1	1
select * from t2 left join t1 on t1.c1 = t2.c1 where not exists (select 1 from t3 where t3.c2 = t1.c2);
c1	c2	c1	c2
1	1	NULL	NULL
select /*+NO_REWRITE*/ * from t2 left join t1 on t1.c1 = t2.c1 where not exists (select 1 from t3 where t3.c2 = t1.c2);
c1	c2	c1	c2
1	1	NULL	NULL
insert into t1_temp (select * from t2 left join t1 on t1.c1 = t2.c1 where not exists (select 1 from t3 where t3.c2 = t1.c2));
rollback;
insert into t1_temp (select /*+NO_REWRITE*/ * from t2 left join t1 on t1.c1 = t2.c1 where not exists (select 1 from t3 where t3.c2 = t1.c2));
rollback;
update t1 set c2 = (select t1.c1 from t2 left join t1 on t1.c1 = t2.c1 where not exists (select 1 from t3 where t3.c2 = t1.c2) limit 1);
select stddev(c2) from t1;
stddev(c2)
NULL
rollback;
update t1 set c2 = (select /*+NO_REWRITE*/t1.c1 from t2 left join t1 on t1.c1 = t2.c1 where not exists (select 1 from t3 where t3.c2 = t1.c2) limit 1);
select stddev(c2) from t1;
stddev(c2)
NULL
rollback;
delete from t1 where c2 = (select t1.c1 from t2 left join t1 on t1.c1 = t2.c1 where not exists (select 1 from t3 where t3.c2 = t1.c2) limit 1);
select stddev(c2) from t1;
stddev(c2)
NULL
rollback;
delete from t1 where c2 = (select /*+NO_REWRITE*/t1.c1 from t2 left join t1 on t1.c1 = t2.c1 where not exists (select 1 from t3 where t3.c2 = t1.c2) limit 1);
select stddev(c2) from t1;
stddev(c2)
NULL
rollback;
select * from t2 left join t1 on t1.c1 = t2.c1 where exists (select 1 from t3 where t3.c2 = t1.c2);
c1	c2	c1	c2
select /*+NO_REWRITE*/ * from t2 left join t1 on t1.c1 = t2.c1 where exists (select 1 from t3 where t3.c2 = t1.c2);
c1	c2	c1	c2
insert into t1_temp (select * from t2 left join t1 on t1.c1 = t2.c1 where exists (select 1 from t3 where t3.c2 = t1.c2));
rollback;
insert into t1_temp (select /*+NO_REWRITE*/ * from t2 left join t1 on t1.c1 = t2.c1 where exists (select 1 from t3 where t3.c2 = t1.c2));
rollback;
update t1 set c2 = (select t1.c1 from t2 left join t1 on t1.c1 = t2.c1 where exists (select 1 from t3 where t3.c2 = t1.c2) limit 1);
select stddev(c2) from t1;
stddev(c2)
NULL
rollback;
update t1 set c2 = (select /*+NO_REWRITE*/t1.c1 from t2 left join t1 on t1.c1 = t2.c1 where exists (select 1 from t3 where t3.c2 = t1.c2) limit 1);
select stddev(c2) from t1;
stddev(c2)
NULL
rollback;
delete from t1 where c2 = (select t1.c1 from t2 left join t1 on t1.c1 = t2.c1 where exists (select 1 from t3 where t3.c2 = t1.c2) limit 1);
select stddev(c2) from t1;
stddev(c2)
NULL
rollback;
delete from t1 where c2 = (select /*+NO_REWRITE*/t1.c1 from t2 left join t1 on t1.c1 = t2.c1 where exists (select 1 from t3 where t3.c2 = t1.c2) limit 1);
select stddev(c2) from t1;
stddev(c2)
NULL
rollback;
set autocommit=1;
set autocommit=0;
select * from t1 where (11) in (select t3.c1 from t2 left join t3 on t2.c1=t3.c1 where t1.c1 = 1);
c1	c2
select /*+no_rewrite*/* from t1 where (11) in (select t3.c1 from t2 left join t3 on t2.c1=t3.c1 where t1.c1 = 1);
c1	c2
insert into t11_temp (select * from t1 where (11) in (select t3.c1 from t2 left join t3 on t2.c1=t3.c1 where t1.c1 = 1));
rollback;
insert into t11_temp (select /*+no_rewrite*/* from t1 where (11) in (select t3.c1 from t2 left join t3 on t2.c1=t3.c1 where t1.c1 = 1));
rollback;
update t1 set c2 = (select t1.c1 from t1 where (11) in (select t3.c1 from t2 left join t3 on t2.c1=t3.c1 where t1.c1 = 1) limit 1);
select stddev(c2) from t1;
stddev(c2)
NULL
rollback;
update t1 set c2 = (select /*+no_rewrite*/t1.c1 from t1 where (11) in (select t3.c1 from t2 left join t3 on t2.c1=t3.c1 where t1.c1 = 1) limit 1);
select stddev(c2) from t1;
stddev(c2)
NULL
rollback;
delete from t1 where c2 = (select t1.c1 from t1 where (11) in (select t3.c1 from t2 left join t3 on t2.c1=t3.c1 where t1.c1 = 1) limit 1);
select stddev(c2) from t1;
stddev(c2)
2.8722813232690143
rollback;
delete from t1 where c2 = (select /*+no_rewrite*/t1.c1 from t1 where (11) in (select t3.c1 from t2 left join t3 on t2.c1=t3.c1 where t1.c1 = 1) limit 1);
select stddev(c2) from t1;
stddev(c2)
2.8722813232690143
rollback;
select * from t1 left join t2 on t1.c1=t2.c1 where exists (select 1 from t3 where t2.c1=t3.c1);
c1	c2	c1	c2
1	1	1	1
1	1	1	1
3	2	3	3
4	2	4	4
select /*+NO_REWRITE*/* from t1 left join t2 on t1.c1=t2.c1 where exists (select 1 from t3 where t2.c1=t3.c1);
c1	c2	c1	c2
1	1	1	1
1	1	1	1
3	2	3	3
4	2	4	4
insert into t4_temp (select * from t1 left join t2 on t1.c1=t2.c1 where exists (select 1 from t3 where t2.c1=t3.c1));
rollback;
insert into t4_temp (select /*+NO_REWRITE*/* from t1 left join t2 on t1.c1=t2.c1 where exists (select 1 from t3 where t2.c1=t3.c1));
rollback;
update t1 set c2 = (select t1.c1 from t1 left join t2 on t1.c1=t2.c1 where exists (select 1 from t3 where t2.c1=t3.c1) limit 1);
select stddev(c2) from t1;
stddev(c2)
0
rollback;
update t1 set c2 = (select /*+ NO_REWRITE */t1.c1 from t1 left join t2 on t1.c1=t2.c1 where exists (select 1 from t3 where t2.c1=t3.c1) limit 1);
select stddev(c2) from t1;
stddev(c2)
0
rollback;
delete from t1 where c2 = (select t1.c1 from t1 left join t2 on t1.c1=t2.c1 where exists (select 1 from t3 where t2.c1=t3.c1) limit 1);
select stddev(c2) from t1;
stddev(c2)
2.8674417556808756
rollback;
delete from t1 where c2 = (select /*+ NO_REWRITE */t1.c1 from t1 left join t2 on t1.c1=t2.c1 where exists (select 1 from t3 where t2.c1=t3.c1) limit 1);
select stddev(c2) from t1;
stddev(c2)
2.8674417556808756
rollback;
select * from t1 left join t2 on t1.c1=t2.c1 where exists (select 1 from t3 where t1.c1=t3.c1);
c1	c2	c1	c2
1	1	1	1
1	1	1	1
3	2	3	3
4	2	4	4
5	5	NULL	NULL
select /*+NO_REWRITE*/* from t1 left join t2 on t1.c1=t2.c1 where exists (select 1 from t3 where t1.c1=t3.c1);
c1	c2	c1	c2
1	1	1	1
1	1	1	1
3	2	3	3
4	2	4	4
5	5	NULL	NULL
insert into t4_temp (select * from t1 left join t2 on t1.c1=t2.c1 where exists (select 1 from t3 where t1.c1=t3.c1));
rollback;
insert into t4_temp (select /*+NO_REWRITE*/* from t1 left join t2 on t1.c1=t2.c1 where exists (select 1 from t3 where t1.c1=t3.c1));
rollback;
update t1 set c2 = (select t1.c1 from t1 left join t2 on t1.c1=t2.c1 where exists (select 1 from t3 where t1.c1=t3.c1) limit 1);
select stddev(c2) from t1;
stddev(c2)
0
rollback;
update t1 set c2 = (select /*+ NO_REWRITE */t1.c1 from t1 left join t2 on t1.c1=t2.c1 where exists (select 1 from t3 where t1.c1=t3.c1) limit 1);
select stddev(c2) from t1;
stddev(c2)
0
rollback;
delete from t1 where c2 = (select t1.c1 from t1 left join t2 on t1.c1=t2.c1 where exists (select 1 from t3 where t1.c1=t3.c1) limit 1);
select stddev(c2) from t1;
stddev(c2)
2.8674417556808756
rollback;
delete from t1 where c2 = (select /*+ NO_REWRITE */t1.c1 from t1 left join t2 on t1.c1=t2.c1 where exists (select 1 from t3 where t1.c1=t3.c1) limit 1);
select stddev(c2) from t1;
stddev(c2)
2.8674417556808756
rollback;
select * from t1 where exists (select 1 from t2 left join t3 on t2.c1=t3.c1 where t1.c1=t3.c1);
c1	c2
1	1
3	2
4	2
select /*+NO_REWRITE*/* from t1 where exists (select 1 from t2 left join t3 on t2.c1=t3.c1 where t1.c1=t3.c1);
c1	c2
1	1
3	2
4	2
insert into t11_temp (select * from t1 where exists (select 1 from t2 left join t3 on t2.c1=t3.c1 where t1.c1=t3.c1));
rollback;
insert into t11_temp (select /*+NO_REWRITE*/* from t1 where exists (select 1 from t2 left join t3 on t2.c1=t3.c1 where t1.c1=t3.c1));
rollback;
update t1 set c2 = (select t1.c1 from t1 where exists (select 1 from t2 left join t3 on t2.c1=t3.c1 where t1.c1=t3.c1) limit 1);
select stddev(c2) from t1;
stddev(c2)
0
rollback;
update t1 set c2 = (select /*+ NO_REWRITE */t1.c1 from t1 where exists (select 1 from t2 left join t3 on t2.c1=t3.c1 where t1.c1=t3.c1) limit 1);
select stddev(c2) from t1;
stddev(c2)
0
rollback;
delete from t1 where c2 = (select t1.c1 from t1 where exists (select 1 from t2 left join t3 on t2.c1=t3.c1 where t1.c1=t3.c1) limit 1);
select stddev(c2) from t1;
stddev(c2)
2.8674417556808756
rollback;
delete from t1 where c2 = (select /*+ NO_REWRITE */t1.c1 from t1 where exists (select 1 from t2 left join t3 on t2.c1=t3.c1 where t1.c1=t3.c1) limit 1);
select stddev(c2) from t1;
stddev(c2)
2.8674417556808756
rollback;
select * from t1 where exists (select 1 from t2 left join t3 on t2.c1=t3.c1 where t1.c1=t2.c1);
c1	c2
1	1
2	2
3	2
4	2
select /*+NO_REWRITE*/* from t1 where exists (select 1 from t2 left join t3 on t2.c1=t3.c1 where t1.c1=t2.c1);
c1	c2
1	1
2	2
3	2
4	2
insert into t11_temp (select * from t1 where exists (select 1 from t2 left join t3 on t2.c1=t3.c1 where t1.c1=t2.c1));
rollback;
insert into t11_temp (select /*+NO_REWRITE*/* from t1 where exists (select 1 from t2 left join t3 on t2.c1=t3.c1 where t1.c1=t2.c1));
rollback;
update t1 set c2 = (select t1.c1 from t1 where exists (select 1 from t2 left join t3 on t2.c1=t3.c1 where t1.c1=t2.c1) limit 1);
select stddev(c2) from t1;
stddev(c2)
0
rollback;
update t1 set c2 = (select /*+ NO_REWRITE */t1.c1 from t1 where exists (select 1 from t2 left join t3 on t2.c1=t3.c1 where t1.c1=t2.c1) limit 1);
select stddev(c2) from t1;
stddev(c2)
0
rollback;
delete from t1 where c2 = (select t1.c1 from t1 where exists (select 1 from t2 left join t3 on t2.c1=t3.c1 where t1.c1=t2.c1) limit 1);
select stddev(c2) from t1;
stddev(c2)
2.8674417556808756
rollback;
delete from t1 where c2 = (select /*+ NO_REWRITE */t1.c1 from t1 where exists (select 1 from t2 left join t3 on t2.c1=t3.c1 where t1.c1=t2.c1) limit 1);
select stddev(c2) from t1;
stddev(c2)
2.8674417556808756
rollback;
select * from t1 where not exists (select 1 from t2 left join t3 on t2.c1=t3.c1 where t1.c1=t3.c1);
c1	c2
10	10
2	2
5	5
NULL	1
NULL	5
select /*+NO_REWRITE*/* from t1 where not exists (select 1 from t2 left join t3 on t2.c1=t3.c1 where t1.c1=t3.c1);
c1	c2
10	10
2	2
5	5
NULL	1
NULL	5
insert into t11_temp (select * from t1 where not exists (select 1 from t2 left join t3 on t2.c1=t3.c1 where t1.c1=t3.c1));
rollback;
insert into t11_temp (select /*+NO_REWRITE*/* from t1 where not exists (select 1 from t2 left join t3 on t2.c1=t3.c1 where t1.c1=t3.c1));
rollback;
update t1 set c2 = (select t1.c1 from t1 where not exists (select 1 from t2 left join t3 on t2.c1=t3.c1 where t1.c1=t3.c1) limit 1);
select stddev(c2) from t1;
stddev(c2)
NULL
rollback;
update t1 set c2 = (select /*+ NO_REWRITE */t1.c1 from t1 where not exists (select 1 from t2 left join t3 on t2.c1=t3.c1 where t1.c1=t3.c1) limit 1);
select stddev(c2) from t1;
stddev(c2)
NULL
rollback;
delete from t1 where c2 = (select t1.c1 from t1 where not exists (select 1 from t2 left join t3 on t2.c1=t3.c1 where t1.c1=t3.c1) limit 1);
select stddev(c2) from t1;
stddev(c2)
2.8722813232690143
rollback;
delete from t1 where c2 = (select /*+ NO_REWRITE */t1.c1 from t1 where not exists (select 1 from t2 left join t3 on t2.c1=t3.c1 where t1.c1=t3.c1) limit 1);
select stddev(c2) from t1;
stddev(c2)
2.8722813232690143
rollback;
select * from t1 where not exists (select 1 from t2 left join t3 on t2.c1=t3.c1 where t1.c1=t2.c1);
c1	c2
10	10
5	5
NULL	1
NULL	5
select /*+NO_REWRITE*/* from t1 where not exists (select 1 from t2 left join t3 on t2.c1=t3.c1 where t1.c1=t2.c1);
c1	c2
10	10
5	5
NULL	1
NULL	5
insert into t11_temp (select * from t1 where not exists (select 1 from t2 left join t3 on t2.c1=t3.c1 where t1.c1=t2.c1));
rollback;
insert into t11_temp (select /*+NO_REWRITE*/* from t1 where not exists (select 1 from t2 left join t3 on t2.c1=t3.c1 where t1.c1=t2.c1));
rollback;
update t1 set c2 = (select t1.c1 from t1 where not exists (select 1 from t2 left join t3 on t2.c1=t3.c1 where t1.c1=t2.c1) limit 1);
select stddev(c2) from t1;
stddev(c2)
NULL
rollback;
update t1 set c2 = (select /*+ NO_REWRITE */t1.c1 from t1 where not exists (select 1 from t2 left join t3 on t2.c1=t3.c1 where t1.c1=t2.c1) limit 1);
select stddev(c2) from t1;
stddev(c2)
NULL
rollback;
delete from t1 where c2 = (select t1.c1 from t1 where not exists (select 1 from t2 left join t3 on t2.c1=t3.c1 where t1.c1=t2.c1) limit 1);
select stddev(c2) from t1;
stddev(c2)
2.8722813232690143
rollback;
delete from t1 where c2 = (select /*+ NO_REWRITE */t1.c1 from t1 where not exists (select 1 from t2 left join t3 on t2.c1=t3.c1 where t1.c1=t2.c1) limit 1);
select stddev(c2) from t1;
stddev(c2)
2.8722813232690143
rollback;
select * from t1 left join t2 on t1.c1=t2.c1 where not exists (select 1 from t3 where t2.c1=t3.c1);
c1	c2	c1	c2
10	10	NULL	NULL
2	2	2	2
5	5	NULL	NULL
NULL	1	NULL	NULL
NULL	5	NULL	NULL
select /*+NO_REWRITE*/* from t1 left join t2 on t1.c1=t2.c1 where not exists (select 1 from t3 where t2.c1=t3.c1);
c1	c2	c1	c2
10	10	NULL	NULL
2	2	2	2
5	5	NULL	NULL
NULL	1	NULL	NULL
NULL	5	NULL	NULL
insert into t4_temp (select * from t1 left join t2 on t1.c1=t2.c1 where not exists (select 1 from t3 where t2.c1=t3.c1));
rollback;
insert into t4_temp (select /*+NO_REWRITE*/* from t1 left join t2 on t1.c1=t2.c1 where not exists (select 1 from t3 where t2.c1=t3.c1));
rollback;
update t1 set c2 = (select t1.c1 from t1 left join t2 on t1.c1=t2.c1 where not exists (select 1 from t3 where t2.c1=t3.c1) limit 1);
select stddev(c2) from t1;
stddev(c2)
0
rollback;
update t1 set c2 = (select /*+ NO_REWRITE */t1.c1 from t1 left join t2 on t1.c1=t2.c1 where not exists (select 1 from t3 where t2.c1=t3.c1) limit 1);
select stddev(c2) from t1;
stddev(c2)
0
rollback;
delete from t1 where c2 = (select t1.c1 from t1 left join t2 on t1.c1=t2.c1 where not exists (select 1 from t3 where t2.c1=t3.c1) limit 1);
select stddev(c2) from t1;
stddev(c2)
3.3226495451672298
rollback;
delete from t1 where c2 = (select /*+ NO_REWRITE */t1.c1 from t1 left join t2 on t1.c1=t2.c1 where not exists (select 1 from t3 where t2.c1=t3.c1) limit 1);
select stddev(c2) from t1;
stddev(c2)
3.3226495451672298
rollback;
select * from t1 left join t2 on t1.c1=t2.c1 where t1.c1 in (select t3.c1 from t3 limit 2);
c1	c2	c1	c2
1	1	1	1
1	1	1	1
3	2	3	3
select /*+NO_REWRITE*/* from t1 left join t2 on t1.c1=t2.c1 where t1.c1 in (select t3.c1 from t3 limit 2);
c1	c2	c1	c2
1	1	1	1
1	1	1	1
3	2	3	3
insert into t4_temp (select * from t1 left join t2 on t1.c1=t2.c1 where t1.c1 in (select t3.c1 from t3 limit 2));
rollback;
insert into t4_temp (select /*+NO_REWRITE*/* from t1 left join t2 on t1.c1=t2.c1 where t1.c1 in (select t3.c1 from t3 limit 2));
rollback;
update t1 set c2 = (select t1.c1 from t1 left join t2 on t1.c1=t2.c1 where t1.c1 in (select t3.c1 from t3 limit 2) limit 1);
select stddev(c2) from t1;
stddev(c2)
0
rollback;
update t1 set c2 = (select /*+ NO_REWRITE */t1.c1 from t1 left join t2 on t1.c1=t2.c1 where t1.c1 in (select t3.c1 from t3 limit 2) limit 1);
select stddev(c2) from t1;
stddev(c2)
0
rollback;
delete from t1 where c2 = (select t1.c1 from t1 left join t2 on t1.c1=t2.c1 where t1.c1 in (select t3.c1 from t3 limit 2) limit 1);
select stddev(c2) from t1;
stddev(c2)
2.8674417556808756
rollback;
delete from t1 where c2 = (select /*+ NO_REWRITE */t1.c1 from t1 left join t2 on t1.c1=t2.c1 where t1.c1 in (select t3.c1 from t3 limit 2) limit 1);
select stddev(c2) from t1;
stddev(c2)
2.8674417556808756
rollback;
select * from t1 left join t2 on t1.c1=t2.c1 where t1.c1 not in (select t3.c1 from t3 limit 2);
c1	c2	c1	c2
10	10	NULL	NULL
2	2	2	2
4	2	4	4
5	5	NULL	NULL
select /*+NO_REWRITE*/* from t1 left join t2 on t1.c1=t2.c1 where t1.c1 not in (select t3.c1 from t3 limit 2);
c1	c2	c1	c2
10	10	NULL	NULL
2	2	2	2
4	2	4	4
5	5	NULL	NULL
insert into t4_temp (select * from t1 left join t2 on t1.c1=t2.c1 where t1.c1 not in (select t3.c1 from t3 limit 2));
rollback;
insert into t4_temp (select /*+NO_REWRITE*/* from t1 left join t2 on t1.c1=t2.c1 where t1.c1 not in (select t3.c1 from t3 limit 2));
rollback;
update t1 set c2 = (select t1.c1 from t1 left join t2 on t1.c1=t2.c1 where t1.c1 not in (select t3.c1 from t3 limit 2) limit 1);
select stddev(c2) from t1;
stddev(c2)
0
rollback;
update t1 set c2 = (select /*+ NO_REWRITE */t1.c1 from t1 left join t2 on t1.c1=t2.c1 where t1.c1 not in (select t3.c1 from t3 limit 2) limit 1);
select stddev(c2) from t1;
stddev(c2)
0
rollback;
delete from t1 where c2 = (select t1.c1 from t1 left join t2 on t1.c1=t2.c1 where t1.c1 not in (select t3.c1 from t3 limit 2) limit 1);
select stddev(c2) from t1;
stddev(c2)
3.3226495451672298
rollback;
delete from t1 where c2 = (select /*+ NO_REWRITE */t1.c1 from t1 left join t2 on t1.c1=t2.c1 where t1.c1 not in (select t3.c1 from t3 limit 2) limit 1);
select stddev(c2) from t1;
stddev(c2)
3.3226495451672298
rollback;
select * from t1 left join t2 on t1.c1=t2.c1 where t2.c1 in (select t3.c1 from t3 limit 2);
c1	c2	c1	c2
1	1	1	1
1	1	1	1
3	2	3	3
select /*+NO_REWRITE*/* from t1 left join t2 on t1.c1=t2.c1 where t2.c1 in (select t3.c1 from t3 limit 2);
c1	c2	c1	c2
1	1	1	1
1	1	1	1
3	2	3	3
insert into t4_temp (select * from t1 left join t2 on t1.c1=t2.c1 where t2.c1 in (select t3.c1 from t3 limit 2));
rollback;
insert into t4_temp (select /*+NO_REWRITE*/* from t1 left join t2 on t1.c1=t2.c1 where t2.c1 in (select t3.c1 from t3 limit 2));
rollback;
update t1 set c2 = (select t1.c1 from t1 left join t2 on t1.c1=t2.c1 where t2.c1 in (select t3.c1 from t3 limit 2) limit 1);
select stddev(c2) from t1;
stddev(c2)
0
rollback;
update t1 set c2 = (select /*+ NO_REWRITE */t1.c1 from t1 left join t2 on t1.c1=t2.c1 where t2.c1 in (select t3.c1 from t3 limit 2) limit 1);
select stddev(c2) from t1;
stddev(c2)
0
rollback;
delete from t1 where c2 = (select t1.c1 from t1 left join t2 on t1.c1=t2.c1 where t2.c1 in (select t3.c1 from t3 limit 2) limit 1);
select stddev(c2) from t1;
stddev(c2)
2.8674417556808756
rollback;
delete from t1 where c2 = (select /*+ NO_REWRITE */t1.c1 from t1 left join t2 on t1.c1=t2.c1 where t2.c1 in (select t3.c1 from t3 limit 2) limit 1);
select stddev(c2) from t1;
stddev(c2)
2.8674417556808756
rollback;
select * from t1 left join t2 on t1.c1=t2.c1 where t2.c1 not in (select t3.c1 from t3 limit 2);
c1	c2	c1	c2
2	2	2	2
4	2	4	4
select /*+NO_REWRITE*/* from t1 left join t2 on t1.c1=t2.c1 where t2.c1 not in (select t3.c1 from t3 limit 2);
c1	c2	c1	c2
2	2	2	2
4	2	4	4
insert into t4_temp (select * from t1 left join t2 on t1.c1=t2.c1 where t2.c1 not in (select t3.c1 from t3 limit 2));
rollback;
insert into t4_temp (select /*+NO_REWRITE*/* from t1 left join t2 on t1.c1=t2.c1 where t2.c1 not in (select t3.c1 from t3 limit 2));
rollback;
update t1 set c2 = (select t1.c1 from t1 left join t2 on t1.c1=t2.c1 where t2.c1 not in (select t3.c1 from t3 limit 2) limit 1);
select stddev(c2) from t1;
stddev(c2)
0
rollback;
update t1 set c2 = (select /*+ NO_REWRITE */t1.c1 from t1 left join t2 on t1.c1=t2.c1 where t2.c1 not in (select t3.c1 from t3 limit 2) limit 1);
select stddev(c2) from t1;
stddev(c2)
0
rollback;
delete from t1 where c2 = (select t1.c1 from t1 left join t2 on t1.c1=t2.c1 where t2.c1 not in (select t3.c1 from t3 limit 2) limit 1);
select stddev(c2) from t1;
stddev(c2)
3.3226495451672298
rollback;
delete from t1 where c2 = (select /*+ NO_REWRITE */t1.c1 from t1 left join t2 on t1.c1=t2.c1 where t2.c1 not in (select t3.c1 from t3 limit 2) limit 1);
select stddev(c2) from t1;
stddev(c2)
3.3226495451672298
rollback;
select * from t1 left join t2 on t1.c1=t2.c1 where exists (select 1 from t3 left join t4 on t3.c1=t4.c1 where t2.c1=t4.c1);
c1	c2	c1	c2
1	1	1	1
1	1	1	1
3	2	3	3
4	2	4	4
select /*+NO_REWRITE*/* from t1 left join t2 on t1.c1=t2.c1 where exists (select 1 from t3 left join t4 on t3.c1=t4.c1 where t2.c1=t4.c1);
c1	c2	c1	c2
1	1	1	1
1	1	1	1
3	2	3	3
4	2	4	4
insert into t4_temp (select * from t1 left join t2 on t1.c1=t2.c1 where exists (select 1 from t3 left join t4 on t3.c1=t4.c1 where t2.c1=t4.c1));
rollback;
insert into t4_temp (select /*+NO_REWRITE*/* from t1 left join t2 on t1.c1=t2.c1 where exists (select 1 from t3 left join t4 on t3.c1=t4.c1 where t2.c1=t4.c1));
rollback;
update t1 set c2 = (select t1.c1 from t1 left join t2 on t1.c1=t2.c1 where exists (select 1 from t3 left join t4 on t3.c1=t4.c1 where t2.c1=t4.c1) limit 1);
select stddev(c2) from t1;
stddev(c2)
0
rollback;
update t1 set c2 = (select /*+ NO_REWRITE */t1.c1 from t1 left join t2 on t1.c1=t2.c1 where exists (select 1 from t3 left join t4 on t3.c1=t4.c1 where t2.c1=t4.c1) limit 1);
select stddev(c2) from t1;
stddev(c2)
0
rollback;
delete from t1 where c2 = (select t1.c1 from t1 left join t2 on t1.c1=t2.c1 where exists (select 1 from t3 left join t4 on t3.c1=t4.c1 where t2.c1=t4.c1) limit 1);
select stddev(c2) from t1;
stddev(c2)
2.8674417556808756
rollback;
delete from t1 where c2 = (select /*+ NO_REWRITE */t1.c1 from t1 left join t2 on t1.c1=t2.c1 where exists (select 1 from t3 left join t4 on t3.c1=t4.c1 where t2.c1=t4.c1) limit 1);
select stddev(c2) from t1;
stddev(c2)
2.8674417556808756
rollback;
select * from t1 left join t2 on t1.c1=t2.c1 where exists (select 1 from t3 left join t4 on t3.c1=t4.c1 where t2.c1=t3.c1);
c1	c2	c1	c2
1	1	1	1
1	1	1	1
3	2	3	3
4	2	4	4
select /*+NO_REWRITE*/* from t1 left join t2 on t1.c1=t2.c1 where exists (select 1 from t3 left join t4 on t3.c1=t4.c1 where t2.c1=t3.c1);
c1	c2	c1	c2
1	1	1	1
1	1	1	1
3	2	3	3
4	2	4	4
insert into t4_temp (select * from t1 left join t2 on t1.c1=t2.c1 where exists (select 1 from t3 left join t4 on t3.c1=t4.c1 where t2.c1=t3.c1));
rollback;
insert into t4_temp (select /*+NO_REWRITE*/* from t1 left join t2 on t1.c1=t2.c1 where exists (select 1 from t3 left join t4 on t3.c1=t4.c1 where t2.c1=t3.c1));
rollback;
update t1 set c2 = (select t1.c1 from t1 left join t2 on t1.c1=t2.c1 where exists (select 1 from t3 left join t4 on t3.c1=t4.c1 where t2.c1=t3.c1) limit 1);
select stddev(c2) from t1;
stddev(c2)
0
rollback;
update t1 set c2 = (select /*+ NO_REWRITE */t1.c1 from t1 left join t2 on t1.c1=t2.c1 where exists (select 1 from t3 left join t4 on t3.c1=t4.c1 where t2.c1=t3.c1) limit 1);
select stddev(c2) from t1;
stddev(c2)
0
rollback;
delete from t1 where c2 = (select t1.c1 from t1 left join t2 on t1.c1=t2.c1 where exists (select 1 from t3 left join t4 on t3.c1=t4.c1 where t2.c1=t3.c1) limit 1);
select stddev(c2) from t1;
stddev(c2)
2.8674417556808756
rollback;
delete from t1 where c2 = (select /*+ NO_REWRITE */t1.c1 from t1 left join t2 on t1.c1=t2.c1 where exists (select 1 from t3 left join t4 on t3.c1=t4.c1 where t2.c1=t3.c1) limit 1);
select stddev(c2) from t1;
stddev(c2)
2.8674417556808756
rollback;
select * from t1 left join t2 on t1.c1=t2.c1 where exists (select 1 from t3 left join t4 on t3.c1=t4.c1 where t1.c1=t4.c1);
c1	c2	c1	c2
1	1	1	1
1	1	1	1
3	2	3	3
4	2	4	4
select /*+NO_REWRITE*/* from t1 left join t2 on t1.c1=t2.c1 where exists (select 1 from t3 left join t4 on t3.c1=t4.c1 where t1.c1=t4.c1);
c1	c2	c1	c2
1	1	1	1
1	1	1	1
3	2	3	3
4	2	4	4
insert into t4_temp (select * from t1 left join t2 on t1.c1=t2.c1 where exists (select 1 from t3 left join t4 on t3.c1=t4.c1 where t1.c1=t4.c1));
rollback;
insert into t4_temp (select /*+NO_REWRITE*/* from t1 left join t2 on t1.c1=t2.c1 where exists (select 1 from t3 left join t4 on t3.c1=t4.c1 where t1.c1=t4.c1));
rollback;
update t1 set c2 = (select t1.c1 from t1 left join t2 on t1.c1=t2.c1 where exists (select 1 from t3 left join t4 on t3.c1=t4.c1 where t1.c1=t4.c1) limit 1);
select stddev(c2) from t1;
stddev(c2)
0
rollback;
update t1 set c2 = (select /*+ NO_REWRITE */t1.c1 from t1 left join t2 on t1.c1=t2.c1 where exists (select 1 from t3 left join t4 on t3.c1=t4.c1 where t1.c1=t4.c1) limit 1);
select stddev(c2) from t1;
stddev(c2)
0
rollback;
delete from t1 where c2 = (select t1.c1 from t1 left join t2 on t1.c1=t2.c1 where exists (select 1 from t3 left join t4 on t3.c1=t4.c1 where t1.c1=t4.c1) limit 1);
select stddev(c2) from t1;
stddev(c2)
2.8674417556808756
rollback;
delete from t1 where c2 = (select /*+ NO_REWRITE */t1.c1 from t1 left join t2 on t1.c1=t2.c1 where exists (select 1 from t3 left join t4 on t3.c1=t4.c1 where t1.c1=t4.c1) limit 1);
select stddev(c2) from t1;
stddev(c2)
2.8674417556808756
rollback;
select * from t1 left join t2 on t1.c1=t2.c1 where not exists (select 1 from t3 left join t4 on t3.c1=t4.c2 where t2.c2=t4.c2);
c1	c2	c1	c2
10	10	NULL	NULL
2	2	2	2
5	5	NULL	NULL
NULL	1	NULL	NULL
NULL	5	NULL	NULL
select /*+NO_REWRITE*/* from t1 left join t2 on t1.c1=t2.c1 where not exists (select 1 from t3 left join t4 on t3.c1=t4.c2 where t2.c2=t4.c2);
c1	c2	c1	c2
10	10	NULL	NULL
2	2	2	2
5	5	NULL	NULL
NULL	1	NULL	NULL
NULL	5	NULL	NULL
insert into t4_temp (select * from t1 left join t2 on t1.c1=t2.c1 where not exists (select 1 from t3 left join t4 on t3.c1=t4.c2 where t2.c2=t4.c2));
rollback;
insert into t4_temp (select /*+NO_REWRITE*/* from t1 left join t2 on t1.c1=t2.c1 where not exists (select 1 from t3 left join t4 on t3.c1=t4.c2 where t2.c2=t4.c2));
rollback;
update t1 set c2 = (select t1.c1 from t1 left join t2 on t1.c1=t2.c1 where not exists (select 1 from t3 left join t4 on t3.c1=t4.c2 where t2.c2=t4.c2) limit 1);
select stddev(c2) from t1;
stddev(c2)
0
rollback;
update t1 set c2 = (select /*+ NO_REWRITE */t1.c1 from t1 left join t2 on t1.c1=t2.c1 where not exists (select 1 from t3 left join t4 on t3.c1=t4.c2 where t2.c2=t4.c2) limit 1);
select stddev(c2) from t1;
stddev(c2)
0
rollback;
delete from t1 where c2 = (select t1.c1 from t1 left join t2 on t1.c1=t2.c1 where not exists (select 1 from t3 left join t4 on t3.c1=t4.c2 where t2.c2=t4.c2) limit 1);
select stddev(c2) from t1;
stddev(c2)
3.3226495451672298
rollback;
delete from t1 where c2 = (select /*+ NO_REWRITE */t1.c1 from t1 left join t2 on t1.c1=t2.c1 where not exists (select 1 from t3 left join t4 on t3.c1=t4.c2 where t2.c2=t4.c2) limit 1);
select stddev(c2) from t1;
stddev(c2)
3.3226495451672298
rollback;
select * from t1 left join t2 on t1.c1=t2.c1 where not exists (select 1 from t3 left join t4 on t3.c1=t4.c2 where t2.c2=t3.c2);
c1	c2	c1	c2
10	10	NULL	NULL
2	2	2	2
5	5	NULL	NULL
NULL	1	NULL	NULL
NULL	5	NULL	NULL
select /*+NO_REWRITE*/* from t1 left join t2 on t1.c1=t2.c1 where not exists (select 1 from t3 left join t4 on t3.c1=t4.c2 where t2.c2=t3.c2);
c1	c2	c1	c2
10	10	NULL	NULL
2	2	2	2
5	5	NULL	NULL
NULL	1	NULL	NULL
NULL	5	NULL	NULL
insert into t4_temp (select * from t1 left join t2 on t1.c1=t2.c1 where not exists (select 1 from t3 left join t4 on t3.c1=t4.c2 where t2.c2=t3.c2));
rollback;
insert into t4_temp (select /*+NO_REWRITE*/* from t1 left join t2 on t1.c1=t2.c1 where not exists (select 1 from t3 left join t4 on t3.c1=t4.c2 where t2.c2=t3.c2));
rollback;
update t1 set c2 = (select t1.c1 from t1 left join t2 on t1.c1=t2.c1 where not exists (select 1 from t3 left join t4 on t3.c1=t4.c2 where t2.c2=t3.c2) limit 1);
select stddev(c2) from t1;
stddev(c2)
0
rollback;
update t1 set c2 = (select /*+ NO_REWRITE */t1.c1 from t1 left join t2 on t1.c1=t2.c1 where not exists (select 1 from t3 left join t4 on t3.c1=t4.c2 where t2.c2=t3.c2) limit 1);
select stddev(c2) from t1;
stddev(c2)
0
rollback;
delete from t1 where c2 = (select t1.c1 from t1 left join t2 on t1.c1=t2.c1 where not exists (select 1 from t3 left join t4 on t3.c1=t4.c2 where t2.c2=t3.c2) limit 1);
select stddev(c2) from t1;
stddev(c2)
3.3226495451672298
rollback;
delete from t1 where c2 = (select /*+ NO_REWRITE */t1.c1 from t1 left join t2 on t1.c1=t2.c1 where not exists (select 1 from t3 left join t4 on t3.c1=t4.c2 where t2.c2=t3.c2) limit 1);
select stddev(c2) from t1;
stddev(c2)
3.3226495451672298
rollback;
select * from t1 left join t2 on t1.c1=t2.c1 where exists (select 1 from t3 left join t4 on t3.c1=t4.c1 where t2.c2=t4.c2) and not exists (select 1 from t5 left join t6 on t5.c1=t6.c1 where t1.c1=t5.c1);
c1	c2	c1	c2
select /*+NO_REWRITE*/* from t1 left join t2 on t1.c1=t2.c1 where exists (select 1 from t3 left join t4 on t3.c1=t4.c1 where t2.c2=t4.c2) and not exists (select 1 from t5 left join t6 on t5.c1=t6.c1 where t1.c1=t5.c1);
c1	c2	c1	c2
insert into t4_temp (select * from t1 left join t2 on t1.c1=t2.c1 where exists (select 1 from t3 left join t4 on t3.c1=t4.c1 where t2.c2=t4.c2) and not exists (select 1 from t5 left join t6 on t5.c1=t6.c1 where t1.c1=t5.c1));
rollback;
insert into t4_temp (select /*+NO_REWRITE*/* from t1 left join t2 on t1.c1=t2.c1 where exists (select 1 from t3 left join t4 on t3.c1=t4.c1 where t2.c2=t4.c2) and not exists (select 1 from t5 left join t6 on t5.c1=t6.c1 where t1.c1=t5.c1));
rollback;
update t1 set c2 = (select t1.c1 from t1 left join t2 on t1.c1=t2.c1 where exists (select 1 from t3 left join t4 on t3.c1=t4.c1 where t2.c2=t4.c2) and not exists (select 1 from t5 left join t6 on t5.c1=t6.c1 where t1.c1=t5.c1) limit 1);
select stddev(c2) from t1;
stddev(c2)
NULL
rollback;
update t1 set c2 = (select /*+ NO_REWRITE */t1.c1 from t1 left join t2 on t1.c1=t2.c1 where exists (select 1 from t3 left join t4 on t3.c1=t4.c1 where t2.c2=t4.c2) and not exists (select 1 from t5 left join t6 on t5.c1=t6.c1 where t1.c1=t5.c1) limit 1);
select stddev(c2) from t1;
stddev(c2)
NULL
rollback;
delete from t1 where c2 = (select t1.c1 from t1 left join t2 on t1.c1=t2.c1 where exists (select 1 from t3 left join t4 on t3.c1=t4.c1 where t2.c2=t4.c2) and not exists (select 1 from t5 left join t6 on t5.c1=t6.c1 where t1.c1=t5.c1) limit 1);
select stddev(c2) from t1;
stddev(c2)
2.8722813232690143
rollback;
delete from t1 where c2 = (select /*+ NO_REWRITE */t1.c1 from t1 left join t2 on t1.c1=t2.c1 where exists (select 1 from t3 left join t4 on t3.c1=t4.c1 where t2.c2=t4.c2) and not exists (select 1 from t5 left join t6 on t5.c1=t6.c1 where t1.c1=t5.c1) limit 1);
select stddev(c2) from t1;
stddev(c2)
2.8722813232690143
rollback;
select * from t1 left join t2 on t1.c1=t2.c1 where exists (select 1 from t3 left join t4 on t3.c1=t4.c1 where t1.c2=t3.c2) and not exists (select 1 from t5 left join t6 on t5.c1=t6.c1 where t1.c1=t5.c1);
c1	c2	c1	c2
5	5	NULL	NULL
NULL	1	NULL	NULL
NULL	5	NULL	NULL
select /*+NO_REWRITE*/* from t1 left join t2 on t1.c1=t2.c1 where exists (select 1 from t3 left join t4 on t3.c1=t4.c1 where t1.c2=t3.c2) and not exists (select 1 from t5 left join t6 on t5.c1=t6.c1 where t1.c1=t5.c1);
c1	c2	c1	c2
5	5	NULL	NULL
NULL	1	NULL	NULL
NULL	5	NULL	NULL
insert into t4_temp (select * from t1 left join t2 on t1.c1=t2.c1 where exists (select 1 from t3 left join t4 on t3.c1=t4.c1 where t1.c2=t3.c2) and not exists (select 1 from t5 left join t6 on t5.c1=t6.c1 where t1.c1=t5.c1));
rollback;
insert into t4_temp (select /*+NO_REWRITE*/* from t1 left join t2 on t1.c1=t2.c1 where exists (select 1 from t3 left join t4 on t3.c1=t4.c1 where t1.c2=t3.c2) and not exists (select 1 from t5 left join t6 on t5.c1=t6.c1 where t1.c1=t5.c1));
rollback;
update t1 set c2 = (select t1.c1 from t1 left join t2 on t1.c1=t2.c1 where exists (select 1 from t3 left join t4 on t3.c1=t4.c1 where t1.c2=t3.c2) and not exists (select 1 from t5 left join t6 on t5.c1=t6.c1 where t1.c1=t5.c1) limit 1);
select stddev(c2) from t1;
stddev(c2)
NULL
rollback;
update t1 set c2 = (select /*+ NO_REWRITE */t1.c1 from t1 left join t2 on t1.c1=t2.c1 where exists (select 1 from t3 left join t4 on t3.c1=t4.c1 where t1.c2=t3.c2) and not exists (select 1 from t5 left join t6 on t5.c1=t6.c1 where t1.c1=t5.c1) limit 1);
select stddev(c2) from t1;
stddev(c2)
NULL
rollback;
delete from t1 where c2 = (select t1.c1 from t1 left join t2 on t1.c1=t2.c1 where exists (select 1 from t3 left join t4 on t3.c1=t4.c1 where t1.c2=t3.c2) and not exists (select 1 from t5 left join t6 on t5.c1=t6.c1 where t1.c1=t5.c1) limit 1);
select stddev(c2) from t1;
stddev(c2)
2.8722813232690143
rollback;
delete from t1 where c2 = (select /*+ NO_REWRITE */t1.c1 from t1 left join t2 on t1.c1=t2.c1 where exists (select 1 from t3 left join t4 on t3.c1=t4.c1 where t1.c2=t3.c2) and not exists (select 1 from t5 left join t6 on t5.c1=t6.c1 where t1.c1=t5.c1) limit 1);
select stddev(c2) from t1;
stddev(c2)
2.8722813232690143
rollback;
select * from t1 left join t2 on t1.c1=t2.c1 where not exists (select 1 from t3 left join t4 on t3.c1=t4.c1 where t2.c2=t4.c2) and exists (select 1 from t5 left join t6 on t5.c1=t6.c1 where t2.c1=t5.c1);
c1	c2	c1	c2
2	2	2	2
select /*+NO_REWRITE*/* from t1 left join t2 on t1.c1=t2.c1 where not exists (select 1 from t3 left join t4 on t3.c1=t4.c1 where t2.c2=t4.c2) and exists (select 1 from t5 left join t6 on t5.c1=t6.c1 where t2.c1=t5.c1);
c1	c2	c1	c2
2	2	2	2
insert into t4_temp (select * from t1 left join t2 on t1.c1=t2.c1 where not exists (select 1 from t3 left join t4 on t3.c1=t4.c1 where t2.c2=t4.c2) and exists (select 1 from t5 left join t6 on t5.c1=t6.c1 where t2.c1=t5.c1));
rollback;
insert into t4_temp (select /*+NO_REWRITE*/* from t1 left join t2 on t1.c1=t2.c1 where not exists (select 1 from t3 left join t4 on t3.c1=t4.c1 where t2.c2=t4.c2) and exists (select 1 from t5 left join t6 on t5.c1=t6.c1 where t2.c1=t5.c1));
rollback;
update t1 set c2 = (select t1.c1 from t1 left join t2 on t1.c1=t2.c1 where not exists (select 1 from t3 left join t4 on t3.c1=t4.c1 where t2.c2=t4.c2) and exists (select 1 from t5 left join t6 on t5.c1=t6.c1 where t2.c1=t5.c1) limit 1);
select stddev(c2) from t1;
stddev(c2)
0
rollback;
update t1 set c2 = (select /*+ NO_REWRITE */t1.c1 from t1 left join t2 on t1.c1=t2.c1 where not exists (select 1 from t3 left join t4 on t3.c1=t4.c1 where t2.c2=t4.c2) and exists (select 1 from t5 left join t6 on t5.c1=t6.c1 where t2.c1=t5.c1) limit 1);
select stddev(c2) from t1;
stddev(c2)
0
rollback;
delete from t1 where c2 = (select t1.c1 from t1 left join t2 on t1.c1=t2.c1 where not exists (select 1 from t3 left join t4 on t3.c1=t4.c1 where t2.c2=t4.c2) and exists (select 1 from t5 left join t6 on t5.c1=t6.c1 where t2.c1=t5.c1) limit 1);
select stddev(c2) from t1;
stddev(c2)
3.3226495451672298
rollback;
delete from t1 where c2 = (select /*+ NO_REWRITE */t1.c1 from t1 left join t2 on t1.c1=t2.c1 where not exists (select 1 from t3 left join t4 on t3.c1=t4.c1 where t2.c2=t4.c2) and exists (select 1 from t5 left join t6 on t5.c1=t6.c1 where t2.c1=t5.c1) limit 1);
select stddev(c2) from t1;
stddev(c2)
3.3226495451672298
rollback;
select * from t1 left join t2 on t1.c1=t2.c1 where exists( select null from t3 left join t4 on t3.c1=t4.c1 where exists(select null from t5 left join t6 on t5.c1=t6.c1 where t1.c1=t6.c1));
c1	c2	c1	c2
1	1	1	1
1	1	1	1
2	2	2	2
3	2	3	3
4	2	4	4
select /*+NO_REWRITE*/* from t1 left join t2 on t1.c1=t2.c1 where exists( select null from t3 left join t4 on t3.c1=t4.c1 where exists(select null from t5 left join t6 on t5.c1=t6.c1 where t1.c1=t6.c1));
c1	c2	c1	c2
1	1	1	1
1	1	1	1
2	2	2	2
3	2	3	3
4	2	4	4
insert into t4_temp (select * from t1 left join t2 on t1.c1=t2.c1 where exists( select null from t3 left join t4 on t3.c1=t4.c1 where exists(select null from t5 left join t6 on t5.c1=t6.c1 where t1.c1=t6.c1)));
rollback;
insert into t4_temp (select /*+NO_REWRITE*/* from t1 left join t2 on t1.c1=t2.c1 where exists( select null from t3 left join t4 on t3.c1=t4.c1 where exists(select null from t5 left join t6 on t5.c1=t6.c1 where t1.c1=t6.c1)));
rollback;
update t1 set c2 = (select t1.c1 from t1 left join t2 on t1.c1=t2.c1 where exists( select null from t3 left join t4 on t3.c1=t4.c1 where exists(select null from t5 left join t6 on t5.c1=t6.c1 where t1.c1=t6.c1)) limit 1);
select stddev(c2) from t1;
stddev(c2)
0
rollback;
update t1 set c2 = (select /*+ NO_REWRITE */t1.c1 from t1 left join t2 on t1.c1=t2.c1 where exists( select null from t3 left join t4 on t3.c1=t4.c1 where exists(select null from t5 left join t6 on t5.c1=t6.c1 where t1.c1=t6.c1)) limit 1);
select stddev(c2) from t1;
stddev(c2)
0
rollback;
delete from t1 where c2 = (select t1.c1 from t1 left join t2 on t1.c1=t2.c1 where exists( select null from t3 left join t4 on t3.c1=t4.c1 where exists(select null from t5 left join t6 on t5.c1=t6.c1 where t1.c1=t6.c1)) limit 1);
select stddev(c2) from t1;
stddev(c2)
2.8674417556808756
rollback;
delete from t1 where c2 = (select /*+ NO_REWRITE */t1.c1 from t1 left join t2 on t1.c1=t2.c1 where exists( select null from t3 left join t4 on t3.c1=t4.c1 where exists(select null from t5 left join t6 on t5.c1=t6.c1 where t1.c1=t6.c1)) limit 1);
select stddev(c2) from t1;
stddev(c2)
2.8674417556808756
rollback;
select * from t1 left join t2 on t1.c1=t2.c1 where exists( select null from t3 left join t4 on t3.c1=t4.c1 where t1.c1=t4.c1 and exists(select null from t5 left join t6 on t5.c1=t6.c1 where t1.c1=t6.c1));
c1	c2	c1	c2
1	1	1	1
1	1	1	1
3	2	3	3
4	2	4	4
select /*+NO_REWRITE*/* from t1 left join t2 on t1.c1=t2.c1 where exists( select null from t3 left join t4 on t3.c1=t4.c1 where t1.c1=t4.c1 and exists(select null from t5 left join t6 on t5.c1=t6.c1 where t1.c1=t6.c1));
c1	c2	c1	c2
1	1	1	1
1	1	1	1
3	2	3	3
4	2	4	4
insert into t4_temp (select * from t1 left join t2 on t1.c1=t2.c1 where exists( select null from t3 left join t4 on t3.c1=t4.c1 where t1.c1=t4.c1 and exists(select null from t5 left join t6 on t5.c1=t6.c1 where t1.c1=t6.c1)));
rollback;
insert into t4_temp (select /*+NO_REWRITE*/* from t1 left join t2 on t1.c1=t2.c1 where exists( select null from t3 left join t4 on t3.c1=t4.c1 where t1.c1=t4.c1 and exists(select null from t5 left join t6 on t5.c1=t6.c1 where t1.c1=t6.c1)));
rollback;
update t1 set c2 = (select t1.c1 from t1 left join t2 on t1.c1=t2.c1 where exists( select null from t3 left join t4 on t3.c1=t4.c1 where t1.c1=t4.c1 and exists(select null from t5 left join t6 on t5.c1=t6.c1 where t1.c1=t6.c1)) limit 1);
select stddev(c2) from t1;
stddev(c2)
0
rollback;
update t1 set c2 = (select /*+ NO_REWRITE */t1.c1 from t1 left join t2 on t1.c1=t2.c1 where exists( select null from t3 left join t4 on t3.c1=t4.c1 where t1.c1=t4.c1 and exists(select null from t5 left join t6 on t5.c1=t6.c1 where t1.c1=t6.c1)) limit 1);
select stddev(c2) from t1;
stddev(c2)
0
rollback;
delete from t1 where c2 = (select t1.c1 from t1 left join t2 on t1.c1=t2.c1 where exists( select null from t3 left join t4 on t3.c1=t4.c1 where t1.c1=t4.c1 and exists(select null from t5 left join t6 on t5.c1=t6.c1 where t1.c1=t6.c1)) limit 1);
select stddev(c2) from t1;
stddev(c2)
2.8674417556808756
rollback;
delete from t1 where c2 = (select /*+ NO_REWRITE */t1.c1 from t1 left join t2 on t1.c1=t2.c1 where exists( select null from t3 left join t4 on t3.c1=t4.c1 where t1.c1=t4.c1 and exists(select null from t5 left join t6 on t5.c1=t6.c1 where t1.c1=t6.c1)) limit 1);
select stddev(c2) from t1;
stddev(c2)
2.8674417556808756
rollback;
select * from t1 left join t2 on t1.c1=t2.c1 where exists (select 1 from t3 where t2.c1+t3.c1<5);
c1	c2	c1	c2
1	1	1	1
1	1	1	1
2	2	2	2
3	2	3	3
select /*+NO_REWRITE*/* from t1 left join t2 on t1.c1=t2.c1 where exists (select 1 from t3 where t2.c1+t3.c1<5);
c1	c2	c1	c2
1	1	1	1
1	1	1	1
2	2	2	2
3	2	3	3
insert into t4_temp (select * from t1 left join t2 on t1.c1=t2.c1 where exists (select 1 from t3 where t2.c1+t3.c1<5));
rollback;
insert into t4_temp (select /*+NO_REWRITE*/* from t1 left join t2 on t1.c1=t2.c1 where exists (select 1 from t3 where t2.c1+t3.c1<5));
rollback;
update t1 set c2 = (select t1.c1 from t1 left join t2 on t1.c1=t2.c1 where exists (select 1 from t3 where t2.c1+t3.c1<5) limit 1);
select stddev(c2) from t1;
stddev(c2)
0
rollback;
update t1 set c2 = (select /*+ NO_REWRITE */t1.c1 from t1 left join t2 on t1.c1=t2.c1 where exists (select 1 from t3 where t2.c1+t3.c1<5) limit 1);
select stddev(c2) from t1;
stddev(c2)
0
rollback;
delete from t1 where c2 = (select t1.c1 from t1 left join t2 on t1.c1=t2.c1 where exists (select 1 from t3 where t2.c1+t3.c1<5) limit 1);
select stddev(c2) from t1;
stddev(c2)
2.8674417556808756
rollback;
delete from t1 where c2 = (select /*+ NO_REWRITE */t1.c1 from t1 left join t2 on t1.c1=t2.c1 where exists (select 1 from t3 where t2.c1+t3.c1<5) limit 1);
select stddev(c2) from t1;
stddev(c2)
2.8674417556808756
rollback;
select * from t1 left join t2 on t1.c1=t2.c1 where not exists (select 1 from t3 where t2.c1+t3.c1<5);
c1	c2	c1	c2
10	10	NULL	NULL
4	2	4	4
5	5	NULL	NULL
NULL	1	NULL	NULL
NULL	5	NULL	NULL
select /*+NO_REWRITE*/* from t1 left join t2 on t1.c1=t2.c1 where not exists (select 1 from t3 where t2.c1+t3.c1<5);
c1	c2	c1	c2
10	10	NULL	NULL
4	2	4	4
5	5	NULL	NULL
NULL	1	NULL	NULL
NULL	5	NULL	NULL
insert into t4_temp (select * from t1 left join t2 on t1.c1=t2.c1 where not exists (select 1 from t3 where t2.c1+t3.c1<5));
rollback;
insert into t4_temp (select /*+NO_REWRITE*/* from t1 left join t2 on t1.c1=t2.c1 where not exists (select 1 from t3 where t2.c1+t3.c1<5));
rollback;
update t1 set c2 = (select t1.c1 from t1 left join t2 on t1.c1=t2.c1 where not exists (select 1 from t3 where t2.c1+t3.c1<5) limit 1);
select stddev(c2) from t1;
stddev(c2)
0
rollback;
update t1 set c2 = (select /*+ NO_REWRITE */t1.c1 from t1 left join t2 on t1.c1=t2.c1 where not exists (select 1 from t3 where t2.c1+t3.c1<5) limit 1);
select stddev(c2) from t1;
stddev(c2)
0
rollback;
delete from t1 where c2 = (select t1.c1 from t1 left join t2 on t1.c1=t2.c1 where not exists (select 1 from t3 where t2.c1+t3.c1<5) limit 1);
select stddev(c2) from t1;
stddev(c2)
2.8722813232690143
rollback;
delete from t1 where c2 = (select /*+ NO_REWRITE */t1.c1 from t1 left join t2 on t1.c1=t2.c1 where not exists (select 1 from t3 where t2.c1+t3.c1<5) limit 1);
select stddev(c2) from t1;
stddev(c2)
2.8722813232690143
rollback;
select * from t1 left join t2 on t1.c1=t2.c1 where exists (select 1 from t3 where t2.c1+t3.c1 = 5);
c1	c2	c1	c2
1	1	1	1
1	1	1	1
2	2	2	2
4	2	4	4
select /*+NO_REWRITE*/* from t1 left join t2 on t1.c1=t2.c1 where exists (select 1 from t3 where t2.c1+t3.c1 = 5);
c1	c2	c1	c2
1	1	1	1
1	1	1	1
2	2	2	2
4	2	4	4
insert into t4_temp (select * from t1 left join t2 on t1.c1=t2.c1 where exists (select 1 from t3 where t2.c1+t3.c1 = 5));
rollback;
insert into t4_temp (select /*+NO_REWRITE*/* from t1 left join t2 on t1.c1=t2.c1 where exists (select 1 from t3 where t2.c1+t3.c1 = 5));
rollback;
update t1 set c2 = (select t1.c1 from t1 left join t2 on t1.c1=t2.c1 where exists (select 1 from t3 where t2.c1+t3.c1 = 5) limit 1);
select stddev(c2) from t1;
stddev(c2)
0
rollback;
update t1 set c2 = (select /*+ NO_REWRITE */t1.c1 from t1 left join t2 on t1.c1=t2.c1 where exists (select 1 from t3 where t2.c1+t3.c1 = 5) limit 1);
select stddev(c2) from t1;
stddev(c2)
0
rollback;
delete from t1 where c2 = (select t1.c1 from t1 left join t2 on t1.c1=t2.c1 where exists (select 1 from t3 where t2.c1+t3.c1 = 5) limit 1);
select stddev(c2) from t1;
stddev(c2)
2.8674417556808756
rollback;
delete from t1 where c2 = (select /*+ NO_REWRITE */t1.c1 from t1 left join t2 on t1.c1=t2.c1 where exists (select 1 from t3 where t2.c1+t3.c1 = 5) limit 1);
select stddev(c2) from t1;
stddev(c2)
2.8674417556808756
rollback;
select * from t1 left join t2 on t1.c1=t2.c1 where not exists (select 1 from t3 where t2.c1+t3.c1 = 5);
c1	c2	c1	c2
10	10	NULL	NULL
3	2	3	3
5	5	NULL	NULL
NULL	1	NULL	NULL
NULL	5	NULL	NULL
select /*+NO_REWRITE*/* from t1 left join t2 on t1.c1=t2.c1 where not exists (select 1 from t3 where t2.c1+t3.c1 = 5);
c1	c2	c1	c2
10	10	NULL	NULL
3	2	3	3
5	5	NULL	NULL
NULL	1	NULL	NULL
NULL	5	NULL	NULL
insert into t4_temp (select * from t1 left join t2 on t1.c1=t2.c1 where not exists (select 1 from t3 where t2.c1+t3.c1 = 5));
rollback;
insert into t4_temp (select /*+NO_REWRITE*/* from t1 left join t2 on t1.c1=t2.c1 where not exists (select 1 from t3 where t2.c1+t3.c1 = 5));
rollback;
update t1 set c2 = (select t1.c1 from t1 left join t2 on t1.c1=t2.c1 where not exists (select 1 from t3 where t2.c1+t3.c1 = 5) limit 1);
select stddev(c2) from t1;
stddev(c2)
0
rollback;
update t1 set c2 = (select /*+ NO_REWRITE */t1.c1 from t1 left join t2 on t1.c1=t2.c1 where not exists (select 1 from t3 where t2.c1+t3.c1 = 5) limit 1);
select stddev(c2) from t1;
stddev(c2)
0
rollback;
delete from t1 where c2 = (select t1.c1 from t1 left join t2 on t1.c1=t2.c1 where not exists (select 1 from t3 where t2.c1+t3.c1 = 5) limit 1);
select stddev(c2) from t1;
stddev(c2)
2.8722813232690143
rollback;
delete from t1 where c2 = (select /*+ NO_REWRITE */t1.c1 from t1 left join t2 on t1.c1=t2.c1 where not exists (select 1 from t3 where t2.c1+t3.c1 = 5) limit 1);
select stddev(c2) from t1;
stddev(c2)
2.8722813232690143
rollback;
select * from t1 where not exists (select null from t2 left join t3 on t2.c1=t3.c1 where t1.c1=t3.c1 and t2.c1=100);
c1	c2
1	1
10	10
2	2
3	2
4	2
5	5
NULL	1
NULL	5
select /*+NO_REWRITE*/* from t1 where not exists (select /*+NO_REWRITE*/null from t2 left join t3 on t2.c1=t3.c1 where t1.c1=t3.c1 and t2.c1=100);
c1	c2
1	1
10	10
2	2
3	2
4	2
5	5
NULL	1
NULL	5
insert into t11_temp (select * from t1 where not exists (select null from t2 left join t3 on t2.c1=t3.c1 where t1.c1=t3.c1 and t2.c1=100));
rollback;
insert into t11_temp (select /*+NO_REWRITE*/* from t1 where not exists (select /*+NO_REWRITE*/null from t2 left join t3 on t2.c1=t3.c1 where t1.c1=t3.c1 and t2.c1=100));
rollback;
update t1 set c2 = (select t1.c1 from t1 where not exists (select null from t2 left join t3 on t2.c1=t3.c1 where t1.c1=t3.c1 and t2.c1=100) limit 1);
select stddev(c2) from t1;
stddev(c2)
0
rollback;
update t1 set c2 = (select /*+ NO_REWRITE */t1.c1 from t1 where not exists (select /*+NO_REWRITE*/null from t2 left join t3 on t2.c1=t3.c1 where t1.c1=t3.c1 and t2.c1=100) limit 1);
select stddev(c2) from t1;
stddev(c2)
0
rollback;
delete from t1 where c2 = (select t1.c1 from t1 where not exists (select null from t2 left join t3 on t2.c1=t3.c1 where t1.c1=t3.c1 and t2.c1=100) limit 1);
select stddev(c2) from t1;
stddev(c2)
2.8674417556808756
rollback;
delete from t1 where c2 = (select /*+ NO_REWRITE */t1.c1 from t1 where not exists (select /*+NO_REWRITE*/null from t2 left join t3 on t2.c1=t3.c1 where t1.c1=t3.c1 and t2.c1=100) limit 1);
select stddev(c2) from t1;
stddev(c2)
2.8674417556808756
rollback;
select t1.c2, t2.c2, t3.c2 from t1 left join (t2 left join t3 on t2.c1 = t3.c1) on t1.c1 = 1 and t2.c1 = 1 and t3.c1 = 1;
c2	c2	c2
1	1	1
1	1	1
1	NULL	NULL
10	NULL	NULL
2	NULL	NULL
2	NULL	NULL
2	NULL	NULL
5	NULL	NULL
5	NULL	NULL
select /*+NO_REWRITE*/t1.c2, t2.c2, t3.c2 from t1 left join (t2 left join t3 on t2.c1 = t3.c1) on t1.c1 = 1 and t2.c1 = 1 and t3.c1 = 1;
c2	c2	c2
1	1	1
1	1	1
1	NULL	NULL
10	NULL	NULL
2	NULL	NULL
2	NULL	NULL
2	NULL	NULL
5	NULL	NULL
5	NULL	NULL
insert into t14_temp (select t1.c2, t2.c2, t3.c2 from t1 left join (t2 left join t3 on t2.c1 = t3.c1) on t1.c1 = 1 and t2.c1 = 1 and t3.c1 = 1);
rollback;
insert into t14_temp (select /*+NO_REWRITE*/t1.c2, t2.c2, t3.c2 from t1 left join (t2 left join t3 on t2.c1 = t3.c1) on t1.c1 = 1 and t2.c1 = 1 and t3.c1 = 1);
rollback;
update t1 set c2 = (select t1.c2 from t1 left join (t2 left join t3 on t2.c1 = t3.c1) on t1.c1 = 1 and t2.c1 = 1 and t3.c1 = 1 limit 1);
select stddev(c2) from t1;
stddev(c2)
0
rollback;
update t1 set c2 = (select /*+NO_REWRITE*/t1.c2 from t1 left join (t2 left join t3 on t2.c1 = t3.c1) on t1.c1 = 1 and t2.c1 = 1 and t3.c1 = 1 limit 1);
select stddev(c2) from t1;
stddev(c2)
0
rollback;
delete from t1 where c2 = (select t1.c2 from t1 left join (t2 left join t3 on t2.c1 = t3.c1) on t1.c1 = 1 and t2.c1 = 1 and t3.c1 = 1 limit 1);
select stddev(c2) from t1;
stddev(c2)
2.8674417556808756
rollback;
delete from t1 where c2 = (select /*+NO_REWRITE*/t1.c2 from t1 left join (t2 left join t3 on t2.c1 = t3.c1) on t1.c1 = 1 and t2.c1 = 1 and t3.c1 = 1 limit 1);
select stddev(c2) from t1;
stddev(c2)
2.8674417556808756
rollback;
select * from t1 left join t2 on t1.c1=t2.c1 left join t3 on t1.c1=t3.c1 and t2.c2=1;
c1	c2	c1	c2	c1	c2
1	1	1	1	1	1
1	1	1	1	1	1
10	10	NULL	NULL	NULL	NULL
2	2	2	2	NULL	NULL
3	2	3	3	NULL	NULL
4	2	4	4	NULL	NULL
5	5	NULL	NULL	NULL	NULL
NULL	1	NULL	NULL	NULL	NULL
NULL	5	NULL	NULL	NULL	NULL
select /*+NO_REWRITE*/* from t1 left join t2 on t1.c1=t2.c1 left join t3 on t1.c1=t3.c1 and t2.c2=1;
c1	c2	c1	c2	c1	c2
1	1	1	1	1	1
1	1	1	1	1	1
10	10	NULL	NULL	NULL	NULL
2	2	2	2	NULL	NULL
3	2	3	3	NULL	NULL
4	2	4	4	NULL	NULL
5	5	NULL	NULL	NULL	NULL
NULL	1	NULL	NULL	NULL	NULL
NULL	5	NULL	NULL	NULL	NULL
insert into t5_temp (select * from t1 left join t2 on t1.c1=t2.c1 left join t3 on t1.c1=t3.c1 and t2.c2=1);
rollback;
insert into t5_temp (select /*+NO_REWRITE*/* from t1 left join t2 on t1.c1=t2.c1 left join t3 on t1.c1=t3.c1 and t2.c2=1);
rollback;
update t1 set c2 = (select t1.c1 from t1 left join t2 on t1.c1=t2.c1 left join t3 on t1.c1=t3.c1 and t2.c2=1 limit 1);
select stddev(c2) from t1;
stddev(c2)
0
rollback;
update t1 set c2 = (select /*+ NO_REWRITE */t1.c1 from t1 left join t2 on t1.c1=t2.c1 left join t3 on t1.c1=t3.c1 and t2.c2=1 limit 1);
select stddev(c2) from t1;
stddev(c2)
0
rollback;
delete from t1 where c2 = (select t1.c1 from t1 left join t2 on t1.c1=t2.c1 left join t3 on t1.c1=t3.c1 and t2.c2=1 limit 1);
select stddev(c2) from t1;
stddev(c2)
2.8674417556808756
rollback;
delete from t1 where c2 = (select /*+ NO_REWRITE */t1.c1 from t1 left join t2 on t1.c1=t2.c1 left join t3 on t1.c1=t3.c1 and t2.c2=1 limit 1);
select stddev(c2) from t1;
stddev(c2)
2.8674417556808756
rollback;
select * from t1 left join (t2 left join t3 on t2.c1=t3.c1) on t1.c1=t3.c1 and t3.c2 = 1;
c1	c2	c1	c2	c1	c2
1	1	1	1	1	1
1	1	1	1	1	1
10	10	NULL	NULL	NULL	NULL
2	2	NULL	NULL	NULL	NULL
3	2	NULL	NULL	NULL	NULL
4	2	NULL	NULL	NULL	NULL
5	5	NULL	NULL	NULL	NULL
NULL	1	NULL	NULL	NULL	NULL
NULL	5	NULL	NULL	NULL	NULL
select /*+NO_REWRITE*/* from t1 left join (t2 left join t3 on t2.c1=t3.c1) on t1.c1=t3.c1 and t3.c2 = 1;
c1	c2	c1	c2	c1	c2
1	1	1	1	1	1
1	1	1	1	1	1
10	10	NULL	NULL	NULL	NULL
2	2	NULL	NULL	NULL	NULL
3	2	NULL	NULL	NULL	NULL
4	2	NULL	NULL	NULL	NULL
5	5	NULL	NULL	NULL	NULL
NULL	1	NULL	NULL	NULL	NULL
NULL	5	NULL	NULL	NULL	NULL
insert into t5_temp (select * from t1 left join (t2 left join t3 on t2.c1=t3.c1) on t1.c1=t3.c1 and t3.c2 = 1);
rollback;
insert into t5_temp (select /*+NO_REWRITE*/* from t1 left join (t2 left join t3 on t2.c1=t3.c1) on t1.c1=t3.c1 and t3.c2 = 1);
rollback;
update t1 set c2 = (select t1.c1 from t1 left join (t2 left join t3 on t2.c1=t3.c1) on t1.c1=t3.c1 and t3.c2 = 1 limit 1);
select stddev(c2) from t1;
stddev(c2)
0
rollback;
update t1 set c2 = (select /*+ NO_REWRITE */t1.c1 from t1 left join (t2 left join t3 on t2.c1=t3.c1) on t1.c1=t3.c1 and t3.c2 = 1 limit 1);
select stddev(c2) from t1;
stddev(c2)
0
rollback;
delete from t1 where c2 = (select t1.c1 from t1 left join (t2 left join t3 on t2.c1=t3.c1) on t1.c1=t3.c1 and t3.c2 = 1 limit 1);
select stddev(c2) from t1;
stddev(c2)
2.8674417556808756
rollback;
delete from t1 where c2 = (select /*+ NO_REWRITE */t1.c1 from t1 left join (t2 left join t3 on t2.c1=t3.c1) on t1.c1=t3.c1 and t3.c2 = 1 limit 1);
select stddev(c2) from t1;
stddev(c2)
2.8674417556808756
rollback;
select * from t1 right join (t2 left join t3 on t2.c1=t3.c1) on t2.c1=1 and t3.c1=1;
c1	c2	c1	c2	c1	c2
1	1	1	1	1	1
1	1	1	1	1	1
10	10	1	1	1	1
10	10	1	1	1	1
2	2	1	1	1	1
2	2	1	1	1	1
3	2	1	1	1	1
3	2	1	1	1	1
4	2	1	1	1	1
4	2	1	1	1	1
5	5	1	1	1	1
5	5	1	1	1	1
NULL	1	1	1	1	1
NULL	1	1	1	1	1
NULL	5	1	1	1	1
NULL	5	1	1	1	1
NULL	NULL	2	2	NULL	NULL
NULL	NULL	3	3	3	3
NULL	NULL	4	4	4	4
NULL	NULL	6	6	NULL	NULL
NULL	NULL	NULL	2	NULL	NULL
NULL	NULL	NULL	6	NULL	NULL
NULL	NULL	NULL	NULL	NULL	NULL
select /*+NO_REWRITE*/* from t1 right join (t2 left join t3 on t2.c1=t3.c1) on t2.c1=1 and t3.c1=1;
c1	c2	c1	c2	c1	c2
1	1	1	1	1	1
1	1	1	1	1	1
10	10	1	1	1	1
10	10	1	1	1	1
2	2	1	1	1	1
2	2	1	1	1	1
3	2	1	1	1	1
3	2	1	1	1	1
4	2	1	1	1	1
4	2	1	1	1	1
5	5	1	1	1	1
5	5	1	1	1	1
NULL	1	1	1	1	1
NULL	1	1	1	1	1
NULL	5	1	1	1	1
NULL	5	1	1	1	1
NULL	NULL	2	2	NULL	NULL
NULL	NULL	3	3	3	3
NULL	NULL	4	4	4	4
NULL	NULL	6	6	NULL	NULL
NULL	NULL	NULL	2	NULL	NULL
NULL	NULL	NULL	6	NULL	NULL
NULL	NULL	NULL	NULL	NULL	NULL
insert into t5_temp (select * from t1 right join (t2 left join t3 on t2.c1=t3.c1) on t2.c1=1 and t3.c1=1);
rollback;
insert into t5_temp (select /*+NO_REWRITE*/* from t1 right join (t2 left join t3 on t2.c1=t3.c1) on t2.c1=1 and t3.c1=1);
rollback;
update t1 set c2 = (select t1.c1 from t1 right join (t2 left join t3 on t2.c1=t3.c1) on t2.c1=1 and t3.c1=1 limit 1);
select stddev(c2) from t1;
stddev(c2)
0
rollback;
update t1 set c2 = (select /*+ NO_REWRITE */t1.c1 from t1 right join (t2 left join t3 on t2.c1=t3.c1) on t2.c1=1 and t3.c1=1 limit 1);
select stddev(c2) from t1;
stddev(c2)
0
rollback;
delete from t1 where c2 = (select t1.c1 from t1 right join (t2 left join t3 on t2.c1=t3.c1) on t2.c1=1 and t3.c1=1 limit 1);
select stddev(c2) from t1;
stddev(c2)
2.8674417556808756
rollback;
delete from t1 where c2 = (select /*+ NO_REWRITE */t1.c1 from t1 right join (t2 left join t3 on t2.c1=t3.c1) on t2.c1=1 and t3.c1=1 limit 1);
select stddev(c2) from t1;
stddev(c2)
2.8674417556808756
rollback;
select * from t1 right join (t2 left join t3 on t2.c1=t3.c1) on t2.c1=1 and t3.c1=1 where t1.c1>1;
c1	c2	c1	c2	c1	c2
10	10	1	1	1	1
10	10	1	1	1	1
2	2	1	1	1	1
2	2	1	1	1	1
3	2	1	1	1	1
3	2	1	1	1	1
4	2	1	1	1	1
4	2	1	1	1	1
5	5	1	1	1	1
5	5	1	1	1	1
select /*+NO_REWRITE*/* from t1 right join (t2 left join t3 on t2.c1=t3.c1) on t2.c1=1 and t3.c1=1 where t1.c1>1;
c1	c2	c1	c2	c1	c2
10	10	1	1	1	1
10	10	1	1	1	1
2	2	1	1	1	1
2	2	1	1	1	1
3	2	1	1	1	1
3	2	1	1	1	1
4	2	1	1	1	1
4	2	1	1	1	1
5	5	1	1	1	1
5	5	1	1	1	1
insert into t5_temp (select * from t1 right join (t2 left join t3 on t2.c1=t3.c1) on t2.c1=1 and t3.c1=1 where t1.c1>1);
rollback;
insert into t5_temp (select /*+NO_REWRITE*/* from t1 right join (t2 left join t3 on t2.c1=t3.c1) on t2.c1=1 and t3.c1=1 where t1.c1>1);
rollback;
update t1 set c2 = (select t1.c1 from t1 right join (t2 left join t3 on t2.c1=t3.c1) on t2.c1=1 and t3.c1=1 where t1.c1>1 limit 1);
select stddev(c2) from t1;
stddev(c2)
0
rollback;
update t1 set c2 = (select /*+ NO_REWRITE */t1.c1 from t1 right join (t2 left join t3 on t2.c1=t3.c1) on t2.c1=1 and t3.c1=1 where t1.c1>1 limit 1);
select stddev(c2) from t1;
stddev(c2)
0
rollback;
delete from t1 where c2 = (select t1.c1 from t1 right join (t2 left join t3 on t2.c1=t3.c1) on t2.c1=1 and t3.c1=1 where t1.c1>1 limit 1);
select stddev(c2) from t1;
stddev(c2)
3.1622776601683795
rollback;
delete from t1 where c2 = (select /*+ NO_REWRITE */t1.c1 from t1 right join (t2 left join t3 on t2.c1=t3.c1) on t2.c1=1 and t3.c1=1 where t1.c1>1 limit 1);
select stddev(c2) from t1;
stddev(c2)
3.1622776601683795
rollback;
select * from t1 left join t2 on t1.c1=t2.c1 left join t3 on t2.c1=t3.c1 and t2.c1>1;
c1	c2	c1	c2	c1	c2
1	1	1	1	NULL	NULL
1	1	1	1	NULL	NULL
10	10	NULL	NULL	NULL	NULL
2	2	2	2	NULL	NULL
3	2	3	3	3	3
4	2	4	4	4	4
5	5	NULL	NULL	NULL	NULL
NULL	1	NULL	NULL	NULL	NULL
NULL	5	NULL	NULL	NULL	NULL
select /*+NO_REWRITE*/* from t1 left join t2 on t1.c1=t2.c1 left join t3 on t2.c1=t3.c1 and t2.c1>1;
c1	c2	c1	c2	c1	c2
1	1	1	1	NULL	NULL
1	1	1	1	NULL	NULL
10	10	NULL	NULL	NULL	NULL
2	2	2	2	NULL	NULL
3	2	3	3	3	3
4	2	4	4	4	4
5	5	NULL	NULL	NULL	NULL
NULL	1	NULL	NULL	NULL	NULL
NULL	5	NULL	NULL	NULL	NULL
insert into t5_temp (select * from t1 left join t2 on t1.c1=t2.c1 left join t3 on t2.c1=t3.c1 and t2.c1>1);
rollback;
insert into t5_temp (select /*+NO_REWRITE*/* from t1 left join t2 on t1.c1=t2.c1 left join t3 on t2.c1=t3.c1 and t2.c1>1);
rollback;
update t1 set c2 = (select t1.c1 from t1 left join t2 on t1.c1=t2.c1 left join t3 on t2.c1=t3.c1 and t2.c1>1 limit 1);
select stddev(c2) from t1;
stddev(c2)
0
rollback;
update t1 set c2 = (select /*+ NO_REWRITE */t1.c1 from t1 left join t2 on t1.c1=t2.c1 left join t3 on t2.c1=t3.c1 and t2.c1>1 limit 1);
select stddev(c2) from t1;
stddev(c2)
0
rollback;
delete from t1 where c2 = (select t1.c1 from t1 left join t2 on t1.c1=t2.c1 left join t3 on t2.c1=t3.c1 and t2.c1>1 limit 1);
select stddev(c2) from t1;
stddev(c2)
2.8674417556808756
rollback;
delete from t1 where c2 = (select /*+ NO_REWRITE */t1.c1 from t1 left join t2 on t1.c1=t2.c1 left join t3 on t2.c1=t3.c1 and t2.c1>1 limit 1);
select stddev(c2) from t1;
stddev(c2)
2.8674417556808756
rollback;
select * from t1 left join t2 on t1.c1=1 left join t3 on t1.c1=t3.c1 inner join t4 on t4.c1=t2.c1;
c1	c2	c1	c2	c1	c2	c1	c2
1	1	1	1	1	1	1	1
1	1	1	1	1	1	1	1
1	1	2	2	1	1	2	2
1	1	3	3	1	1	3	3
1	1	4	4	1	1	4	4
select /*+NO_REWRITE*/* from t1 left join t2 on t1.c1=1 left join t3 on t1.c1=t3.c1 inner join t4 on t4.c1=t2.c1;
c1	c2	c1	c2	c1	c2	c1	c2
1	1	1	1	1	1	1	1
1	1	1	1	1	1	1	1
1	1	2	2	1	1	2	2
1	1	3	3	1	1	3	3
1	1	4	4	1	1	4	4
insert into t7_temp (select * from t1 left join t2 on t1.c1=1 left join t3 on t1.c1=t3.c1 inner join t4 on t4.c1=t2.c1);
rollback;
insert into t7_temp (select /*+NO_REWRITE*/* from t1 left join t2 on t1.c1=1 left join t3 on t1.c1=t3.c1 inner join t4 on t4.c1=t2.c1);
rollback;
update t1 set c2 = (select t1.c1 from t1 left join t2 on t1.c1=1 left join t3 on t1.c1=t3.c1 inner join t4 on t4.c1=t2.c1 limit 1);
select stddev(c2) from t1;
stddev(c2)
0
rollback;
update t1 set c2 = (select /*+ NO_REWRITE */t1.c1 from t1 left join t2 on t1.c1=1 left join t3 on t1.c1=t3.c1 inner join t4 on t4.c1=t2.c1 limit 1);
select stddev(c2) from t1;
stddev(c2)
0
rollback;
delete from t1 where c2 = (select t1.c1 from t1 left join t2 on t1.c1=1 left join t3 on t1.c1=t3.c1 inner join t4 on t4.c1=t2.c1 limit 1);
select stddev(c2) from t1;
stddev(c2)
2.8674417556808756
rollback;
delete from t1 where c2 = (select /*+ NO_REWRITE */t1.c1 from t1 left join t2 on t1.c1=1 left join t3 on t1.c1=t3.c1 inner join t4 on t4.c1=t2.c1 limit 1);
select stddev(c2) from t1;
stddev(c2)
2.8674417556808756
rollback;
select * from t1 left join t2 on t1.c1=1 left join t3 on t1.c1=t3.c1 left join t4 on t4.c1=t2.c1;
c1	c2	c1	c2	c1	c2	c1	c2
1	1	1	1	1	1	1	1
1	1	1	1	1	1	1	1
1	1	2	2	1	1	2	2
1	1	3	3	1	1	3	3
1	1	4	4	1	1	4	4
1	1	6	6	1	1	NULL	NULL
1	1	NULL	2	1	1	NULL	NULL
1	1	NULL	6	1	1	NULL	NULL
1	1	NULL	NULL	1	1	NULL	NULL
10	10	NULL	NULL	NULL	NULL	NULL	NULL
2	2	NULL	NULL	NULL	NULL	NULL	NULL
3	2	NULL	NULL	3	3	NULL	NULL
4	2	NULL	NULL	4	4	NULL	NULL
5	5	NULL	NULL	5	5	NULL	NULL
NULL	1	NULL	NULL	NULL	NULL	NULL	NULL
NULL	5	NULL	NULL	NULL	NULL	NULL	NULL
select /*+NO_REWRITE*/* from t1 left join t2 on t1.c1=1 left join t3 on t1.c1=t3.c1 left join t4 on t4.c1=t2.c1;
c1	c2	c1	c2	c1	c2	c1	c2
1	1	1	1	1	1	1	1
1	1	1	1	1	1	1	1
1	1	2	2	1	1	2	2
1	1	3	3	1	1	3	3
1	1	4	4	1	1	4	4
1	1	6	6	1	1	NULL	NULL
1	1	NULL	2	1	1	NULL	NULL
1	1	NULL	6	1	1	NULL	NULL
1	1	NULL	NULL	1	1	NULL	NULL
10	10	NULL	NULL	NULL	NULL	NULL	NULL
2	2	NULL	NULL	NULL	NULL	NULL	NULL
3	2	NULL	NULL	3	3	NULL	NULL
4	2	NULL	NULL	4	4	NULL	NULL
5	5	NULL	NULL	5	5	NULL	NULL
NULL	1	NULL	NULL	NULL	NULL	NULL	NULL
NULL	5	NULL	NULL	NULL	NULL	NULL	NULL
insert into t7_temp (select * from t1 left join t2 on t1.c1=1 left join t3 on t1.c1=t3.c1 left join t4 on t4.c1=t2.c1);
rollback;
insert into t7_temp (select /*+NO_REWRITE*/* from t1 left join t2 on t1.c1=1 left join t3 on t1.c1=t3.c1 left join t4 on t4.c1=t2.c1);
rollback;
update t1 set c2 = (select t1.c1 from t1 left join t2 on t1.c1=1 left join t3 on t1.c1=t3.c1 left join t4 on t4.c1=t2.c1 limit 1);
select stddev(c2) from t1;
stddev(c2)
0
rollback;
update t1 set c2 = (select /*+ NO_REWRITE */t1.c1 from t1 left join t2 on t1.c1=1 left join t3 on t1.c1=t3.c1 left join t4 on t4.c1=t2.c1 limit 1);
select stddev(c2) from t1;
stddev(c2)
0
rollback;
delete from t1 where c2 = (select t1.c1 from t1 left join t2 on t1.c1=1 left join t3 on t1.c1=t3.c1 left join t4 on t4.c1=t2.c1 limit 1);
select stddev(c2) from t1;
stddev(c2)
2.8674417556808756
rollback;
delete from t1 where c2 = (select /*+ NO_REWRITE */t1.c1 from t1 left join t2 on t1.c1=1 left join t3 on t1.c1=t3.c1 left join t4 on t4.c1=t2.c1 limit 1);
select stddev(c2) from t1;
stddev(c2)
2.8674417556808756
rollback;
select * from t1 left join (t2 left join (t3 left join t4 on t3.c1=t4.c1) on t2.c1=t3.c1) on t1.c1=t4.c1;
c1	c2	c1	c2	c1	c2	c1	c2
1	1	1	1	1	1	1	1
1	1	1	1	1	1	1	1
10	10	NULL	NULL	NULL	NULL	NULL	NULL
2	2	NULL	NULL	NULL	NULL	NULL	NULL
3	2	3	3	3	3	3	3
4	2	4	4	4	4	4	4
5	5	NULL	NULL	NULL	NULL	NULL	NULL
NULL	1	NULL	NULL	NULL	NULL	NULL	NULL
NULL	5	NULL	NULL	NULL	NULL	NULL	NULL
select /*+NO_REWRITE*/* from t1 left join (t2 left join (t3 left join t4 on t3.c1=t4.c1) on t2.c1=t3.c1) on t1.c1=t4.c1;
c1	c2	c1	c2	c1	c2	c1	c2
1	1	1	1	1	1	1	1
1	1	1	1	1	1	1	1
10	10	NULL	NULL	NULL	NULL	NULL	NULL
2	2	NULL	NULL	NULL	NULL	NULL	NULL
3	2	3	3	3	3	3	3
4	2	4	4	4	4	4	4
5	5	NULL	NULL	NULL	NULL	NULL	NULL
NULL	1	NULL	NULL	NULL	NULL	NULL	NULL
NULL	5	NULL	NULL	NULL	NULL	NULL	NULL
insert into t7_temp (select * from t1 left join (t2 left join (t3 left join t4 on t3.c1=t4.c1) on t2.c1=t3.c1) on t1.c1=t4.c1);
rollback;
insert into t7_temp (select /*+NO_REWRITE*/* from t1 left join (t2 left join (t3 left join t4 on t3.c1=t4.c1) on t2.c1=t3.c1) on t1.c1=t4.c1);
rollback;
update t1 set c2 = (select t1.c1 from t1 left join (t2 left join (t3 left join t4 on t3.c1=t4.c1) on t2.c1=t3.c1) on t1.c1=t4.c1 limit 1);
select stddev(c2) from t1;
stddev(c2)
0
rollback;
update t1 set c2 = (select /*+ NO_REWRITE */t1.c1 from t1 left join (t2 left join (t3 left join t4 on t3.c1=t4.c1) on t2.c1=t3.c1) on t1.c1=t4.c1 limit 1);
select stddev(c2) from t1;
stddev(c2)
0
rollback;
delete from t1 where c2 = (select t1.c1 from t1 left join (t2 left join (t3 left join t4 on t3.c1=t4.c1) on t2.c1=t3.c1) on t1.c1=t4.c1 limit 1);
select stddev(c2) from t1;
stddev(c2)
2.8674417556808756
rollback;
delete from t1 where c2 = (select /*+ NO_REWRITE */t1.c1 from t1 left join (t2 left join (t3 left join t4 on t3.c1=t4.c1) on t2.c1=t3.c1) on t1.c1=t4.c1 limit 1);
select stddev(c2) from t1;
stddev(c2)
2.8722813232690143
rollback;
select * from t1 left join (t2 left join (t3 left join t4 on t3.c1=t4.c1) on t2.c1=t3.c1) on t1.c1=t3.c1;
c1	c2	c1	c2	c1	c2	c1	c2
1	1	1	1	1	1	1	1
1	1	1	1	1	1	1	1
10	10	NULL	NULL	NULL	NULL	NULL	NULL
2	2	NULL	NULL	NULL	NULL	NULL	NULL
3	2	3	3	3	3	3	3
4	2	4	4	4	4	4	4
5	5	NULL	NULL	NULL	NULL	NULL	NULL
NULL	1	NULL	NULL	NULL	NULL	NULL	NULL
NULL	5	NULL	NULL	NULL	NULL	NULL	NULL
select /*+NO_REWRITE*/* from t1 left join (t2 left join (t3 left join t4 on t3.c1=t4.c1) on t2.c1=t3.c1) on t1.c1=t3.c1;
c1	c2	c1	c2	c1	c2	c1	c2
1	1	1	1	1	1	1	1
1	1	1	1	1	1	1	1
10	10	NULL	NULL	NULL	NULL	NULL	NULL
2	2	NULL	NULL	NULL	NULL	NULL	NULL
3	2	3	3	3	3	3	3
4	2	4	4	4	4	4	4
5	5	NULL	NULL	NULL	NULL	NULL	NULL
NULL	1	NULL	NULL	NULL	NULL	NULL	NULL
NULL	5	NULL	NULL	NULL	NULL	NULL	NULL
insert into t7_temp (select * from t1 left join (t2 left join (t3 left join t4 on t3.c1=t4.c1) on t2.c1=t3.c1) on t1.c1=t3.c1);
rollback;
insert into t7_temp (select /*+NO_REWRITE*/* from t1 left join (t2 left join (t3 left join t4 on t3.c1=t4.c1) on t2.c1=t3.c1) on t1.c1=t3.c1);
rollback;
update t1 set c2 = (select t1.c1 from t1 left join (t2 left join (t3 left join t4 on t3.c1=t4.c1) on t2.c1=t3.c1) on t1.c1=t3.c1 limit 1);
select stddev(c2) from t1;
stddev(c2)
0
rollback;
update t1 set c2 = (select /*+ NO_REWRITE */t1.c1 from t1 left join (t2 left join (t3 left join t4 on t3.c1=t4.c1) on t2.c1=t3.c1) on t1.c1=t3.c1 limit 1);
select stddev(c2) from t1;
stddev(c2)
0
rollback;
delete from t1 where c2 = (select t1.c1 from t1 left join (t2 left join (t3 left join t4 on t3.c1=t4.c1) on t2.c1=t3.c1) on t1.c1=t3.c1 limit 1);
select stddev(c2) from t1;
stddev(c2)
2.8674417556808756
rollback;
delete from t1 where c2 = (select /*+ NO_REWRITE */t1.c1 from t1 left join (t2 left join (t3 left join t4 on t3.c1=t4.c1) on t2.c1=t3.c1) on t1.c1=t3.c1 limit 1);
select stddev(c2) from t1;
stddev(c2)
2.8722813232690143
rollback;
select * from t1 left join t2 on t1.c1=1 left join t3 on t1.c1=t3.c1 left join t4 on t1.c1>1 and t3.c1>1 where t3.c1>0;
c1	c2	c1	c2	c1	c2	c1	c2
1	1	1	1	1	1	NULL	NULL
1	1	1	1	1	1	NULL	NULL
1	1	2	2	1	1	NULL	NULL
1	1	3	3	1	1	NULL	NULL
1	1	4	4	1	1	NULL	NULL
1	1	6	6	1	1	NULL	NULL
1	1	NULL	2	1	1	NULL	NULL
1	1	NULL	6	1	1	NULL	NULL
1	1	NULL	NULL	1	1	NULL	NULL
3	2	NULL	NULL	3	3	1	1
3	2	NULL	NULL	3	3	2	2
3	2	NULL	NULL	3	3	3	3
3	2	NULL	NULL	3	3	4	4
3	2	NULL	NULL	3	3	8	8
3	2	NULL	NULL	3	3	8	8
3	2	NULL	NULL	3	3	NULL	4
3	2	NULL	NULL	3	3	NULL	8
4	2	NULL	NULL	4	4	1	1
4	2	NULL	NULL	4	4	2	2
4	2	NULL	NULL	4	4	3	3
4	2	NULL	NULL	4	4	4	4
4	2	NULL	NULL	4	4	8	8
4	2	NULL	NULL	4	4	8	8
4	2	NULL	NULL	4	4	NULL	4
4	2	NULL	NULL	4	4	NULL	8
5	5	NULL	NULL	5	5	1	1
5	5	NULL	NULL	5	5	2	2
5	5	NULL	NULL	5	5	3	3
5	5	NULL	NULL	5	5	4	4
5	5	NULL	NULL	5	5	8	8
5	5	NULL	NULL	5	5	8	8
5	5	NULL	NULL	5	5	NULL	4
5	5	NULL	NULL	5	5	NULL	8
select /*+NO_REWRITE*/* from t1 left join t2 on t1.c1=1 left join t3 on t1.c1=t3.c1 left join t4 on t1.c1>1 and t3.c1>1 where t3.c1>0;
c1	c2	c1	c2	c1	c2	c1	c2
1	1	1	1	1	1	NULL	NULL
1	1	1	1	1	1	NULL	NULL
1	1	2	2	1	1	NULL	NULL
1	1	3	3	1	1	NULL	NULL
1	1	4	4	1	1	NULL	NULL
1	1	6	6	1	1	NULL	NULL
1	1	NULL	2	1	1	NULL	NULL
1	1	NULL	6	1	1	NULL	NULL
1	1	NULL	NULL	1	1	NULL	NULL
3	2	NULL	NULL	3	3	1	1
3	2	NULL	NULL	3	3	2	2
3	2	NULL	NULL	3	3	3	3
3	2	NULL	NULL	3	3	4	4
3	2	NULL	NULL	3	3	8	8
3	2	NULL	NULL	3	3	8	8
3	2	NULL	NULL	3	3	NULL	4
3	2	NULL	NULL	3	3	NULL	8
4	2	NULL	NULL	4	4	1	1
4	2	NULL	NULL	4	4	2	2
4	2	NULL	NULL	4	4	3	3
4	2	NULL	NULL	4	4	4	4
4	2	NULL	NULL	4	4	8	8
4	2	NULL	NULL	4	4	8	8
4	2	NULL	NULL	4	4	NULL	4
4	2	NULL	NULL	4	4	NULL	8
5	5	NULL	NULL	5	5	1	1
5	5	NULL	NULL	5	5	2	2
5	5	NULL	NULL	5	5	3	3
5	5	NULL	NULL	5	5	4	4
5	5	NULL	NULL	5	5	8	8
5	5	NULL	NULL	5	5	8	8
5	5	NULL	NULL	5	5	NULL	4
5	5	NULL	NULL	5	5	NULL	8
insert into t7_temp (select * from t1 left join t2 on t1.c1=1 left join t3 on t1.c1=t3.c1 left join t4 on t1.c1>1 and t3.c1>1 where t3.c1>0);
rollback;
insert into t7_temp (select /*+NO_REWRITE*/* from t1 left join t2 on t1.c1=1 left join t3 on t1.c1=t3.c1 left join t4 on t1.c1>1 and t3.c1>1 where t3.c1>0);
rollback;
update t1 set c2 = (select t1.c1 from t1 left join t2 on t1.c1=1 left join t3 on t1.c1=t3.c1 left join t4 on t1.c1>1 and t3.c1>1 where t3.c1>0 limit 1);
select stddev(c2) from t1;
stddev(c2)
0
rollback;
update t1 set c2 = (select /*+ NO_REWRITE */t1.c1 from t1 left join t2 on t1.c1=1 left join t3 on t1.c1=t3.c1 left join t4 on t1.c1>1 and t3.c1>1 where t3.c1>0 limit 1);
select stddev(c2) from t1;
stddev(c2)
0
rollback;
delete from t1 where c2 = (select t1.c1 from t1 left join t2 on t1.c1=1 left join t3 on t1.c1=t3.c1 left join t4 on t1.c1>1 and t3.c1>1 where t3.c1>0 limit 1);
select stddev(c2) from t1;
stddev(c2)
2.8674417556808756
rollback;
delete from t1 where c2 = (select /*+ NO_REWRITE */t1.c1 from t1 left join t2 on t1.c1=1 left join t3 on t1.c1=t3.c1 left join t4 on t1.c1>1 and t3.c1>1 where t3.c1>0 limit 1);
select stddev(c2) from t1;
stddev(c2)
2.8674417556808756
rollback;
select * from t1 left join (t2 left join (t3 left join t4 on t3.c1=t4.c1) on t2.c1=t3.c1) on t3.c1>1 where t3.c1>1;
c1	c2	c1	c2	c1	c2	c1	c2
1	1	3	3	3	3	3	3
1	1	4	4	4	4	4	4
10	10	3	3	3	3	3	3
10	10	4	4	4	4	4	4
2	2	3	3	3	3	3	3
2	2	4	4	4	4	4	4
3	2	3	3	3	3	3	3
3	2	4	4	4	4	4	4
4	2	3	3	3	3	3	3
4	2	4	4	4	4	4	4
5	5	3	3	3	3	3	3
5	5	4	4	4	4	4	4
NULL	1	3	3	3	3	3	3
NULL	1	4	4	4	4	4	4
NULL	5	3	3	3	3	3	3
NULL	5	4	4	4	4	4	4
select /*+NO_REWRITE*/* from t1 left join (t2 left join (t3 left join t4 on t3.c1=t4.c1) on t2.c1=t3.c1) on t3.c1>1 where t3.c1>1;
c1	c2	c1	c2	c1	c2	c1	c2
1	1	3	3	3	3	3	3
1	1	4	4	4	4	4	4
10	10	3	3	3	3	3	3
10	10	4	4	4	4	4	4
2	2	3	3	3	3	3	3
2	2	4	4	4	4	4	4
3	2	3	3	3	3	3	3
3	2	4	4	4	4	4	4
4	2	3	3	3	3	3	3
4	2	4	4	4	4	4	4
5	5	3	3	3	3	3	3
5	5	4	4	4	4	4	4
NULL	1	3	3	3	3	3	3
NULL	1	4	4	4	4	4	4
NULL	5	3	3	3	3	3	3
NULL	5	4	4	4	4	4	4
insert into t7_temp (select * from t1 left join (t2 left join (t3 left join t4 on t3.c1=t4.c1) on t2.c1=t3.c1) on t3.c1>1 where t3.c1>1);
rollback;
insert into t7_temp (select /*+NO_REWRITE*/* from t1 left join (t2 left join (t3 left join t4 on t3.c1=t4.c1) on t2.c1=t3.c1) on t3.c1>1 where t3.c1>1);
rollback;
update t1 set c2 = (select t1.c1 from t1 left join (t2 left join (t3 left join t4 on t3.c1=t4.c1) on t2.c1=t3.c1) on t3.c1>1 where t3.c1>1 limit 1);
select stddev(c2) from t1;
stddev(c2)
0
rollback;
update t1 set c2 = (select /*+ NO_REWRITE */t1.c1 from t1 left join (t2 left join (t3 left join t4 on t3.c1=t4.c1) on t2.c1=t3.c1) on t3.c1>1 where t3.c1>1 limit 1);
select stddev(c2) from t1;
stddev(c2)
0
rollback;
delete from t1 where c2 = (select t1.c1 from t1 left join (t2 left join (t3 left join t4 on t3.c1=t4.c1) on t2.c1=t3.c1) on t3.c1>1 where t3.c1>1 limit 1);
select stddev(c2) from t1;
stddev(c2)
2.8674417556808756
rollback;
delete from t1 where c2 = (select /*+ NO_REWRITE */t1.c1 from t1 left join (t2 left join (t3 left join t4 on t3.c1=t4.c1) on t2.c1=t3.c1) on t3.c1>1 where t3.c1>1 limit 1);
select stddev(c2) from t1;
stddev(c2)
2.8674417556808756
rollback;
select * from (t1 left join t2 on t1.c1=t2.c1) left join (t3 left join t4 on t3.c1=t4.c1) on t1.c1=t4.c1;
c1	c2	c1	c2	c1	c2	c1	c2
1	1	1	1	1	1	1	1
1	1	1	1	1	1	1	1
10	10	NULL	NULL	NULL	NULL	NULL	NULL
2	2	2	2	NULL	NULL	NULL	NULL
3	2	3	3	3	3	3	3
4	2	4	4	4	4	4	4
5	5	NULL	NULL	NULL	NULL	NULL	NULL
NULL	1	NULL	NULL	NULL	NULL	NULL	NULL
NULL	5	NULL	NULL	NULL	NULL	NULL	NULL
select /*+NO_REWRITE*/* from (t1 left join t2 on t1.c1=t2.c1) left join (t3 left join t4 on t3.c1=t4.c1) on t1.c1=t4.c1;
c1	c2	c1	c2	c1	c2	c1	c2
1	1	1	1	1	1	1	1
1	1	1	1	1	1	1	1
10	10	NULL	NULL	NULL	NULL	NULL	NULL
2	2	2	2	NULL	NULL	NULL	NULL
3	2	3	3	3	3	3	3
4	2	4	4	4	4	4	4
5	5	NULL	NULL	NULL	NULL	NULL	NULL
NULL	1	NULL	NULL	NULL	NULL	NULL	NULL
NULL	5	NULL	NULL	NULL	NULL	NULL	NULL
insert into t7_temp (select * from (t1 left join t2 on t1.c1=t2.c1) left join (t3 left join t4 on t3.c1=t4.c1) on t1.c1=t4.c1);
rollback;
insert into t7_temp (select /*+NO_REWRITE*/* from (t1 left join t2 on t1.c1=t2.c1) left join (t3 left join t4 on t3.c1=t4.c1) on t1.c1=t4.c1);
rollback;
update t1 set c2 = (select t1.c1 from (t1 left join t2 on t1.c1=t2.c1) left join (t3 left join t4 on t3.c1=t4.c1) on t1.c1=t4.c1 limit 1);
select stddev(c2) from t1;
stddev(c2)
0
rollback;
update t1 set c2 = (select /*+ NO_REWRITE */t1.c1 from (t1 left join t2 on t1.c1=t2.c1) left join (t3 left join t4 on t3.c1=t4.c1) on t1.c1=t4.c1 limit 1);
select stddev(c2) from t1;
stddev(c2)
0
rollback;
delete from t1 where c2 = (select t1.c1 from (t1 left join t2 on t1.c1=t2.c1) left join (t3 left join t4 on t3.c1=t4.c1) on t1.c1=t4.c1 limit 1);
select stddev(c2) from t1;
stddev(c2)
2.8674417556808756
rollback;
delete from t1 where c2 = (select /*+ NO_REWRITE */t1.c1 from (t1 left join t2 on t1.c1=t2.c1) left join (t3 left join t4 on t3.c1=t4.c1) on t1.c1=t4.c1 limit 1);
select stddev(c2) from t1;
stddev(c2)
2.8722813232690143
rollback;
select * from (t1 left join t2 on t1.c1=t2.c1) full join (t3 left join t4 on t3.c1=t4.c1) on t1.c1=t4.c1;
c1	c2	c1	c2	c1	c2	c1	c2
1	1	1	1	1	1	1	1
1	1	1	1	1	1	1	1
10	10	NULL	NULL	NULL	NULL	NULL	NULL
2	2	2	2	NULL	NULL	NULL	NULL
3	2	3	3	3	3	3	3
4	2	4	4	4	4	4	4
5	5	NULL	NULL	NULL	NULL	NULL	NULL
NULL	1	NULL	NULL	NULL	NULL	NULL	NULL
NULL	5	NULL	NULL	NULL	NULL	NULL	NULL
NULL	NULL	NULL	NULL	5	5	NULL	NULL
NULL	NULL	NULL	NULL	7	7	NULL	NULL
NULL	NULL	NULL	NULL	7	7	NULL	NULL
NULL	NULL	NULL	NULL	NULL	3	NULL	NULL
NULL	NULL	NULL	NULL	NULL	7	NULL	NULL
select /*+NO_REWRITE*/* from (t1 left join t2 on t1.c1=t2.c1) full join (t3 left join t4 on t3.c1=t4.c1) on t1.c1=t4.c1;
c1	c2	c1	c2	c1	c2	c1	c2
1	1	1	1	1	1	1	1
1	1	1	1	1	1	1	1
10	10	NULL	NULL	NULL	NULL	NULL	NULL
2	2	2	2	NULL	NULL	NULL	NULL
3	2	3	3	3	3	3	3
4	2	4	4	4	4	4	4
5	5	NULL	NULL	NULL	NULL	NULL	NULL
NULL	1	NULL	NULL	NULL	NULL	NULL	NULL
NULL	5	NULL	NULL	NULL	NULL	NULL	NULL
NULL	NULL	NULL	NULL	5	5	NULL	NULL
NULL	NULL	NULL	NULL	7	7	NULL	NULL
NULL	NULL	NULL	NULL	7	7	NULL	NULL
NULL	NULL	NULL	NULL	NULL	3	NULL	NULL
NULL	NULL	NULL	NULL	NULL	7	NULL	NULL
insert into t7_temp (select * from (t1 left join t2 on t1.c1=t2.c1) full join (t3 left join t4 on t3.c1=t4.c1) on t1.c1=t4.c1);
rollback;
insert into t7_temp (select /*+NO_REWRITE*/* from (t1 left join t2 on t1.c1=t2.c1) full join (t3 left join t4 on t3.c1=t4.c1) on t1.c1=t4.c1);
rollback;
update t1 set c2 = (select t1.c1 from (t1 left join t2 on t1.c1=t2.c1) full join (t3 left join t4 on t3.c1=t4.c1) on t1.c1=t4.c1 limit 1);
select stddev(c2) from t1;
stddev(c2)
0
rollback;
update t1 set c2 = (select /*+ NO_REWRITE */t1.c1 from (t1 left join t2 on t1.c1=t2.c1) full join (t3 left join t4 on t3.c1=t4.c1) on t1.c1=t4.c1 limit 1);
select stddev(c2) from t1;
stddev(c2)
0
rollback;
delete from t1 where c2 = (select t1.c1 from (t1 left join t2 on t1.c1=t2.c1) full join (t3 left join t4 on t3.c1=t4.c1) on t1.c1=t4.c1 limit 1);
select stddev(c2) from t1;
stddev(c2)
2.8722813232690143
rollback;
delete from t1 where c2 = (select /*+ NO_REWRITE */t1.c1 from (t1 left join t2 on t1.c1=t2.c1) full join (t3 left join t4 on t3.c1=t4.c1) on t1.c1=t4.c1 limit 1);
select stddev(c2) from t1;
stddev(c2)
2.8722813232690143
rollback;
select * from (t1 left join t2 on t1.c1=t2.c1) inner join (t3 left join t4 on t3.c1=t4.c1) on t2.c1=t4.c1;
c1	c2	c1	c2	c1	c2	c1	c2
1	1	1	1	1	1	1	1
1	1	1	1	1	1	1	1
3	2	3	3	3	3	3	3
4	2	4	4	4	4	4	4
select /*+NO_REWRITE*/* from (t1 left join t2 on t1.c1=t2.c1) inner join (t3 left join t4 on t3.c1=t4.c1) on t2.c1=t4.c1;
c1	c2	c1	c2	c1	c2	c1	c2
1	1	1	1	1	1	1	1
1	1	1	1	1	1	1	1
3	2	3	3	3	3	3	3
4	2	4	4	4	4	4	4
insert into t7_temp (select * from (t1 left join t2 on t1.c1=t2.c1) inner join (t3 left join t4 on t3.c1=t4.c1) on t2.c1=t4.c1);
rollback;
insert into t7_temp (select /*+NO_REWRITE*/* from (t1 left join t2 on t1.c1=t2.c1) inner join (t3 left join t4 on t3.c1=t4.c1) on t2.c1=t4.c1);
rollback;
update t1 set c2 = (select t1.c1 from (t1 left join t2 on t1.c1=t2.c1) inner join (t3 left join t4 on t3.c1=t4.c1) on t2.c1=t4.c1 limit 1);
select stddev(c2) from t1;
stddev(c2)
0
rollback;
update t1 set c2 = (select /*+ NO_REWRITE */t1.c1 from (t1 left join t2 on t1.c1=t2.c1) inner join (t3 left join t4 on t3.c1=t4.c1) on t2.c1=t4.c1 limit 1);
select stddev(c2) from t1;
stddev(c2)
0
rollback;
delete from t1 where c2 = (select t1.c1 from (t1 left join t2 on t1.c1=t2.c1) inner join (t3 left join t4 on t3.c1=t4.c1) on t2.c1=t4.c1 limit 1);
select stddev(c2) from t1;
stddev(c2)
2.8674417556808756
rollback;
delete from t1 where c2 = (select /*+ NO_REWRITE */t1.c1 from (t1 left join t2 on t1.c1=t2.c1) inner join (t3 left join t4 on t3.c1=t4.c1) on t2.c1=t4.c1 limit 1);
select stddev(c2) from t1;
stddev(c2)
2.8722813232690143
rollback;
select * from (t1 left join t2 on t1.c1=t2.c1 left join t3 on t1.c1=t3.c1) left join (t4 left join t5 on t4.c1=t5.c1) on t1.c1>1 and t2.c1>1 and t3.c1>1;
c1	c2	c1	c2	c1	c2	c1	c2	c1	c2
1	1	1	1	1	1	NULL	NULL	NULL	NULL
1	1	1	1	1	1	NULL	NULL	NULL	NULL
10	10	NULL	NULL	NULL	NULL	NULL	NULL	NULL	NULL
2	2	2	2	NULL	NULL	NULL	NULL	NULL	NULL
3	2	3	3	3	3	1	1	1	1
3	2	3	3	3	3	2	2	2	2
3	2	3	3	3	3	3	3	3	3
3	2	3	3	3	3	4	4	4	4
3	2	3	3	3	3	8	8	NULL	NULL
3	2	3	3	3	3	8	8	NULL	NULL
3	2	3	3	3	3	NULL	4	NULL	NULL
3	2	3	3	3	3	NULL	8	NULL	NULL
4	2	4	4	4	4	1	1	1	1
4	2	4	4	4	4	2	2	2	2
4	2	4	4	4	4	3	3	3	3
4	2	4	4	4	4	4	4	4	4
4	2	4	4	4	4	8	8	NULL	NULL
4	2	4	4	4	4	8	8	NULL	NULL
4	2	4	4	4	4	NULL	4	NULL	NULL
4	2	4	4	4	4	NULL	8	NULL	NULL
5	5	NULL	NULL	5	5	NULL	NULL	NULL	NULL
NULL	1	NULL	NULL	NULL	NULL	NULL	NULL	NULL	NULL
NULL	5	NULL	NULL	NULL	NULL	NULL	NULL	NULL	NULL
select /*+NO_REWRITE*/* from (t1 left join t2 on t1.c1=t2.c1 left join t3 on t1.c1=t3.c1) left join (t4 left join t5 on t4.c1=t5.c1) on t1.c1>1 and t2.c1>1 and t3.c1>1;
c1	c2	c1	c2	c1	c2	c1	c2	c1	c2
1	1	1	1	1	1	NULL	NULL	NULL	NULL
1	1	1	1	1	1	NULL	NULL	NULL	NULL
10	10	NULL	NULL	NULL	NULL	NULL	NULL	NULL	NULL
2	2	2	2	NULL	NULL	NULL	NULL	NULL	NULL
3	2	3	3	3	3	1	1	1	1
3	2	3	3	3	3	2	2	2	2
3	2	3	3	3	3	3	3	3	3
3	2	3	3	3	3	4	4	4	4
3	2	3	3	3	3	8	8	NULL	NULL
3	2	3	3	3	3	8	8	NULL	NULL
3	2	3	3	3	3	NULL	4	NULL	NULL
3	2	3	3	3	3	NULL	8	NULL	NULL
4	2	4	4	4	4	1	1	1	1
4	2	4	4	4	4	2	2	2	2
4	2	4	4	4	4	3	3	3	3
4	2	4	4	4	4	4	4	4	4
4	2	4	4	4	4	8	8	NULL	NULL
4	2	4	4	4	4	8	8	NULL	NULL
4	2	4	4	4	4	NULL	4	NULL	NULL
4	2	4	4	4	4	NULL	8	NULL	NULL
5	5	NULL	NULL	5	5	NULL	NULL	NULL	NULL
NULL	1	NULL	NULL	NULL	NULL	NULL	NULL	NULL	NULL
NULL	5	NULL	NULL	NULL	NULL	NULL	NULL	NULL	NULL
insert into t15_temp (select * from (t1 left join t2 on t1.c1=t2.c1 left join t3 on t1.c1=t3.c1) left join (t4 left join t5 on t4.c1=t5.c1) on t1.c1>1 and t2.c1>1 and t3.c1>1);
rollback;
insert into t15_temp (select /*+NO_REWRITE*/* from (t1 left join t2 on t1.c1=t2.c1 left join t3 on t1.c1=t3.c1) left join (t4 left join t5 on t4.c1=t5.c1) on t1.c1>1 and t2.c1>1 and t3.c1>1);
rollback;
update t1 set c2 = (select t1.c1 from (t1 left join t2 on t1.c1=t2.c1 left join t3 on t1.c1=t3.c1) left join (t4 left join t5 on t4.c1=t5.c1) on t1.c1>1 and t2.c1>1 and t3.c1>1 limit 1);
select stddev(c2) from t1;
stddev(c2)
0
rollback;
update t1 set c2 = (select /*+ NO_REWRITE */t1.c1 from (t1 left join t2 on t1.c1=t2.c1 left join t3 on t1.c1=t3.c1) left join (t4 left join t5 on t4.c1=t5.c1) on t1.c1>1 and t2.c1>1 and t3.c1>1 limit 1);
select stddev(c2) from t1;
stddev(c2)
0
rollback;
delete from t1 where c2 = (select t1.c1 from (t1 left join t2 on t1.c1=t2.c1 left join t3 on t1.c1=t3.c1) left join (t4 left join t5 on t4.c1=t5.c1) on t1.c1>1 and t2.c1>1 and t3.c1>1 limit 1);
select stddev(c2) from t1;
stddev(c2)
2.8674417556808756
rollback;
delete from t1 where c2 = (select /*+ NO_REWRITE */t1.c1 from (t1 left join t2 on t1.c1=t2.c1 left join t3 on t1.c1=t3.c1) left join (t4 left join t5 on t4.c1=t5.c1) on t1.c1>1 and t2.c1>1 and t3.c1>1 limit 1);
select stddev(c2) from t1;
stddev(c2)
2.8674417556808756
rollback;
select * from (t1 left join t2 on t1.c1=t2.c1 left join t3 on t1.c1=t3.c1) right join (t4 left join t5 on t4.c1=t5.c1) on t1.c1>1 and t2.c1>1 and t3.c1>1;
c1	c2	c1	c2	c1	c2	c1	c2	c1	c2
3	2	3	3	3	3	1	1	1	1
3	2	3	3	3	3	2	2	2	2
3	2	3	3	3	3	3	3	3	3
3	2	3	3	3	3	4	4	4	4
3	2	3	3	3	3	8	8	NULL	NULL
3	2	3	3	3	3	8	8	NULL	NULL
3	2	3	3	3	3	NULL	4	NULL	NULL
3	2	3	3	3	3	NULL	8	NULL	NULL
4	2	4	4	4	4	1	1	1	1
4	2	4	4	4	4	2	2	2	2
4	2	4	4	4	4	3	3	3	3
4	2	4	4	4	4	4	4	4	4
4	2	4	4	4	4	8	8	NULL	NULL
4	2	4	4	4	4	8	8	NULL	NULL
4	2	4	4	4	4	NULL	4	NULL	NULL
4	2	4	4	4	4	NULL	8	NULL	NULL
select /*+NO_REWRITE*/* from (t1 left join t2 on t1.c1=t2.c1 left join t3 on t1.c1=t3.c1) right join (t4 left join t5 on t4.c1=t5.c1) on t1.c1>1 and t2.c1>1 and t3.c1>1;
c1	c2	c1	c2	c1	c2	c1	c2	c1	c2
3	2	3	3	3	3	1	1	1	1
3	2	3	3	3	3	2	2	2	2
3	2	3	3	3	3	3	3	3	3
3	2	3	3	3	3	4	4	4	4
3	2	3	3	3	3	8	8	NULL	NULL
3	2	3	3	3	3	8	8	NULL	NULL
3	2	3	3	3	3	NULL	4	NULL	NULL
3	2	3	3	3	3	NULL	8	NULL	NULL
4	2	4	4	4	4	1	1	1	1
4	2	4	4	4	4	2	2	2	2
4	2	4	4	4	4	3	3	3	3
4	2	4	4	4	4	4	4	4	4
4	2	4	4	4	4	8	8	NULL	NULL
4	2	4	4	4	4	8	8	NULL	NULL
4	2	4	4	4	4	NULL	4	NULL	NULL
4	2	4	4	4	4	NULL	8	NULL	NULL
insert into t15_temp (select * from (t1 left join t2 on t1.c1=t2.c1 left join t3 on t1.c1=t3.c1) right join (t4 left join t5 on t4.c1=t5.c1) on t1.c1>1 and t2.c1>1 and t3.c1>1);
rollback;
insert into t15_temp (select /*+NO_REWRITE*/* from (t1 left join t2 on t1.c1=t2.c1 left join t3 on t1.c1=t3.c1) right join (t4 left join t5 on t4.c1=t5.c1) on t1.c1>1 and t2.c1>1 and t3.c1>1);
rollback;
update t1 set c2 = (select t1.c1 from (t1 left join t2 on t1.c1=t2.c1 left join t3 on t1.c1=t3.c1) right join (t4 left join t5 on t4.c1=t5.c1) on t1.c1>1 and t2.c1>1 and t3.c1>1 limit 1);
select stddev(c2) from t1;
stddev(c2)
0
rollback;
update t1 set c2 = (select /*+ NO_REWRITE */t1.c1 from (t1 left join t2 on t1.c1=t2.c1 left join t3 on t1.c1=t3.c1) right join (t4 left join t5 on t4.c1=t5.c1) on t1.c1>1 and t2.c1>1 and t3.c1>1 limit 1);
select stddev(c2) from t1;
stddev(c2)
0
rollback;
delete from t1 where c2 = (select t1.c1 from (t1 left join t2 on t1.c1=t2.c1 left join t3 on t1.c1=t3.c1) right join (t4 left join t5 on t4.c1=t5.c1) on t1.c1>1 and t2.c1>1 and t3.c1>1 limit 1);
select stddev(c2) from t1;
stddev(c2)
2.8722813232690143
rollback;
delete from t1 where c2 = (select /*+ NO_REWRITE */t1.c1 from (t1 left join t2 on t1.c1=t2.c1 left join t3 on t1.c1=t3.c1) right join (t4 left join t5 on t4.c1=t5.c1) on t1.c1>1 and t2.c1>1 and t3.c1>1 limit 1);
select stddev(c2) from t1;
stddev(c2)
2.8722813232690143
rollback;
select * from t1 left join t2 on t1.c1=t2.c1 right join t5 on t2.c1=t5.c1 where exists (select null from t3 left join t4 on t3.c1=t4.c1 where t3.c1>1);
c1	c2	c1	c2	c1	c2
1	1	1	1	1	1
1	1	1	1	1	1
2	2	2	2	2	2
3	2	3	3	3	3
4	2	4	4	4	4
NULL	NULL	NULL	NULL	NULL	NULL
select /*+NO_REWRITE*/* from t1 left join t2 on t1.c1=t2.c1 right join t5 on t2.c1=t5.c1 where exists (select null from t3 left join t4 on t3.c1=t4.c1 where t3.c1>1);
c1	c2	c1	c2	c1	c2
1	1	1	1	1	1
1	1	1	1	1	1
2	2	2	2	2	2
3	2	3	3	3	3
4	2	4	4	4	4
NULL	NULL	NULL	NULL	NULL	NULL
insert into t5_temp (select * from t1 left join t2 on t1.c1=t2.c1 right join t5 on t2.c1=t5.c1 where exists (select null from t3 left join t4 on t3.c1=t4.c1 where t3.c1>1));
rollback;
insert into t5_temp (select /*+NO_REWRITE*/* from t1 left join t2 on t1.c1=t2.c1 right join t5 on t2.c1=t5.c1 where exists (select null from t3 left join t4 on t3.c1=t4.c1 where t3.c1>1));
rollback;
update t1 set c2 = (select t1.c1 from t1 left join t2 on t1.c1=t2.c1 right join t5 on t2.c1=t5.c1 where exists (select null from t3 left join t4 on t3.c1=t4.c1 where t3.c1>1) limit 1);
select stddev(c2) from t1;
stddev(c2)
0
rollback;
update t1 set c2 = (select /*+ NO_REWRITE */t1.c1 from t1 left join t2 on t1.c1=t2.c1 right join t5 on t2.c1=t5.c1 where exists (select null from t3 left join t4 on t3.c1=t4.c1 where t3.c1>1) limit 1);
select stddev(c2) from t1;
stddev(c2)
0
rollback;
delete from t1 where c2 = (select t1.c1 from t1 left join t2 on t1.c1=t2.c1 right join t5 on t2.c1=t5.c1 where exists (select null from t3 left join t4 on t3.c1=t4.c1 where t3.c1>1) limit 1);
select stddev(c2) from t1;
stddev(c2)
2.8674417556808756
rollback;
delete from t1 where c2 = (select /*+ NO_REWRITE */t1.c1 from t1 left join t2 on t1.c1=t2.c1 right join t5 on t2.c1=t5.c1 where exists (select null from t3 left join t4 on t3.c1=t4.c1 where t3.c1>1) limit 1);
select stddev(c2) from t1;
stddev(c2)
2.8674417556808756
rollback;
select * from t1 left join t2 on t1.c1=t2.c1 left join t5 on t2.c1=t5.c1 where exists (select null from t3 left join t4 on t3.c1=t4.c1 where t3.c1>1);
c1	c2	c1	c2	c1	c2
1	1	1	1	1	1
1	1	1	1	1	1
10	10	NULL	NULL	NULL	NULL
2	2	2	2	2	2
3	2	3	3	3	3
4	2	4	4	4	4
5	5	NULL	NULL	NULL	NULL
NULL	1	NULL	NULL	NULL	NULL
NULL	5	NULL	NULL	NULL	NULL
select /*+NO_REWRITE*/* from t1 left join t2 on t1.c1=t2.c1 left join t5 on t2.c1=t5.c1 where exists (select null from t3 left join t4 on t3.c1=t4.c1 where t3.c1>1);
c1	c2	c1	c2	c1	c2
1	1	1	1	1	1
1	1	1	1	1	1
10	10	NULL	NULL	NULL	NULL
2	2	2	2	2	2
3	2	3	3	3	3
4	2	4	4	4	4
5	5	NULL	NULL	NULL	NULL
NULL	1	NULL	NULL	NULL	NULL
NULL	5	NULL	NULL	NULL	NULL
insert into t5_temp (select * from t1 left join t2 on t1.c1=t2.c1 left join t5 on t2.c1=t5.c1 where exists (select null from t3 left join t4 on t3.c1=t4.c1 where t3.c1>1));
rollback;
insert into t5_temp (select /*+NO_REWRITE*/* from t1 left join t2 on t1.c1=t2.c1 left join t5 on t2.c1=t5.c1 where exists (select null from t3 left join t4 on t3.c1=t4.c1 where t3.c1>1));
rollback;
update t1 set c2 = (select t1.c1 from t1 left join t2 on t1.c1=t2.c1 left join t5 on t2.c1=t5.c1 where exists (select null from t3 left join t4 on t3.c1=t4.c1 where t3.c1>1) limit 1);
select stddev(c2) from t1;
stddev(c2)
0
rollback;
update t1 set c2 = (select /*+ NO_REWRITE */t1.c1 from t1 left join t2 on t1.c1=t2.c1 left join t5 on t2.c1=t5.c1 where exists (select null from t3 left join t4 on t3.c1=t4.c1 where t3.c1>1) limit 1);
select stddev(c2) from t1;
stddev(c2)
0
rollback;
delete from t1 where c2 = (select t1.c1 from t1 left join t2 on t1.c1=t2.c1 left join t5 on t2.c1=t5.c1 where exists (select null from t3 left join t4 on t3.c1=t4.c1 where t3.c1>1) limit 1);
select stddev(c2) from t1;
stddev(c2)
2.8674417556808756
rollback;
delete from t1 where c2 = (select /*+ NO_REWRITE */t1.c1 from t1 left join t2 on t1.c1=t2.c1 left join t5 on t2.c1=t5.c1 where exists (select null from t3 left join t4 on t3.c1=t4.c1 where t3.c1>1) limit 1);
select stddev(c2) from t1;
stddev(c2)
2.8674417556808756
rollback;
select * from t1 left join t2 on t1.c1=t2.c1 where exists (select null from t3 left join t4 on t3.c1=t4.c1 left join t5 on t3.c1=t5.c1 where t1.c1=t5.c1);
c1	c2	c1	c2
1	1	1	1
1	1	1	1
3	2	3	3
4	2	4	4
select /*+NO_REWIRTE*/* from t1 left join t2 on t1.c1=t2.c1 where exists (select null from t3 left join t4 on t3.c1=t4.c1 left join t5 on t3.c1=t5.c1 where t1.c1=t5.c1);
c1	c2	c1	c2
1	1	1	1
1	1	1	1
3	2	3	3
4	2	4	4
insert into t4_temp (select * from t1 left join t2 on t1.c1=t2.c1 where exists (select null from t3 left join t4 on t3.c1=t4.c1 left join t5 on t3.c1=t5.c1 where t1.c1=t5.c1));
rollback;
insert into t4_temp (select /*+NO_REWIRTE*/* from t1 left join t2 on t1.c1=t2.c1 where exists (select null from t3 left join t4 on t3.c1=t4.c1 left join t5 on t3.c1=t5.c1 where t1.c1=t5.c1));
rollback;
update t1 set c2 = (select t1.c1 from t1 left join t2 on t1.c1=t2.c1 where exists (select null from t3 left join t4 on t3.c1=t4.c1 left join t5 on t3.c1=t5.c1 where t1.c1=t5.c1) limit 1);
select stddev(c2) from t1;
stddev(c2)
0
rollback;
update t1 set c2 = (select /*+NO_REWIRTE*/t1.c1 from t1 left join t2 on t1.c1=t2.c1 where exists (select null from t3 left join t4 on t3.c1=t4.c1 left join t5 on t3.c1=t5.c1 where t1.c1=t5.c1) limit 1);
select stddev(c2) from t1;
stddev(c2)
0
rollback;
delete from t1 where c2 = (select t1.c1 from t1 left join t2 on t1.c1=t2.c1 where exists (select null from t3 left join t4 on t3.c1=t4.c1 left join t5 on t3.c1=t5.c1 where t1.c1=t5.c1) limit 1);
select stddev(c2) from t1;
stddev(c2)
2.8674417556808756
rollback;
delete from t1 where c2 = (select /*+NO_REWIRTE*/t1.c1 from t1 left join t2 on t1.c1=t2.c1 where exists (select null from t3 left join t4 on t3.c1=t4.c1 left join t5 on t3.c1=t5.c1 where t1.c1=t5.c1) limit 1);
select stddev(c2) from t1;
stddev(c2)
2.8674417556808756
rollback;
select * from t1 left join t2 on t1.c1=t2.c1 where exists (select null from t3 left join t4 on t3.c1=t4.c1 left join t5 on t3.c1=t4.c1 where t1.c1=1);
c1	c2	c1	c2
1	1	1	1
1	1	1	1
select /*+NO_REWRITE*/* from t1 left join t2 on t1.c1=t2.c1 where exists (select null from t3 left join t4 on t3.c1=t4.c1 left join t5 on t3.c1=t4.c1 where t1.c1=1);
c1	c2	c1	c2
1	1	1	1
1	1	1	1
insert into t4_temp (select * from t1 left join t2 on t1.c1=t2.c1 where exists (select null from t3 left join t4 on t3.c1=t4.c1 left join t5 on t3.c1=t4.c1 where t1.c1=1));
rollback;
insert into t4_temp (select /*+NO_REWRITE*/* from t1 left join t2 on t1.c1=t2.c1 where exists (select null from t3 left join t4 on t3.c1=t4.c1 left join t5 on t3.c1=t4.c1 where t1.c1=1));
rollback;
update t1 set c2 = (select t1.c1 from t1 left join t2 on t1.c1=t2.c1 where exists (select null from t3 left join t4 on t3.c1=t4.c1 left join t5 on t3.c1=t4.c1 where t1.c1=1) limit 1);
select stddev(c2) from t1;
stddev(c2)
0
rollback;
update t1 set c2 = (select /*+ NO_REWRITE */t1.c1 from t1 left join t2 on t1.c1=t2.c1 where exists (select null from t3 left join t4 on t3.c1=t4.c1 left join t5 on t3.c1=t4.c1 where t1.c1=1) limit 1);
select stddev(c2) from t1;
stddev(c2)
0
rollback;
delete from t1 where c2 = (select t1.c1 from t1 left join t2 on t1.c1=t2.c1 where exists (select null from t3 left join t4 on t3.c1=t4.c1 left join t5 on t3.c1=t4.c1 where t1.c1=1) limit 1);
select stddev(c2) from t1;
stddev(c2)
2.8674417556808756
rollback;
delete from t1 where c2 = (select /*+ NO_REWRITE */t1.c1 from t1 left join t2 on t1.c1=t2.c1 where exists (select null from t3 left join t4 on t3.c1=t4.c1 left join t5 on t3.c1=t4.c1 where t1.c1=1) limit 1);
select stddev(c2) from t1;
stddev(c2)
2.8674417556808756
rollback;
select * from t1 left join t2 on t1.c1=t2.c1 where not exists (select null from t3 left join t4 on t3.c1=t4.c1 left join t5 on t3.c1=t5.c1 where t1.c1=t5.c1);
c1	c2	c1	c2
10	10	NULL	NULL
2	2	2	2
5	5	NULL	NULL
NULL	1	NULL	NULL
NULL	5	NULL	NULL
select /*+NO_REWRITE*/* from t1 left join t2 on t1.c1=t2.c1 where not exists (select null from t3 left join t4 on t3.c1=t4.c1 left join t5 on t3.c1=t5.c1 where t1.c1=t5.c1);
c1	c2	c1	c2
10	10	NULL	NULL
2	2	2	2
5	5	NULL	NULL
NULL	1	NULL	NULL
NULL	5	NULL	NULL
insert into t4_temp (select * from t1 left join t2 on t1.c1=t2.c1 where not exists (select null from t3 left join t4 on t3.c1=t4.c1 left join t5 on t3.c1=t5.c1 where t1.c1=t5.c1));
rollback;
insert into t4_temp (select /*+NO_REWRITE*/* from t1 left join t2 on t1.c1=t2.c1 where not exists (select null from t3 left join t4 on t3.c1=t4.c1 left join t5 on t3.c1=t5.c1 where t1.c1=t5.c1));
rollback;
update t1 set c2 = (select t1.c1 from t1 left join t2 on t1.c1=t2.c1 where not exists (select null from t3 left join t4 on t3.c1=t4.c1 left join t5 on t3.c1=t5.c1 where t1.c1=t5.c1) limit 1);
select stddev(c2) from t1;
stddev(c2)
0
rollback;
update t1 set c2 = (select /*+ NO_REWRITE */t1.c1 from t1 left join t2 on t1.c1=t2.c1 where not exists (select null from t3 left join t4 on t3.c1=t4.c1 left join t5 on t3.c1=t5.c1 where t1.c1=t5.c1) limit 1);
select stddev(c2) from t1;
stddev(c2)
0
rollback;
delete from t1 where c2 = (select t1.c1 from t1 left join t2 on t1.c1=t2.c1 where not exists (select null from t3 left join t4 on t3.c1=t4.c1 left join t5 on t3.c1=t5.c1 where t1.c1=t5.c1) limit 1);
select stddev(c2) from t1;
stddev(c2)
3.3226495451672298
rollback;
delete from t1 where c2 = (select /*+ NO_REWRITE */t1.c1 from t1 left join t2 on t1.c1=t2.c1 where not exists (select null from t3 left join t4 on t3.c1=t4.c1 left join t5 on t3.c1=t5.c1 where t1.c1=t5.c1) limit 1);
select stddev(c2) from t1;
stddev(c2)
3.3226495451672298
rollback;
set autocommit=1;
drop table if exists t5, t6, t7, t8, t9, t10, t11;
create table t5(c1 int primary key, c2 int, c3 varchar(32));
create table t6(c1 int, c2 int, c3 varchar(32), primary key(c1,c2));
create table t7(c1 int primary key, c2 int, c3 varchar(32))
partition by hash(c1) partitions 5;
create table t8(c1 int, c2 int not null, c3 varchar(32),
foreign key(c1) references t5(c1),
foreign key(c2) references t5(c1));
create table t9(c1 int not null, c2 int, c3 varchar(32),
foreign key(c1) references t7(c1))
partition by list(c1) (
partition p0 values in(1,2),
partition p1 values in(3,4),
partition p2 values in(5,6),
partition p3 values in(7,8),
partition p4 values in(9,10));
create table t10(c1 int not null, c2 int, c3 varchar(32),
foreign key(c1) references t7(c1))
partition by hash(c1) partitions 5;
create table t11(c1 int not null, c2 int not null, c3 varchar(32),
foreign key(c1,c2) references t6(c1,c2));
set autocommit=0;
select * from t8 a left join t5 b on a.c1=b.c1;
c1	c2	c3	c1	c2	c3
1	1	a	1	1	a
1	2	b	1	1	a
3	3	c	3	5	c
3	3	d	3	5	c
NULL	4	e	NULL	NULL	NULL
NULL	4	f	NULL	NULL	NULL
select * from t8 a right join t5 b on a.c2=b.c1;
c1	c2	c3	c1	c2	c3
1	1	a	1	1	a
1	2	b	2	5	b
3	3	c	3	5	c
3	3	d	3	5	c
NULL	4	e	4	6	d
NULL	4	f	4	6	d
NULL	NULL	NULL	5	7	e
NULL	NULL	NULL	6	8	f
select * from t8 a left join (select * from t5 where t5.c1>0) b on a.c2=b.c1;
c1	c2	c3	c1	c2	c3
1	1	a	1	1	a
1	2	b	2	5	b
3	3	c	3	5	c
3	3	d	3	5	c
NULL	4	e	4	6	d
NULL	4	f	4	6	d
select * from (select * from t8 where t8.c1>0) a left join (select * from t5 where t5.c1>0) b on a.c2=b.c1;
c1	c2	c3	c1	c2	c3
1	1	a	1	1	a
1	2	b	2	5	b
3	3	c	3	5	c
3	3	d	3	5	c
select * from t8 a left join t5 b on a.c2>b.c1;
c1	c2	c3	c1	c2	c3
1	1	a	NULL	NULL	NULL
1	2	b	1	1	a
3	3	c	1	1	a
3	3	c	2	5	b
3	3	d	1	1	a
3	3	d	2	5	b
NULL	4	e	1	1	a
NULL	4	e	2	5	b
NULL	4	e	3	5	c
NULL	4	f	1	1	a
NULL	4	f	2	5	b
NULL	4	f	3	5	c
select * from t8 a left join t5 b on a.c2=b.c1 and a.c1<3;
c1	c2	c3	c1	c2	c3
1	1	a	1	1	a
1	2	b	2	5	b
3	3	c	NULL	NULL	NULL
3	3	d	NULL	NULL	NULL
NULL	4	e	NULL	NULL	NULL
NULL	4	f	NULL	NULL	NULL
select * from t8 a left join t5 b on a.c2=b.c1 and a.c2=b.c1 and a.c2=b.c1;
c1	c2	c3	c1	c2	c3
1	1	a	1	1	a
1	2	b	2	5	b
3	3	c	3	5	c
3	3	d	3	5	c
NULL	4	e	4	6	d
NULL	4	f	4	6	d
select * from t8 a left join t5 b on a.c2=b.c1;
c1	c2	c3	c1	c2	c3
1	1	a	1	1	a
1	2	b	2	5	b
3	3	c	3	5	c
3	3	d	3	5	c
NULL	4	e	4	6	d
NULL	4	f	4	6	d
select /*+NO_REWRITE*/* from t8 a left join t5 b on a.c2=b.c1;
c1	c2	c3	c1	c2	c3
1	1	a	1	1	a
1	2	b	2	5	b
3	3	c	3	5	c
3	3	d	3	5	c
NULL	4	e	4	6	d
NULL	4	f	4	6	d
insert into t16_temp (select * from t8 a left join t5 b on a.c2=b.c1);
rollback;
insert into t16_temp (select /*+NO_REWRITE*/ * from t8 a left join t5 b on a.c2=b.c1);
rollback;
update t5 set c2 = (select a.c1 from t8 a left join t5 b on a.c2=b.c1 limit 1);
select stddev(c2) from t5;
stddev(c2)
0
rollback;
update t5 set c2 = (select /*+NO_REWRITE*/ a.c1 from t8 a left join t5 b on a.c2=b.c1 limit 1);
select stddev(c2) from t5;
stddev(c2)
0
rollback;
select * from t8 a left join t5 b on a.c1=b.c1 where a.c1>0;
c1	c2	c3	c1	c2	c3
1	1	a	1	1	a
1	2	b	1	1	a
3	3	c	3	5	c
3	3	d	3	5	c
select /*+NO_REWRITE*/* from t8 a left join t5 b on a.c1=b.c1 where a.c1>0;
c1	c2	c3	c1	c2	c3
1	1	a	1	1	a
1	2	b	1	1	a
3	3	c	3	5	c
3	3	d	3	5	c
insert into t16_temp (select * from t8 a left join t5 b on a.c1=b.c1 where a.c1>0);
rollback;
insert into t16_temp (select /*+NO_REWRITE*/ * from t8 a left join t5 b on a.c1=b.c1 where a.c1>0);
rollback;
update t5 set c2 = (select a.c1 from t8 a left join t5 b on a.c1=b.c1 where a.c1>0 limit 1);
select stddev(c2) from t5;
stddev(c2)
0
rollback;
update t5 set c2 = (select /*+NO_REWRITE*/ a.c1 from t8 a left join t5 b on a.c1=b.c1 where a.c1>0 limit 1);
select stddev(c2) from t5;
stddev(c2)
0
rollback;
select * from t11 a left join t6 b on a.c1=b.c2 and a.c2=b.c1;
c1	c2	c3	c1	c2	c3
1	1	a	1	1	a
1	1	b	1	1	a
3	3	c	3	3	c
3	3	d	3	3	c
4	4	e	4	4	d
4	4	f	4	4	d
select * from t11 a left join t6 b on a.c1=b.c1 and a.c2=b.c2;
c1	c2	c3	c1	c2	c3
1	1	a	1	1	a
1	1	b	1	1	a
3	3	c	3	3	c
3	3	d	3	3	c
4	4	e	4	4	d
4	4	f	4	4	d
select /*+NO_REWRITE*/* from t11 a left join t6 b on a.c1=b.c1 and a.c2=b.c2;
c1	c2	c3	c1	c2	c3
1	1	a	1	1	a
1	1	b	1	1	a
3	3	c	3	3	c
3	3	d	3	3	c
4	4	e	4	4	d
4	4	f	4	4	d
insert into t16_temp (select * from t11 a left join t6 b on a.c1=b.c1 and a.c2=b.c2);
rollback;
insert into t16_temp (select /*+NO_REWRITE*/ * from t11 a left join t6 b on a.c1=b.c1 and a.c2=b.c2);
rollback;
update t5 set c2 = (select a.c1 from t11 a left join t6 b on a.c1=b.c1 and a.c2=b.c2 limit 1);
select stddev(c2) from t5;
stddev(c2)
0
rollback;
update t5 set c2 = (select /*+NO_REWRITE*/ a.c1 from t11 a left join t6 b on a.c1=b.c1 and a.c2=b.c2 limit 1);
select stddev(c2) from t5;
stddev(c2)
0
rollback;
select * from t10 partition(p1) a left join t7 partition(p1) b on a.c1=b.c1;
c1	c2	c3	c1	c2	c3
1	2	a	1	1	a
1	2	b	1	1	a
select * from t10 partition(p1) a left join t7 b on a.c1=b.c1;
c1	c2	c3	c1	c2	c3
1	2	a	1	1	a
1	2	b	1	1	a
select /*+NO_REWRITE*/ * from t10 partition(p1) a left join t7 b on a.c1=b.c1;
c1	c2	c3	c1	c2	c3
1	2	a	1	1	a
1	2	b	1	1	a
insert into t16_temp (select * from t10 partition(p1) a left join t7 b on a.c1=b.c1);
rollback;
insert into t16_temp (select /*+NO_REWRITE*/ * from t10 partition(p1) a left join t7 b on a.c1=b.c1);
rollback;
update t5 set c2 = (select a.c1 from t10 partition(p1) a left join t7 b on a.c1=b.c1 limit 1);
select stddev(c2) from t5;
stddev(c2)
0
rollback;
update t5 set c2 = (select /*+NO_REWRITE*/ a.c1 from t10 partition(p1) a left join t7 b on a.c1=b.c1 limit 1);
select stddev(c2) from t5;
stddev(c2)
0
rollback;
select * from t8 a full join t5 b on a.c2=b.c1;
c1	c2	c3	c1	c2	c3
1	1	a	1	1	a
1	2	b	2	5	b
3	3	c	3	5	c
3	3	d	3	5	c
NULL	4	e	4	6	d
NULL	4	f	4	6	d
NULL	NULL	NULL	5	7	e
NULL	NULL	NULL	6	8	f
select /*+NO_REWRITE*/* from t8 a full join t5 b on a.c2=b.c1;
c1	c2	c3	c1	c2	c3
1	1	a	1	1	a
1	2	b	2	5	b
3	3	c	3	5	c
3	3	d	3	5	c
NULL	4	e	4	6	d
NULL	4	f	4	6	d
NULL	NULL	NULL	5	7	e
NULL	NULL	NULL	6	8	f
insert into t16_temp (select * from t8 a full join t5 b on a.c2=b.c1);
rollback;
insert into t16_temp (select /*+NO_REWRITE*/ * from t8 a full join t5 b on a.c2=b.c1);
rollback;
update t5 set c2 = (select a.c1 from t8 a full join t5 b on a.c2=b.c1 limit 1);
select stddev(c2) from t5;
stddev(c2)
0
rollback;
update t5 set c2 = (select /*+NO_REWRITE*/ a.c1 from t8 a full join t5 b on a.c2=b.c1 limit 1);
select stddev(c2) from t5;
stddev(c2)
0
rollback;
select * from t5 b right join t8 a on a.c2=b.c1;
c1	c2	c3	c1	c2	c3
1	1	a	1	1	a
2	5	b	1	2	b
3	5	c	3	3	c
3	5	c	3	3	d
4	6	d	NULL	4	e
4	6	d	NULL	4	f
select /*+NO_REWRITE*/* from t5 b right join t8 a on a.c2=b.c1;
c1	c2	c3	c1	c2	c3
1	1	a	1	1	a
2	5	b	1	2	b
3	5	c	3	3	c
3	5	c	3	3	d
4	6	d	NULL	4	e
4	6	d	NULL	4	f
insert into t16_temp (select * from t5 b right join t8 a on a.c2=b.c1);
rollback;
insert into t16_temp (select /*+NO_REWRITE*/ * from t5 b right join t8 a on a.c2=b.c1);
rollback;
update t5 set c2 = (select a.c1 from t5 b right join t8 a on a.c2=b.c1 limit 1);
select stddev(c2) from t5;
stddev(c2)
0
rollback;
update t5 set c2 = (select /*+NO_REWRITE*/ a.c1 from t5 b right join t8 a on a.c2=b.c1 limit 1);
select stddev(c2) from t5;
stddev(c2)
0
rollback;
select * from t8 a full join t5 b on a.c2=b.c1 where a.c1 is not null;
c1	c2	c3	c1	c2	c3
1	1	a	1	1	a
1	2	b	2	5	b
3	3	c	3	5	c
3	3	d	3	5	c
select /*+NO_REWRITE*/* from t8 a full join t5 b on a.c2=b.c1 where a.c1 is not null;
c1	c2	c3	c1	c2	c3
1	1	a	1	1	a
1	2	b	2	5	b
3	3	c	3	5	c
3	3	d	3	5	c
insert into t16_temp (select * from t8 a full join t5 b on a.c2=b.c1 where a.c1 is not null);
rollback;
insert into t16_temp (select /*+NO_REWRITE*/ * from t8 a full join t5 b on a.c2=b.c1 where a.c1 is not null);
rollback;
update t5 set c2 = (select a.c1 from t8 a full join t5 b on a.c2=b.c1 where a.c1 is not null limit 1);
select stddev(c2) from t5;
stddev(c2)
0
rollback;
update t5 set c2 = (select /*+NO_REWRITE*/ a.c1 from t8 a full join t5 b on a.c2=b.c1 where a.c1 is not null limit 1);
select stddev(c2) from t5;
stddev(c2)
0
rollback;
select * from (select t5.c2 from t8 left join t5 on t5.c1=t8.c2) a full join (select t8.c2 from t8 left join t5 on t8.c1=t5.c1 where t5.c2 is not null) b on a.c2 = b.c2;
c2	c2
1	1
5	NULL
5	NULL
5	NULL
6	NULL
6	NULL
NULL	2
NULL	3
NULL	3
select /*+NO_REWRITE*/* from (select /*+NO_REWRITE*/t5.c2 from t8 left join t5 on t5.c1=t8.c2) a full join (select /*+NO_REWRITE*/t8.c2 from t8 left join t5 on t8.c1=t5.c1 where t5.c2 is not null) b on a.c2 = b.c2;
c2	c2
1	1
5	NULL
5	NULL
5	NULL
6	NULL
6	NULL
NULL	2
NULL	3
NULL	3
insert into t11_temp (select * from (select t5.c2 from t8 left join t5 on t5.c1=t8.c2) a full join (select t8.c2 from t8 left join t5 on t8.c1=t5.c1 where t5.c2 is not null) b on a.c2 = b.c2);
rollback;
insert into t11_temp (select /*+NO_REWRITE*/ * from (select /*+NO_REWRITE*/t5.c2 from t8 left join t5 on t5.c1=t8.c2) a full join (select /*+NO_REWRITE*/t8.c2 from t8 left join t5 on t8.c1=t5.c1 where t5.c2 is not null) b on a.c2 = b.c2);
rollback;
update t5 set c2 = (select a.c2 from (select t5.c2 from t8 left join t5 on t5.c1=t8.c2) a full join (select t8.c2 from t8 left join t5 on t8.c1=t5.c1 where t5.c2 is not null) b on a.c2 = b.c2 limit 1);
select stddev(c2) from t5;
stddev(c2)
0
rollback;
update t5 set c2 = (select /*+NO_REWRITE*/ a.c2 from (select /*+NO_REWRITE*/t5.c2 from t8 left join t5 on t5.c1=t8.c2) a full join (select /*+NO_REWRITE*/t8.c2 from t8 left join t5 on t8.c1=t5.c1 where t5.c2 is not null) b on a.c2 = b.c2 limit 1);
select stddev(c2) from t5;
stddev(c2)
0
rollback;
set autocommit=1;
drop table if exists t11, t10, t9, t8, t7, t6, t5;
insert into t4_temp(select * from t1 left join t2 on t1.c1=t2.c1);
delete from t4_temp where a = (select t1.c1, t1.c2 from t1 left join t2 on t1.c1=t2.c1 limit 1);
ERROR 21000: Operand should contain 1 column(s)
delete from t4_temp where a = (select t1.c1 from t1 left join t2 on t1.c1=t2.c1 limit 1);
delete from t4_temp where (a, b) = (select t1.c1, t1.c2 from t1 left join t2 on t1.c1=t2.c1 limit 1);
delete from t4_temp where (a, b) = (select t1.c1, t1.c2, t2.c1 from t1 left join t2 on t1.c1=t2.c1 limit 1);
ERROR 21000: Operand should contain 2 column(s)
select stddev(a) from t4_temp;
stddev(a)
2.7856776554368237
update t4_temp set a = (select t1.c1, t1.c2 from t1 left join t2 on t1.c1=t2.c1 limit 1);
ERROR 21000: Operand should contain 1 column(s)
update t4_temp set a = (select t1.c1 from t1 left join t2 on t1.c1=t2.c1 limit 1);
select stddev(a) from t4_temp;
stddev(a)
0
drop table if exists t1_temp, t2_temp, t3_temp, t4_temp, t5_temp, t6_temp, t7_temp, t8_temp, t9_temp, t10_temp, t11_temp, t12_temp, t13_temp, t14_temp, t15_temp, t16_temp;
drop database transformer;
